Category,FY,Funding IC,Project Number,Sub Project #,Project Title,PI Name,Org Name,State / Country,Amount
Stroke,2015,NICHD,5R01HD061462-04,,Driving Cortical Plasticity for Rehabilitation of Reaching After Stroke.,"WITTENBERG, GEORGE",UNIVERSITY OF MARYLAND BALTIMORE,MD,"$301,509"
Stroke,2015,NINDS,5U01NS062835-05,,POINT: Platelet-Oriented Inhibition in New TIA,"EASTON, J. DONALD","UNIVERSITY OF CALIFORNIA, SAN FRANCISCO",CA,"$7,772,710"
Stroke,2015,NIDCD,5K23DC011056-03,,Neural Basis of Coexisting Swallowing and Communication Disorders after Stroke,"GONZALEZ-FERNANDEZ, MARLIS",JOHNS HOPKINS UNIVERSITY,MD,"$236,359"
Stroke,2015,NINDS,5F31NS086431-02,,Molecular Mechanisms of Activity-dependent Cortical Circuits in Stroke Recovery,"NIE, ESTHER",UNIVERSITY OF CALIFORNIA LOS ANGELES,CA,"$48,120"
Stroke,2015,NINDS,5F32NS082017-04,,Endothelial Aromatase in Sex-Specific Cerebrovascular Dysfunction After Ischemia,"ZULOAGA, KRISTEN",REGENERATIVE RESEARCH FOUNDATION,NY,"$56,042"
Stroke,2015,NEI,5R01EY022129-05,,Signaling Scaffolds and Survival in Stroke,"GOLDBERG, JEFFREY",UNIVERSITY OF CALIFORNIA SAN DIEGO,CA,"$84,183"
Stroke,2015,NIA,5P01AG027956-07,6471,Animal Core,"FORSTER, MICHAEL",UNIVERSITY OF NORTH TEXAS HLTH SCI CTR,TX,"$284,176"
Stroke,2015,NHLBI,5P01HL101398-05,8664,Depressions and Mental Stress Ischemia: Brain Mechanisms,"VACCARINO, VIOLA",EMORY UNIVERSITY,GA,"$209,793"
Stroke,2015,NICHD,5R01HD068488-05,,Post-Stroke Aphasia and rTMS Treatment (PART) Study,"SZAFLARSKI, JERZY",UNIVERSITY OF ALABAMA AT BIRMINGHAM,AL,"$518,439"
Stroke,2015,NINDS,5R01NS055215-09,,Chromosomal and Hormonal Contributions to Sex Differences in Ischemic Stroke.,"MCCULLOUGH, LOUISE",UNIVERSITY OF CONNECTICUT SCH OF MED/DNT,CT,"$478,062"
Stroke,2015,NINDS,5R01NS027713-24,,Hemodynamics of Cerebral Arteriovenous Malformations,"SU, HUA","UNIVERSITY OF CALIFORNIA, SAN FRANCISCO",CA,"$312,588"
Stroke,2015,NINDS,5P01NS082184-02,5161,Osteopontin Protects Neurovascular Unite by Activation Interleukin Receptors,"ZHANG, JOHN",LOMA LINDA UNIVERSITY,CA,"$183,907"
Stroke,2015,NINDS,5P01NS082184-02,5162,Gleevec Protects Neurovascular Unit by Inhibition of PDGFR,"TANG, JIPING",LOMA LINDA UNIVERSITY,CA,"$194,619"
Stroke,2015,NINDS,5P01NS082184-02,5163,Caveolin 1 Role in Hemorrhagic Injuries,"BADAUT, JEROME",LOMA LINDA UNIVERSITY,CA,"$142,419"
Stroke,2015,NINDS,5P01NS082184-02,5164,Administrative Core,"ZHANG, JOHN",LOMA LINDA UNIVERSITY,CA,"$175,462"
Stroke,2015,NINDS,5P01NS082184-02,5165,Imaging Core,"OBENAUS, ANDRE",LOMA LINDA UNIVERSITY,CA,"$194,656"
Stroke,2015,NINDS,5P01NS082184-02,5166,Neurological and Neurobehavioral Function Evaluation Core,"HARTMAN, RICHARD",LOMA LINDA UNIVERSITY,CA,"$81,083"
Stroke,2015,NINDS,5P01NS082184-02,5167,Vascular Biology Core Facility,"PEARCE, WILLIAM",LOMA LINDA UNIVERSITY,CA,"$255,960"
Stroke,2015,NINDS,5U54NS081763-03,5151,Florida Puerto Rico Stroke Registry,"SACCO, RALPH",UNIVERSITY OF MIAMI SCHOOL OF MEDICINE,FL,"$245,904"
Stroke,2015,NINDS,5U54NS081763-03,5152,Administrative Core,"SACCO, RALPH",UNIVERSITY OF MIAMI SCHOOL OF MEDICINE,FL,"$186,442"
Stroke,2015,NINDS,5U54NS081763-03,5153,Research Education and Training Plan,"ROMANO, JOSE",UNIVERSITY OF MIAMI SCHOOL OF MEDICINE,FL,"$191,300"
Stroke,2015,NINDS,5U54NS081763-03,5154,The Data Management and Biostatistics,"RUNDEK, TATJANA",UNIVERSITY OF MIAMI SCHOOL OF MEDICINE,FL,"$93,816"
Stroke,2015,NHLBI,5R01HL082517-10,,Sulfonylurea receptor 1 (SUR1) - A novel therapeutic target in ischemic stroke,"SIMARD, J. MARC",UNIVERSITY OF MARYLAND BALTIMORE,MD,"$505,654"
Stroke,2015,NHLBI,5R01HL118742-02,,Fibronectin alternative splicing in thrombosis and inflammation,"CHAUHAN, ANIL",UNIVERSITY OF IOWA,IA,"$371,837"
Stroke,2015,NHLBI,5K25HL121192-02,,MRI-based Quantitative Brain Perfusion Mapping for Sickle Cell Disease,"QIN, QIN",HUGO W. MOSER RES INST KENNEDY KRIEGER,MD,"$152,145"
Stroke,2015,NINDS,5R01NS073779-04,,Increased cerebral ischemic injury by repeated hypoglycemic episodes in diabetes,"DAVE, KUNJAN",UNIVERSITY OF MIAMI SCHOOL OF MEDICINE,FL,"$301,219"
Stroke,2015,NINDS,5R01NS073595-04,,Mechanisms of Brain Injury after Intraventricular Hemorrhage,"XI, GUOHUA",UNIVERSITY OF MICHIGAN,MI,"$340,156"
Stroke,2015,NINDS,5R01NS065825-05,,The attenuation of ischemic injury by transglutaminase 2,"JOHNSON, GAIL",UNIVERSITY OF ROCHESTER,NY,"$389,275"
Stroke,2015,NINDS,5U01NS041588-14,,Etiology of Geographic and Racial Differences in Stroke,"HOWARD, GEORGE",UNIVERSITY OF ALABAMA AT BIRMINGHAM,AL,"$5,251,259"
Stroke,2015,NICHD,5R01HD075777-02,,Cortical priming to optimize gait rehabilitation post stroke,"MADHAVAN, SANGEETHA",UNIVERSITY OF ILLINOIS AT CHICAGO,IL,"$287,410"
Stroke,2015,NINDS,5U01NS038384-16,,Carotid Revascularization Endarterectomy vs. Stenting Trial: Long Term Follow-up,"BROTT, THOMAS",RBHS-NEW JERSEY MEDICAL SCHOOL,NJ,"$1,425,454"
Stroke,2015,NINDS,5R01NS073666-05,,"CHRONIC INTERMITTENT HYPOXIA, NEUROVASCULAR DYSFUNCTION AND STROKE","IADECOLA, COSTANTINO",WEILL MEDICAL COLL OF CORNELL UNIV,NY,"$369,688"
Stroke,2015,NICHD,5R44HD074331-03,,A Music-Based Rehabilitation Device for Training and Assessing Hand Function,"FRIEDMAN, NIZAN",FLINT REHABILITATION DEVICES,CA,"$923,524"
Stroke,2015,NINDS,5R01NS055876-09,,Intracranial aneurysm pathogenesis-roles of vascular remodeling and inflammation,"HASHIMOTO, TOMOKI","UNIVERSITY OF CALIFORNIA, SAN FRANCISCO",CA,"$337,969"
Stroke,2015,NINDS,5R01NS079331-03,,tPA is a Neuroprotectant in the Ischemic Brain,"YEPES, MANUEL",EMORY UNIVERSITY,GA,"$341,250"
Stroke,2015,NINDS,5R01NS071011-05,,THE ROLE OF A-BETA SPECIES IN VASCULAR SMOOTH MUSCLE CELL AND CEREBRAL ARTERIOLE,"ZIPFEL, GREGORY",WASHINGTON UNIVERSITY,MO,"$332,500"
Stroke,2015,NIBIB,5R01EB016629-02,,Neurovascualar Regeneration,"HIRSCHI, KAREN",YALE UNIVERSITY,CT,"$938,623"
Stroke,2015,NINDS,5K23NS086852-02,,Stroke Plasticity,"PRABHAKARAN, VIVEK",UNIVERSITY OF WISCONSIN-MADISON,WI,"$187,483"
Stroke,2015,NCI,5U01AG029824-05,,ASPirin in Reducing Events in the Elderly,"GRIMM, RICHARD","MINNEAPOLIS MEDICAL RESEARCH FDN, INC.",MN,"$1,421,281"
Stroke,2015,NIA,5U01AG029824-05,,ASPirin in Reducing Events in the Elderly,"GRIMM, RICHARD","MINNEAPOLIS MEDICAL RESEARCH FDN, INC.",MN,"$7,064,057"
Stroke,2015,NINDS,5R01NS080177-03,,Mitochondrial protection in post-stroke recovery,"GIFFARD, RONA",STANFORD UNIVERSITY,CA,"$343,858"
Stroke,2015,NIDCD,5R01DC011526-04,,"Overcoming Learned Non-Use in Chronic Aphasia: Behavioral, fMRI, and QoL Outcomes","KURLAND, JACQUIE",UNIVERSITY OF MASSACHUSETTS AMHERST,MA,"$347,563"
Stroke,2015,NINDS,5R01NS071127-05,,Cytoprotection with Autologous Mononuclear Cells for Stroke,"SAVITZ, SEAN",UNIVERSITY OF TEXAS HLTH SCI CTR HOUSTON,TX,"$328,125"
Stroke,2015,NIMHD,5P60MD006920-04,5584,Subproject 2: Verifying Information and Communication Technology and Outcomes,"ADAMS-CAMPBELL, LUCILE",GEORGETOWN UNIVERSITY,DC,"$282,207"
Stroke,2015,NIMHD,5P60MD006920-04,5586,Research Core,"ADAMS-CAMPBELL, LUCILE",GEORGETOWN UNIVERSITY,DC,"$142,391"
Stroke,2015,NICHD,5K08HD074668-03,,The role of ROCKs in stroke recovery,"WANG, QING",SPAULDING REHABILITATION HOSPITAL,MA,"$137,160"
Stroke,2015,NINDS,5U01NS079077-03,,Insights on Selected Procoagulation Markers and Outcomes in Stroke Trial (I-SPOT),"GENTILE, NINA",TEMPLE UNIV OF THE COMMONWEALTH,PA,"$484,256"
Stroke,2015,NINDS,5R01NS053898-09,,Astrocytes and ischemic brain injury,"GIFFARD, RONA",STANFORD UNIVERSITY,CA,"$366,071"
Stroke,2015,NINDS,5R01NS071050-05,,Neuroplasticity after experimental stroke,"LIU, JIALING",NORTHERN CALIFORNIA INSTITUTE/RES/EDU,CA,"$324,188"
Stroke,2015,NINDS,5R01NS080531-04,,Effects of obstructive sleep apnea on cerebral circulation,"BRYAN, ROBERT",BAYLOR COLLEGE OF MEDICINE,TX,"$342,344"
Stroke,2015,NINDS,5K23NS079477-03,,Surgical Indirect Revascularization For Symptomatic Intracranial Aterial Stenosis,"GONZALEZ, NESTOR",UNIVERSITY OF CALIFORNIA LOS ANGELES,CA,"$164,389"
Stroke,2015,NINDS,5R01NS083559-02,,Vascular Injury and Recovery in Diabetic Ischemic Stroke,"ERGUL, ADVIYE",GEORGIA REGENTS UNIVERSITY,GA,"$378,715"
Stroke,2015,NINDS,5R21NS083692-02,,"Leptin, Obesity, and Stroke","MURPHY, MICHAEL",UNIVERSITY OF KENTUCKY,KY,"$187,865"
Stroke,2015,NICHD,5R01HD068290-04,,Dose-Response of Movement Practice During Stroke Rehabilitation,"LANG, CATHERINE",WASHINGTON UNIVERSITY,MO,"$429,265"
Stroke,2015,NINR,5R01NR014221-02,,Developing Goal Directed Perfusion Therapy in SAH Neurocardiac Injury,"HRAVNAK, MARILYN",UNIVERSITY OF PITTSBURGH AT PITTSBURGH,PA,"$518,484"
Stroke,2015,NIA,1R01AG049084-01,,Rhythm and Timing Exercises for Cerebral Vascular Disease in American Indians,"VERNEY, STEVEN",UNIVERSITY OF NEW MEXICO,NM,"$291,923"
Stroke,2015,NIGMS,1R01AG049084-01,,Rhythm and Timing Exercises for Cerebral Vascular Disease in American Indians,"VERNEY, STEVEN",UNIVERSITY OF NEW MEXICO,NM,"$280,000"
Stroke,2015,NINDS,5K23NS079422-03,,The trajectory of functional status and quality of life before and after stroke,"DHAMOON, MANDIP",ICAHN SCHOOL OF MEDICINE AT MOUNT SINAI,NY,"$183,093"
Stroke,2015,NINDS,5R21NS084148-02,,Nanomotors for thrombolytic therapy after stroke,"JIN, KUNLIN",UNIVERSITY OF NORTH TEXAS HLTH SCI CTR,TX,"$184,495"
Stroke,2015,NIDCD,5R03DC012643-03,,Masked priming treatment for anomia,"SILKES, JOANN",UNIVERSITY OF WASHINGTON,WA,"$154,500"
Stroke,2015,NINDS,5R01NS083947-02,,Germinal matrix hemorrhage affects glutamatergic neurogenesis,"BALLABH, PRAVEEN",NEW YORK MEDICAL COLLEGE,NY,"$352,188"
Stroke,2015,NHLBI,5R01HL107640-04,,Mechanisms of Mitochondrial Dysfunction in Brain Vasculature,"TYAGI, NEETU",UNIVERSITY OF LOUISVILLE,KY,"$369,375"
Stroke,2015,NINDS,5R21NS085475-02,,Prediction of Motor Outcome after Acute Stroke using Diffusional Kurtosis Imaging,"JENSEN, JENS",MEDICAL UNIVERSITY OF SOUTH CAROLINA,SC,"$186,875"
Stroke,2015,NINDS,5R21NS084081-02,,A stroke preparedness assessment instrument,"MORGENSTERN, LEWIS",UNIVERSITY OF MICHIGAN,MI,"$196,462"
Stroke,2015,NICHD,5R01HD033053-18,,Fetal Cardiovascular and Endocrine Reflex Responses,"WOOD, CHARLES",UNIVERSITY OF FLORIDA,FL,"$296,387"
Stroke,2015,NIDCD,5R01DC012511-03,,Figurative Language in Aphasic and Health Participants,"CHATTERJEE, ANJAN",UNIVERSITY OF PENNSYLVANIA,PA,"$336,600"
Stroke,2015,NICHD,5R01HD065438-05,,Optimizing the Dose of Rehabilitation After Stroke,"SCHWEIGHOFER, NICOLAS",UNIVERSITY OF SOUTHERN CALIFORNIA,CA,"$335,643"
Stroke,2015,NICHD,5R01HD003807-42,,Cerebral Artery Alpha1 Adrenergic and PKC Regulatory Mechanisms,"LONGO, LAWRENCE",LOMA LINDA UNIVERSITY,CA,"$307,673"
Stroke,2015,NINDS,5R01NS072370-05,,MRI method for quantitatively mapping cerebral microbleeds,"WANG, YI",WEILL MEDICAL COLL OF CORNELL UNIV,NY,"$361,594"
Stroke,2015,NINDS,5R01NS078167-04,,Failure of metabolite clearance in a model of multi-lacunar infarcts,"NEDERGAARD, MAIKEN",UNIVERSITY OF ROCHESTER,NY,"$337,969"
Stroke,2015,NINDS,5R01NS083078-02,,Neurorestorative therapy of stroke with HUCBC in type two diabetic mice,"CHEN, JIELI",HENRY FORD HEALTH SYSTEM,MI,"$324,844"
Stroke,2015,NINDS,5R01NS084288-02,,Mechanisms of Early Recurrence in Intracranial Atherosclerotic Disease,"ROMANO, JOSE",UNIVERSITY OF MIAMI SCHOOL OF MEDICINE,FL,"$625,883"
Stroke,2015,NINDS,5R21NS084290-02,,Augmenting carbon nanoparticles as novel antioxidants for ischemic stroke,"KENT, THOMAS",BAYLOR COLLEGE OF MEDICINE,TX,"$191,906"
Stroke,2015,NINDS,5K25NS083754-02,,MECHANISMS OF FUNCTIONAL AND BEHAVIORAL RECOVERY FOLLOWING ISCHEMIC STROKE,"BAUER, ADAM",WASHINGTON UNIVERSITY,MO,"$151,214"
Stroke,2015,NINDS,5R21NS087344-02,,Non Invasive Free Radical MRI in Stroke,"ROSEN, MATTHEW",MASSACHUSETTS GENERAL HOSPITAL,MA,"$217,027"
Stroke,2015,NIGMS,1P20GM109089-01A1,6101,Functional recovery from acute brain injury via human neural stem cell transplantation,"WEICK, JASON",UNIVERSITY OF NEW MEXICO HEALTH SCIS CTR,NM,"$284,662"
Stroke,2015,NIGMS,1P20GM109089-01A1,6104,Transcranial Direct Current Stimulation for Treatment of Deficits after Traumatic Brain Injury,"QUINN, DAVIN",UNIVERSITY OF NEW MEXICO HEALTH SCIS CTR,NM,"$275,691"
Stroke,2015,NICHD,5R01HD069776-04,,Transcranial Direct Current Stimulation and Robotic Training in Chronic Stroke,"EDWARDS, DYLAN",WINIFRED MASTERSON BURKE MED RES INST,NY,"$633,698"
Stroke,2015,NICHD,5P01HD009402-36,5695,Proj 2: TNF-a Signaling of Oligodendrocyte Injury and Activity-Department Myelin,"KRAIG, RICHARD",UNIVERSITY OF CHICAGO,IL,"$242,115"
Stroke,2015,NHLBI,5R01HL108623-04,,FGF-23 and the Risk of Stroke and Cognitive Decline,"WRIGHT, CLINTON",UNIVERSITY OF MIAMI SCHOOL OF MEDICINE,FL,"$404,492"
Stroke,2015,NINDS,5R01NS087541-02,,An Integrated Genetic and Epigenetic Approach to Cerebral Small Vessel Disease,"FORNAGE, MYRIAM",UNIVERSITY OF TEXAS HLTH SCI CTR HOUSTON,TX,"$602,099"
Stroke,2015,NHLBI,2R01HL093554-06A1,,Mitochondrial influences on cerebral arteries,"BUSIJA, DAVID",TULANE UNIVERSITY OF LOUISIANA,LA,"$376,250"
Stroke,2015,NIEHS,1R01ES024936-01,,Neurotoxicity of Airborne Particles:  Role of Chronic Cerebral Hypoperfusion,"MACK, WILLIAM",UNIVERSITY OF SOUTHERN CALIFORNIA,CA,"$479,312"
Stroke,2015,NINDS,5R01NS084057-02,,Phospho-regulation of NMDA receptors in neonatal brain hypoxia-ischemia,"JIANG, XIANGNING","UNIVERSITY OF CALIFORNIA, SAN FRANCISCO",CA,"$346,354"
Stroke,2015,NINDS,5R01NS085419-02,,Genetic Architecture of Acute Human Brain Ischemia,"LEE, JIN-MOO",WASHINGTON UNIVERSITY,MO,"$582,602"
Stroke,2015,NINDS,5R01NS038916-17,,Brain Attack Surveillance in Corpus Christi (BASIC) Project,"MORGENSTERN, LEWIS",UNIVERSITY OF MICHIGAN,MI,"$766,337"
Stroke,2015,NINDS,5K23NS086873-02,,Genetic Analyses of Lipids in Cerebral Hemorrhage and Small Vessel Disease,"ANDERSON, CHRISTOPHER",MASSACHUSETTS GENERAL HOSPITAL,MA,"$186,228"
Stroke,2015,NINDS,5R01NS071072-04,,Plasmalemma permeability and necroptosis: New targets for intracerebral hemo,"WHALEN, MICHAEL",MASSACHUSETTS GENERAL HOSPITAL,MA,"$368,970"
Stroke,2015,NINDS,5R01NS044025-12,,Neonatal Stroke: The Role of Microglia,"VEXLER, ZINAIDA","UNIVERSITY OF CALIFORNIA, SAN FRANCISCO",CA,"$395,092"
Stroke,2015,NINDS,5R01NS076013-04,,Sex differences in brain inflammation in experimental stroke,"OFFNER, HALINA",OREGON HEALTH & SCIENCE UNIVERSITY,OR,"$460,203"
Stroke,2015,NINDS,5R01NS083544-02,,Role and Regulation of SIRT3 in White Matter,"GUDZ, TATYANA",MEDICAL UNIVERSITY OF SOUTH CAROLINA,SC,"$327,031"
Stroke,2015,NINDS,5R01NS057756-09,,Molecular Genetic Pathogenesis of Intracranial Aneurysms,"GUNEL, MURAT",YALE UNIVERSITY,CT,"$692,870"
Stroke,2015,NHLBI,5F30HL108624-05,,Role of P450 Eicosanoids in Delayed Microvascular Spasm Following Subarachnoid He,"SILER, DOMINIC",OREGON HEALTH & SCIENCE UNIVERSITY,OR,"$48,120"
Stroke,2015,NINDS,5R01NS045727-11,,Protective Prostaglandin Receptors in Cerebral Ischemia,"ANDREASSON, KATRIN",STANFORD UNIVERSITY,CA,"$359,826"
Stroke,2015,NINDS,5R01NS079612-03,,Ac-SDKP for Treatment of Acute Stroke,"ZHANG, ZHENG GANG",HENRY FORD HEALTH SYSTEM,MI,"$324,844"
Stroke,2015,NINDS,5R01NS082553-02,,FRET probes for analysis of serpin-mediated apoptosis in focal brain ischemia,"DIDENKO, VLADIMIR",BAYLOR COLLEGE OF MEDICINE,TX,"$308,109"
Stroke,2015,NINDS,5R01NS084604-02,,Mitochondria-Targeted Redox Therapy for Cerebral Ischemia in the Developing Brain,"CLARK, ROBERT",UNIVERSITY OF PITTSBURGH AT PITTSBURGH,PA,"$396,780"
Stroke,2015,NINDS,5R01NS034179-20,,NO SYNTHASE GENE EXPRESSION AND CEREBRAL ISCHEMIC DAMAGE,"IADECOLA, COSTANTINO",WEILL MEDICAL COLL OF CORNELL UNIV,NY,"$369,688"
Stroke,2015,NINDS,5R01NS056244-08,,Kinase/phosphatase-mediated Mitochondrial Restructuring in Neuroprotection,"STRACK, STEFAN",UNIVERSITY OF IOWA,IA,"$330,313"
Stroke,2015,NINDS,5R01NS059962-08,,Role of Brain Specific Tyrosne Phosphatase STEP in Neuroprotection and Death,"PAUL, SUROJIT",UNIVERSITY OF NEW MEXICO HEALTH SCIS CTR,NM,"$330,313"
Stroke,2015,NINDS,5U01NS080165-02,,CREST-2 Statistical and Data Coordinating Center - SDCC,"HOWARD, GEORGE",UNIVERSITY OF ALABAMA AT BIRMINGHAM,AL,"$1,249,046"
Stroke,2015,NINDS,5U01NS080168-02,,CREST-2 Clinical Coordinating Center,"BROTT, THOMAS",MAYO CLINIC  JACKSONVILLE,FL,"$4,678,363"
Stroke,2015,NIBIB,5R21EB017928-02,,Development of MRI-based Cerebral Oxygen Extraction Fraction,"CARROLL, TIMOTHY",NORTHWESTERN UNIVERSITY AT CHICAGO,IL,"$185,649"
Stroke,2015,NINDS,5R01NS070308-05,,Long-term Cognitive Effects of Microembolization Associated with Carotid Stenting,"ZHOU, WEI",PALO ALTO VETERANS INSTIT FOR RESEARCH,CA,"$390,227"
Stroke,2015,NINDS,5R01NS076729-04,,Mechanisms regulating vessel development in the embryonic and postnatal brain,"HUANG, ZHEN",UNIVERSITY OF WISCONSIN-MADISON,WI,"$322,149"
Stroke,2015,NINDS,5R01NS079792-03,,Dietary targeting of dihydrolipoamide dehydrogenase for stroke tolerance,"YAN, LIANG-JUN",UNIVERSITY OF NORTH TEXAS HLTH SCI CTR,TX,"$253,750"
Stroke,2015,NIDCD,5U01DC011739-04,,Trans-cranial Direct Current Stimulation to Treat Aphasia: Phase II Trial,"FRIDRIKSSON, JULIUS",UNIVERSITY OF SOUTH CAROLINA AT COLUMBIA,SC,"$889,883"
Stroke,2015,NIDCD,5P50DC012283-03,,Neurobiology of Language Recovery in Aphasia:  Natural History and Treatment-Ind*,"THOMPSON, CYNTHIA",NORTHWESTERN UNIVERSITY,IL,"$2,339,020"
Stroke,2015,NINDS,5R01NS076942-03,,Mechanisms of structural neuronal plasticity and functional remapping after strok,"PORTERA-CAILLIAU, CARLOS",UNIVERSITY OF CALIFORNIA LOS ANGELES,CA,"$336,875"
Stroke,2015,NINDS,5R01NS082309-02,,Detection of Cerebral Ischemia With a Noninvasive Neurometabolic Optical Monitor,"KOFKE, W",UNIVERSITY OF PENNSYLVANIA,PA,"$578,213"
Stroke,2015,NINDS,5K08NS087118-02,,"ALK signaling in CNS development, ischemic brain injury and gliomagenesis","RAMKISSOON, SHAKTI",BRIGHAM AND WOMEN'S HOSPITAL,MA,"$193,590"
Stroke,2015,NIDCD,5R01DC013196-02,,Theory-driven treatment of language and cognitive processes in aphasia,"MARTIN, NADINE",TEMPLE UNIV OF THE COMMONWEALTH,PA,"$582,549"
Stroke,2015,NINDS,5K23NS069668-05,,Characterization of Intracranial Atherosclerotic Stenosis Using HR MRI,"TURAN, TANYA",MEDICAL UNIVERSITY OF SOUTH CAROLINA,SC,"$180,520"
Stroke,2015,NINDS,5R01NS076277-04,,Blood Flow and Cognition in Asymptomatic Carotid Artery Disease,"MARSHALL, RANDOLPH",COLUMBIA UNIVERSITY HEALTH SCIENCES,NY,"$411,120"
Stroke,2015,NINDS,5R01NS078828-04,,Characterizing Hemodynamic Compensation and Stroke Risk in Stenosis Patients,"DONAHUE, MANUS",VANDERBILT UNIVERSITY,TN,"$321,037"
Stroke,2015,NINDS,5R01NS044313-15,,Peroxisomal Biogenesis after Cerebral Ischemia,"ALKAYED, NABIL",OREGON HEALTH & SCIENCE UNIVERSITY,OR,"$354,855"
Stroke,2015,NINDS,5K99NS086916-02,,Ca2+ activated TMEM16 channels and their physiological roles in the brain,"YANG, HUANGHE","UNIVERSITY OF CALIFORNIA, SAN FRANCISCO",CA,"$24,330"
Stroke,2015,NINR,5R00NR013593-04,,Inflammation and delayed cognitive dysfunction after stroke,"DOYLE, KRISTIAN",UNIVERSITY OF ARIZONA,AZ,"$190,404"
Stroke,2015,NIGMS,5R01GM101972-04,,Genetics Analysis of Neuronal Hypoxic Stress Resistance,"RONGO, CHRISTOPHER","RUTGERS, THE STATE UNIV OF N.J.",NJ,"$305,796"
Stroke,2015,NHLBI,5R44HL117589-03,,Therapeutic Protein C Activator for Myocardial Ischemia,"VERBOUT, NORAH","ARONORA, INC.",OR,"$945,814"
Stroke,2015,NINDS,5R01NS075209-05,,CTP to predict Response to recanalization in Ischemic Stroke Project (CRISP),"LANSBERG, MAARTEN",STANFORD UNIVERSITY,CA,"$553,876"
Stroke,2015,NINDS,5F31NS086441-02,,Role of Haptoglobin and CD163 in brain hemorrhage,"LECLERC, JENNA",UNIVERSITY OF FLORIDA,FL,"$35,735"
Stroke,2015,NIEHS,5R01ES020871-04,,Ambient Air Pollution and Incident Stroke,"WELLENIUS, GREGORY",BROWN UNIVERSITY,RI,"$488,794"
Stroke,2015,NINDS,5K08NS064094-05,,Erythropoietin and Neurogenesis after Neonatal Stroke,"GONZALEZ, FERNANDO","UNIVERSITY OF CALIFORNIA, SAN FRANCISCO",CA,"$177,541"
Stroke,2015,NINDS,5R01NS065849-06,,Cyclooxygenase-2 Regulation of Blood-Brain Barrier Opening in Ischemic Stroke,"CANDELARIO-JALIL, EDUARDO",UNIVERSITY OF FLORIDA,FL,"$307,097"
Stroke,2015,NINDS,5R01NS079153-04,,A Novel Approach to Assessing Cryptogenic Stroke,"SHARP, FRANK",UNIVERSITY OF CALIFORNIA AT DAVIS,CA,"$561,068"
Stroke,2015,NINDS,5R01NS083784-02,,Prevalence and predictors of asymptomatic atrial fibrillation in the community,"DI TULLIO, MARCO",COLUMBIA UNIVERSITY HEALTH SCIENCES,NY,"$639,886"
Stroke,2015,NICHD,5R01HD068565-04,,Home-based mirror therapy for treating hemiparesis in stroke patients,"JAX, STEVEN",ALBERT EINSTEIN HEALTHCARE NETWORK,PA,"$310,709"
Stroke,2015,NINDS,5R01NS070837-05,,Mechanism of Vascular Dysfunction after Stroke in Postmenopausal Female,"ALKAYED, NABIL",OREGON HEALTH & SCIENCE UNIVERSITY,OR,"$336,875"
Stroke,2015,NINDS,5R21NS087491-02,,Oxygenation Fingerprinting with MRI for Ischemic Stroke,"ZAHARCHUK, GREGORY",STANFORD UNIVERSITY,CA,"$200,625"
Stroke,2015,NIMH,5R01MH096685-04,,"""Ecosystem Focused Therapy"" in Post Stroke Depression","ALEXOPOULOS, GEORGE",WEILL MEDICAL COLL OF CORNELL UNIV,NY,"$389,675"
Stroke,2015,NINDS,5R01NS077521-04,,Mechanisms of Axonal Sprouting and Recovery in Intracerebral Hemorrhage,"CARMICHAEL, STANLEY",UNIVERSITY OF CALIFORNIA LOS ANGELES,CA,"$336,875"
Stroke,2015,NIAMS,5R01AR064258-02,,Pathogenesis and Natural History in a Longitudinal Hemangioma Syndrome Cohort,"SIEGEL, DAWN",MEDICAL COLLEGE OF WISCONSIN,WI,"$384,832"
Stroke,2015,NINDS,5U01NS087748-02,,Stroke Trials Network National Data Management Center (NDMC),"PALESCH, YUKO",MEDICAL UNIVERSITY OF SOUTH CAROLINA,SC,"$1,104,817"
Stroke,2015,NINDS,5K23NS073806-06,,Biomarkers of Vasospasm and Outcome following Subarachnoid Hemorrhage,"CHOU, SHERRY",UNIVERSITY OF PITTSBURGH AT PITTSBURGH,PA,"$193,536"
Stroke,2015,NINDS,5R01NS075107-05,,Cerebrovascular Disease and Cognitive Performance in African Americans,"FREEDMAN, BARRY",WAKE FOREST UNIVERSITY HEALTH SCIENCES,NC,"$500,452"
Stroke,2015,NINDS,5R01NS082561-02,,"Rapid, robust and non-invasive cerebral oxygenation measurements using MRI","AN, HONGYU",UNIV OF NORTH CAROLINA CHAPEL HILL,NC,"$630,771"
Stroke,2015,NICHD,5R01HD068712-05,,Effects of early exercise on muscle and cardiovascular health after stroke,"MACKO, RICHARD",UNIVERSITY OF MARYLAND BALTIMORE,MD,"$406,909"
Stroke,2015,NINDS,5R01NS066027-05,,ASICs and increased ischemic brain injury in diabetic condition,"XIONG, ZHIGANG",MOREHOUSE SCHOOL OF MEDICINE,GA,"$319,018"
Stroke,2015,NINDS,2R37NS067525-06,,"Parthanatos, AIF and PAAN-1 in Neuronal Injury","DAWSON, TED",JOHNS HOPKINS UNIVERSITY,MD,"$729,000"
Stroke,2015,NINDS,5R01NS070941-05,,Sleep apnea health disparities in Mexican American stroke patients,"BROWN, DEVIN",UNIVERSITY OF MICHIGAN,MI,"$619,580"
Stroke,2015,NHLBI,5R01HL112966-03,,5Lipoxygenase-mediated vasculopathy in HHcy,"PRATICO, DOMENICO",TEMPLE UNIV OF THE COMMONWEALTH,PA,"$384,150"
Stroke,2015,NINDS,5R01NS079710-04,,Deacetylation of mitochondrial proteins protect neurons from ischemic injury,"ALANO, CONRAD",NORTHERN CALIFORNIA INSTITUTE/RES/EDU,CA,"$332,500"
Stroke,2015,NINDS,5R01NS025372-26,,Reperfusion and Neurovascular Injury in Stroke,"CHAN, PAK",STANFORD UNIVERSITY,CA,"$350,707"
Stroke,2015,NINDS,5P01NS055104-07,7772,Gliovascular regulation of the microglial switch,"LO, ENG",MASSACHUSETTS GENERAL HOSPITAL,MA,"$298,937"
Stroke,2015,NINDS,5P01NS055104-07,7773,Mechanisms of Recovery After White Matter Injury,"ARAI, KEN",MASSACHUSETTS GENERAL HOSPITAL,MA,"$307,140"
Stroke,2015,NINDS,5P01NS055104-07,7774,Targeting ROCK for Neurogliovascular Plasticity & Remodeling After Stroke,"AYATA, CENK",MASSACHUSETTS GENERAL HOSPITAL,MA,"$295,258"
Stroke,2015,NINDS,5P01NS055104-07,7775,High Resolution Optical Imaging,"BOAS, DAVID",MASSACHUSETTS GENERAL HOSPITAL,MA,"$285,859"
Stroke,2015,NINDS,5P01NS055104-07,7776,Neurobehavioral Core,"WHALEN, MICHAEL",MASSACHUSETTS GENERAL HOSPITAL,MA,"$140,086"
Stroke,2015,NINDS,5P01NS055104-07,7777,Project Coordination Core,"LO, ENG",MASSACHUSETTS GENERAL HOSPITAL,MA,"$86,567"
Stroke,2015,NINDS,5R01NS079639-04,,Mechanism of thrombolytic tPA induced intracerebral hemorrhage after stroke,"LAWRENCE, DANIEL",UNIVERSITY OF MICHIGAN,MI,"$340,156"
Stroke,2015,NIA,5R01AG029493-07,,Targeting CNTF to increase adult forebrain neurogenesis,"HAGG, THEO",EAST TENNESSEE STATE UNIVERSITY,TN,"$290,321"
Stroke,2015,NINDS,5R01NS077897-04,,Impact of BDNF SNP on stroke-induced plasticity and motor function,"CHO, SUNGHEE",WINIFRED MASTERSON BURKE MED RES INST,NY,"$396,581"
Stroke,2015,NICHD,5K23HD079556-03,,Assessing arousal regulation in post-stroke apathy using amantadine and EEG.,"GOLDFINE, ANDREW",STATE UNIVERSITY NEW YORK STONY BROOK,NY,"$151,318"
Stroke,2015,NIGMS,5R01GM109487-02,,Investigating cellular function and biochemical mechanism for STK24-CCM3 complex,"WU, DIANQING",YALE UNIVERSITY,CT,"$316,350"
Stroke,2015,NINDS,5R01NS083654-03,,Establishment of fast pH MRI for imaging metabolic injury during acute stroke,"SUN, PHILLIP",MASSACHUSETTS GENERAL HOSPITAL,MA,"$379,997"
Stroke,2015,NIDCD,5R01DC012584-03,,Non-invasive brain stimulation for swallowing recovery after a dysphagic stroke,"KUMAR, SANDEEP",BETH ISRAEL DEACONESS MEDICAL CENTER,MA,"$528,452"
Stroke,2015,NINDS,5R01NS083914-02,,Molecular basis of hyperhomocysteinemia induced brain injury in ischemic stroke,"PODDAR, RANJANA",UNIVERSITY OF NEW MEXICO HEALTH SCIS CTR,NM,"$330,313"
Stroke,2015,NINDS,5R03NS084340-02,,Studies of the Therapeutic Role of IU1 in a Mouse Model of Ischemic Stroke,"WANG, HONGMIN",UNIVERSITY OF SOUTH DAKOTA,SD,"$69,688"
Stroke,2015,NINDS,5R01NS020989-28,,Hemorheological Factors in Cerebral Ischemia,"FISHER, MARK",UNIVERSITY OF CALIFORNIA-IRVINE,CA,"$546,630"
Stroke,2015,NINDS,5R01NS080851-03,,CaMKII in global cerebral ischemia,"HERSON, PACO",UNIVERSITY OF COLORADO DENVER,CO,"$414,164"
