Category,FY,Funding IC,Project Number,Sub Project #,Project Title,PI Name,Org Name,State / Country,Amount
Stroke,2015,NICHD,5K01HD069504-05,,Brain Stimulation- aided Stroke Rehabilitation: Neural Mechanisms of Recovery,"PLOW, ELA",CLEVELAND CLINIC LERNER COM-CWRU,OH,"$110,416"
Stroke,2015,NICHD,5K01HD079584-02,,Cortical and spinal correlates of stroke gait rehabilitation,"KESAR, TRISHA",EMORY UNIVERSITY,GA,"$126,638"
Stroke,2015,NINDS,5R01NS083435-03,,US-China Collaborative Research on Stroke Imaging,"ZHOU, JINYUAN",JOHNS HOPKINS UNIVERSITY,MD,"$194,967"
Stroke,2015,FIC,5D43TW009137-02,,Interdisciplinary Cerebrovascular Diseases Training Program in South America,"ZUNT, JOSEPH",UNIVERSITY OF WASHINGTON,WA,"$232,735"
Stroke,2015,NINDS,1R15NS088384-01A1,,Targeting the Blood-Brain Barrier in Ischemic Stroke,"HAO, JIUKUAN",UNIVERSITY OF CINCINNATI,OH,"$487,203"
Stroke,2015,NINDS,5U01NS088312-02,,ZZ-3K3A-201: Safety evaluation of 3K3A-APC in ischemic stroke,"LYDEN, PATRICK",CEDARS-SINAI MEDICAL CENTER,CA,"$1,874,392"
Stroke,2015,NINDS,5F32NS089155-03,,Cell-Specific Targets and Functions of Caspase-9 in Cerebral Ischemia,"CODDING, JENNIFER",STANFORD UNIVERSITY,CA,"$54,194"
Stroke,2015,NIA,5R01AG040039-05,,Vascular Cognitive and Motor Decline: Impact of aPL,"ARVANITAKIS, ZOE",RUSH UNIVERSITY MEDICAL CENTER,IL,"$527,363"
Stroke,2015,NIGMS,5P01GM015431-48,7662,Inhibition of Lipid Peroxidation in Subarachnoid Hemorrage,"ROBERTS, L",VANDERBILT UNIVERSITY,TN,"$283,219"
Stroke,2015,NINDS,5R00NS078118-04,,Role of Thalamus in Post-stroke epileptogenesis,"PAZ, JEANNE",J. DAVID GLADSTONE INSTITUTES,CA,"$249,000"
Stroke,2015,NICHD,5R21HD080594-02,,Neonatal Resuscitation with Intact Cord (NRIC),"KATHERIA, ANUP",SHARP MEMORIAL HOSPITAL,CA,"$156,000"
Stroke,2015,NINDS,5R01NS080850-04,,Impact of disordered mineral metabolism on stroke and cognitive impairment,"GUTIERREZ, ORLANDO",UNIVERSITY OF ALABAMA AT BIRMINGHAM,AL,"$224,680"
Stroke,2015,NINDS,5R01NS088413-02,,GPR37 & GPR37L1 signaling pathways promoting cell survival: relevance to stroke,"HALL, RANDY",EMORY UNIVERSITY,GA,"$341,250"
Stroke,2015,NHLBI,1R01HL122200-01A1,,Comparative Effectiveness of Oral Anticoagulants in Atrial Fibrillation,"ALONSO, ALVARO",UNIVERSITY OF MINNESOTA,MN,"$645,731"
Stroke,2015,NICHD,5R01HD068588-04,,Optimizing Contralaterally Controlled FES for Acute Upper Limb Hemiplegia,"KNUTSON, JAYME",CASE WESTERN RESERVE UNIVERSITY,OH,"$423,054"
Stroke,2015,NHLBI,5R01HL080477-10,,REasons for Geographic And Racial Differences in Stroke-Myocardial Infarction-2,"SAFFORD, MONIKA",UNIVERSITY OF ALABAMA AT BIRMINGHAM,AL,"$783,419"
Stroke,2015,NHLBI,5R01HL102171-05,,Redox Regulation of Kv Channels,"TIPPARAJU, SRINIVAS",UNIVERSITY OF SOUTH FLORIDA,FL,"$338,584"
Stroke,2015,NHLBI,5R01HL110347-05,,Arterial Smooth Muscle Chloride Channels,"JAGGAR, JONATHAN",UNIVERSITY OF TENNESSEE HEALTH SCI CTR,TN,"$414,604"
Stroke,2015,NINDS,5R01NS083503-03,,Culprit Plaque in Acute Cerebral Infarction: A Histological and MRI Assessment,"HATSUKAMI, THOMAS",UNIVERSITY OF WASHINGTON,WA,"$200,000"
Stroke,2015,NINDS,2R01NS065842-08,,Alpha5Beta1 Integrin inhibition as a Profound Blood-Brain Barrier Stabilizing Neuroprotective Stroke Therapy,"BIX, GREGORY",UNIVERSITY OF KENTUCKY,KY,"$328,946"
Stroke,2015,NINDS,2R01NS065089-06,,Oligo-Vascular Signaling in Stroke,"ARAI, KEN",MASSACHUSETTS GENERAL HOSPITAL,MA,"$374,150"
Stroke,2015,NIA,5K23AG038444-05,,"Risk Factors, Genetics and Cognition in Cerebral Microbleeds: Framingham Study","ROMERO, JOSE",BOSTON UNIVERSITY MEDICAL CAMPUS,MA,"$128,736"
Stroke,2015,NIMHD,5R01MD008879-02,,Reducing Racial Disparities in Post-Stroke Disability in the Elderly,"SKOLARUS, LESLI",UNIVERSITY OF MICHIGAN,MI,"$387,500"
Stroke,2015,NINDS,5R01NS072628-05,,Cerebrovascular Structure in Hypertension: Mechanisms and Contributions to Stroke,"BAUMBACH, GARY",UNIVERSITY OF IOWA,IA,"$330,313"
Stroke,2015,NINDS,5U10NS080375-04,,Los Angeles Neurological Emergencies Treatment Trials (LA NETT),"STARKMAN, SIDNEY",UNIVERSITY OF CALIFORNIA LOS ANGELES,CA,"$196,537"
Stroke,2015,NINDS,1R01NS088656-01A1,,miR-17-92 exosome treatment of stroke,"CHOPP, MICHAEL",HENRY FORD HEALTH SYSTEM,MI,"$324,844"
Stroke,2015,NICHD,1R01DC013803-01A1,,Language connectivity pathways and neuroplasticity in aphasic stroke patients,"FERNANDEZ-MIRANDA, JUAN",UNIVERSITY OF PITTSBURGH AT PITTSBURGH,PA,"$100,000"
Stroke,2015,NIDCD,1R01DC013803-01A1,,Language connectivity pathways and neuroplasticity in aphasic stroke patients,"FERNANDEZ-MIRANDA, JUAN",UNIVERSITY OF PITTSBURGH AT PITTSBURGH,PA,"$268,784"
Stroke,2015,NINDS,1R01NS088555-01A1,,B cells alter adaptive autoimmunity to protect from ischemic injury after stroke,"STOWE, ANN",UT SOUTHWESTERN MEDICAL CENTER,TX,"$353,281"
Stroke,2015,NINDS,2R01NS045737-12A1,,Cellular mechanisms of fetal cerebral white matter injury,"BACK, STEPHEN",OREGON HEALTH & SCIENCE UNIVERSITY,OR,"$597,714"
Stroke,2015,NINDS,5R01NS075887-05,,Regulatory B-cells Limit CNS Inflammation and Infarct in Experimental Stroke,"OFFNER, HALINA",OREGON HEALTH & SCIENCE UNIVERSITY,OR,"$350,535"
Stroke,2015,NINDS,5U54NS083932-03,7032,Combination theraphy of betaine and fenofibrate against delayed neuronal,"NAMURA, SHOBU",MOREHOUSE SCHOOL OF MEDICINE,GA,"$153,664"
Stroke,2015,NINDS,1R01NS087147-01A1,,Vascular Ectonucleotidase Regulation of Ischemic Stroke,"PINSKY, DAVID",UNIVERSITY OF MICHIGAN,MI,"$422,114"
Stroke,2015,NIGMS,2R01GM044842-24,,Sensitive and Selective Detection of Peptides,"WEBER, STEPHEN",UNIVERSITY OF PITTSBURGH AT PITTSBURGH,PA,"$460,375"
Stroke,2015,NIBIB,2R01EB011556-05,,Optical Imaging of Baseline Blood Flow and Oxygenation During Stroke,"DUNN, ANDREW","UNIVERSITY OF TEXAS, AUSTIN",TX,"$465,127"
Stroke,2015,NINDS,2R01NS067078-06A1,,Role of prohibitin in ischemic brain injury,"ZHOU, PING",WEILL MEDICAL COLL OF CORNELL UNIV,NY,"$370,781"
Stroke,2015,NICHD,1R01HD084009-01A1,,Motor impairment related changes in muscles properties in chronic stroke,"DEWALD, JULIUS",NORTHWESTERN UNIVERSITY AT CHICAGO,IL,"$474,888"
Stroke,2015,NIDDK,5R01DK077148-08,,Metabolic and Xenobiotic Control of Thyroid Hormone Metabolism,"BIANCO, ANTONIO",RUSH UNIVERSITY MEDICAL CENTER,IL,"$332,775"
Stroke,2015,NINDS,5R01NS058784-07,,Paracrine and synaptic mechanisms underlying recovery using human stem cell thera,"STEINBERG, GARY",STANFORD UNIVERSITY,CA,"$446,009"
Stroke,2015,NIDCD,5R01DC011317-05,,Rehabilitation and Prophylaxis of Anomia in Primary Progressive Aphasia,"FRIEDMAN, RHONDA",GEORGETOWN UNIVERSITY,DC,"$477,794"
Stroke,2015,NINDS,5R01NS056457-10,,Sensitization to Brain Antigens Following Stroke,"BECKER, KYRA",UNIVERSITY OF WASHINGTON,WA,"$337,969"
Stroke,2015,NIMHD,5R01MD009164-02,,HISPANIC SECONDARY STROKE PREVENTION INITIATIVE,"CARRASQUILLO, OLVEEN",UNIVERSITY OF MIAMI SCHOOL OF MEDICINE,FL,"$383,750"
Stroke,2015,NINDS,5U10NS086729-03,,New England Regional Coordinating Center for the NINDS Stroke Trials Network,"SCHWAMM, LEE",MASSACHUSETTS GENERAL HOSPITAL,MA,"$324,874"
Stroke,2015,NINDS,5U10NS086496-03,,UT-Houston Regional Stroke Center,"SAVITZ, SEAN",UNIVERSITY OF TEXAS HLTH SCI CTR HOUSTON,TX,"$339,250"
Stroke,2015,NINDS,5U01NS086872-03,,NSTN National Clinical Coordinating Center,"BRODERICK, JOSEPH",UNIVERSITY OF CINCINNATI,OH,"$2,347,302"
Stroke,2015,NINDS,1R21NS088315-01A1,,Examining the hibernating brain for temperature-sensitive RNA editing,"MARTIN, SANDRA",UNIVERSITY OF COLORADO DENVER,CO,"$269,496"
Stroke,2015,NINDS,5U01NS069498-05,,The Stroke Hyperglycemia Insulin Network Effort (SHINE) Trial,"JOHNSTON, KAREN",UNIVERSITY OF VIRGINIA,VA,"$1,096,776"
Stroke,2015,NINDS,1R21NS088256-01A1,,"Translational, multimodality correlation between human and rabbit saccular aneurysms","KALLMES, DAVID",MAYO CLINIC ROCHESTER,MN,"$241,911"
Stroke,2015,NINDS,1R21NS085282-01A1,,A Pharmaco-Epigenomic Intervention for the Mitochondrial Disorder MELAS,"CHIARAMELLO, ANNE",GEORGE WASHINGTON UNIVERSITY,DC,"$408,354"
Stroke,2015,NICHD,1K23HD080837-01A1,,Evaluation of a Carepartner-Integrated Telehealth Rehabilitation Program for Persons with Stroke - NICHD K-23,"BLANTON, SARAH",EMORY UNIVERSITY,GA,"$126,442"
Stroke,2015,NIBIB,1R21EB018426-01A1,,Transistor and Circuit Designs for Real Time Brain Injury Biomarker Detection,"KATZ, HOWARD",JOHNS HOPKINS UNIVERSITY,MD,"$227,640"
Stroke,2015,NIA,1R03AG048180-01A1,,"Cerebral Microbleeds in Young Adults: risk factors, biomarkers and genetics","ROMERO, JOSE",BOSTON UNIVERSITY MEDICAL CAMPUS,MA,"$81,850"
Stroke,2015,NINDS,5R01NS043277-13,,Liberation of Intracellular Zinc and Neuronal Cell Death,"AIZENMAN, ELIAS",UNIVERSITY OF PITTSBURGH AT PITTSBURGH,PA,"$389,065"
Stroke,2015,NINDS,5R01NS045048-10,,Neuroprotection in Models of Cerebral Ischemia,"CHEN, JUN",UNIVERSITY OF PITTSBURGH AT PITTSBURGH,PA,"$337,866"
Stroke,2015,NINDS,5R01NS045847-09,,White matter hypoxia in a novel model of MMP-mediated inflammation in SHR/SP,"ROSENBERG, GARY",UNIVERSITY OF NEW MEXICO HEALTH SCIS CTR,NM,"$330,495"
Stroke,2015,NINDS,5R01NS075156-05,,MicroRNAs and neurogenesis after stroke,"ZHANG, ZHENG GANG",HENRY FORD HEALTH SYSTEM,MI,"$320,469"
Stroke,2015,NINDS,5R01NS083761-03,,Rapid high order diffusion imaging for stroke,"DI BELLA, EDWARD",UNIVERSITY OF UTAH,UT,"$348,924"
Stroke,2015,NINDS,1R21NS087157-01A1,,Xenon As A Therapeutic in Experimental Intracerebral Hemorrhage,"WARNER, DAVID",DUKE UNIVERSITY,NC,"$396,250"
Stroke,2015,NINDS,5R01NS082285-03,,Statins augment small vessel function and improve stroke outcomes,"ROST, NATALIA",MASSACHUSETTS GENERAL HOSPITAL,MA,"$543,021"
Stroke,2015,NINDS,5K23NS073104-05,,Neuro-vascular Disease as a Cause of Impaired Mobility,"WILLEY, JOSHUA",COLUMBIA UNIVERSITY HEALTH SCIENCES,NY,"$190,766"
Stroke,2015,NINDS,5R01NS076617-05,,Targeting phosphatase regulated cleavage of HIF-1-alpha in ischemic brain injury,"HALTERMAN, MARC",UNIVERSITY OF ROCHESTER,NY,"$329,408"
Stroke,2015,NINDS,5R01NS079345-03,,White Matter Protection in Cerebral Ischemia,"CAO, GUODONG",UNIVERSITY OF PITTSBURGH AT PITTSBURGH,PA,"$336,875"
Stroke,2015,NINDS,5F31NS083244-03,,The Immunoinhibitory Role of CD200-CD200R1 Signaling in Experimental Stroke,"RITZEL, RODNEY",UNIVERSITY OF CONNECTICUT SCH OF MED/DNT,CT,"$33,628"
Stroke,2015,NINDS,2R01NS030678-21A1,,Comparison of Hemorrhagic & Ischemic Stroke Among Blacks and Whites,"KISSELA, BRETT",UNIVERSITY OF CINCINNATI,OH,"$1,599,356"
Stroke,2015,NINDS,5U10NS086512-03,,Cincinnati Regional Coordinating Stroke Center (Cincinnati RCC),"KHATRI, POOJA",UNIVERSITY OF CINCINNATI,OH,"$291,400"
Stroke,2015,NINDS,5U10NS086521-03,,The University of Iowa's Statewide Stroke Research Network,"LEIRA, ENRIQUE",UNIVERSITY OF IOWA,IA,"$301,169"
Stroke,2015,NINDS,5U10NS086528-03,,Miami Regional Coordinating Center for NINDS Stroke Trials Network,"ROMANO, JOSE",UNIVERSITY OF MIAMI SCHOOL OF MEDICINE,FL,"$381,910"
Stroke,2015,NINDS,5U10NS086535-03,,UCSD Regional Coordinating Center for the NINDS Stroke Trials Network,"MEYER, BRETT",UNIVERSITY OF CALIFORNIA SAN DIEGO,CA,"$210,976"
Stroke,2015,NINDS,5U10NS086606-03,,UT StrokeNet,"MAJERSIK, JENNIFER",UNIVERSITY OF UTAH,UT,"$366,620"
Stroke,2015,NINDS,5U10NS086608-03,,Stroke Trials Network - Regional Coordinating Stroke Centers,"PRABHAKARAN, SHYAM",NORTHWESTERN UNIVERSITY AT CHICAGO,IL,"$274,697"
Stroke,2015,NINDS,5U01NS080856-03,,MISTIE III: Cluster Application for the Data Coordinating Center,"THOMPSON, RICHARD",JOHNS HOPKINS UNIVERSITY,MD,"$738,346"
Stroke,2015,NINDS,5U10NS086467-03,,NINDS Stroke Trials Network - Regional Coordinating Center,"EZZEDDINE, MUSTAPHA",UNIVERSITY OF MINNESOTA,MN,"$185,985"
Stroke,2015,NINDS,5U10NS086474-03,,The Philadelphia Regional Stroke Trials Network coordinating Center (PRSTNCC),"KASNER, SCOTT",UNIVERSITY OF PENNSYLVANIA,PA,"$234,955"
Stroke,2015,NINDS,5U10NS086487-03,,Stanford University Regional Coordinating Stroke Center for the NINDS Stroke Tria,"ALBERS, GREGORY",STANFORD UNIVERSITY,CA,"$291,345"
Stroke,2015,NINDS,5U10NS086490-03,,South Carolina Collaborative Alliance for Stroke Trials (SC-CoAST),"JAUCH, EDWARD",MEDICAL UNIVERSITY OF SOUTH CAROLINA,SC,"$242,271"
Stroke,2015,NINDS,5U10NS086494-03,,NorCal - Coordinating Stroke Center,"SMITH, WADE","UNIVERSITY OF CALIFORNIA, SAN FRANCISCO",CA,"$381,417"
Stroke,2015,NINDS,5U10NS086533-03,,University of Wisconsin Regional Coordinating Center (UW RCC),"DEMPSEY, ROBERT",UNIVERSITY OF WISCONSIN-MADISON,WI,"$115,750"
Stroke,2015,NHLBI,5R00HL106232-04,,MRI of Intracranial Atherosclerosis,"QIAO, YE",JOHNS HOPKINS UNIVERSITY,MD,"$245,009"
Stroke,2015,NINDS,5K23NS073685-05,,A Community Partnership to Treat Stroke,"SKOLARUS, LESLI",UNIVERSITY OF MICHIGAN,MI,"$187,380"
Stroke,2015,NINDS,5U01NS080824-03,,MISTIE III_ Lead Grant_ Cluster Application for the Clinical Coordinating Center,"HANLEY, DANIEL",JOHNS HOPKINS UNIVERSITY,MD,"$2,539,627"
Stroke,2015,NINDS,5U10NS086489-03,,Stroke Trials Network-Regional Coordinating Ctr. Univ. of Pittsburgh (STN-UP),"WECHSLER, LAWRENCE",UNIVERSITY OF PITTSBURGH AT PITTSBURGH,PA,"$287,995"
Stroke,2015,NINDS,5U10NS086531-03,,The New York City Collaborative Regional Coordinating Stroke Center,"TUHRIM, STANLEY",ICAHN SCHOOL OF MEDICINE AT MOUNT SINAI,NY,"$257,473"
Stroke,2015,NINDS,5K23NS076597-05,,Metabolomic analysis of acute stress hyperglycemia in ischemic stroke,"KIMBERLY, WILLIAM",MASSACHUSETTS GENERAL HOSPITAL,MA,"$196,144"
Stroke,2015,NINDS,5U10NS086728-03,,New York Stroke Trials Network of Columbia and Cornell (NYCCSTN),"MARSHALL, RANDOLPH",COLUMBIA UNIVERSITY HEALTH SCIENCES,NY,"$390,950"
Stroke,2015,NINDS,5U10NS086492-03,,The Vanderbilt Stroke Trials Network Regional Coordinating Center for Tennessee,"FROEHLER, MICHAEL",VANDERBILT UNIVERSITY,TN,"$266,500"
Stroke,2015,NIBIB,5K99EB017289-02,,Generation of Cell-based and Animal-based Imaging Systems for Monitoring Synaptic,"QIN, YAN",UNIVERSITY OF COLORADO,CO,"$7,229"
Stroke,2015,NICHD,5R44HD071745-03,,Virtual Occupational Therapy Assistant (VOTA),"ADAMS, RICHARD","BARRON ASSOCIATES, INC.",VA,"$712,549"
Stroke,2015,NIGMS,5P20GM109021-02,5235,Identifying Genetic Predictors of Stroke Using Next Generation Sequencing,"KOLB, EDWARD",ALFRED I. DU PONT HOSP FOR CHILDREN,DE,"$69,346"
Stroke,2015,NHLBI,5K01HL124391-02,,Examining Racial Disparities in Stroke,"JIMENEZ, MONIK",BRIGHAM AND WOMEN'S HOSPITAL,MA,"$130,086"
Stroke,2015,NIA,5R01AG012975-18,,Epidemiology of Functional Status in Elderly Hispanics,"HAAN, MARY","UNIVERSITY OF CALIFORNIA, SAN FRANCISCO",CA,"$611,033"
Stroke,2015,NEI,5R01EY015304-10,,Mechanisms of Optic Nerve Stroke Neuroprotection,"BERNSTEIN, STEVEN",UNIVERSITY OF MARYLAND BALTIMORE,MD,"$376,075"
Stroke,2015,NINDS,5K08NS078110-05,,Targeting Myeloid Populations to Reduce Injury after Intracerebral Hemorrhage,"SANSING, LAUREN",YALE UNIVERSITY,CT,"$187,380"
Stroke,2015,NINDS,5U54NS083924-03,7037,Neuroprotection of the cembranoid 4R compound against stroke,"MARTINS, ANTONIO",UNIVERSIDAD CENTRAL DEL CARIBE,PR,"$164,396"
Stroke,2015,NINDS,5F32NS086397-02,,Therapeutic functions of prostaglandin signaling in post-stroke inflammation,"LARKIN, PAUL",STANFORD UNIVERSITY,CA,"$54,194"
Stroke,2015,NIGMS,5P20GM109090-02,5347,The Effects of Virtual Reality on Gait Variability after Stroke,"MUKHERJEE, MUKUL",UNIVERSITY OF NEBRASKA OMAHA,NE,"$194,732"
Stroke,2015,NICHD,5R21HD073105-02,,Neonatal ischemic seizures:  age and gender susceptibility to refractoriness,"KADAM, SHILPA",HUGO W. MOSER RES INST KENNEDY KRIEGER,MD,"$196,950"
Stroke,2015,NINDS,5R01NS047603-10,,Ultrasound-Assisted Thrombolysis for Stroke Therapy,"HOLLAND, CHRISTY",UNIVERSITY OF CINCINNATI,OH,"$545,685"
Stroke,2015,NINDS,5R21NS086144-02,,Developing a system to study stroke rehabilitation in an ethnically diverse community,"MORGENSTERN, LEWIS",UNIVERSITY OF MICHIGAN,MI,"$193,444"
Stroke,2015,NINDS,5U10NS086525-03,,UW Medicine NINDS Stroke Trials Network Regional Coordinating Stroke Center,"TIRSCHWELL, DAVID",UNIVERSITY OF WASHINGTON,WA,"$386,074"
Stroke,2015,NINDS,5U10NS086607-03,,NINDS Stroke Trials Network - Regional Coordinating Stroke Centers (U10),"FRANKEL, MICHAEL",EMORY UNIVERSITY,GA,"$133,000"
Stroke,2015,NHLBI,1R44HL127758-01,,Anticoagulum Cardiac RF Ablation Catheter (Direct Phase II),"SIGG, DANIEL","FOCUSSTART, LLC",MN,"$1,220,224"
Stroke,2015,NINDS,5R01NS076694-05,,Astrocyte-endothelial crosstalk after cerebral ischemia and hemorrhage,"LO, ENG",MASSACHUSETTS GENERAL HOSPITAL,MA,"$374,150"
Stroke,2015,NINDS,5R01NS080839-02,,High Density Surface EMG Assessment of Motor Unit Alterations after Stroke,"ZHOU, PING",UNIVERSITY OF TEXAS HLTH SCI CTR HOUSTON,TX,"$297,753"
Stroke,2015,NINDS,5U10NS086497-03,,Los Angeles - Southern California NINDS Stroke Trial Network (LASC NSTN),"SAVER, JEFFREY",UNIVERSITY OF CALIFORNIA LOS ANGELES,CA,"$398,750"
Stroke,2015,NINDS,5U10NS086513-03,,Stroke National Capital Area Network for Research (SCANR),"DROMERICK, ALEXANDER",MEDSTAR HEALTH RESEARCH INSTITUTE,MD,"$285,737"
Stroke,2015,NINDS,5U10NS086526-03,,University of Michigan Regional Coordinating Stroke Center,"SCOTT, PHILLIP",UNIVERSITY OF MICHIGAN,MI,"$257,320"
Stroke,2015,NINDS,5U10NS086532-03,,Cleveland NINDS Stroke Trial Collaborative,"FURLAN, ANTHONY",CASE WESTERN RESERVE UNIVERSITY,OH,"$215,400"
Stroke,2015,NINDS,1R41NS086295-01A1,,Automated Assessment of Leptomeningeal Collaterals on CT Angiograms,"LEE, YUEH","KITWARE, INC.",NY,"$150,000"
Stroke,2015,NICHD,2R44HD082882-02A1,,Lever Actuated Rehabilitation of the Arm using Wheelchair Propulsion and Computer Gaming,"ZONDERVAN, DANIEL",FLINT REHABILITATION DEVICES,CA,"$622,746"
Stroke,2015,NINDS,1R43NS090821-01A1,,Drug Eluting Coils for Improved Treatment of Brain Aneurysms,"BETTINGER, CHRISTOPHER","ANCURE, LLC",PA,"$225,000"
Stroke,2015,NINDS,2R42NS073378-03A1,,Stroke Treatment by Chemically-induced Hypothermia,"DIX, THOMAS","JT PHARMACEUTICALS, INC.",SC,"$793,793"
Stroke,2015,NINDS,1R44NS092144-01,,Targeted Transcranial Electrotherapy to accelerate Stroke Rehabilitation-Exploratory Trial on Aphasia,"DATTA, ABHISHEK","SOTERIX MEDICAL,INC.",NY,"$535,329"
Stroke,2015,NINDS,5F32NS086392-02,,Moderating Post-Stroke Hemiparesis with the Cross Education Phenomenon,"URBIN, MICHAEL",WASHINGTON UNIVERSITY,MO,"$18,049"
Stroke,2015,NHLBI,2R01HL101972-06,,Characterization of coagulation factor-platelet interactions: role of FXI,"MCCARTY, OWEN",OREGON HEALTH & SCIENCE UNIVERSITY,OR,"$383,124"
Stroke,2015,NINDS,5K23NS082367-03,,Atrial Fibrillation Precursors May Be Novel Stroke Risk Factors,"KAMEL, HOOMAN",WEILL MEDICAL COLL OF CORNELL UNIV,NY,"$187,483"
Stroke,2015,NINDS,1F31NS089135-01A1,,The Role of Homotopic Functional Connectivity in Cortical Remapping after Focal Ischemia,"KRAFT, ANDREW",WASHINGTON UNIVERSITY,MO,"$29,696"
Stroke,2015,NIDCD,1F31DC014389-01A1,,Neural correlates of treatment-induced recovery of phonological processing in chronic aphasia,"DEMARCO, ANDREW",UNIVERSITY OF ARIZONA,AZ,"$38,600"
Stroke,2015,NINDS,1F30NS092168-01,,Role of lung-brain coupling on neutrophil priming and reperfusion injury following global cerebral ischemia,"MAI, NGUYEN",UNIVERSITY OF ROCHESTER,NY,"$48,120"
Stroke,2015,NINDS,1F31NS092268-01,,Brain circuits in motor learning,"YAROSSI, MATHEW",RBHS-SCHOOL/ HEALTH RELATED PROFESSIONS,NJ,"$29,934"
Stroke,2015,NIDCD,5R01DC000191-34,,Psycholinguistic Analysis of Aphasic Syndromes,"SCHWARTZ, MYRNA",ALBERT EINSTEIN HEALTHCARE NETWORK,PA,"$581,154"
Stroke,2015,NHLBI,5R01HL092259-07,,Cerebral Autoregulation Monitoring to Reduce Brain Injury from Cardiac Surgery,"HOGUE, CHARLES",JOHNS HOPKINS UNIVERSITY,MD,"$385,403"
Stroke,2015,NINDS,5U01NS074425-04,,Futility Study of Deferoxamine Mesylate in Intracerebral Hemorrhage (i-DEF),"SELIM, MAGDY",BETH ISRAEL DEACONESS MEDICAL CENTER,MA,"$1,744,825"
Stroke,2015,NINDS,5R21NS087908-02,,Outer mitochondrial PKA and PP2A in neurodevelopment and plasticity,"STRACK, STEFAN",UNIVERSITY OF IOWA,IA,"$188,750"
Stroke,2015,NINDS,1F32NS087775-01A1,,Muscle coordination changes affecting impaired balance control post-stroke.,"ALLEN, JESSICA",EMORY UNIVERSITY,GA,"$56,669"
Stroke,2015,NINDS,1F31NS089356-01A1,,Neuroprotective mechanims of reseveratrol pre-conditioning,"KORONOWSKI, KEVIN",UNIVERSITY OF MIAMI SCHOOL OF MEDICINE,FL,"$36,720"
Stroke,2015,NINDS,5R21NS090422-02,,Fetal Microchimeric Responses to Ischemic Stroke,"MCCULLOUGH, LOUISE",UNIVERSITY OF CONNECTICUT SCH OF MED/DNT,CT,"$239,250"
Stroke,2015,NINDS,1F31NS090921-01A1,,Remote ischemic conditioning as a pre-hospital therapeutic intervention for diffuse traumatic brain injury,"HARRISON, JORDAN",ARIZONA STATE UNIVERSITY-TEMPE CAMPUS,AZ,"$39,084"
Stroke,2015,NIDCD,5F32DC014211-02,,Control of duration in speech and temporal deficits in Ataxic Dysarthria,"PARRELL, BENJAMIN",UNIVERSITY OF CALIFORNIA BERKELEY,CA,"$52,406"
Stroke,2015,NINDS,5R01NS078223-04,,OPTICAL IMAGING AND FUNCTIONAL CONNECTIVITY MAPPING FOR MICE,"CULVER, JOSEPH",WASHINGTON UNIVERSITY,MO,"$525,663"
Stroke,2015,NINDS,2R37NS090610-10A1,,Human Locomotor Plasticity in Health and Disease,"BASTIAN, AMY",HUGO W. MOSER RES INST KENNEDY KRIEGER,MD,"$564,100"
Stroke,2015,NINDS,5R01NS076491-05,,Computational and Biological Approach to Flow Diversion,"KADIRVEL, RAMANATHAN",MAYO CLINIC ROCHESTER,MN,"$485,225"
Stroke,2015,NINDS,5R01NS082225-03,,In vivo Inhibition of Specific microRNAs to Support Post-Stroke Revascularization,"ROITBAK, TAMARA",UNIVERSITY OF NEW MEXICO HEALTH SCIS CTR,NM,"$330,495"
Stroke,2015,RMAP,5DP1NS082101-05,,Generating transplantable neurons by in vivo combinatorial screening of transcrip,"YANIK, MEHMET",MASSACHUSETTS INSTITUTE OF TECHNOLOGY,MA,"$802,500"
Stroke,2015,NIGMS,5SC1DC009792-07,,Facilitation and competition across languages in multilingual aphasia,"GORAL, MIRA",HERBERT H. LEHMAN COLLEGE,NY,"$313,498"
Stroke,2015,NINDS,5R21NS088789-02,,NEUROPROTECTIVE EFFECTS OF KETONE BODY OXIDATION IN CEREBRAL ISCHEMIA,"THIO, KWEE",WASHINGTON UNIVERSITY,MO,"$190,625"
Stroke,2015,NINDS,1R01NS092455-01,,Mechanisms of lung-dependent neutrophil priming in global cerebral ischemia-reperfusion injury,"HALTERMAN, MARC",UNIVERSITY OF ROCHESTER,NY,"$350,261"
Stroke,2015,NLM,5R01LM011566-03,,Predictive optimal anticlotting treatment for segmented patient populations,"TONELLATO, PETER",HARVARD MEDICAL SCHOOL,MA,"$247,867"
Stroke,2015,NINDS,5R01NS053813-09,,Stretch Reflex Contributions to Multijoint Coordination,"PERREAULT, ERIC",REHABILITATION INSTITUTE OF CHICAGO,IL,"$304,873"
Stroke,2015,NINDS,5U10NS086484-03,,The Ohio State University Regional Coordinating Stroke Center,"TORBEY, MICHEL",OHIO STATE UNIVERSITY,OH,"$270,768"
Stroke,2015,NINDS,5R01NS086929-02,,Low-level Laser Therapy in Global Cerebral Ischemia,"ZHANG, QUANGUANG",GEORGIA REGENTS UNIVERSITY,GA,"$332,500"
Stroke,2015,NINDS,5R03NS087416-02,,The Role of THSD1 in Endothelial Cell Adhesion and Survival,"KIM, DONG",UNIVERSITY OF TEXAS HLTH SCI CTR HOUSTON,TX,"$77,000"
Stroke,2015,NIA,5P30AG028747-10,8618,PILOT/EXPLORATORY STUDIES CORE,"GOLDBERG, ANDREW",UNIVERSITY OF MARYLAND BALTIMORE,MD,"$208,754"
Stroke,2015,NINDS,5U54NS081760-04,5143,"Shake, Rattle and Roll","NGUYEN-HUYNH, MAI",KAISER FOUNDATION RESEARCH INSTITUTE,CA,"$560,097"
Stroke,2015,NINDS,5U54NS081760-04,5144,Racial Disparities in Ischemic Stroke &Atherosclerotic Risk Factors In the Young,"FULLERTON, HEATHER",KAISER FOUNDATION RESEARCH INSTITUTE,CA,"$619,521"
Stroke,2015,NINDS,5U54NS081760-04,5145,Administrative Core,"BLICK, NOELLE",KAISER FOUNDATION RESEARCH INSTITUTE,CA,"$338,958"
Stroke,2015,NINDS,5U54NS081760-04,5146,Research Education and Training Core,"BIBBINS-DOMINGO, KIRSTEN",KAISER FOUNDATION RESEARCH INSTITUTE,CA,"$204,849"
Stroke,2015,NINDS,5U54NS081760-04,5147,Research Methods Core,"BIBBINS-DOMINGO, KIRSTEN",KAISER FOUNDATION RESEARCH INSTITUTE,CA,"$252,674"
Stroke,2015,NINDS,5U54NS081764-04,5155,Secondary Stroke prevention by Uniting Community and,"VICKREY, BARBARA",UNIVERSITY OF CALIFORNIA LOS ANGELES,CA,"$795,657"
Stroke,2015,NINDS,5U54NS081764-04,5156,Racial/Ethnic Differences in Trends in Socioeconomic,"BROWN, ARLEEN",UNIVERSITY OF CALIFORNIA LOS ANGELES,CA,"$366,146"
Stroke,2015,NINDS,5U54NS081764-04,5157,Implementing and Testing a Culturally-Tailored Stroke,"SARKISIAN, CATHERINE",UNIVERSITY OF CALIFORNIA LOS ANGELES,CA,"$356,108"
Stroke,2015,NINDS,5U54NS081764-04,5158,Administrative Core,"VICKREY, BARBARA",UNIVERSITY OF CALIFORNIA LOS ANGELES,CA,"$415,690"
Stroke,2015,NINDS,5U54NS081764-04,5159,Research Education & Training Core,"ESCARCE, JOSE",UNIVERSITY OF CALIFORNIA LOS ANGELES,CA,"$80,507"
Stroke,2015,NINDS,5U54NS081764-04,5160,Biomarker Collection and Analysis Core,"SEEMAN, TERESA",UNIVERSITY OF CALIFORNIA LOS ANGELES,CA,"$128,367"
Stroke,2015,NINDS,5U54NS081764-04,5161,"Community Engagement, Outreach & Dissemination","BROWN, ARLEEN",UNIVERSITY OF CALIFORNIA LOS ANGELES,CA,"$115,940"
Stroke,2015,NINR,5R01NR014756-03,,NRI: Novel platform for rapid exploration of robotic ankle exoskeleton control st,"SAWICKI, GREGORY",NORTH CAROLINA STATE UNIVERSITY RALEIGH,NC,"$146,953"
Stroke,2015,NINDS,5K08NS085033-03,,The contributions of motor learning and inhibitory balance to stroke recovery,"ZEILER, STEVEN",JOHNS HOPKINS UNIVERSITY,MD,"$190,216"
Stroke,2015,NINDS,5R37NS045876-12,,Mitochondrial Ion Channels in Hypoxic Neurons,"JONAS, ELIZABETH",YALE UNIVERSITY,CT,"$416,250"
Stroke,2015,NINDS,5U54NS081765-04,5162,Practice-Based Trial of Home BP Telemonitoring Among Minority Stroke Survivors,"OGEDEGBE, GBENGA",NEW YORK UNIVERSITY SCHOOL OF MEDICINE,NY,"$752,198"
Stroke,2015,NINDS,5U54NS081765-04,5163,Stroke Community Transitions Project,"FELDMAN, PENNY",NEW YORK UNIVERSITY SCHOOL OF MEDICINE,NY,"$377,165"
Stroke,2015,NINDS,5U54NS081765-04,5164,Tailored Approaches to Stroke Health Education,"WILLIAMS, OLAJIDE",NEW YORK UNIVERSITY SCHOOL OF MEDICINE,NY,"$234,590"
