Category,FY,Funding IC,Project Number,Sub Project #,Project Title,PI Name,Org Name,State / Country,Amount
Stroke,2016,NINDS,4U10NS086728-04,,New York Stroke Trials Network of Columbia and Cornell (NYCCSTN),"MARSHALL, RANDOLPH",COLUMBIA UNIVERSITY HEALTH SCIENCES,NY,"$383,397"
Stroke,2016,NINDS,2R01NS067443-06,,Statewide dissemination of a school-based public stroke education intervention,"WILLIAMS, OLAJIDE",COLUMBIA UNIVERSITY HEALTH SCIENCES,NY,"$769,647"
Stroke,2016,NHLBI,5R01HL129179-02,,Platelet-inspired Delivery System for Targeted Thrombolytic Therapy,"SEN GUPTA, ANIRBAN",CASE WESTERN RESERVE UNIVERSITY,OH,"$465,003"
Stroke,2016,NINDS,4U01NS069498-06,,The Stroke Hyperglycemia Insulin Network Effort (SHINE) Trial,"JOHNSTON, KAREN",UNIVERSITY OF VIRGINIA,VA,"$4,122,174"
Stroke,2016,NINDS,1R01NS093870-01A1,,Recurrent Hemorrhagic Stroke in Minority Populations,"ROSAND, JONATHAN",MASSACHUSETTS GENERAL HOSPITAL,MA,"$589,160"
Stroke,2016,NINDS,1R21NS096997-01,,Pericytes as Inducers of Blood-brain Barrier Injury During Stroke,"SHIH, ANDY",MEDICAL UNIVERSITY OF SOUTH CAROLINA,SC,"$224,250"
Stroke,2016,NINDS,2R01NS048216-11,,The role of Na/H exchanger in cerebral ischemia,"SUN, DANDAN",UNIVERSITY OF PITTSBURGH AT PITTSBURGH,PA,"$336,875"
Stroke,2016,NINDS,1R01NS097000-01,,Whole Transcriptome Studies of Patients with Transient Ischemic Attacks (TIAs),"SHARP, FRANK",UNIVERSITY OF CALIFORNIA AT DAVIS,CA,"$620,686"
Stroke,2016,NINDS,4U10NS086526-04,,University of Michigan Regional Coordinating Stroke Center,"SCOTT, PHILLIP",UNIVERSITY OF MICHIGAN,MI,"$356,650"
Stroke,2016,NINDS,4U10NS086532-04,,Cleveland NINDS Stroke Trial Collaborative,"FURLAN, ANTHONY",CASE WESTERN RESERVE UNIVERSITY,OH,"$357,037"
Stroke,2016,NINDS,5U01NS087876-03,,Development of a next-generation PSD95 Inhibitor for the treatment of acute ische,"TYMIANSKI, MICHAEL",UNIVERSITY HEALTH NETWORK,CANADA,"$1,198,933"
Stroke,2016,NINDS,3U01NS087748-02S1,,Workshop to Identify Collaborative Project(s) for the NIH StrokeNet and the Japan NEtwork for Clinical Stroke Trials (NECST),"PALESCH, YUKO",MEDICAL UNIVERSITY OF SOUTH CAROLINA,SC,"$52,325"
Stroke,2016,NIDCD,5R03DC014310-02,,Investigating insight into inner speech in aphasia,"TURKELTAUB, PETER",GEORGETOWN UNIVERSITY,DC,"$153,835"
Stroke,2016,NINDS,4U10NS086531-04,,The New York City Collaborative Regional Coordinating Stroke Center,"TUHRIM, STANLEY",ICAHN SCHOOL OF MEDICINE AT MOUNT SINAI,NY,"$369,627"
Stroke,2016,NICHD,4K24HD074722-04,,Brain plasticity and rehabilitation after stroke,"CRAMER, STEVEN",UNIVERSITY OF CALIFORNIA-IRVINE,CA,"$117,626"
Stroke,2016,NINDS,5R01NS094758-02,,Purinergic Signaling in Varicella Zoster Virus Vasculopathy,"NAGEL, MARIA",UNIVERSITY OF COLORADO DENVER,CO,"$340,156"
Stroke,2016,RMAP,5UH3TR000891-04,,exRNA signatures Predict Outcomes after brain injury,"JENSEN, KENDALL",TRANSLATIONAL GENOMICS RESEARCH INST,AZ,"$948,972"
Stroke,2016,NIMHD,1U01MD010579-01,,A Community Based Participatory Trial to Increase Stroke Treatment,"SKOLARUS, LESLI",UNIVERSITY OF MICHIGAN,MI,"$265,364"
Stroke,2016,OD,1U01MD010579-01,,A Community Based Participatory Trial to Increase Stroke Treatment,"SKOLARUS, LESLI",UNIVERSITY OF MICHIGAN,MI,"$273,586"
Stroke,2016,NINDS,4K08NS085033-04,,The contributions of motor learning and inhibitory balance to stroke recovery,"ZEILER, STEVEN",JOHNS HOPKINS UNIVERSITY,MD,"$189,280"
Stroke,2016,NINDS,5R01NS091112-02,,Outcomes Among Surrogate decision makers In Stroke (OASIS),"MORGENSTERN, LEWIS",UNIVERSITY OF MICHIGAN,MI,"$521,414"
Stroke,2016,NIA,5R01AG049084-02,,Rhythm and Timing Exercises for Cerebral Vascular Disease in American Indians,"VERNEY, STEVEN",UNIVERSITY OF NEW MEXICO,NM,"$238,655"
Stroke,2016,NIGMS,5R01AG049084-02,,Rhythm and Timing Exercises for Cerebral Vascular Disease in American Indians,"VERNEY, STEVEN",UNIVERSITY OF NEW MEXICO,NM,"$280,000"
Stroke,2016,NINDS,5R21NS094022-02,,Reducing stroke burden in Uganda,"SAJATOVIC, MARTHA",CASE WESTERN RESERVE UNIVERSITY,OH,"$161,047"
Stroke,2016,NINDS,4R01NS058784-08,,Paracrine and synaptic mechanisms underlying recovery using human stem cell thera,"STEINBERG, GARY",STANFORD UNIVERSITY,CA,"$429,536"
Stroke,2016,NINDS,5R01NS047603-11,,Ultrasound-Assisted Thrombolysis for Stroke Therapy,"HOLLAND, CHRISTY",UNIVERSITY OF CINCINNATI,OH,"$545,685"
Stroke,2016,NINDS,4U01NS074425-05,,Futility Study of Deferoxamine Mesylate in Intracerebral Hemorrhage (i-DEF),"SELIM, MAGDY",BETH ISRAEL DEACONESS MEDICAL CENTER,MA,"$1,456,455"
Stroke,2016,NINDS,4U10NS086606-04,,UT StrokeNet,"MAJERSIK, JENNIFER",UNIVERSITY OF UTAH,UT,"$366,620"
Stroke,2016,NINDS,5R21NS091600-02,,Stroke Treatment by Modulation of Hemodynamics with Drag Reducing Molecules,"BRAGIN, DENIS",UNIVERSITY OF NEW MEXICO HEALTH SCIS CTR,NM,"$189,381"
Stroke,2016,NINDS,5R21NS095154-02,,Immune Mechanisms of Protection by Remote Limb Ischemic Conditioning after Intracerebral Hemorrhage,"DHANDAPANI, KRISHNAN",GEORGIA REGENTS UNIVERSITY,GA,"$190,000"
Stroke,2016,FIC,6R01NS094041-02,,Primary prevention of stroke in children with SCD in Sub-Saharan Africa II,"DEBAUN, MICHAEL",VANDERBILT UNIVERSITY MEDICAL CENTER,TN,"$10,000"
Stroke,2016,NINDS,6R01NS094041-02,,Primary prevention of stroke in children with SCD in Sub-Saharan Africa II,"DEBAUN, MICHAEL",VANDERBILT UNIVERSITY MEDICAL CENTER,TN,"$1,140,318"
Stroke,2016,NEI,5R01EY015304-11,,Mechanisms of Optic Nerve Stroke Neuroprotection,"BERNSTEIN, STEVEN",UNIVERSITY OF MARYLAND BALTIMORE,MD,"$383,750"
Stroke,2016,NINDS,5R01NS089707-02,,Alpha-2-antiplasmin and Ischemic Stroke,"REED, GUY",UNIVERSITY OF TENNESSEE HEALTH SCI CTR,TN,"$376,975"
Stroke,2016,NINDS,5R01NS094535-02,,Novel carbon nanoparticle superoxide dismutation pathways,"KENT, THOMAS",BAYLOR COLLEGE OF MEDICINE,TX,"$424,342"
Stroke,2016,NINDS,5R01NS094756-02,,Promotion of neurovascular remodeling through mitochondria transfer after stroke,"HAYAKAWA, KAZUHIDE",MASSACHUSETTS GENERAL HOSPITAL,MA,"$378,035"
Stroke,2016,NINDS,5R21NS091709-02,,MRI of cerebral metabolic reactivity,"DUBOWITZ, DAVID",UNIVERSITY OF CALIFORNIA SAN DIEGO,CA,"$193,750"
Stroke,2016,NINDS,4U54NS081765-05,5162,Practice-Based Trial of Home BP Telemonitoring Among Minority Stroke Survivors,"OGEDEGBE, GBENGA",NEW YORK UNIVERSITY SCHOOL OF MEDICINE,NY,"$689,560"
Stroke,2016,NINDS,4U54NS081765-05,5163,Stroke Community Transitions Project,"FELDMAN, PENNY",NEW YORK UNIVERSITY SCHOOL OF MEDICINE,NY,"$245,242"
Stroke,2016,NINDS,4U54NS081765-05,5164,Tailored Approaches to Stroke Health Education,"WILLIAMS, OLAJIDE",NEW YORK UNIVERSITY SCHOOL OF MEDICINE,NY,"$236,474"
Stroke,2016,NINDS,4U54NS081765-05,5165,Administrative Core,"OGEDEGBE, GBENGA",NEW YORK UNIVERSITY SCHOOL OF MEDICINE,NY,"$960,350"
Stroke,2016,NINDS,4U54NS081765-05,5166,Research Education/Training Plan,"OGEDEGBE, GBENGA",NEW YORK UNIVERSITY SCHOOL OF MEDICINE,NY,"$155,494"
Stroke,2016,NINDS,4U54NS081765-05,5167,Research Core,"TERESI, JEANNE",NEW YORK UNIVERSITY SCHOOL OF MEDICINE,NY,"$165,557"
Stroke,2016,NINDS,5R01NS090998-02,,Pressor Choice Influences Protection Of Autoregulation in Brain Injury,"ARMSTEAD, WILLIAM",UNIVERSITY OF PENNSYLVANIA,PA,"$348,918"
Stroke,2016,NINDS,5F31NS090921-02,,Remote ischemic conditioning as a pre-hospital therapeutic intervention for diffuse traumatic brain injury,"HARRISON, JORDAN",ARIZONA STATE UNIVERSITY-TEMPE CAMPUS,AZ,"$39,540"
Stroke,2016,NINDS,2R42NS090650-02,,Optimized lactoferrin for treatment of intracerebral hemorrhage,"KRUZEL, MARIAN",PHARMAREVIEW CORPORATION,TX,"$776,623"
Stroke,2016,NCATS,1R43TR001687-01,,Noninvasive Monitoring of Atrial Fibrillation and Informatics to Prevent Stroke,"KNUESEL, ROBERT",KORONIS BIOMEDICAL TECHNOLOGIES CORPORAT,MN,"$224,234"
Stroke,2016,NINDS,5R21NS090327-02,,STIM1-dependent calcium signaling in neuronal responses to hypoxia and ischemia,"ROSENBERG, PAUL",DUKE UNIVERSITY,NC,"$198,750"
Stroke,2016,NINDS,5K23NS091382-02,,DIASTOLIC CLOSING MARGIN PREDICTS BRAIN INJURY IN PREMATURE INFANTS,"RHEE, CHRISTOPHER",BAYLOR COLLEGE OF MEDICINE,TX,"$173,732"
Stroke,2016,NINDS,5R43NS093677-02,,"Role of HBI-002, an orally administered gasotransmitter, in ischemic stroke","GOMPERTS, EDWARD","HILLHURST BIOPHARMACEUTICALS, INC.",CA,"$223,821"
Stroke,2016,FIC,5R21TW010356-02,,China-America MRI Plaque Imaging & Outcome Network (ChAMPION),"TURAN, TANYA",MEDICAL UNIVERSITY OF SOUTH CAROLINA,SC,"$159,878"
Stroke,2016,NINDS,5R01NS091201-02,,Urokinase-type plasminogen activator in the ischemic brain,"YEPES, MANUEL",EMORY UNIVERSITY,GA,"$238,875"
Stroke,2016,NINDS,5R21NS095192-02,,LncRNA FosDT mediates ischemic brain damage,"VEMUGANTI, RAGHU",UNIVERSITY OF WISCONSIN-MADISON,WI,"$306,940"
Stroke,2016,NINDS,5R21NS088152-02,,Nanoformulation of the BDNF for treatment of stroke,"KABANOV, ALEXANDER",UNIV OF NORTH CAROLINA CHAPEL HILL,NC,"$372,147"
Stroke,2016,NINDS,2R44NS076272-02A1,,Reducing Brain Injury After Focal Ischemia Using a Nitric Oxide-Neutral Oxygen Carrier,"CARY, STEPHEN","OMNIOX, INC.",CA,"$1,115,299"
Stroke,2016,NICHD,5R44HD082882-03,,Lever Actuated Rehabilitation of the Arm using Wheelchair Propulsion and Computer Gaming,"ZONDERVAN, DANIEL",FLINT REHABILITATION DEVICES,CA,"$874,693"
Stroke,2016,NINDS,5R01NS091552-02,,Unruptured Intracranial Aneurysms: Rupture-Risk Assessment by Non-Invasive Molecular Imaging,"BOGDANOV, ALEXEI",UNIV OF MASSACHUSETTS MED SCH WORCESTER,MA,"$527,707"
Stroke,2016,NINDS,4U54NS081760-05,5143,"Shake, Rattle and Roll","NGUYEN-HUYNH, MAI",KAISER FOUNDATION RESEARCH INSTITUTE,CA,"$480,106"
Stroke,2016,NINDS,4U54NS081760-05,5144,Racial Disparities in Ischemic Stroke &Atherosclerotic Risk Factors In the Young,"FULLERTON, HEATHER",KAISER FOUNDATION RESEARCH INSTITUTE,CA,"$633,397"
Stroke,2016,NINDS,4U54NS081760-05,5145,Administrative Core,"BLICK, NOELLE",KAISER FOUNDATION RESEARCH INSTITUTE,CA,"$338,958"
Stroke,2016,NINDS,4U54NS081760-05,5146,Research Education and Training Core,"BIBBINS-DOMINGO, KIRSTEN",KAISER FOUNDATION RESEARCH INSTITUTE,CA,"$204,849"
Stroke,2016,NINDS,4U54NS081760-05,5147,Research Methods Core,"BIBBINS-DOMINGO, KIRSTEN",KAISER FOUNDATION RESEARCH INSTITUTE,CA,"$252,674"
Stroke,2016,NINDS,5R01NS091300-02,,The role of TRPM8 and Nav1.8 channels in cold tolerance of hibernators,"GRACHEVA, ELENA",YALE UNIVERSITY,CT,"$365,887"
Stroke,2016,NIBIB,3R01EB016629-03S1,,Neurovascualar Regeneration,"HIRSCHI, KAREN",YALE UNIVERSITY,CT,"$116,006"
Stroke,2016,NIGMS,5P20GM109089-02,6101,Functional recovery from acute brain injury via human neural stem cell transplantation,"WEICK, JASON",UNIVERSITY OF NEW MEXICO HEALTH SCIS CTR,NM,"$263,880"
Stroke,2016,NIGMS,5P20GM109089-02,6104,Transcranial Direct Current Stimulation for Treatment of Deficits after Traumatic Brain Injury,"QUINN, DAVIN",UNIVERSITY OF NEW MEXICO HEALTH SCIS CTR,NM,"$278,119"
Stroke,2016,NINDS,5R01NS095671-02,,White matter restoration and functional recovery after experimental stroke,"CHEN, JUN",UNIVERSITY OF PITTSBURGH AT PITTSBURGH,PA,"$336,875"
Stroke,2016,NINDS,5R24NS092983-02,,Platform for Accelerating Genetic Discovery for Cerebrovascular Disease,"ROSAND, JONATHAN","BROAD INSTITUTE, INC.",MA,"$371,723"
Stroke,2016,NINDS,5R21NS094780-02,,"Improved Evaluation of PCOM Aneurysms: Angio-Architecture, Hemodynamics and Shape","CEBRAL, JUAN",GEORGE MASON UNIVERSITY,VA,"$222,136"
Stroke,2016,NICHD,5R01HD053793-10,,Novel Strategies to Enhance Motor Function After Stroke,"CELNIK, PABLO",JOHNS HOPKINS UNIVERSITY,MD,"$438,621"
Stroke,2016,NINDS,5R44NS089082-03,,Rapid Magnetomotive Thrombolysis for Stroke,"CREIGHTON, FRANCIS","PULSE THERAPEUTICS, INC.",MO,"$748,265"
Stroke,2016,NINDS,5K08NS089830-03,,Alpha-Endosulfine in Post-Ischemic Neuronal Apoptosis,"MEHTA, RUPAL",UNIVERSITY OF ROCHESTER,NY,"$155,126"
Stroke,2016,NINDS,5R01NS094748-02,,Designing brain machine interfaces to drive plasticity and enhance recovery after brain injury,"SLUTZKY, MARC",NORTHWESTERN UNIVERSITY AT CHICAGO,IL,"$444,908"
Stroke,2016,NINDS,5U01NS092076-02,,DEFUSE 3: EnDovascular ThErapy Following Imaging EvalUation for ISchemic StrokE 3,"ALBERS, GREGORY",STANFORD UNIVERSITY,CA,"$2,383,083"
Stroke,2016,NINDS,5R01NS091213-02,,Genetic and drug modulation of sonic hedgehog pathway in brain ischemia,"LUO, YU",CASE WESTERN RESERVE UNIVERSITY,OH,"$346,719"
Stroke,2016,NINDS,5R01NS095359-11,,Role of CD36 in functional recovery in chronic stroke,"CHO, SUNGHEE",WINIFRED MASTERSON BURKE MED RES INST,NY,"$421,094"
Stroke,2016,NINDS,5R01NS029993-24,,Risk Factors for Stroke and Cognitive Decline in a Tri-Ethnic Region,"SACCO, RALPH",UNIVERSITY OF MIAMI SCHOOL OF MEDICINE,FL,"$1,716,978"
Stroke,2016,NIGMS,5R01NS088084-02,,Role of ubiquilin in ischemic stroke,"WANG, HONGMIN",UNIVERSITY OF SOUTH DAKOTA,SD,"$215,035"
Stroke,2016,NINDS,5R01NS088084-02,,Role of ubiquilin in ischemic stroke,"WANG, HONGMIN",UNIVERSITY OF SOUTH DAKOTA,SD,"$71,679"
Stroke,2016,NINDS,5K08NS094760-02,,ADVANCED DIFFUSION BIOMARKERS OF BRAIN INJURY IN SUBARACHNOID HEMORRHAGE,"KUMMER, TERRANCE",WASHINGTON UNIVERSITY,MO,"$172,853"
Stroke,2016,NINDS,5R21NS091686-02,,Assessment of Locomotor Potential Following Stroke,"PATTEN, CAROLYNN",UNIVERSITY OF FLORIDA,FL,"$225,000"
Stroke,2016,NINDS,5K08NS089976-02,,Optimizing Stem Cell-Enhanced Stroke Recovery through a Bioengineered Electrically Conductive Polymer Scaffold,"GEORGE, PAUL",STANFORD UNIVERSITY,CA,"$187,996"
Stroke,2016,NINDS,5R01NS094539-02,,THE ROLE AND MECHANISMS OF PBEF IN ACUTE BRAIN INJURY AND LONG-TERM STROKE OUTCOMES AFTER FOCAL ISCHEMIC STROKE,"DING, SHINGHUA",UNIVERSITY OF MISSOURI-COLUMBIA,MO,"$317,426"
Stroke,2016,NINDS,5R01NS093314-02,,Combined Nanoparticle and Neural Stem Cell Therapies in a Pig Model of Stroke,"WEST, FRANKLIN",UNIVERSITY OF GEORGIA,GA,"$478,563"
Stroke,2016,NIDCD,5R03DC014556-02,,Assessment of anomia: Improving efficiency and utility using item response theory,"FERGADIOTIS, GERASIMOS",PORTLAND STATE UNIVERSITY,OR,"$135,966"
Stroke,2016,RMAP,5K01ES026833-02,,Multiparametric Prediction of Vasospasm after Subarachnoid Hemorrhage,"PARK, SOOJIN",COLUMBIA UNIVERSITY HEALTH SCIENCES,NY,"$216,241"
Stroke,2016,NINDS,5R01NS060703-07,,Therapeutic Strategies for Neonatal Hypoxic-Ischemiic Encephalopathy,"KOEHLER, RAYMOND",JOHNS HOPKINS UNIVERSITY,MD,"$413,720"
Stroke,2016,NINDS,5R21NS095321-02,,Vasoactive Agents and Cerebral Outcomes in Brain Injury,"VAVILALA, MONICA",UNIVERSITY OF WASHINGTON,WA,"$211,835"
Stroke,2016,NINR,5K01NR015494-02,,Stroke Counseling for Risk Reduction in Young Adult African Americans,"AYCOCK, DAWN",GEORGIA STATE UNIVERSITY,GA,"$92,610"
Stroke,2016,NINDS,5R01NS091242-02,,Limiting brain reperfusion injury by controlling mitochondrial function,"HUTTEMANN, MAIK",WAYNE STATE UNIVERSITY,MI,"$336,692"
Stroke,2016,NINDS,5R03NS095246-03,,Seed-derived Therapeutic Protein for Acute Ischemic Stroke,"WANG, KEVIN",NORTHEASTERN STATE UNIVERSITY,OK,"$64,527"
Stroke,2016,NINDS,5R01NS093042-02,,IRF5-IRF4 Regulatory Axis: A new Target for Stroke,"LIU, FUDONG",UNIVERSITY OF TEXAS HLTH SCI CTR HOUSTON,TX,"$336,875"
Stroke,2016,NINDS,5R21NS092385-02,,Non- invasive cortical stimulation as neuroprotective and regenerative treatment in stroke,"BUETEFISCH, CATHRIN",EMORY UNIVERSITY,GA,"$195,000"
Stroke,2016,NINDS,5R01NS091100-02,,Image-Guided Stem Cell Therapy of Perinatal Asphyxia in a Large Animal Model,"JANOWSKI, MIROSLAW",JOHNS HOPKINS UNIVERSITY,MD,"$354,375"
Stroke,2016,NINDS,5R01NS095741-02,,"Stroke, Brain Networks, and Behavior","CORBETTA, MAURIZIO",WASHINGTON UNIVERSITY,MO,"$604,285"
Stroke,2016,NIBIB,5R01EB021935-02,,SCH: Ubiquitous rehabilitation to improve movement after neurologic injury,"STEELE, KATHERINE",UNIVERSITY OF WASHINGTON,WA,"$385,474"
Stroke,2016,NIBIB,5U01EB021183-02,,One Stop Shop Imaging for Acute Ischemic StrokeTreatment,"CHEN, GUANG-HONG",UNIVERSITY OF WISCONSIN-MADISON,WI,"$728,787"
Stroke,2016,NICHD,1P01HD085928-01A1,5744,Administration Core,"MCKENNA, MARY",UNIVERSITY OF MARYLAND BALTIMORE,MD,"$94,617"
Stroke,2016,NICHD,1P01HD085928-01A1,5745,Animal and Behavior Core,"MCKENNA, MARY",UNIVERSITY OF MARYLAND BALTIMORE,MD,"$352,813"
Stroke,2016,NICHD,1P01HD085928-01A1,5746,Project I- Impact of Hypoxia-Ischemia and/or Inflammation on Microglia in Cerebellum,"MCCARTHY, MARGARET",UNIVERSITY OF MARYLAND BALTIMORE,MD,"$255,709"
Stroke,2016,NICHD,1P01HD085928-01A1,5747,Project II- Impact of Hypoxia-Ischemia and/or inflammation on Metabolism in Cerebellum,"MCKENNA, MARY",UNIVERSITY OF MARYLAND BALTIMORE,MD,"$255,709"
Stroke,2016,NICHD,1P01HD085928-01A1,5748,Project III- Impact of Hypoxia-Ischemia and/or Inflammation on Lipid Rafts in Cerebellum,"BEARER, CYNTHIA",UNIVERSITY OF MARYLAND BALTIMORE,MD,"$255,709"
Stroke,2016,NICHD,1P01HD085928-01A1,5749,Project IV- Cerebellar Function After Hypoxia-Ischemia and Precipitating Inflammation,"WADDELL, JAYLYN",UNIVERSITY OF MARYLAND BALTIMORE,MD,"$63,927"
Stroke,2016,NINDS,1R01NS097450-01,,Rehabilitation Mechanisms of Hand Motor Recovery After Sensorimotor Cortex Injury,"MORECRAFT, ROBERT",UNIVERSITY OF SOUTH DAKOTA,SD,"$523,972"
Stroke,2016,NINDS,1R01NS097423-01,,Functional data analytics for kinematic assessments of motor control,"GOLDSMITH, ARTHUR",COLUMBIA UNIVERSITY HEALTH SCIENCES,NY,"$364,000"
Stroke,2016,NINDS,1R01NS097457-01,,Improving cerebral aneurysm risk assessment through understanding wall vulnerability andfailure modes,"ROBERTSON, ANNE",UNIVERSITY OF PITTSBURGH AT PITTSBURGH,PA,"$656,528"
Stroke,2016,NINDS,1R01NS097443-01,,"Left Atrial abNormality, ThromboEmbolism, and Race: Novel risk factors for stroke (LANTERN)","KAMEL, HOOMAN",WEILL MEDICAL COLL OF CORNELL UNIV,NY,"$432,045"
Stroke,2016,NINDS,1R01NS097728-01,,Dynamic Neuroimmune Profiling in Patients with Acute Intracerebral Hemorrhage,"SANSING, LAUREN",YALE UNIVERSITY,CT,"$636,165"
Stroke,2016,NHLBI,1R01HL133618-01,,Sustained blood pressure control and progression of multimorbidity,"BOWLING, CHRISTOPHER",EMORY UNIVERSITY,GA,"$704,988"
Stroke,2016,NINDS,1R01NS097800-01,,Mechanisms and therapeutic targets of neurovascular injury in hyperglycemic stroke,"ISHRAT, TAUHEED",UNIVERSITY OF GEORGIA,GA,"$275,625"
Stroke,2016,NINDS,1R01NS097554-01,,"Effect of Aging on Brain Ischemia/Stroke Outcome; Pathways, Mechanisms, and Rescue","PASCHEN, WULF",DUKE UNIVERSITY,NC,"$347,813"
Stroke,2016,NHLBI,1R01HL133221-01,,Epigenetics of Arteriosclerosis in African American Hypertensive Sibships,"SMITH, JENNIFER",UNIVERSITY OF MICHIGAN,MI,"$669,689"
Stroke,2016,NIDCD,1K99DC015554-01,,Cerebellar Transcranial Direct Current Stimulation to Augment Chronic Aphasia Treatment,"SEBASTIAN, RAJANI",JOHNS HOPKINS UNIVERSITY,MD,"$89,342"
Stroke,2016,NINDS,1R21NS098066-01,,Role of Cx43 signaling in cerebral cavernous malformation type-3 lesion,"ANDJELKOVIC-ZOCHOWSKA, ANUSKA",UNIVERSITY OF MICHIGAN,MI,"$226,151"
Stroke,2016,NINDS,1R21NS098211-01,,Influence of Brain Inflammation on the Occurrence of Embolic Stroke,"STAMATOVIC, SVETLANA",UNIVERSITY OF MICHIGAN,MI,"$227,000"
Stroke,2016,NEI,1K08EY027006-01,,Functional Imaging in Hypoxic-Ischemic Retinal Disease,"KASHANI, AMIR",UNIVERSITY OF SOUTHERN CALIFORNIA,CA,"$221,648"
Stroke,2016,NICHD,1R21HD088783-01,,Home therapy for upper limb stroke rehabilitation using the HandSOME exoskeleton,"LUM, PETER",CATHOLIC UNIVERSITY OF AMERICA,DC,"$189,648"
Stroke,2016,NICHD,1R21HD088987-01,,Contralaterally Controlled Functional Electrical Stimulation for Hand Opening in Hemiplegic Cerebral Palsy: Pilot RCT,"FU, MICHAEL",CASE WESTERN RESERVE UNIVERSITY,OH,"$237,750"
Stroke,2016,NIA,2P30AG028748-11,6700,Data Acquisition and Analysis Core (DAAC),"KARLAMANGLA, ARUN",UNIVERSITY OF CALIFORNIA LOS ANGELES,CA,"$28,585"
Stroke,2016,NINDS,5F32NS090810-02,,Elucidating the mechanisms of neuroprotection of histone deacetylase inhibition in ischemic stroke,"BOURASSA, MEGAN",WINIFRED MASTERSON BURKE MED RES INST,NY,"$61,670"
Stroke,2016,NIA,2P30AG028747-11,6770,Applied Physiology and Tissue Mechanisms,"RYAN, ALICE",UNIVERSITY OF MARYLAND BALTIMORE,MD,"$192,845"
Stroke,2016,NIA,2P30AG028747-11,6772,Pilot/Exploratory Studies Core,"RODGERS, MARY",UNIVERSITY OF MARYLAND BALTIMORE,MD,"$182,468"
Stroke,2016,NIDCD,1R03DC015075-01A1,,Tongue- and Jaw-Specific Contributions to Vowel Acoustic Changes: Towards a Mechanistic Model of Intelligibility Loss and Recovery in Dysarthria,"MEFFERD, ANTJE",VANDERBILT UNIVERSITY MEDICAL CENTER,TN,"$158,000"
Stroke,2016,NIBIB,4R00EB017289-03,,Generation of Cell-based and Animal-based Imaging Systems for Monitoring Synaptic,"QIN, YAN",UNIVERSITY OF DENVER (COLORADO SEMINARY),CO,"$247,570"
Stroke,2016,NICHD,1R01HD084564-01A1,,Multimodal Treatment for Hemiplegic Shoulder Pain,"WILSON, RICHARD",CASE WESTERN RESERVE UNIVERSITY,OH,"$550,064"
Stroke,2016,NINDS,1R01NS094392-01A1,,Comparative Gene Expression in Human vs Rodent Stroke Models,"XING, CHANGHONG",MASSACHUSETTS GENERAL HOSPITAL,MA,"$340,154"
Stroke,2016,NIDCD,1U01DC014922-01A1,,Predicting rehabilitation outcomes in bilingual aphasia using computational modeling,"KIRAN, SWATHI",BOSTON UNIVERSITY (CHARLES RIVER CAMPUS),MA,"$632,117"
Stroke,2016,NINDS,1R01NS095334-01A1,,Coherent hemodynamics spectroscopy for cerebral autoregulation and blood flow,"FANTINI, SERGIO",TUFTS UNIVERSITY MEDFORD,MA,"$539,575"
Stroke,2016,NICHD,1R01HD086058-01A1,,Adult Biomarkers in Neonatal Brain Injury and Development,"EVERETT, ALLEN",JOHNS HOPKINS UNIVERSITY,MD,"$656,559"
Stroke,2016,NINDS,1R01NS094599-01A1,,Engineering Injectable Microporous Hydrogels for Brain Repair,"SEGURA, TATIANA",UNIVERSITY OF CALIFORNIA LOS ANGELES,CA,"$374,377"
Stroke,2016,NINDS,1R01NS094384-01A1,,Evaluation of the Neuromodulatory Mechanisms of Vagus Nerve Stimulation to Improve Motor Rehabilitation after Stroke,"HAYS, SETH",UNIVERSITY OF TEXAS DALLAS,TX,"$334,688"
Stroke,2016,NIA,1R01AG050819-01A1,,"Statin Neuroprotection & Cognitive Dysfunction after Carotid Endarterectomy: Safety, Feasibility, & Outcomes.","CONNOLLY, EDWARD",COLUMBIA UNIVERSITY HEALTH SCIENCES,NY,"$1,172,928"
Stroke,2016,NICHD,1R01HD086362-01A1,,Promoting Recovery Optimization with WALKing Exercise after Stroke (PROWALKS),"REISMAN, DARCY",UNIVERSITY OF DELAWARE,DE,"$874,119"
Stroke,2016,NINDS,1R01NS094507-01A1,,Immunomodulation by Commensal Microbiota: Role in Ischemic Brain Injury,"ANRATHER, JOSEF",WEILL MEDICAL COLL OF CORNELL UNIV,NY,"$370,781"
Stroke,2016,NINDS,1R01NS094543-01A1,,Reversing Age Related Inflammation,"MCCULLOUGH, LOUISE",UNIVERSITY OF TEXAS HLTH SCI CTR HOUSTON,TX,"$553,358"
Stroke,2016,NIGMS,1R01GM115570-01A1,,Molecular composition of the mitochondrial permeability transition pore,"PAVLOV, EVGENY",NEW YORK UNIVERSITY,NY,"$364,466"
Stroke,2016,NINDS,1R21NS094859-01A1,,Impacts of the systemic milieu on stroke outcome,"JIN, KUNLIN",UNIVERSITY OF NORTH TEXAS HLTH SCI CTR,TX,"$219,000"
Stroke,2016,NINDS,2R01NS075930-05A1,,Thrombin mediated cytotoxicity during cerebral ischemia,"LYDEN, PATRICK",CEDARS-SINAI MEDICAL CENTER,CA,"$431,381"
Stroke,2016,NINDS,1R21NS094833-01A1,,Development of Poly ICLC for neuroprotection against ischemic brain injury,"STENZEL-POORE, MARY",OREGON HEALTH & SCIENCE UNIVERSITY,OR,"$259,471"
Stroke,2016,NINDS,1R21NS095130-01A1,,Inter-alpha inhibitors:  Novel neuroinflammatory modulator of neonatal brain injury,"STONESTREET, BARBARA",WOMEN AND INFANTS HOSPITAL-RHODE ISLAND,RI,"$200,250"
Stroke,2016,NINDS,1R21NS095166-01A1,,Regulation and Implication of Hemoglobin Clearance in Subarachnoid Hemorrhagic Patients,"DORE, SYLVAIN",UNIVERSITY OF FLORIDA,FL,"$232,071"
Stroke,2016,NINDS,1R21NS095271-01A1,,Repositioning Drugs to Treat Ischemic Stroke at Delayed Time Points,"SCHETZ, JOHN",UNIVERSITY OF NORTH TEXAS HLTH SCI CTR,TX,"$219,000"
Stroke,2016,NINDS,1R01NS094280-01A1,,Role of vimentin in thrombosis and stroke,"CRUZ, MIGUEL",BAYLOR COLLEGE OF MEDICINE,TX,"$408,916"
Stroke,2016,NINDS,1R01NS095205-01A1,,Protective Effect of Astrocyte Heme Oxygenase-1 after Intracerebral Hemorrhage,"REGAN, RAYMOND",THOMAS JEFFERSON UNIVERSITY,PA,"$341,250"
Stroke,2016,NINDS,1R01NS095064-01A1,,Crosstalk of Innate and Adaptive Immunity in Infection-Sensitized Neonatal HIE,"KUAN, CHIA-YI",EMORY UNIVERSITY,GA,"$341,250"
Stroke,2016,NINDS,7R01NS055215-10,,Chromosomal and Hormonal Contributions to Sex Differences in Ischemic Stroke,"MCCULLOUGH, LOUISE",UNIVERSITY OF TEXAS HLTH SCI CTR HOUSTON,TX,"$470,864"
Stroke,2016,NHLBI,3R01HL082517-10S1,,Sulfonylurea receptor 1 (SUR1) - A novel therapeutic target in ischemic stroke,"SIMARD, J. MARC",UNIVERSITY OF MARYLAND BALTIMORE,MD,"$126,665"
Stroke,2016,NINDS,1R21NS098514-01,,Leukocyte trafficking through the choroid plexus as modulator of neonatal focal stroke,"VEXLER, ZINAIDA","UNIVERSITY OF CALIFORNIA, SAN FRANCISCO",CA,"$231,900"
Stroke,2016,NIDCD,1F32DC015163-01A1,,Mechanisms of adaptation in (healthy and aphasic) noisy-channel comprehension,"RYSKIN, RACHEL",MASSACHUSETTS INSTITUTE OF TECHNOLOGY,MA,"$52,542"
Stroke,2016,NINDS,1R13NS098650-01,,2016 Barriers of the CNS Gordon Research Conference & Gordon Research Seminar,"THORNE, ROBERT",GORDON RESEARCH CONFERENCES,RI,"$24,000"
Stroke,2016,NINDS,1R01NS096917-01A1,,Targeting CD47 to aid in clearing intracerebral hemorrhages,"XI, GUOHUA",UNIVERSITY OF MICHIGAN,MI,"$339,063"
Stroke,2016,NHLBI,1F31HL134314-01,,Biological Interventions to Improve Cognition in Children with Sickle Cell Disease,"HOOD, ANNA",WASHINGTON UNIVERSITY,MO,"$43,576"
Stroke,2016,NINDS,1R21NS096987-01A1,,Mitochondrial Zn2+ in ischemic neurodegeneration: In vivo tests of principle studies in a rat cardiac arrest model,"WEISS, JOHN",UNIVERSITY OF CALIFORNIA-IRVINE,CA,"$193,125"
Stroke,2016,NINDS,2SB1NS060175-04,,Human Apyrase Therapy for Acute Ischemic Stroke,"CHEN, RIDONG","APT THERAPEUTICS, INC.",MO,"$968,157"
