Category,FY,Funding IC,Project Number,Sub Project #,Project Title,PI Name,Org Name,State / Country,Amount
Stroke,2015,NINDS,5U54NS081765-04,5165,Administrative Core,"OGEDEGBE, GBENGA",NEW YORK UNIVERSITY SCHOOL OF MEDICINE,NY,"$790,520"
Stroke,2015,NINDS,5U54NS081765-04,5166,Research Education/Training Plan,"OGEDEGBE, GBENGA",NEW YORK UNIVERSITY SCHOOL OF MEDICINE,NY,"$180,688"
Stroke,2015,NINDS,5U54NS081765-04,5167,Research Core,"TERESI, JEANNE",NEW YORK UNIVERSITY SCHOOL OF MEDICINE,NY,"$152,906"
Stroke,2015,NINDS,5K08NS082363-03,,Mechanisms of Effect of Aspirin on Cerebral Aneurysms in Mice,"HASAN, DAVID",UNIVERSITY OF IOWA,IA,"$167,886"
Stroke,2015,NINDS,5R01NS089534-02,,Mechanisms of Neurovascular Injury in Cerebral Ischemia,"CHEN, JUN",UNIVERSITY OF PITTSBURGH AT PITTSBURGH,PA,"$336,875"
Stroke,2015,NICHD,5R21HD076157-02,,Real World Assessment of Dual-Task Performance After Stroke,"PLUMMER, PRUDENCE",UNIV OF NORTH CAROLINA CHAPEL HILL,NC,"$187,128"
Stroke,2015,NINDS,5R21NS087639-02,,Microglial and macrophage PGE2 signaling in post-stroke inflammation,"ANDREASSON, KATRIN",STANFORD UNIVERSITY,CA,"$244,513"
Stroke,2015,NINDS,5R01NS088072-02,,Predicting cerebral aneurysm recurrence using Doppler guidewire measurements,"KIM, LOUIS",UNIVERSITY OF WASHINGTON,WA,"$337,969"
Stroke,2015,NINDS,5R01NS089515-02,,The Role of Perlecan Domain V in Vascular Dementia,"BIX, GREGORY",UNIVERSITY OF KENTUCKY,KY,"$329,219"
Stroke,2015,NINDS,5R01NS073344-05,,SCORE-IT: The CTA Spot Sign Score in Acute Cerebral Hemorrhage,"ROSAND, JONATHAN",MASSACHUSETTS GENERAL HOSPITAL,MA,"$449,708"
Stroke,2015,NIGMS,5R01GM114851-02,,Injury Mechanisms and Systemic Immune Responses after Cerebral Global Ischemia,"XU, YAN",UNIVERSITY OF PITTSBURGH AT PITTSBURGH,PA,"$464,638"
Stroke,2015,NICHD,5R21HD079048-02,,Low frequency rTMS and fluoxetine for motor recovery after ischemic stroke,"FREGNI, FELIPE",SPAULDING REHABILITATION HOSPITAL,MA,"$241,312"
Stroke,2015,NHLBI,5R01HL119443-02,,Genetic Mechanisms of Arteriosclerosis in Hypertensive Sibships,"KARDIA, SHARON",UNIVERSITY OF MICHIGAN,MI,"$675,842"
Stroke,2015,NINDS,5K24NS072272-05,,Modeling of Collateral Perfusion in the Ischemic Brain,"LIEBESKIND, DAVID",UNIVERSITY OF CALIFORNIA LOS ANGELES,CA,"$187,891"
Stroke,2015,NICHD,5K24HD074722-03,,Brain plasticity and rehabilitation after stroke,"CRAMER, STEVEN",UNIVERSITY OF CALIFORNIA-IRVINE,CA,"$117,626"
Stroke,2015,NINDS,5R01NS085568-02,,Application of optogenetics in iPS cell transplantation therapy for ischemic stro,"WEI, LING",EMORY UNIVERSITY,GA,"$341,250"
Stroke,2015,NICHD,5R01HD075813-02,,Altering Activation Patterns in the Distal Upper Extremity After Stroke,"KAMPER, DEREK",REHABILITATION INSTITUTE OF CHICAGO,IL,"$367,555"
Stroke,2015,NINDS,5R37NS037074-16,,Biphasic mechanisms of injury and repair in stroke therapy,"LO, ENG",MASSACHUSETTS GENERAL HOSPITAL,MA,"$435,000"
Stroke,2015,NINDS,5R21NS087887-02,,Image-Guided Transcranial Focused Ultrasound Therapy for Neurological Disorders,"EBBINI, EMAD",UNIVERSITY OF MINNESOTA,MN,"$177,545"
Stroke,2015,NINDS,5R21NS088972-02,,Modulating Monocyte Responses to Reduce Injury after Intracerebral Hemorrhage,"SANSING, LAUREN",YALE UNIVERSITY,CT,"$208,125"
Stroke,2015,NINDS,5R21NS090129-02,,TRPV1-mediated induction of a protective heat shock response after stroke,"MARRELLI, SEAN",BAYLOR COLLEGE OF MEDICINE,TX,"$198,125"
Stroke,2015,NIAAA,5R21AA022734-02,,Mechanisms of Atherosclerosis in Alcohol Intake,"HAORAH, JAMES",NEW JERSEY INSTITUTE OF TECHNOLOGY,NJ,"$214,035"
Stroke,2015,NINDS,5R01NS083858-02,,Synaptic Circuitry in Stroke,"KIROV, SERGEI",GEORGIA REGENTS UNIVERSITY,GA,"$332,500"
Stroke,2015,NINDS,5R21NS087209-02,,Establishment of inducible astrocyte specific p38 MAPK knockout mouse line,"YANG, SHAOHUA",UNIVERSITY OF NORTH TEXAS HLTH SCI CTR,TX,"$219,000"
Stroke,2015,NINDS,5R01NS080893-03,,High Content Sceening for Hereditary Stroke Syndrome,"LI, DEAN",UNIVERSITY OF UTAH,UT,"$325,938"
Stroke,2015,NICHD,5R21HD072588-02,,Robotic Ankle to Restore Symmetry and Reduce Energy Cost of Walking Post-Stroke,"SAWICKI, GREGORY",NORTH CAROLINA STATE UNIVERSITY RALEIGH,NC,"$182,156"
Stroke,2015,NIDCD,5F30DC014198-02,,Investigating subjective experience of inner speech in aphasia,"HAYWARD, WILLIAM",GEORGETOWN UNIVERSITY,DC,"$29,320"
Stroke,2015,NIBIB,5R01EB019834-02,,NRI: Wearable eMbots to Induce Recovery of Function,"GILLESPIE, RICHARD",UNIVERSITY OF MICHIGAN,MI,"$138,971"
Stroke,2015,NICHD,5R01EB019834-02,,NRI: Wearable eMbots to Induce Recovery of Function,"GILLESPIE, RICHARD",UNIVERSITY OF MICHIGAN,MI,"$138,971"
Stroke,2015,NIGMS,5P20GM109098-02,5371,Administrative Core,"SIMPKINS, JAMES",WEST VIRGINIA UNIVERSITY,WV,"$530,472"
Stroke,2015,NIGMS,5P20GM109098-02,5372,Experimental Stroke Core,"SIMPKINS, JAMES",WEST VIRGINIA UNIVERSITY,WV,"$202,585"
Stroke,2015,NIGMS,5P20GM109098-02,5373,Biostafistics Core,"GURKA, MATTHEW",WEST VIRGINIA UNIVERSITY,WV,"$59,740"
Stroke,2015,NIGMS,5P20GM109098-02,5374,The Impact of Cardiovascular Funcfion on Stroke Outcome,"CHANTLER, PAUL",WEST VIRGINIA UNIVERSITY,WV,"$301,186"
Stroke,2015,NIGMS,5P20GM109098-02,5375,A Genomic Bio-signature of Post-Stroke Immune Dysfunction,"BARR, TAURA",WEST VIRGINIA UNIVERSITY,WV,"$233,712"
Stroke,2015,NIGMS,5P20GM109098-02,5376,Corticospinal Control of Sensorimotor Synergies in Health and Disease.,"YAKOVENKO, SERGIY",WEST VIRGINIA UNIVERSITY,WV,"$276,593"
Stroke,2015,NIGMS,5P20GM109098-02,5377,Corticospinal Control of Limb Dynamics in Health and After Stroke,"GRITSENKO, VALERIYA",WEST VIRGINIA UNIVERSITY,WV,"$251,034"
Stroke,2015,NIGMS,5P20GM109098-02,5378,"Effects of perfluoroalkyl chemicals on stroke incidence, mortality and morbidity","FRISBEE, STEPHANIE",WEST VIRGINIA UNIVERSITY,WV,"$298,000"
Stroke,2015,NCATS,5UH3TR000491-04,,"Neurovascular Unit on a Chip: Chemical Communication, Drug and Toxin Responses","WIKSWO, JOHN",VANDERBILT UNIVERSITY,TN,"$739,107"
Stroke,2015,RMAP,5UH3TR000491-04,,"Neurovascular Unit on a Chip: Chemical Communication, Drug and Toxin Responses","WIKSWO, JOHN",VANDERBILT UNIVERSITY,TN,"$316,125"
Stroke,2015,NHGRI,5U54HG007479-03,,Stroke Investigative Research & Educational Network (SIREN),"OWOLABI, MAYOWA",UNIVERSITY OF IBADAN,NIGERI,"$300,000"
Stroke,2015,NINDS,5U54HG007479-03,,Stroke Investigative Research & Educational Network (SIREN),"OWOLABI, MAYOWA",UNIVERSITY OF IBADAN,NIGERI,"$300,000"
Stroke,2015,NINDS,5R01NS076620-05,,Microglial Interferon Signaling and Ischemic Preconditioning,"WEINSTEIN, JONATHAN",UNIVERSITY OF WASHINGTON,WA,"$337,969"
Stroke,2015,NICHD,4R00HD073240-03,,Mechanisms underlying impaired postural corrections following stroke,"HONEYCUTT, CLAIRE",ARIZONA STATE UNIVERSITY-TEMPE CAMPUS,AZ,"$250,000"
Stroke,2015,NHLBI,5R01HL126559-02,,Novel role of occludin and pericytes in ischemic stroke in HIV infection,"TOBOREK, MICHAL",UNIVERSITY OF MIAMI SCHOOL OF MEDICINE,FL,"$383,750"
Stroke,2015,NCATS,5U54NS078059-05,5774,Rare Dis Clin Res Consortia (RDCRC) for Rare Dis Clin Res Network (U54),"HIRANO, MICHIO",COLUMBIA UNIVERSITY HEALTH SCIENCES,NY,"$23,580"
Stroke,2015,NICHD,5U54NS078059-05,5774,Rare Dis Clin Res Consortia (RDCRC) for Rare Dis Clin Res Network (U54),"HIRANO, MICHIO",COLUMBIA UNIVERSITY HEALTH SCIENCES,NY,"$23,580"
Stroke,2015,NINDS,5U54NS078059-05,5774,Rare Dis Clin Res Consortia (RDCRC) for Rare Dis Clin Res Network (U54),"HIRANO, MICHIO",COLUMBIA UNIVERSITY HEALTH SCIENCES,NY,"$86,763"
Stroke,2015,OD,5U54NS078059-05,5774,Rare Dis Clin Res Consortia (RDCRC) for Rare Dis Clin Res Network (U54),"HIRANO, MICHIO",COLUMBIA UNIVERSITY HEALTH SCIENCES,NY,"$11,790"
Stroke,2015,NICHD,5U01NS091951-02,,Telerehabilitation for Patients with Stroke,"CRAMER, STEVEN",UNIVERSITY OF CALIFORNIA-IRVINE,CA,"$523,905"
Stroke,2015,NIA,5K01AG043581-02,,"Race, Childhood Social Disadvantage, and the Adult Brain: HANDLS BRAINCHILD.","BEATTY, DANIELLE",UNIVERSITY OF MARYLAND BALT CO CAMPUS,MD,"$123,026"
Stroke,2015,NINDS,5R44NS086344-03,,Development of a turnkey system for assessing forelimb function in rats and mice.,"SLOAN, ANDREW","VULINTUS, LLC",TX,"$400,093"
Stroke,2015,NINDS,5U01NS087876-02,,Development of a next-generation PSD95 Inhibitor for the treatment of acute ische,"TYMIANSKI, MICHAEL",UNIVERSITY HEALTH NETWORK,CANADA,"$1,152,717"
Stroke,2015,NINDS,5R01NS090874-06,,High-Sensitivity DOT for Mapping Human Brain Function,"CULVER, JOSEPH",WASHINGTON UNIVERSITY,MO,"$559,450"
Stroke,2015,FIC,5R01NS064905-05,,CHADSS: Chagas Disease Scan Study,"OLIVEIRA-FILHO, JAMARY",FEDERAL UNIVERSITY OF BAHIA,BRAZIL,"$5,000"
Stroke,2015,NINDS,5R01NS064905-05,,CHADSS: Chagas Disease Scan Study,"OLIVEIRA-FILHO, JAMARY",FEDERAL UNIVERSITY OF BAHIA,BRAZIL,"$48,083"
Stroke,2015,NINDS,5R21NS084022-02,,Using transcranial brain stimulation to prevent cortical spreading depression,"RUSHMORE, RICHARD",BOSTON UNIVERSITY MEDICAL CAMPUS,MA,"$204,625"
Stroke,2015,NINDS,5R01NS089694-02,,Ocular Fundus Abnormalities for Acute Risk Stratification in TIA and Minor Stroke,"BRUCE, BEAU",EMORY UNIVERSITY,GA,"$307,125"
Stroke,2015,NCATS,5U54NS065705-07,5794,Modifiers of disease Severity and Progression in Cerebral Cavernous Malformation,"LAWTON, MICHAEL","UNIVERSITY OF CALIFORNIA, SAN FRANCISCO",CA,"$187,050"
Stroke,2015,NINDS,5U54NS065705-07,5794,Modifiers of disease Severity and Progression in Cerebral Cavernous Malformation,"LAWTON, MICHAEL","UNIVERSITY OF CALIFORNIA, SAN FRANCISCO",CA,"$88,797"
Stroke,2015,NCATS,5U54NS065705-07,5796,Cerebal Hemmorage Risk in Heredotary Hempprrahagic Telangiectasia,"LAWTON, MICHAEL","UNIVERSITY OF CALIFORNIA, SAN FRANCISCO",CA,"$195,944"
Stroke,2015,NINDS,5U54NS065705-07,5796,Cerebal Hemmorage Risk in Heredotary Hempprrahagic Telangiectasia,"LAWTON, MICHAEL","UNIVERSITY OF CALIFORNIA, SAN FRANCISCO",CA,"$93,020"
Stroke,2015,NICHD,5R01HD078330-02,,Behavioral and neurophysiologic processes of locomotor learning after stroke,"REISMAN, DARCY",UNIVERSITY OF DELAWARE,DE,"$194,220"
Stroke,2015,NICHD,5R03HD079841-02,,FEASIBILITY OF A NOVEL INTERVENTION TO IMPROVE PARTICIPATION AFTER STROKE,"STARK, SUSAN",WASHINGTON UNIVERSITY,MO,"$64,178"
Stroke,2015,NINDS,5R21NS089851-02,,Vascular repair extends therapeutic window for ischemic stroke,"BORLONGAN, CESARIO",UNIVERSITY OF SOUTH FLORIDA,FL,"$186,875"
Stroke,2015,NICHD,5K01HD078484-02,,Novel Neuromodulatory Intervention in the Rehabilitation of Pediatric Hemiparesis,"GILLICK, BERNADETTE",UNIVERSITY OF MINNESOTA,MN,"$130,821"
Stroke,2015,NINDS,5F31NS090715-02,,Estrogen Receptor Beta in Mitochondrial Permeability Transition and Ischemic Brain Injury,"BURSTEIN, SUZANNE",WEILL MEDICAL COLL OF CORNELL UNIV,NY,"$43,120"
Stroke,2015,NINDS,5R01NS038118-14,,Na-K-Cl Contransporter in Cerebral Ischemia,"SUN, DANDAN",UNIVERSITY OF PITTSBURGH AT PITTSBURGH,PA,"$336,567"
Stroke,2015,NINDS,5R21NS087183-02,,Immunomodulatory effects of Inter-alpha Inhibitors in attenuating Ischemic Stroke,"MCCULLOUGH, LOUISE",UNIVERSITY OF CONNECTICUT SCH OF MED/DNT,CT,"$437,030"
Stroke,2015,NINDS,5R21NS087796-02,,Debulking From Within: A Steerable Needle for Intracerebral Hemorrhage Aspiration,"WEBSTER, ROBERT",VANDERBILT UNIVERSITY,TN,"$174,363"
Stroke,2015,NINDS,5R01NS090904-17,,Activated protein C system in stroke models,"ZLOKOVIC, BERISLAV",UNIVERSITY OF SOUTHERN CALIFORNIA,CA,"$636,078"
Stroke,2015,NINDS,1R01NS092618-01,,Immunomodulation of white matter integrity after stroke,"HU, XIAOMING",UNIVERSITY OF PITTSBURGH AT PITTSBURGH,PA,"$336,875"
Stroke,2015,NINDS,1R01NS092810-01,,A novel mechanism of neurovascular protection in ischemic tolerance,"ZHANG, FENG",UNIVERSITY OF PITTSBURGH AT PITTSBURGH,PA,"$336,875"
Stroke,2015,NINDS,1R01NS092875-01,,Motor cortex electrical stimulation to augment spontaneous recovery after chronic subcortical stroke,"CARMEL, JASON",WINIFRED MASTERSON BURKE MED RES INST,NY,"$426,563"
Stroke,2015,NINDS,1R01NS092917-01,,ABCA1 regulates white matter remodeling and oligodendrogenesis after stroke,"CUI, XU",HENRY FORD HEALTH SYSTEM,MI,"$324,844"
Stroke,2015,NHLBI,1R01HL129179-01,,Platelet-inspired Delivery System for Targeted Thrombolytic Therapy,"SEN GUPTA, ANIRBAN",CASE WESTERN RESERVE UNIVERSITY,OH,"$466,440"
Stroke,2015,NHLBI,1R01HL129241-01,,MR-Derived Cerebral Blood Flow and Oxygen Metabolism to Stratify Stroke Risk in Pediatric Sickle Cell Disease,"FORD, ANDRIA",WASHINGTON UNIVERSITY,MO,"$558,231"
Stroke,2015,NIMHD,1R01MD009738-01,,PeRiodontal treatment to Eliminate Minority InEquality and Rural disparities in Stroke (PREMIERS),"SEN, SOUVIK",UNIVERSITY OF SOUTH CAROLINA AT COLUMBIA,SC,"$702,365"
Stroke,2015,NINDS,1R01NS093057-01,,Optogenetic approaches to study post-stroke recovery mechanisms,"STEINBERG, GARY",STANFORD UNIVERSITY,CA,"$539,200"
Stroke,2015,NINDS,1R01NS093042-01,,IRF5-IRF4 Regulatory Axis: A new Target for Stroke,"LIU, FUDONG",UNIVERSITY OF TEXAS HLTH SCI CTR HOUSTON,TX,"$336,875"
Stroke,2015,NINDS,1R21NS093121-01,,Novel Ultrasonic Technology to Treat Hemorrhagic Stroke,"XU, ZHEN",UNIVERSITY OF MICHIGAN,MI,"$193,802"
Stroke,2015,NINDS,1K02NS093014-01,,Development of circuit-based therapies for motor recovery after stroke,"GANGULY, KARUNESH","UNIVERSITY OF CALIFORNIA, SAN FRANCISCO",CA,"$205,729"
Stroke,2015,NINDS,1R21NS093154-01,,A novel ferret model of preterm encephalopathy,"JUUL, SANDRA",UNIVERSITY OF WASHINGTON,WA,"$231,750"
Stroke,2015,NICHD,1R03HD084971-01,,Transcranial direct current stimulation and robotic training in adults with cerebral palsy,"FRIEL, KATHLEEN",WINIFRED MASTERSON BURKE MED RES INST,NY,"$97,500"
Stroke,2015,NINDS,1R21NS093493-01,,Application of Brain-Targeted Anti-inflammatory RNA Nanoparticle for Ischemic Stroke Therapy,"HAO, JIUKUAN",UNIVERSITY OF CINCINNATI,OH,"$205,506"
Stroke,2015,NINDS,1R21NS093522-01,,OGR1 as a novel mediator of acid signaling in the brain,"ZHA, XIANGMING",UNIVERSITY OF SOUTH ALABAMA,AL,"$216,788"
Stroke,2015,NINDS,1R21NS093259-01,,Monitoring intracranial pressure with diffuse correlation spectroscopy,"FRANCESCHINI, MARIA",MASSACHUSETTS GENERAL HOSPITAL,MA,"$234,952"
Stroke,2015,NICHD,1R21HD085527-01,,Functional Electrical Stimulation and Volitional Effort Training,"NOLAN, KAREN","KESSLER FOUNDATION, INC.",NJ,"$226,500"
Stroke,2015,NINDS,1R01NS093289-01,,Targeting Parenchymal Arterioles in Acute Stroke Treatment,"CIPOLLA, MARILYN",UNIVERSITY OF VERMONT & ST AGRIC COLLEGE,VT,"$330,733"
Stroke,2015,NINDS,1R24NS092983-01,,Platform for Accelerating Genetic Discovery for Cerebrovascular Disease,"ROSAND, JONATHAN","BROAD INSTITUTE, INC.",MA,"$381,458"
Stroke,2015,NIDCD,1R03DC014310-01A1,,Investigating insight into inner speech in aphasia,"TURKELTAUB, PETER",GEORGETOWN UNIVERSITY,DC,"$153,669"
Stroke,2015,NINDS,1R01NS089638-01A1,,"Novel lipoprotein particles, brain abnormalities, and risk of dementia and stroke","JENSEN, MAJKEN",HARVARD SCHOOL OF PUBLIC HEALTH,MA,"$727,653"
Stroke,2015,NINDS,1R21NS093399-01,,Perivascular astrocyte swelling after BBB disruption,"KEEP, RICHARD",UNIVERSITY OF MICHIGAN,MI,"$193,854"
Stroke,2015,NINDS,1R01NS089707-01A1,,Alpha-2-antiplasmin and Ischemic Stroke,"REED, GUY",UNIVERSITY OF TENNESSEE HEALTH SCI CTR,TN,"$376,975"
Stroke,2015,NINDS,1R01NS086905-01A1,,MRI-GENetics Interface Exploration_MRI-GENIE_Study,"ROST, NATALIA",MASSACHUSETTS GENERAL HOSPITAL,MA,"$701,927"
Stroke,2015,RMAP,4UH3TR000891-03,,exRNA signatures Predict Outcomes after brain injury,"JENSEN, KENDALL",TRANSLATIONAL GENOMICS RESEARCH INST,AZ,"$961,051"
Stroke,2015,NINDS,1R01NS086953-01A1,,Poly (ADP-ribose) Mediates Cell Death in Stroke by Inhibiting Glucose Metabolism,"ANDRABI, SHAIDA",JOHNS HOPKINS UNIVERSITY,MD,"$354,375"
Stroke,2015,NINDS,1R01NS086820-01A1,,Kruppel-like factor 11 and ischemic stroke,"YIN, KEJIE",UNIVERSITY OF MICHIGAN,MI,"$339,154"
Stroke,2015,NICHD,1R01HD082216-01A1,,Constraint induced movement therapy for walking in individuals post stroke,"WU, MING",REHABILITATION INSTITUTE OF CHICAGO,IL,"$313,289"
Stroke,2015,NIGMS,1R01NS088084-01A1,,Role of ubiquilin in ischemic stroke,"WANG, HONGMIN",UNIVERSITY OF SOUTH DAKOTA,SD,"$215,035"
Stroke,2015,NINDS,1R01NS088084-01A1,,Role of ubiquilin in ischemic stroke,"WANG, HONGMIN",UNIVERSITY OF SOUTH DAKOTA,SD,"$71,679"
Stroke,2015,NINDS,1R01NS086945-01A1,,MicroRNAs and Perinatal Hypoxia-Ischemia,"DIZON, MARIA LUZ",NORTHWESTERN UNIVERSITY AT CHICAGO,IL,"$344,560"
Stroke,2015,NINDS,1R01NS089991-01A1,,Therapeutic targeting of the class IB PI3-kinase gamma for treatment of acute ischemic stroke,"LI, GUOHONG",LOUISIANA STATE UNIV HSC SHREVEPORT,LA,"$317,188"
Stroke,2015,NINDS,2R01NS066982-05A1,,Accelerated Neuro-MRA Using Compressed Sensing and Constrained Reconstruction,"JOHNSON, KEVIN",UNIVERSITY OF WISCONSIN-MADISON,WI,"$329,390"
Stroke,2015,NICHD,2R01HD053793-09A1,,Novel Strategies to Enhance Motor Function After Stroke,"CELNIK, PABLO",JOHNS HOPKINS UNIVERSITY,MD,"$458,553"
Stroke,2015,NIAAA,1R21AA023521-01A1,,Drinking patterns and chronic diseases: a series of meta-analyses,"ROERECKE, MICHAEL",CENTRE FOR ADDICTION AND MENTAL HEALTH,CANADA,"$138,705"
Stroke,2015,NIDCD,1K01DC014298-01A1,,Using tDCS to Promote Speech Motor Learning,"BUCHWALD, ADAM",NEW YORK UNIVERSITY,NY,"$172,552"
Stroke,2015,NINDS,1R01NS090925-01A1,,"Iron, minocycline and brain injury after intracerebral hemorrhage","XI, GUOHUA",UNIVERSITY OF MICHIGAN,MI,"$339,154"
Stroke,2015,NINDS,1K01NS086969-01A1,,Differential mechanisms and consequences of Purkinje cell loss in an adult and pediatric model of global cerebral ischemia,"QUILLINAN, NIDIA",UNIVERSITY OF COLORADO DENVER,CO,"$223,272"
Stroke,2015,NINDS,1K08NS088563-01A1,,Estrogen receptors and TrkB mediated neuroprotection in neonatal hypoxia-ischemia,"CENGIZ, PELIN",UNIVERSITY OF WISCONSIN-MADISON,WI,"$195,562"
Stroke,2015,NINDS,2R01NS037459-14A1,,Role of CyPgs UCHL1 in Ischemic Injury and Recovery,"GRAHAM, STEVEN",UNIVERSITY OF PITTSBURGH AT PITTSBURGH,PA,"$379,442"
Stroke,2015,NINDS,1R03NS090193-01A1,,AView: A Bedside Simulation Tool for Neurovascular Intervention,"XIANG, JIANPING",STATE UNIVERSITY OF NEW YORK AT BUFFALO,NY,"$78,659"
Stroke,2015,NINDS,1R21NS088986-01A1,,Effect of Hemopexin Therapy after Intracerebral Hemorrhage,"REGAN, RAYMOND",THOMAS JEFFERSON UNIVERSITY,PA,"$234,000"
Stroke,2015,NINDS,1R21NS088152-01A1,,Nanoformulation of the BDNF for treatment of stroke,"KABANOV, ALEXANDER",UNIV OF NORTH CAROLINA CHAPEL HILL,NC,"$411,216"
Stroke,2015,NIDCD,1R21DC015263-01A1,,Perfusion informed lesion mapping in aphasia,"LOVE-GEFFEN, TRACY",SAN DIEGO STATE UNIVERSITY,CA,"$225,000"
Stroke,2015,NINDS,2R01NS034773-15A1,,Ischemic Preconditioning: Mechanisms of Neuroprotection,"PEREZ-PINZON, MIGUEL",UNIVERSITY OF MIAMI SCHOOL OF MEDICINE,FL,"$335,781"
Stroke,2015,NINDS,1R21NS090153-01A1,,Assessing Brain Tissue Viability after TBI: A Susceptibility Mapping Approach,"KOU, ZHIFENG",WAYNE STATE UNIVERSITY,MI,"$229,438"
Stroke,2015,NHLBI,3R01HL110068-03S1,,Sleep-Disordered Breathing and Risk for CVD and Stroke in the Jackson Heart Study,"WILSON, JAMES",UNIVERSITY OF MISSISSIPPI MED CTR,MS,"$46,905"
Stroke,2015,NINDS,5F32NS089162-02,,Astrocytic TGFB Signaling Pathways and Neuroinflammation Following Stroke,"PETERSON, TODD",STANFORD UNIVERSITY,CA,"$54,194"
Stroke,2015,NHLBI,2R01HL096119-05,,3D MRI Characterization of High-Risk Carotid Artery Plaques without Contrast Media,"LI, DEBIAO",CEDARS-SINAI MEDICAL CENTER,CA,"$437,500"
Stroke,2015,NICHD,1R01NS090677-01A1,,Customized cortical stimulation therapy in the rehabilitation of stroke patients,"BUETEFISCH, CATHRIN",EMORY UNIVERSITY,GA,"$200,000"
Stroke,2015,NINDS,1R01NS090677-01A1,,Customized cortical stimulation therapy in the rehabilitation of stroke patients,"BUETEFISCH, CATHRIN",EMORY UNIVERSITY,GA,"$567,045"
Stroke,2015,NINDS,1R43NS093677-01,,"Role of HBI-002, an orally administered gasotransmitter, in ischemic stroke","GOMPERTS, EDWARD","HILLHURST BIOPHARMACEUTICALS, INC.",CA,"$475,519"
Stroke,2015,NIDCD,1F31DC014875-01,,Using self-reported inner speech to guide treatment for anomia,"FAMA, MACKENZIE",GEORGETOWN UNIVERSITY,DC,"$30,652"
Stroke,2015,NICHD,1R44HD084035-01A1,,Wrist-worn Sensors for Tele-Rehabilitation of the Hemiparetic Upper-Extremity,"GWIN, JOSEPH","BIOSENSICS, LLC",MA,"$225,000"
Stroke,2015,NIDCD,1F31DC014375-01A1,,Speech Motor Planning in Apraxia of Speech and Aphasia,"MAILEND, MARJA-LIISA",UNIVERSITY OF ARIZONA,AZ,"$43,120"
Stroke,2015,NINDS,1R43NS092167-01A1,,Validation of a Stroke Therapy Comprised of Synergistic Stem Cell-Derived Factors,"JOHNSTONE, BRIAN","NEUROFX, INC.",IN,"$203,304"
Stroke,2015,NINDS,1F32NS090810-01A1,,Elucidating the mechanisms of neuroprotection of histone deacetylase inhibition in ischemic stroke,"BOURASSA, MEGAN",WINIFRED MASTERSON BURKE MED RES INST,NY,"$58,742"
Stroke,2015,NHLBI,1F31HL129703-01,,Hemostasis-Independent targeted treatment of thrombosis,"WEN, AMY",CASE WESTERN RESERVE UNIVERSITY,OH,"$32,281"
Stroke,2015,NHLBI,1R01HL128234-01A1,,An integrative approach to functionalize GWAS hits in MI and stroke,"EDELSTEIN, LEONARD",THOMAS JEFFERSON UNIVERSITY,PA,"$406,469"
Stroke,2015,NINDS,1R21NS090609-01A1,,Remote ischemic conditioning for neuroprotection in vascular cognitive impairment,"HESS, DAVID",GEORGIA REGENTS UNIVERSITY,GA,"$380,000"
Stroke,2015,NINDS,4R00NS078049-03,,The role of a novel AIF-associated nuclease PAAN1 in neuronal injury,"WANG, YINGFEI",UT SOUTHWESTERN MEDICAL CENTER,TX,"$249,001"
Stroke,2015,NINDS,1R01NS091175-01A1,,MicroRNAs and post-stroke angiogenesis,"YIN, KEJIE",UNIVERSITY OF MICHIGAN,MI,"$445,600"
Stroke,2015,NINDS,1R01NS092306-01A1,,Fbw7 as a therapeutic target for treating ischemic brain injury,"REED, STEVEN",SCRIPPS RESEARCH INSTITUTE,CA,"$399,172"
Stroke,2015,NINDS,1R01NS092388-01A1,,Adverse Consequences of Light at Night for Cerebral Ischemia,"NELSON, RANDY",OHIO STATE UNIVERSITY,OH,"$395,763"
Stroke,2015,NINDS,1R01NS093908-01,,Development of Novel MR Imaging for Ischemic Stroke Evaluation,"CARROLL, TIMOTHY",NORTHWESTERN UNIVERSITY AT CHICAGO,IL,"$433,653"
Stroke,2015,NINDS,3U54NS081763-03S1,,Hispanic Stroke Prevention Intervention Research Program,"SACCO, RALPH",UNIVERSITY OF MIAMI SCHOOL OF MEDICINE,FL,"$177,274"
Stroke,2015,FIC,1R21NS094022-01,,Reducing stroke burden in Uganda,"SAJATOVIC, MARTHA",CASE WESTERN RESERVE UNIVERSITY,OH,"$5,000"
Stroke,2015,NINDS,1R21NS094022-01,,Reducing stroke burden in Uganda,"SAJATOVIC, MARTHA",CASE WESTERN RESERVE UNIVERSITY,OH,"$156,494"
Stroke,2015,FIC,1R21NS094033-01,,Phone-based Intervention Under Nurse Guidance after Stroke (PINGS),"OVBIAGELE, BRUCE",MEDICAL UNIVERSITY OF SOUTH CAROLINA,SC,"$5,000"
Stroke,2015,NINDS,1R21NS094033-01,,Phone-based Intervention Under Nurse Guidance after Stroke (PINGS),"OVBIAGELE, BRUCE",MEDICAL UNIVERSITY OF SOUTH CAROLINA,SC,"$169,417"
Stroke,2015,FIC,1R01NS094041-01,,Primary prevention of stroke in children with SCD in Sub-Saharan Africa II,"DEBAUN, MICHAEL",VANDERBILT UNIVERSITY,TN,"$10,000"
Stroke,2015,NINDS,1R01NS094041-01,,Primary prevention of stroke in children with SCD in Sub-Saharan Africa II,"DEBAUN, MICHAEL",VANDERBILT UNIVERSITY,TN,"$1,047,951"
Stroke,2015,FIC,1R21TW010356-01,,China-America MRI Plaque Imaging & Outcome Network (ChAMPION),"TURAN, TANYA",MEDICAL UNIVERSITY OF SOUTH CAROLINA,SC,"$172,253"
Stroke,2015,NINDS,1R21NS094087-01,,Probing the stroke vasculome with stem cells,"BORLONGAN, CESARIO",UNIVERSITY OF SOUTH FLORIDA,FL,"$186,875"
Stroke,2015,OD,3R01NS074895-06S1,,Neuroprotection in the Aging Female Brain,"SOHRABJI, FARIDA",TEXAS A&M UNIVERSITY HEALTH SCIENCE CTR,TX,"$99,999"
Stroke,2015,NINDS,3U44NS071657-04S1,,Pre-clinical Development of a Context-Dependent NMADR Neuroprotectant for Treatme,"KOSZALKA, GEORGE","NEUROP, INC.",GA,"$393,610"
Stroke,2015,NIBIB,1U01EB021183-01,,One Stop Shop Imaging for Acute Ischemic StrokeTreatment,"CHEN, GUANG-HONG",UNIVERSITY OF WISCONSIN-MADISON,WI,"$744,443"
Stroke,2015,NINDS,1R01NS094539-01,,THE ROLE AND MECHANISMS OF PBEF IN ACUTE BRAIN INJURY AND LONG-TERM STROKE OUTCOMES AFTER FOCAL ISCHEMIC STROKE,"DING, SHINGHUA",UNIVERSITY OF MISSOURI-COLUMBIA,MO,"$310,625"
Stroke,2015,NINDS,1R01NS094756-01,,Promotion of neurovascular remodeling through mitochondria transfer after stroke,"HAYAKAWA, KAZUHIDE",MASSACHUSETTS GENERAL HOSPITAL,MA,"$378,035"
Stroke,2015,NINDS,1R01NS094758-01,,Purinergic Signaling in Varicella Zoster Virus Vasculopathy,"NAGEL, MARIA",UNIVERSITY OF COLORADO DENVER,CO,"$340,156"
Stroke,2015,NINDS,1R01NS094748-01,,Designing brain machine interfaces to drive plasticity and enhance recovery after brain injury,"SLUTZKY, MARC",NORTHWESTERN UNIVERSITY AT CHICAGO,IL,"$530,199"
Stroke,2015,NINDS,1R01NS094535-01,,Novel carbon nanoparticle superoxide dismutation pathways,"KENT, THOMAS",BAYLOR COLLEGE OF MEDICINE,TX,"$454,236"
Stroke,2015,NINDS,2R56NS064136-06,,Protective mechanisms of ischemic postconditioning,"ZHAO, HENG",STANFORD UNIVERSITY,CA,"$389,585"
Stroke,2015,NINDS,1R56NS092207-01,,3D WALLI: MR intracranial vessel wall imaging for stroke prevention,"YUAN, CHUN",UNIVERSITY OF WASHINGTON,WA,"$609,000"
Stroke,2015,NINDS,1R21NS094780-01,,"Improved Evaluation of PCOM Aneurysms: Angio-Architecture, Hemodynamics and Shape","CEBRAL, JUAN",GEORGE MASON UNIVERSITY,VA,"$184,447"
Stroke,2015,NINDS,1R56NS091146-01,,Anti-Oxidant Promoting Cytokine LIF Enhances Neural Cell Survival During Ischemia,"PENNYPACKER, KEITH",UNIVERSITY OF SOUTH FLORIDA,FL,"$373,750"
Stroke,2015,NINDS,1K08NS094760-01,,ADVANCED DIFFUSION BIOMARKERS OF BRAIN INJURY IN SUBARACHNOID HEMORRHAGE,"KUMMER, TERRANCE",WASHINGTON UNIVERSITY,MO,"$149,242"
Stroke,2015,NINDS,3R41NS090650-01S1,,Optimized lactoferrin for treatment of intracerebral hemorrhage,"KRUZEL, MARIAN",PHARMAREVIEW CORPORATION,TX,"$47,600"
