Category,FY,Funding IC,Project Number,Sub Project #,Project Title,PI Name,Org Name,State / Country,Amount
Brain Cancer,2013,NINDS,5K08NS064297-06,,Role of Nuclear Factor I A (NFIA) gene in glioma,"SONG, HAE-RI",NEW YORK UNIVERSITY SCHOOL OF MEDICINE,NY,"$179,571"
Brain Cancer,2013,NINDS,5R01NS066905-05,,BIRN RESOURCES FACILITATE THE PERSONALIZATION OF MALIGNANT BRAIN TUMOR,"MARCUS, DANIEL",WASHINGTON UNIVERSITY,MO,"$297,986"
Brain Cancer,2013,NCI,1R01CA166067-01A1,,Prevention and treatment of brain micrometastases of breast cancer,"LOCKMAN, PAUL",TEXAS TECH UNIVERSITY HEALTH SCIS CENTER,TX,"$313,325"
Brain Cancer,2013,NCI,1R01CA169345-01A1,,Analysis of STAG2 Inactivation and Aneuploidy in Human Cancer,"WALDMAN, TODD",GEORGETOWN UNIVERSITY,DC,"$322,317"
Brain Cancer,2013,NCI,1R01CA169096-01A1,,Targeting the Urokinase Receptor in Glioblastoma Multiforme,"GONIAS, STEVEN",UNIVERSITY OF CALIFORNIA,CA,"$321,625"
Brain Cancer,2013,NCI,1R01CA176659-01,,Molecular Target Variation Across Environments and at Margins of Glioblastoma,"BRAT, DANIEL",EMORY UNIVERSITY,GA,"$455,206"
Brain Cancer,2013,NCI,1R01CA166492-01A1,,Targeting Radiation Resistance in Glioblastoma Stem Cells,"WANG, JIALIANG",VANDERBILT UNIVERSITY MED CTR,TN,"$309,756"
Brain Cancer,2013,NINDS,5R00NS065974-04,,Revealing new regulators of EGFR-P13K driven glioma proliferation and migration,"READ, RENEE",EMORY UNIVERSITY,GA,"$240,285"
Brain Cancer,2013,NCI,5P01CA071933-15,5093,Preclinical Evaluation of Oncolytic HSV for Anaplastic Glioma Therapy,"WHITLEY, RICHARD",UNIVERSITY OF ALABAMA AT BIRMINGHAM,AL,"$158,410"
Brain Cancer,2013,NCI,5P01CA071933-15,5095,Lessons from the OR: Using Clinical Biologic Correlates to Inform HSV Trial,"MARKERT, JAMES",UNIVERSITY OF ALABAMA AT BIRMINGHAM,AL,"$162,922"
Brain Cancer,2013,NCI,5P01CA071933-15,5096,Administrative Core,"WHITLEY, RICHARD",UNIVERSITY OF ALABAMA AT BIRMINGHAM,AL,"$82,441"
Brain Cancer,2013,NCI,5P01CA071933-15,5097,Experimental Glioma Animal Models Core,"GILLESPIE, G.",UNIVERSITY OF ALABAMA AT BIRMINGHAM,AL,"$163,735"
Brain Cancer,2013,NCI,5P01CA071933-15,5098,Virus Production Core,"PARKER, JACQUELINE",UNIVERSITY OF ALABAMA AT BIRMINGHAM,AL,"$81,223"
Brain Cancer,2013,NCI,5P01CA071933-15,8846,Optimization of Tumor Targeted HSV for Human Use,"ROIZMAN, BERNARD",UNIVERSITY OF CHICAGO,IL,"$351,445"
Brain Cancer,2013,NCI,5P01CA071933-15,8853,Radiation Enhancement of HSV Anti-Tumor Effects,"WEICHSELBAUM, RALPH",UNIVERSITY OF CHICAGO,IL,"$232,718"
Brain Cancer,2013,NCI,5R01CA125244-04,,Adoptive Transfer of AlloCTL for Immunotherapy of Recurrent Gliomas,"KRUSE, CAROL",UNIVERSITY OF CALIFORNIA LOS ANGELES,CA,$1
Brain Cancer,2013,NCI,5R01CA148621-03,,Cancer Stem Cell Niche in Brain Tumors,"FAN, XING",UNIVERSITY OF MICHIGAN,MI,"$349,953"
Brain Cancer,2013,NCI,1R01CA169316-01A1,,Imaging Guided Genomics of Malignant Transformation,"COSTELLO, JOSEPH",UNIVERSITY OF CALIFORNIA SAN FRANCISCO,CA,"$634,902"
Brain Cancer,2013,NCI,1R01CA164714-01A1,,B7H1 Mediated Immunosuppression in Glioma,"PARSA, ANDREW",NORTHWESTERN UNIVERSITY AT CHICAGO,IL,"$320,588"
Brain Cancer,2013,NCI,5R01CA154345-03,,Oxygen as a master immunologic switch,"PENNELL, CHRISTOPHER",UNIVERSITY OF MINNESOTA,MN,"$294,526"
Brain Cancer,2013,NCI,2R01CA129371-06,,Angiogenesis-targeting therapy for glioblastoma,"BATCHELOR, TRACY",MASSACHUSETTS GENERAL HOSPITAL,MA,"$594,234"
Brain Cancer,2013,NCI,1R01CA163891-01A1,,Prognostic and Functional Role of microRNAs in Melanoma Brain Metastasis,"HERNANDO, EVA",NEW YORK UNIVERSITY SCHOOL OF MEDICINE,NY,"$351,713"
Brain Cancer,2013,NCI,1P01CA174645-01,6364,Technology for controlling ultrasound targeted drug delivery in brain,"MCDANNOLD, NATHAN","SENIOR VICE PRESIDENT, RESEARCH",,"$365,097"
Brain Cancer,2013,NCI,1P01CA174645-01,6365,Ultrasound-induced blood-brain/tumor barrier disruption in brain metastases,"JOLESZ, FERENC","SENIOR VICE PRESIDENT, RESEARCH",,"$396,461"
Brain Cancer,2013,NCI,1P01CA174645-01,6366,Ultrasound contrast agent enhanced focused ultrasound ablation of brain tumors,"CLEMENT, GREGORY","SENIOR VICE PRESIDENT, RESEARCH",,"$407,392"
Brain Cancer,2013,NCI,1P01CA174645-01,6367,Administrative Core,"JOLESZ, FERENC","SENIOR VICE PRESIDENT, RESEARCH",,"$131,722"
Brain Cancer,2013,NINDS,1R01NS079701-01A1,,Targeting the cholesterol metabolism to treat glioblastoma,"GUO, DELIANG",OHIO STATE UNIVERSITY,OH,"$336,784"
Brain Cancer,2013,NCI,1R01CA169937-01A1,,MR Investigation of IDH Mutation and Its Marker 2-HG in Brain Tumor Patients,"MAO, HUI",EMORY UNIVERSITY,GA,"$375,455"
Brain Cancer,2013,NINDS,2R01NS037956-14A1,,ATM and DNA Damage in the Nervous System,"MCKINNON, PETER",ST. JUDE CHILDREN'S RESEARCH HOSPITAL,TN,"$382,813"
Brain Cancer,2013,NCI,5R01CA155769-03,,Role of Receptor for Advanced Glycation End Product (RAGE) Pathway in Brain Tumor,"BADIE, BEHNAM",CITY OF HOPE/BECKMAN RESEARCH INSTITUTE,CA,"$327,684"
Brain Cancer,2013,NCI,5R01CA154619-02,,Anticancer Drug Pharmacology in Very Young Children,"STEWART, CLINTON",ST. JUDE CHILDREN'S RESEARCH HOSPITAL,TN,"$407,467"
Brain Cancer,2013,NIBIB,4R01EB003268-17,,Ultrasound Therapy Delivery Through Intact Skull,"HYNYNEN, KULLERVO",SUNNYBROOK & WOMEN'S COLL HLTH SCIS CTR,CANADA,"$513,241"
Brain Cancer,2013,NCI,5R01CA115495-06,,Development of Novel Inducers of Non-Apoptotic Cell Death to Target Glioblastoma,"MALTESE, WILLIAM",UNIVERSITY OF TOLEDO HEALTH SCI CAMPUS,OH,"$271,659"
Brain Cancer,2013,NINDS,5K08NS075144-03,,Modulation of the blood-tumor barrier through targeted suppression of claudin 5,"GRANT, GERALD",DUKE UNIVERSITY,NC,"$121,068"
Brain Cancer,2013,NCI,5P01CA154291-02,6711,Targeted Radiotherapy of Neoplastic Meningitis using Monoclonal Antibodies Label,"ZALUTSKY, MICHAEL",DUKE UNIVERSITY,NC,"$330,634"
Brain Cancer,2013,NCI,5P01CA154291-02,6712,Targeting Immunosuppression Pathways to Enhance Brain Tumor Immunotherapy,"SAMPSON, JOHN",DUKE UNIVERSITY,NC,"$729,405"
Brain Cancer,2013,NCI,5P01CA154291-02,6713,EGFRwt and EGFRvlll Dual-Specific Immunotoxin for Glioblastoma Multiforme,"BIGNER, DARELL",DUKE UNIVERSITY,NC,"$573,030"
Brain Cancer,2013,NCI,5P01CA154291-02,6714,Imaging,"BARBORIAK, DANIEL",DUKE UNIVERSITY,NC,"$550,184"
Brain Cancer,2013,NCI,5P01CA154291-02,6725,Clinical Support,"VREDENBURGH, JAMES",DUKE UNIVERSITY,NC,"$821,791"
Brain Cancer,2013,NCI,5P01CA154291-02,6727,Administration,"BIGNER, DARELL",DUKE UNIVERSITY,NC,"$49,859"
Brain Cancer,2013,NCI,1R03CA171612-01A1,,"Dietary Selenium, Selenoenzyme Genes and Adult Glioma","EGAN, KATHLEEN",H. LEE MOFFITT CANCER CTR & RES INST,FL,"$84,250"
Brain Cancer,2013,NCI,5R01CA141432-04,,Oncogene cooperation in glioma genesis,"ZHANG, WEI",UT MD ANDERSON CANCER CTR,TX,"$298,934"
Brain Cancer,2013,NCI,5R01CA163838-02,,GSK3b mediates radiation-induced cytotoxicity in hippocampal neurons,"XIA, FEN",OHIO STATE UNIVERSITY,OH,"$371,869"
Brain Cancer,2013,NCI,1R21CA170289-01A1,,18F-Fluorocholine to distinguish necrosis from recurrence in brain metastases,"BEAL, KATHRYN",SLOAN-KETTERING INST CAN RES,NY,"$366,860"
Brain Cancer,2013,NCI,1K08CA169005-01A1,,Glioma immunotherapy with strategies based on autonomous parvovirus MVMp,"PAGLINO, JUSTIN",YALE UNIVERSITY,CT,"$117,418"
Brain Cancer,2013,NCI,1R03CA156561-01A1,,Clinical characteristics and patterns of care for rare brain tumor sub-types,"VILLANO, JOHN",UNIVERSITY OF KENTUCKY,KY,"$86,578"
Brain Cancer,2013,NCI,5R01CA161210-03,,Retrotransposon instability in glioblastoma multiforme,"BOEKE, JEF",JOHNS HOPKINS UNIVERSITY,MD,"$252,785"
Brain Cancer,2013,NINDS,1R21NS075602-01A1,,"Posttranslational regulation of augurin, a new secretory tumor suppressor","OZAWA, AKIHIKO",TORREY PINES INST FOR MOLECULAR STUDIES,FL,"$259,500"
Brain Cancer,2013,NCI,2P01CA085878-10A1,6707,Defining Therapeutic Paradigms Based on Molecular Profiling of GBM,"ROSS, BRIAN",UNIVERSITY OF MICHIGAN,MI,"$363,905"
Brain Cancer,2013,NCI,2P01CA085878-10A1,6709,Identification of Genetic Alterations Responsible for Primary GBM Clonal Evoluti,"REHEMTULLA, ALNAWAZ",UNIVERSITY OF MICHIGAN,MI,"$451,755"
Brain Cancer,2013,NCI,2P01CA085878-10A1,6712,Predictive Imaging Biomarkers for GBM Therapeutic Response and Recurrence,"CHENEVERT, THOMAS",UNIVERSITY OF MICHIGAN,MI,"$343,119"
Brain Cancer,2013,NCI,2P01CA085878-10A1,6713,Administration Core,"ROSS, BRIAN",UNIVERSITY OF MICHIGAN,MI,"$208,522"
Brain Cancer,2013,NCI,2P01CA085878-10A1,6715,Imaging Core,"GALBAN, CRAIG",UNIVERSITY OF MICHIGAN,MI,"$310,117"
Brain Cancer,2013,NCI,2P01CA085878-10A1,6716,Bioinformatics Core,"VERHAAK, ROEL",UNIVERSITY OF MICHIGAN,MI,"$154,477"
Brain Cancer,2013,NCI,2P01CA085878-10A1,6718,Biostatistics Core,"JOHNSON, TIMOTHY",UNIVERSITY OF MICHIGAN,MI,"$180,494"
Brain Cancer,2013,NCI,5R01CA168700-02,,Dysregulation of mTORC2 in gliomas,"GERA, JOSEPH",BRENTWOOD BIOMEDICAL RESEARCH INSTITUTE,CA,"$215,921"
Brain Cancer,2013,NCI,2P01CA022443-36,6863,miRNA and v-Cdks: Independent Drivers OF EBV and HCMV Replication and Oncogenesi,"KENNEY, SHANNON",UNIVERSITY OF WISCONSIN-MADISON,WI,"$294,254"
Brain Cancer,2013,NCI,5R21CA164726-02,,Selective Differentiation of Glioblastoma Stem Cells,"RABKIN, SAMUEL",MASSACHUSETTS GENERAL HOSPITAL,MA,"$213,471"
Brain Cancer,2013,NINDS,5F31NS079057-02,,Identification and regulation of quiescent stemcells in the adult brain,"MALDONADO, ANGEL",COLUMBIA UNIVERSITY HEALTH SCIENCES,NY,"$47,232"
Brain Cancer,2013,NCI,2P50CA097257-11A1,7009,BRAIN TUMOR SPORT GRANT,"WIENCKE, JOHN",UNIVERSITY OF CALIFORNIA SAN FRANCISCO,CA,"$277,518"
Brain Cancer,2013,NCI,2P50CA097257-11A1,7010,NOVEL BIOMARKERS OF MALIGNANT PROGRESSION IN RECURRENT LOW GRADE GLIOMA,"CHANG, SUSAN",UNIVERSITY OF CALIFORNIA SAN FRANCISCO,CA,"$334,128"
Brain Cancer,2013,NCI,2P50CA097257-11A1,7011,NOVEL APPROACAHES FOR IMPROVING PEDIATRIC BRAFV600E GLIOMA PATIENT OUTCOMES,"JAMES, CHARLES",UNIVERSITY OF CALIFORNIA SAN FRANCISCO,CA,"$271,490"
Brain Cancer,2013,NCI,2P50CA097257-11A1,7012,OVERCOMING LOCAL AND PERIPHERAL IMMUNE SUPPRESSION IN GLIOMA TO FACILITATE EFFEC,"PARSA, ANDREW",UNIVERSITY OF CALIFORNIA SAN FRANCISCO,CA,"$337,506"
Brain Cancer,2013,NCI,2P50CA097257-11A1,7013,BIOSPECIMEN \ PATHOLOGY CORE,"PERRY, ARIE",UNIVERSITY OF CALIFORNIA SAN FRANCISCO,CA,"$156,176"
Brain Cancer,2013,NCI,2P50CA097257-11A1,7014,PRE-CLINICAL ANIMAL CORE,"JAMES, CHARLES",UNIVERSITY OF CALIFORNIA SAN FRANCISCO,CA,"$164,864"
Brain Cancer,2013,NCI,2P50CA097257-11A1,7015,BIOSTATISTICS AND CLINICAL CORE,"MOLINARO, ANNETTE",UNIVERSITY OF CALIFORNIA SAN FRANCISCO,CA,"$168,913"
Brain Cancer,2013,NCI,2P50CA097257-11A1,7016,AMINISTRATIVE CORE,"BERGER, MITCHEL",UNIVERSITY OF CALIFORNIA SAN FRANCISCO,CA,"$168,398"
Brain Cancer,2013,NCI,2P50CA097257-11A1,7017,DEVELOPMENTAL RESEARCH PROGAM,"PIEPER, RUSSELL",UNIVERSITY OF CALIFORNIA SAN FRANCISCO,CA,"$135,754"
Brain Cancer,2013,NCI,2P50CA097257-11A1,7018,CAREER DEVELOPMENTAL PROGRAM,"PIEPER, RUSSELL",UNIVERSITY OF CALIFORNIA SAN FRANCISCO,CA,"$135,753"
Brain Cancer,2013,NCI,5R01CA160458-02,,Hypoxia-induced Metabolic Changes in Cancer,"ILIOPOULOS, OTHON",MASSACHUSETTS GENERAL HOSPITAL,MA,"$300,200"
Brain Cancer,2013,NINDS,5R01NS077555-03,,Cyclophilin B as a therapeutic target in glioblastoma,"BRAM, RICHARD",MAYO CLINIC ROCHESTER,MN,"$332,895"
Brain Cancer,2013,NCI,5R01CA137110-05,,The 26S Proteasome in Cancer Stem Cells,"PAJONK, FRANK",UNIVERSITY OF CALIFORNIA LOS ANGELES,CA,"$291,367"
Brain Cancer,2013,NCI,5K08CA154790-03,,PET TUMOR AND PROLIFERATION IMAGING VIA CATIONIC AMINO ACID TRANSPORT,"MCCONATHY, JONATHAN",WASHINGTON UNIVERSITY,MO,"$157,715"
Brain Cancer,2013,NCI,5R21CA170148-02,,RESPONSE TO THERAPY FOR PATIENTS WITH GLIOMA USING HYPERPOLARIZED C-13 PYRUVATE,"NELSON, SARAH",UNIVERSITY OF CALIFORNIA SAN FRANCISCO,CA,"$306,229"
Brain Cancer,2013,NINDS,5R01NS060752-06,,Novel Tools for Evaluation and Prediction of Radiotherapy Response in Individual,"SWANSON, KRISTIN",NORTHWESTERN UNIVERSITY AT CHICAGO,IL,"$313,197"
Brain Cancer,2013,NCI,1R01CA176830-01,,Mechanisms of acquired temozolomide resistance in glioblastoma multiforme,"SARKARIA, JANN",MAYO CLINIC ROCHESTER,MN,"$329,925"
Brain Cancer,2013,NCI,5R01CA154256-04,,Optimizing Induction Conditions for Immunotherapeutic CTL,"KRUSE, CAROL",UNIVERSITY OF CALIFORNIA LOS ANGELES,CA,"$370,764"
Brain Cancer,2013,NINDS,5R01NS073870-04,,Defining the role of BRAF in glioma initiation and maintenance,"HOLMEN, SHERI",UNIVERSITY OF UTAH,UT,"$314,530"
Brain Cancer,2013,NCI,5R01CA158079-03,,"MRI Assessment of Tumor Perfusion, Permeability and Cellularity","QUARLES, CHRISTOPHER",VANDERBILT UNIVERSITY MED CTR,TN,"$298,161"
Brain Cancer,2013,NCI,5R01CA164791-02,,The Roles of MicroRNAs in Glioblastoma,"WANG, XIAO-FAN",DUKE UNIVERSITY,NC,"$298,355"
Brain Cancer,2013,NICHD,5P30HD004612-43,7684,Stem Cells,"SUN, YI",UNIVERSITY OF CALIFORNIA LOS ANGELES,CA,"$136,716"
Brain Cancer,2013,NICHD,5P30HD004612-43,7685,Cell Biology and Cellular Imaging,"DE VELLIS, JEAN",UNIVERSITY OF CALIFORNIA LOS ANGELES,CA,"$245,187"
Brain Cancer,2013,NINDS,5R01NS064007-06,,STAT3  REGULATION OF GLIOBLASTOMA PATHOGENESIS,"BONNI, AZAD",WASHINGTON UNIVERSITY,MO,"$296,478"
Brain Cancer,2013,NINDS,5K08NS066083-05,,Developmental Origins of Neural Tumors Using a Novel Genetic Inducible Analysis,"RAJU, PRAVEEN",WEILL MEDICAL COLL OF CORNELL UNIV,NY,"$177,449"
Brain Cancer,2013,NINDS,5K08NS070928-03,,Modeling Apoptotic Suppression in a Mouse Model of Brain Tumors,"RAO, GANESH",UT MD ANDERSON CANCER CTR,TX,"$185,355"
Brain Cancer,2013,NCI,5R01CA109558-08,,Fluorescence Imaging to Optimize Cancer Detection,"POGUE, BRIAN",DARTMOUTH COLLEGE,NH,"$257,044"
Brain Cancer,2013,NCI,5R01CA166078-02,,Improving therapy of glioblastoma multiforme by enhancing therapeutic drug delive,"MCDEVITT, MICHAEL",SLOAN-KETTERING INST CAN RES,NY,"$321,072"
Brain Cancer,2013,NINDS,5R01NS076759-03,,Suppression of Glioblastoma Stem Cells by Kruppel-Like Factor 9,"LATERRA, JOHN",HUGO W. MOSER RES INST KENNEDY KRIEGER,MD,"$312,665"
Brain Cancer,2013,NINDS,5R01NS052634-09,,Amino Acid Transport and the Biology of Human Gliomas,"SONTHEIMER, HARALD",UNIVERSITY OF ALABAMA AT BIRMINGHAM,AL,"$309,253"
Brain Cancer,2013,NINDS,5R01NS061070-08,,Hedgehog:YAP:IGF2/mTOR axis in cerebellar precursor division and medulloblastoma,"KENNEY, ANNA",EMORY UNIVERSITY,GA,"$329,307"
Brain Cancer,2013,NINDS,5R01NS064593-05,,ATM as target for malignant glioma radiosensitization.,"VALERIE, KRISTOFFER",VIRGINIA COMMONWEALTH UNIVERSITY,VA,"$333,230"
Brain Cancer,2013,NCI,5R01CA098503-08,,Dissecting Glioma Genesis through a Glial-Specific Mouse Model,"ZHANG, WEI",UT MD ANDERSON CANCER CTR,TX,"$237,667"
Brain Cancer,2013,NCI,5K07CA134639-05,,Neurobiologic Mechanisms of Cognitive Dysfunction and Decline in Medulloblastoma,"KESLER, SHELLI",STANFORD UNIVERSITY,CA,"$166,757"
Brain Cancer,2013,NCI,5R01CA170702-02,,Defining mechanisms and targets in Wnt addicted human malignancies (PQ22),"AARONSON, STUART",MOUNT SINAI SCHOOL OF MEDICINE,NY,"$330,610"
Brain Cancer,2013,NCI,5K07CA157923-03,,Neurocognitive Outcomes Following Proton Beam Radiation Therapy for Treatment of,"KAHALLEY, LISA",BAYLOR COLLEGE OF MEDICINE,TX,"$148,746"
Brain Cancer,2013,NIGMS,5R01GM067946-11,,"Signal Termination by PHLPP, PH domain Leucine-rich repeat Protein Phosphatase","NEWTON, ALEXANDRA",UNIVERSITY OF CALIFORNIA,CA,"$299,150"
Brain Cancer,2013,NCI,5P30CA047904-25,6482,ANIMAL FACILITY,"NEWSOME, JOSEPH",UNIVERSITY OF PITTSBURGH AT PITTSBURGH,PA,"$121,204"
Brain Cancer,2013,NCI,5U24CA143882-05,,The USC-JHU Cancer Epigenome Characterization Center,"LAIRD, PETER",UNIVERSITY OF SOUTHERN CALIFORNIA,CA,"$500,000"
Brain Cancer,2013,NHGRI,5U24CA143882-05,,The USC-JHU Cancer Epigenome Characterization Center,"LAIRD, PETER",UNIVERSITY OF SOUTHERN CALIFORNIA,CA,"$1,799,795"
Brain Cancer,2013,NIGMS,5R01GM101087-02,,Dissecting the Signaling Mechanisms of Smoothened,"OGDEN, STACEY",ST. JUDE CHILDREN'S RESEARCH HOSPITAL,TN,"$325,085"
Brain Cancer,2013,NCI,5R01CA160782-03,,Discovery and Validation of Tumor Immunoevasion Mechanisms,"LARGAESPADA, DAVID",UNIVERSITY OF MINNESOTA,MN,"$171,148"
Brain Cancer,2013,NCI,5P30CA091842-12,6588,Translational and Clinical Research,"MOLEY, JEFFREY",WASHINGTON UNIVERSITY,MO,"$60,202"
Brain Cancer,2013,NCI,5R00CA157948-03,,Microenvironmental regulation of the cancer stem cell phenotype by integrin a6,"LATHIA, JUSTIN",CLEVELAND CLINIC LERNER COM-CWRU,OH,"$234,059"
Brain Cancer,2013,NCI,5F32CA162558-03,,RECIPROCAL SONIC HEDGEHOG AND CXCR4 INTERACTIONS IN MEDULLOBLASTOMA,"WARD, STACEY",WASHINGTON UNIVERSITY,MO,"$75,432"
Brain Cancer,2013,NCI,5R01CA163815-02,,Role of PLGF in Medulloblastoma Progression and Treatment,"JAIN, RAKESH",MASSACHUSETTS GENERAL HOSPITAL,MA,"$318,487"
Brain Cancer,2013,NCI,5K99CA168943-02,,Effects of Extravasated Serum Proteins on Human Glioblastoma Invasion,"UNDERHILL, HUNTER",UNIVERSITY OF WASHINGTON,WA,"$110,624"
Brain Cancer,2013,NCI,5R01CA170653-02,,"Cadherin11 in cancer & rheumatoid arthritis: Common target, common therapies? (5)","BYERS, STEPHEN",GEORGETOWN UNIVERSITY,DC,"$550,881"
Brain Cancer,2013,NIBIB,5R01EB012117-04,,High Resolution Multiplexed Fluorescence Tomography,"NIEDRE, MARK",NORTHEASTERN UNIVERSITY,MA,"$320,638"
Brain Cancer,2013,NINDS,5R01NS064983-05,,Glioblastoma stem cells therapy,"TANNOUS, BAKHOS",MASSACHUSETTS GENERAL HOSPITAL,MA,"$366,163"
Brain Cancer,2013,NCI,1F31CA177185-01,,Identifying c-Cbl as a critical point of intervention in glioblastoma multiforme,"STRIPAY, JENNIFER",UNIVERSITY OF ROCHESTER,NY,"$42,232"
Brain Cancer,2013,NCI,5K24CA125440-07,,Clinical and Molecular Studies of Malignant Brain Tumors,"BATCHELOR, TRACY",MASSACHUSETTS GENERAL HOSPITAL,MA,"$185,972"
Brain Cancer,2013,NCI,2R44CA132257-03,,4-Demethyl-4-cholesteryloxycarbonylpenclomedine (DM-CHOC-PEN): A Phase II Clinica,"MORGAN, LEE","DEKK-TEC, INC.",LA,"$638,567"
Brain Cancer,2013,NCI,1R43CA174129-01A1,,Novel Chemotherapeutics for Brain Tumors,"JANDELEIT, BERND","QUADRIGA BIOSCIENCES, INC.",CA,"$288,099"
Brain Cancer,2013,NCI,5K08CA163961-02,,Combined Pre & Intraoperative Brain Tumor Imaging Strategy using a Dual-Modality,"KIRCHER, MORITZ",SLOAN-KETTERING INST CAN RES,NY,"$178,740"
Brain Cancer,2013,NCI,1R43CA174280-01A1,,Targeting Deep Brain Tumors with MRI-Insertable Magnetic Gradients and Nanopartic,"WEINBERG, IRVING","WEINBERG MEDICAL PHYSICS, LLC",MD,"$288,303"
Brain Cancer,2013,NINDS,5R01NS061776-05,,Computational analysis of Human High Grade Gliomas,"IAVARONE, ANTONIO",COLUMBIA UNIVERSITY HEALTH SCIENCES,NY,"$457,788"
Brain Cancer,2013,NINDS,5K08NS076548-03,,Targeted Modulation of the Death Receptor as a Therapeutic Strategy for Glioma,"DORSEY, JAY",UNIVERSITY OF PENNSYLVANIA,PA,"$189,227"
Brain Cancer,2013,NCI,1F31CA171733-01A1,,Synergistic interactions between SapC-DOPS and chemotherapy for glioma,"WOJTON, JEFFREY",OHIO STATE UNIVERSITY,OH,"$30,336"
Brain Cancer,2013,NCI,1F30CA177152-01,,Targeting EGFRvIII in Brain Tumors with Bispecific Antibodies,"CHOI, BRYAN",DUKE UNIVERSITY,NC,"$31,711"
Brain Cancer,2013,NCI,1F30CA177193-01,,Molecular Mechanism of Hepatocyte Growth Factor Signaling,"CHEN, PO-HAN",NORTHWESTERN UNIVERSITY AT CHICAGO,IL,"$47,232"
Brain Cancer,2013,NCI,1F30CA177267-01,,Human cytomegalovirus in the promotion of glioblastoma multiforme pathogenesis,"STRONG, MICHAEL",TULANE UNIVERSITY OF LOUISIANA,LA,"$26,412"
Brain Cancer,2013,NCI,5R01CA124756-07,,Targeting Translation Control in Malignant Glioma,"GROMEIER, MATTHIAS",DUKE UNIVERSITY,NC,"$238,436"
Brain Cancer,2013,NCI,5U01CA160045-02,,Objective decision support environment for clinical trials,"ERICKSON, BRADLEY",MAYO CLINIC ROCHESTER,MN,"$514,055"
Brain Cancer,2013,NCI,5R01CA170592-02,,Assaying GBM growth and therapy response in single cells and tumorspheres (PQ17),"LIGON, KEITH",DANA-FARBER CANCER INST,MA,"$486,240"
Brain Cancer,2013,NCI,5R01CA152371-04,,Akt-EphA2 Crosstalk in Glioma Invasion,"WANG, BINGCHENG",CASE WESTERN RESERVE UNIVERSITY,OH,"$306,229"
Brain Cancer,2013,NINDS,5K08NS065268-04,,Optimizing EGFR Targeted Therapy in Malignant Glioma,"NICOLAIDES, THEODORE",UNIVERSITY OF CALIFORNIA SAN FRANCISCO,CA,"$167,300"
Brain Cancer,2013,NINDS,5R01NS079715-02,,Study of a Novel Deubiquitylase in Medulloblastoma,"GOPALAKRISHNAN, VIDYA",UT MD ANDERSON CANCER CTR,TX,"$333,529"
Brain Cancer,2013,NIGMS,1R01GM103841-01A1,,Measuring multiprotein assemblies that drive biological signals,"SCHRUM, ADAM",MAYO CLINIC ROCHESTER,MN,"$313,855"
Brain Cancer,2013,NCI,5K08CA155764-03,,The Significance of Isocitrate Dehydrogenase Mutations in Gliomas,"HORBINSKI, CRAIG",UNIVERSITY OF KENTUCKY,KY,"$171,644"
Brain Cancer,2013,NINDS,5R01NS080619-02,,"BRAF Mutation in Malignant Astrocytoma Origin, Evolution, and Response to Therapy","JAMES, CHARLES",UNIVERSITY OF CALIFORNIA SAN FRANCISCO,CA,"$341,104"
Brain Cancer,2013,NIA,5R03AG040574-02,,Chronic versus acute effects of p53 deletion on Olig2 progenitor malignancy,"ROSTOMILY, ROBERT",UNIVERSITY OF WASHINGTON,WA,"$82,215"
Brain Cancer,2013,NCI,5R01CA163806-02,,TSPO Ligands for Cancer Imaging,"MANNING, HENRY",VANDERBILT UNIVERSITY MED CTR,TN,"$425,575"
Brain Cancer,2013,NCI,5F32CA150610-03,,Dual LSD1 and HDAC Inhibition for Cancer Therapy,"SINGH, MELISSA",UT MD ANDERSON CANCER CTR,TX,"$57,734"
Brain Cancer,2013,NCI,5K23CA157728-03,,PARP Inhibition to Treat Triple-Negative Breast Cancer Brain Metastases,"ANDERS, CAREY",UNIV OF NORTH CAROLINA CHAPEL HILL,NC,"$173,089"
Brain Cancer,2013,NINDS,1R01NS080598-01A1,,Galectin Modulation of Glutamate Receptors and Neuronal Function,"SWANSON, GEOFFREY",NORTHWESTERN UNIVERSITY AT CHICAGO,IL,"$322,724"
Brain Cancer,2013,NCI,5R44CA135906-04,,Nanoparticles and Nanocapsules for Glioma Targeting,"SPRETZ, RUBEN",LNKCHEMSOLUTIONS,NE,"$640,667"
Brain Cancer,2013,NCI,5R01CA164371-03,,Patient-specific predictive modeling that integrates advanced cancer imaging,"KINAHAN, PAUL",UNIVERSITY OF WASHINGTON,WA,"$806,109"
Brain Cancer,2013,RMAP,5R01EB010244-05,,Imaging the Invisible with No Labels: A Major Opportunity in Biology and Medicine,"XIE, XIAOLIANG SUNNEY",HARVARD UNIVERSITY,MA,"$759,192"
Brain Cancer,2013,NINR,5F31NR013091-03,,Caregiver functional expectations for survivors of childhood brain tumors,"LUCAS, MATTHEW",UNIVERSITY OF PENNSYLVANIA,PA,"$42,232"
Brain Cancer,2013,NCI,5U01CA168878-02,,Extracellular Sulfatases As Novel Biomarkers For Early Detection of Cancer,"LEMJABBAR-ALAOUI, HASSAN",UNIVERSITY OF CALIFORNIA SAN FRANCISCO,CA,"$417,843"
Brain Cancer,2013,NINDS,5R01NS066654-05,,Multimodal Connectivity for Surgical Mapping,"HENRY, ROLAND",UNIVERSITY OF CALIFORNIA SAN FRANCISCO,CA,"$259,362"
Brain Cancer,2013,NCI,5U01CA140204-03,,Multi-Modality Quantitiative Imaging for Evaluation of Response to Cancer Therapy,"WAHL, RICHARD",JOHNS HOPKINS UNIVERSITY,MD,"$625,194"
Brain Cancer,2013,NEI,5K23EY022673-02,,Visual outcome measures in children with optic pathway gliomas,"AVERY, ROBERT",CHILDREN'S RESEARCH INSTITUTE,DC,"$229,624"
Brain Cancer,2013,NCI,5R01CA158800-03,,PET/CT Imaging of Malignant Brain Tumors with 124I-NM404,"WEICHERT, JAMEY",UNIVERSITY OF WISCONSIN-MADISON,WI,"$287,246"
Brain Cancer,2013,NCI,5R01CA164729-02,,"Integrative Cancer Genomics: Drivers, Pathways and Drugs","PE'ER, DANA",COLUMBIA UNIV NEW YORK MORNINGSIDE,NY,"$358,131"
Brain Cancer,2013,NCI,5R21CA170722-02,,Evolution of cancer-specific molecular requirements for glioblastoma multiforme (,"PADDISON, PATRICK",FRED HUTCHINSON CAN RES CTR,WA,"$176,645"
Brain Cancer,2013,NCI,7U01CA141502-05,,P3IK Signaling and Biology of Therapeutic Response in Brain and Prostate Tumors,"HOLLAND, ERIC",FRED HUTCHINSON CAN RES CTR,WA,"$725,951"
Brain Cancer,2013,NINDS,5F31NS076028-03,,Characterizing the functional stem-like properties of primary and recurrent gliom,"PITTER, KENNETH",WEILL MEDICAL COLL OF CORNELL UNIV,NY,"$47,232"
Brain Cancer,2013,NCI,5U01CA151815-04,,Nanoconjugate based on polymalic acid for brain tumor treatment,"LJUBIMOVA, JULIA",CEDARS-SINAI MEDICAL CENTER,CA,"$452,587"
Brain Cancer,2013,NCI,5U01CA154601-03,,Quantitative MRI of Glioblastoma Response,"ROSEN, BRUCE",MASSACHUSETTS GENERAL HOSPITAL,MA,"$660,134"
Brain Cancer,2013,NCI,5P50CA114747-09,5348,Image-Guided Resection to Improve Outcome for Children with Medulloblastoma,"CONTAG, CHRISTOPHER",STANFORD UNIVERSITY,CA,"$131,578"
Brain Cancer,2013,NLM,5R01LM010090-04,,Temporal relation discovery for clinical text,"SAVOVA, GUERGANA",CHILDREN'S HOSPITAL CORPORATION,MA,"$663,984"
Brain Cancer,2013,NINDS,5R01NS078018-02,,Brain endothelial cell function under adenosine receptor signaling directive,"BYNOE, MARGARET",CORNELL UNIVERSITY,NY,"$322,849"
Brain Cancer,2013,NINDS,5R21NS081374-02,,A hybrid microvesicle/virus vector for targeted gene transfer to the brain,"MAGUIRE, CASEY",MASSACHUSETTS GENERAL HOSPITAL,MA,"$209,888"
Brain Cancer,2013,NINDS,5R01NS081684-02,,Implications of a novel glioblastoma classification defined by miR-21-Sox2 status,"MAJUMDER, SADHAN",UT MD ANDERSON CANCER CTR,TX,"$365,954"
Brain Cancer,2013,NCI,5F30CA165892-02,,The role of gremlin in regulating the differentiation of glioma stem cells,"YAN, KENNETH",CLEVELAND CLINIC LERNER COM-CWRU,OH,"$47,232"
Brain Cancer,2013,NIGMS,5SC3GM096948-02,,Identifying Key Genes that cause Aggressive Brain Cancer,"YOO, CHANGWON",FLORIDA INTERNATIONAL UNIVERSITY,FL,"$104,944"
Brain Cancer,2013,NCI,5R01CA159811-02,,Modulation of Oncogenic Signaling in Glioblastomas,"CHENG, SHI-YUAN",NORTHWESTERN UNIVERSITY AT CHICAGO,IL,"$301,352"
Brain Cancer,2013,NCI,5R25CA153954-04,,The University of Kentucky Cancer Nanotechnology Training Center (UK CNTC),"ANDERSON, BRADLEY",UNIVERSITY OF KENTUCKY,KY,"$317,669"
Brain Cancer,2013,NINDS,5R01NS080939-02,,Genotypic Interactions in Brain Cancer Heterogeneity,"FURNARI, FRANK",LUDWIG INSTITUTE  FOR CANCER RES  LTD,CA,"$343,872"
