Category,FY,Funding IC,Project Number,Sub Project #,Project Title,PI Name,Org Name,State / Country,Amount
Brain Cancer,2014,NCI,5P50CA108961-09,5346,Animal Core,"SARKARIA, JANN",MAYO CLINIC ROCHESTER,MN,"$346,563"
Brain Cancer,2014,NCI,5P50CA108961-09,5347,Clinical Research Core,"BUCKNER, JAN",MAYO CLINIC ROCHESTER,MN,"$118,299"
Brain Cancer,2014,NCI,5P50CA108961-09,5348,Developmental Research Program,"O'NEILL, BRIAN",MAYO CLINIC ROCHESTER,MN,"$70,483"
Brain Cancer,2014,NCI,5P50CA108961-09,5349,Career Development Program,"O'NEILL, BRIAN",MAYO CLINIC ROCHESTER,MN,"$70,483"
Brain Cancer,2014,NCI,5F32CA174319-02,,Interplay between intrinsic and extrinsic force and glioma aggression,"BARNES, MATT","UNIVERSITY OF CALIFORNIA, SAN FRANCISCO",CA,"$57,929"
Brain Cancer,2014,NCI,5R01CA172048-04,,In vivo detection of involvement of endogenous BM progenitor cells in glioma,"ARBAB, ALI",GEORGIA  REGENTS UNIVERSITY,GA,"$304,261"
Brain Cancer,2014,NCI,5U24CA180918-02,,Quantitative Image Informatics for Cancer Research (QIICR),"KIKINIS, RON",BRIGHAM AND WOMEN'S HOSPITAL,MA,"$647,864"
Brain Cancer,2014,NINDS,5R01NS073610-03,,Molecular Motors and Glioma Dispersion,"ROSENFELD, STEVEN",CLEVELAND CLINIC LERNER COM-CWRU,OH,"$343,069"
Brain Cancer,2014,NINDS,5K08NS076548-04,,Targeted Modulation of the Death Receptor as a Therapeutic Strategy for Glioma,"DORSEY, JAY",UNIVERSITY OF PENNSYLVANIA,PA,"$189,227"
Brain Cancer,2014,NCI,5U01CA160882-03,,Non-neoplastic cell types dictate gliomagenesis and,"HAMBARDZUMYAN, DOLARES",CLEVELAND CLINIC LERNER COM-CWRU,OH,"$532,306"
Brain Cancer,2014,NINDS,5K08NS065268-05,,Optimizing EGFR Targeted Therapy in Malignant Glioma,"NICOLAIDES, THEODORE","UNIVERSITY OF CALIFORNIA, SAN FRANCISCO",CA,"$167,300"
Brain Cancer,2014,NCI,5K24CA160777-03,,Patient Oriented Research Program in Neuro-oncology,"PUDUVALLI, VINAY",OHIO STATE UNIVERSITY,OH,"$180,537"
Brain Cancer,2014,NCI,5U54CA163167-04,5273,The Proneural Perivascular Niche and Therapeutic Response,"HOLLAND, ERIC",FRED HUTCHINSON CANCER RESEARCH CENTER,WA,"$236,655"
Brain Cancer,2014,NCI,5U54CA163167-04,5274,Brain Metastasis Microenvironment and Mechanisms,"MASSAGUE, JOAN",FRED HUTCHINSON CANCER RESEARCH CENTER,WA,"$236,654"
Brain Cancer,2014,NCI,5U54CA163167-04,5275,Endothelial-Derived Angiocrine Factors in Progression of Brain Tumors,"RAFI, SHAHIN",FRED HUTCHINSON CANCER RESEARCH CENTER,WA,"$399,944"
Brain Cancer,2014,NCI,5U54CA163167-04,5276,Administrative Core,"HOLLAND, ERIC",FRED HUTCHINSON CANCER RESEARCH CENTER,WA,"$43,293"
Brain Cancer,2014,NCI,5U54CA163167-04,5277,Pathology Core,"HUSE, JASON",FRED HUTCHINSON CANCER RESEARCH CENTER,WA,"$17,704"
Brain Cancer,2014,NINDS,5R01NS080963-03,,Chemical Probes Targeting Gliomas with IDH Mutation,"SONG, YONGCHENG",BAYLOR COLLEGE OF MEDICINE,TX,"$339,511"
Brain Cancer,2014,NIGMS,5F32GM105227-02,,Requirements for Nfi proteins in Hedgehog signaling and development,"BROWN, ALEXANDER",STANFORD UNIVERSITY,CA,"$53,282"
Brain Cancer,2014,NCI,5R21CA175784-02,,A Wireless Laser Speckle and Fluorescence Imager for In vivo Brain Tumor Imaging,"PATHAK, ARVIND",JOHNS HOPKINS UNIVERSITY,MD,"$170,891"
Brain Cancer,2014,NCI,2UM1CA137443-06,,Adult Brain Tumor Consortium (ABTC),"GROSSMAN, STUART",JOHNS HOPKINS UNIVERSITY,MD,"$1,999,278"
Brain Cancer,2014,NCI,2UM1CA081457-16,,Pediatric Brain Tumor Consortium (PBTC),"BOYETT, JAMES",ST. JUDE CHILDREN'S RESEARCH HOSPITAL,TN,"$2,825,454"
Brain Cancer,2014,NCI,5R44CA138006-07,,"TUMOR RADIOSENSITIZATION USING A NITRIC-OXIDE-NEUTRAL, TUNABLE OXYGEN-BINDING PRO","SHAH, AJIT","OMNIOX, INC.",CA,"$1,000,000"
Brain Cancer,2014,NCI,5R01CA164714-02,,B7H1 Mediated Immunosuppression in Glioma,"PARSA, ANDREW",NORTHWESTERN UNIVERSITY AT CHICAGO,IL,"$310,970"
Brain Cancer,2014,NCI,5P01CA174645-02,6364,Technology for controlling ultrasound targeted drug delivery in brain,"MCDANNOLD, NATHAN","SENIOR VICE PRESIDENT, RESEARCH",,"$350,917"
Brain Cancer,2014,NCI,5P01CA174645-02,6365,Ultrasound-induced blood-brain/tumor barrier disruption in brain metastases,"JOLESZ, FERENC","SENIOR VICE PRESIDENT, RESEARCH",,"$381,897"
Brain Cancer,2014,NCI,5P01CA174645-02,6366,Ultrasound contrast agent enhanced focused ultrasound ablation of brain tumors,"CLEMENT, GREGORY","SENIOR VICE PRESIDENT, RESEARCH",,"$392,692"
Brain Cancer,2014,NCI,5P01CA174645-02,6367,Administrative Core,"JOLESZ, FERENC","SENIOR VICE PRESIDENT, RESEARCH",,"$118,893"
Brain Cancer,2014,NCI,5R33CA174554-02,,High quality CTC isolation using microbubbles for downstream molecular analysis,"LIU, YU-TSUENG",UNIVERSITY OF CALIFORNIA SAN DIEGO,CA,"$308,756"
Brain Cancer,2014,NINDS,5R01NS065195-05,,Genetic Dissection of Glioblastoma:  Cell of Origin,"BACHOO, ROBERT",UT SOUTHWESTERN MEDICAL CENTER,TX,"$338,446"
Brain Cancer,2014,NINDS,5U01NS069997-05,,Neural Stem Cell Based Virotherapy for Malignant Glioma,"LESNIAK, MACIEJ",UNIVERSITY OF CHICAGO,IL,"$1,151,530"
Brain Cancer,2014,NCI,5R44CA136017-05,,SapC-DOPS Nanovesicles for Treating Glioblastoma Multiforme,"XU, KEVIN","BEXION PHARMACEUTICALS, INC.",KY,"$948,501"
Brain Cancer,2014,NIBIB,5R01EB009731-06,,Amide Proton Transfer (APT) MRI of Brain Tumors at 3T,"ZHOU, JINYUAN",JOHNS HOPKINS UNIVERSITY,MD,"$353,460"
Brain Cancer,2014,NINDS,5R01NS083417-02,,Genetic Control of Neural Stem Cell Homeostasis,"LU, BINGWEI",STANFORD UNIVERSITY,CA,"$347,582"
Brain Cancer,2014,NCI,5P01CA118816-07,7518,Improved Management of GBM by Integrating Imaging and Tissue Analysis,"NELSON, SARAH","UNIVERSITY OF CALIFORNIA, SAN FRANCISCO",CA,"$592,568"
Brain Cancer,2014,NCI,5P01CA118816-07,7519,Image Guided Genome-Epigenome Analysis of Tumor Heterogeneity and Evolution,"COSTELLO, JOSEPH","UNIVERSITY OF CALIFORNIA, SAN FRANCISCO",CA,"$160,909"
Brain Cancer,2014,NCI,5P01CA118816-07,7521,Hyperpolarized 13C MRSI Monitoring of Pyruvate Metabolism to Assess Drug Action,"PIEPER, RUSSELL","UNIVERSITY OF CALIFORNIA, SAN FRANCISCO",CA,"$544,039"
Brain Cancer,2014,NCI,5P01CA118816-07,7522,Administrative and Clinical Services Core,"CHANG, SUSAN","UNIVERSITY OF CALIFORNIA, SAN FRANCISCO",CA,"$210,843"
Brain Cancer,2014,NCI,5P01CA118816-07,7528,Biospecimen and Biostatistics Core,"CHANG, SUSAN","UNIVERSITY OF CALIFORNIA, SAN FRANCISCO",CA,"$341,630"
Brain Cancer,2014,NCI,5P01CA118816-07,7530,Imaging Core,"CHANG, SUSAN","UNIVERSITY OF CALIFORNIA, SAN FRANCISCO",CA,"$251,724"
Brain Cancer,2014,NINDS,1R01NS087990-01,,Intranasal Stem-Cell Based Therapy for Glioblastoma,"LESNIAK, MACIEJ",UNIVERSITY OF CHICAGO,IL,"$419,228"
Brain Cancer,2014,NINDS,5R01NS045209-11,,Novel RTK Targeting Strategies in Glioblastoma,"ABOUNADER, ROGER",UNIVERSITY OF VIRGINIA,VA,"$377,597"
Brain Cancer,2014,NINDS,5R01NS079697-02,,Tumor cell and microenvironment changes causing antiangiogenic therapy resistance,"AGHI, MANISH","UNIVERSITY OF CALIFORNIA, SAN FRANCISCO",CA,"$342,347"
Brain Cancer,2014,NCI,5R01CA172455-02,,New 3D tumor models to rapidly test drugs for brain cancer therapy,"ZHANG, MIQIN",UNIVERSITY OF WASHINGTON,WA,"$260,060"
Brain Cancer,2014,NCI,5K07CA178100-02,,A Prospective Study of Social Competence in Pediatric Brain Tumor Survivors,"HOCKING, MATTHEW",CHILDREN'S HOSP OF PHILADELPHIA,PA,"$130,663"
Brain Cancer,2014,NINDS,5K08NS085333-02,,Studying a novel regulator of GBM tumorigeneis: the role of CK2alpha in maintaini,"LI, GORDON",STANFORD UNIVERSITY,CA,"$179,664"
Brain Cancer,2014,RMAP,5U19CA179563-02,7604,Mechanisms of exRNA Trafficking,"BREAKEFIELD, XANDRA",MASSACHUSETTS GENERAL HOSPITAL,,"$397,388"
Brain Cancer,2014,RMAP,5U19CA179563-02,7605,Transfer of microRNA regulators from glioblastoma to brain microenvironment,"BREAKEFIELD, XANDRA",MASSACHUSETTS GENERAL HOSPITAL,,"$399,348"
Brain Cancer,2014,RMAP,5U19CA179563-02,7609,Mouse models of glioma to study functional exRNA transfer to the microenvironmen,"BREAKEFIELD, XANDRA",MASSACHUSETTS GENERAL HOSPITAL,,"$405,707"
Brain Cancer,2014,RMAP,5U19CA179563-02,7612,Intravital Microscopy Core,"BREAKEFIELD, XANDRA",MASSACHUSETTS GENERAL HOSPITAL,,"$401,761"
Brain Cancer,2014,NINDS,5R01NS082745-02,,Molecular Mechanisms Underlying Glioma Invasion of the Human Subventricular Zone,"SANAI, NADER",ST. JOSEPH'S HOSPITAL AND MEDICAL CENTER,AZ,"$363,653"
Brain Cancer,2014,NINDS,5U54CA163155-04,8831,Overall,"BERGERS, GABRIELE","UNIVERSITY OF CALIFORNIA, SAN FRANCISCO",CA,"$427,010"
Brain Cancer,2014,NINDS,5U54CA163155-04,8832,The vascular niche in glioma propagation and resistance to therapy,"BERGERS, GABRIELE","UNIVERSITY OF CALIFORNIA, SAN FRANCISCO",CA,"$123,698"
Brain Cancer,2014,NINDS,5U54CA163155-04,8833,Regulation and function of the vascular niche in glioma recurrance,"WEISS, WILLIAM","UNIVERSITY OF CALIFORNIA, SAN FRANCISCO",CA,"$84,522"
Brain Cancer,2014,NINDS,5U54CA163155-04,8834,Interplay between Intrinsic and extrinsic force and glioma pathogenesis,"WEAVER, VALERIE","UNIVERSITY OF CALIFORNIA, SAN FRANCISCO",CA,"$108,344"
Brain Cancer,2014,NINDS,5U54CA163155-04,8835,Administrative Core,"BISTRUP, ANNETTE","UNIVERSITY OF CALIFORNIA, SAN FRANCISCO",CA,"$62,536"
Brain Cancer,2014,NINDS,5U54CA163155-04,8836,Imaging and Tissue Procurement Core,"PHILLIPS, JOANNA","UNIVERSITY OF CALIFORNIA, SAN FRANCISCO",CA,"$33,777"
Brain Cancer,2014,NINDS,5U54CA163155-04,8837,Quantitative Core,"LAKINS, JOHNATHON","UNIVERSITY OF CALIFORNIA, SAN FRANCISCO",CA,"$14,126"
Brain Cancer,2014,NCI,5R01CA173453-02,,TIC10 anti-tumor effect through regulation of Foxo3a and TRAIL,"EL-DEIRY, WAFIK",PENNSYLVANIA STATE UNIV HERSHEY MED CTR,PA,"$307,182"
Brain Cancer,2014,NINDS,5R01NS082851-02,,Glioma-Astrocyte Vascular Interactions,"SONTHEIMER, HARALD",UNIVERSITY OF ALABAMA AT BIRMINGHAM,AL,"$318,346"
Brain Cancer,2014,NINDS,5R01NS085412-02,,EGFRvIII-targeted Bispecific T cell Engagers for brain tumors,"SAMPSON, JOHN",DUKE UNIVERSITY,NC,"$419,152"
Brain Cancer,2014,NINDS,5R21NS085466-02,,Tracking the in vivo proliferative history of human glioma-derived stem cells,"FRIEDEL, ROLAND",ICAHN SCHOOL OF MEDICINE AT MOUNT SINAI,NY,"$209,756"
Brain Cancer,2014,NINDS,5R01NS086875-02,,Role of Parkinson's disease gene PARK2 in GBM oncogenesis and genomic instability,"CHAN, TIMOTHY",SLOAN-KETTERING INST CAN RESEARCH,NY,"$382,882"
Brain Cancer,2014,NCI,5P30CA093373-12,8787,Administration,"DE VERE WHITE, RALPH",UNIVERSITY OF CALIFORNIA AT DAVIS,CA,"$373,386"
Brain Cancer,2014,NCI,5P01CA085878-11,6707,Defining Therapeutic Paradigms Based on Molecular Profiling of GBM,"ROSS, BRIAN",UNIVERSITY OF MICHIGAN,MI,"$359,201"
Brain Cancer,2014,NCI,5P01CA085878-11,6709,Identification of Genetic Alterations Responsible for Primary GBM Clonal Evoluti,"REHEMTULLA, ALNAWAZ",UNIVERSITY OF MICHIGAN,MI,"$426,766"
Brain Cancer,2014,NCI,5P01CA085878-11,6712,Predictive Imaging Biomarkers for GBM Therapeutic Response and Recurrence,"CHENEVERT, THOMAS",UNIVERSITY OF MICHIGAN,MI,"$330,514"
Brain Cancer,2014,NCI,5P01CA085878-11,6713,Administration Core,"ROSS, BRIAN",UNIVERSITY OF MICHIGAN,MI,"$199,955"
Brain Cancer,2014,NCI,5P01CA085878-11,6715,Imaging Core,"GALBAN, CRAIG",UNIVERSITY OF MICHIGAN,MI,"$318,447"
Brain Cancer,2014,NCI,5P01CA085878-11,6716,Bioinformatics Core,"VERHAAK, ROEL",UNIVERSITY OF MICHIGAN,MI,"$147,529"
Brain Cancer,2014,NCI,5P01CA085878-11,6718,Biostatistics Core,"JOHNSON, TIMOTHY",UNIVERSITY OF MICHIGAN,MI,"$172,766"
Brain Cancer,2014,NCI,1R01CA187202-01,,Cognitive Change after Proton RT vs. Photon or Surgery for Pediatric Brain Tumor,"KAHALLEY, LISA",BAYLOR COLLEGE OF MEDICINE,TX,"$636,476"
Brain Cancer,2014,NINDS,1R21NS088114-01,,Antisecretory factor as a novel therapeutic agent in human glioblastoma,"PERSSON, PER","UNIVERSITY OF CALIFORNIA, SAN FRANCISCO",CA,"$197,292"
Brain Cancer,2014,NCI,1R21CA186976-01,,Enhancing Glioma-Specific Immunity,"JOHNSON, AARON",MAYO CLINIC ROCHESTER,MN,"$172,913"
Brain Cancer,2014,NCI,1R21CA177781-01A1,,New Cancer Therapeutic Target,"SPINELLA, MICHAEL",DARTMOUTH COLLEGE,NH,"$176,175"
Brain Cancer,2014,NCI,1K99CA187594-01,,The molecular mechanism of isocitrate dehydrogenase (lDH) mutations in cancer,"SOHL, CHRISTAL",YALE UNIVERSITY,CT,"$90,000"
Brain Cancer,2014,NINDS,1R01NS088283-01,,Role of EZH2 in Medulloblastoma Tumorigenesis,"VIBHAKAR, RAJEEV",UNIVERSITY OF COLORADO DENVER,CO,"$339,063"
Brain Cancer,2014,NCI,5F30CA174231-02,,Role of IRF-1 dependent chemokines in glioma,"YESTER, JESSIE",VIRGINIA COMMONWEALTH UNIVERSITY,VA,"$40,720"
Brain Cancer,2014,NCI,2P30CA013696-40,6106,Neuro-Oncology Program,"EMERSON, STEPHEN",COLUMBIA UNIVERSITY HEALTH SCIENCES,NY,"$33,320"
Brain Cancer,2014,NCI,5P50CA127001-07,7297,Tropism Enhanced Oncolytic Adenovirus for the Treatment of Brain Tumors,"FUEYO, JUAN",UNIVERSITY OF TX MD ANDERSON CAN CTR,TX,"$283,947"
Brain Cancer,2014,NCI,5P50CA127001-07,7298,Targeting the PI3K Pathway in Malignant Glioma,"YUNG, W K",UNIVERSITY OF TX MD ANDERSON CAN CTR,TX,"$222,389"
Brain Cancer,2014,NCI,5P50CA127001-07,7299,Predictive Markers to Personalize Medicine for Malignant Glioma,"ALDAPE, KENNETH",UNIVERSITY OF TX MD ANDERSON CAN CTR,TX,"$239,920"
Brain Cancer,2014,NCI,5P50CA127001-07,7300,Targeting Malignant Gliomas with a Novel Inhibitor of the STAT3 Pathway,"HEIMBERGER, AMY",UNIVERSITY OF TX MD ANDERSON CAN CTR,TX,"$245,325"
Brain Cancer,2014,NCI,5P50CA127001-07,7301,Administrative Core,"LANG, FREDERICK",UNIVERSITY OF TX MD ANDERSON CAN CTR,TX,"$163,816"
Brain Cancer,2014,NCI,5P50CA127001-07,7302,Pathology and Biorepository Core,"ALDAPE, KENNETH",UNIVERSITY OF TX MD ANDERSON CAN CTR,TX,"$153,317"
Brain Cancer,2014,NCI,5P50CA127001-07,7303,Biostatistics and Bioinformatics Core,"HESS, KENNETH",UNIVERSITY OF TX MD ANDERSON CAN CTR,TX,"$108,518"
Brain Cancer,2014,NCI,5P50CA127001-07,7304,Clinical Core,"GILBERT, MARK",UNIVERSITY OF TX MD ANDERSON CAN CTR,TX,"$116,845"
Brain Cancer,2014,NCI,5P50CA127001-07,7305,Animal Core,"DE GROOT, JOHN",UNIVERSITY OF TX MD ANDERSON CAN CTR,TX,"$259,411"
Brain Cancer,2014,NCI,5P50CA127001-07,7306,Developmental Research Program,"LANG, FREDERICK",UNIVERSITY OF TX MD ANDERSON CAN CTR,TX,"$136,941"
Brain Cancer,2014,NCI,5P50CA127001-07,7307,Career Development Program,"FUEYO, JUAN",UNIVERSITY OF TX MD ANDERSON CAN CTR,TX,"$136,941"
Brain Cancer,2014,NCI,1R21CA177787-01A1,,Phase I Vaccine Study using Brain Tumor Initiating Cells in WHO Grade II Gliomas,"OKADA, HIDEHO","UNIVERSITY OF CALIFORNIA, SAN FRANCISCO",CA,"$182,958"
Brain Cancer,2014,NCI,1R21CA187528-01,,A radiotherapeutic for breast cancer brain metastases,"MAKALE, MILAN",UNIVERSITY OF CALIFORNIA SAN DIEGO,CA,"$202,275"
Brain Cancer,2014,NINDS,1K08NS083732-01A1,,"Overcoming apoptotic resistance in glioblastoma by CP-d/n-ATF5, a novel tumor spe","SIEGELIN, MARKUS",COLUMBIA UNIVERSITY HEALTH SCIENCES,NY,"$187,380"
Brain Cancer,2014,NCI,5F30CA177267-02,,Human cytomegalovirus in the promotion of glioblastoma multiforme pathogenesis,"STRONG, MICHAEL",TULANE UNIVERSITY OF LOUISIANA,LA,"$26,856"
Brain Cancer,2014,NIGMS,2R01GM048259-28,,Mechanisms of alternative splicing of pre-mRNA,"MANLEY, JAMES",COLUMBIA UNIV NEW YORK MORNINGSIDE,NY,"$528,683"
Brain Cancer,2014,NCI,1R01CA181445-01A1,,Microfluidic Device to Profile Chemosensitivity in Glioma Slice Cultures,"FOLCH, ALBERT",UNIVERSITY OF WASHINGTON,WA,"$525,358"
Brain Cancer,2014,NCI,2R01CA139083-06A1,,Recognition and Targeting of CNS Lymphoma by Tumor-Associated Macrophages,"RUBENSTEIN, JAMES","UNIVERSITY OF CALIFORNIA, SAN FRANCISCO",CA,"$384,229"
Brain Cancer,2014,NCI,5P50CA097257-12,7009,BRAIN TUMOR SPORT GRANT,"WIENCKE, JOHN","UNIVERSITY OF CALIFORNIA, SAN FRANCISCO",CA,"$331,716"
Brain Cancer,2014,NCI,5P50CA097257-12,7010,NOVEL BIOMARKERS OF MALIGNANT PROGRESSION IN RECURRENT LOW GRADE GLIOMA,"CHANG, SUSAN","UNIVERSITY OF CALIFORNIA, SAN FRANCISCO",CA,"$325,902"
Brain Cancer,2014,NCI,5P50CA097257-12,7011,NOVEL APPROACAHES FOR IMPROVING PEDIATRIC BRAFV600E GLIOMA PATIENT OUTCOMES,"JAMES, CHARLES","UNIVERSITY OF CALIFORNIA, SAN FRANCISCO",CA,"$240,441"
Brain Cancer,2014,NCI,5P50CA097257-12,7012,OVERCOMING LOCAL AND PERIPHERAL IMMUNE SUPPRESSION IN GLIOMA TO FACILITATE EFFEC,"PARSA, ANDREW","UNIVERSITY OF CALIFORNIA, SAN FRANCISCO",CA,"$325,621"
Brain Cancer,2014,NCI,5P50CA097257-12,7013,BIOSPECIMEN \ PATHOLOGY CORE,"PERRY, ARIE","UNIVERSITY OF CALIFORNIA, SAN FRANCISCO",CA,"$176,570"
Brain Cancer,2014,NCI,5P50CA097257-12,7014,PRE-CLINICAL ANIMAL CORE,"JAMES, CHARLES","UNIVERSITY OF CALIFORNIA, SAN FRANCISCO",CA,"$162,321"
Brain Cancer,2014,NCI,5P50CA097257-12,7015,BIOSTATISTICS AND CLINICAL CORE,"MOLINARO, ANNETTE","UNIVERSITY OF CALIFORNIA, SAN FRANCISCO",CA,"$166,309"
Brain Cancer,2014,NCI,5P50CA097257-12,7016,AMINISTRATIVE CORE,"BERGER, MITCHEL","UNIVERSITY OF CALIFORNIA, SAN FRANCISCO",CA,"$165,799"
Brain Cancer,2014,NCI,5P50CA097257-12,7017,DEVELOPMENTAL RESEARCH PROGAM,"PIEPER, RUSSELL","UNIVERSITY OF CALIFORNIA, SAN FRANCISCO",CA,"$133,659"
Brain Cancer,2014,NCI,5P50CA097257-12,7018,CAREER DEVELOPMENTAL PROGRAM,"PIEPER, RUSSELL","UNIVERSITY OF CALIFORNIA, SAN FRANCISCO",CA,"$133,658"
Brain Cancer,2014,NIDDK,1R01DK098331-01A1,,Prostaglandin biosynthesis: a novel therapeutic target in TSC disorders,"YU, JANE",BRIGHAM AND WOMEN'S HOSPITAL,MA,"$265,313"
Brain Cancer,2014,NIBIB,1R01EB017254-01A1,,In vivo Handheld Coherent Raman Scattering (CRS) Microscopy for Glioma Imaging,"XIE, XIAOLIANG SUNNEY",HARVARD UNIVERSITY,MA,"$391,001"
Brain Cancer,2014,NINDS,1R01NS085364-01A1,,CSF1 signaling in gliomagenesis,"COLLIER, LARA",UNIVERSITY OF WISCONSIN-MADISON,WI,"$329,376"
Brain Cancer,2014,NIGMS,2R01GM073855-09,,Biomimetic Synthesis of Complex Natural Products,"PORCO, JOHN",BOSTON UNIVERSITY (CHARLES RIVER CAMPUS),MA,"$319,215"
Brain Cancer,2014,NINDS,1R01NS085336-01A1,,Pediatric low-grade gliomas: biology and molecular targeting.,"RESNICK, ADAM",CHILDREN'S HOSP OF PHILADELPHIA,PA,"$367,500"
Brain Cancer,2014,NIBIB,1R01EB017748-01A1,,MRI-Photoacoustic-Raman Nanostars for Pre- and Intraoperative Multimodal Imaging,"KIRCHER, MORITZ",SLOAN-KETTERING INST CAN RESEARCH,NY,"$384,056"
Brain Cancer,2014,NCI,1R01CA178499-01A1,,Novel ERbeta agonists for the treatment of gliomas,"VADLAMUDI, RATNA",UNIVERSITY OF TEXAS HLTH SCIENCE CENTER,TX,"$310,213"
Brain Cancer,2014,NCI,2R01CA135491-06,,Chlorotoxin as a Targeting Agent for Cancer Therapies,"OLSON, JAMES",FRED HUTCHINSON CANCER RESEARCH CENTER,WA,"$396,000"
Brain Cancer,2014,NINDS,3R01NS080598-02S1,,Galectin Modulation of Glutamate Receptors and Neuronal Function,"SWANSON, GEOFFREY",NORTHWESTERN UNIVERSITY AT CHICAGO,IL,"$86,440"
Brain Cancer,2014,NCI,1R01CA188500-01,,Novel functions of Pyruvate kinase M2 in DNA double-strand break repair,"XIA, FEN",OHIO STATE UNIVERSITY,OH,"$401,992"
Brain Cancer,2014,NCI,1R15CA186046-01A1,,Mode of Action of the Amaryllidaceae Alkaloid Lycorine-Promising Anticancer Agent,"KORNIENKO, ALEXANDER",TEXAS STATE UNIVERSITY-SAN MARCOS,TX,"$475,519"
Brain Cancer,2014,NCI,1R01CA188404-01,,Autophagy as a microenvironmental regulator of tumorigenesis and resistance,"DEBNATH, JAYANTA","UNIVERSITY OF CALIFORNIA, SAN FRANCISCO",CA,"$423,504"
Brain Cancer,2014,NCI,1K25CA181632-01A1,,Improved Response Assessment in Anti-Angiogenic Treatment of Glioblastoma,"REUTER, MARTIN",MASSACHUSETTS GENERAL HOSPITAL,MA,"$189,837"
Brain Cancer,2014,NCI,1R01CA188516-01,,Cooperating Pathways in Gliomagenesis,"BAKER, SUZANNE",ST. JUDE CHILDREN'S RESEARCH HOSPITAL,TN,"$369,350"
Brain Cancer,2014,NINDS,1R15NS088747-01,,Mechanistic studies of CD44 standard form in medulloblastoma progression and meta,"WU, ERXI",NORTH DAKOTA STATE UNIVERSITY,ND,"$435,000"
Brain Cancer,2014,NCI,1R01CA188652-01,,Exploiting Metabloic Defects in Tumors with Mutant IDH1 and IDH2,"METALLO, CHRISTIAN",UNIVERSITY OF CALIFORNIA SAN DIEGO,CA,"$321,625"
Brain Cancer,2014,NCI,1R03CA178118-01A1,,Identify OTX2-interacting proteins repressing differentiation in medulloblastoma,"BAI, RENYUAN",JOHNS HOPKINS UNIVERSITY,MD,"$81,000"
Brain Cancer,2014,NINDS,1R21NS088775-01,,Contextual Glioblastoma Screening For Efficacious Radiation Sensitizers,"PLACANTONAKIS, DIMITRIS",NEW YORK UNIVERSITY SCHOOL OF MEDICINE,NY,"$254,250"
Brain Cancer,2014,NCI,1R03CA182937-01A1,,Integrative modeling of gene expression into GWAS of glioma,"MICHAUD, DOMINIQUE",BROWN UNIVERSITY,RI,"$81,250"
Brain Cancer,2014,NINDS,1R15NS088899-01,,Molecular Pharmacology of the System xc- Glutamate/Cystine Antiporter,"BRIDGES, RICHARD",UNIVERSITY OF MONTANA,MT,"$415,491"
Brain Cancer,2014,NINDS,1R21NS088965-01,,Therapy for leptomeningeal medulloblastoma by a novel implantable pump,"ERDREICH-EPSTEIN, ANAT",CHILDREN'S HOSPITAL OF LOS ANGELES,CA,"$269,689"
Brain Cancer,2014,NCI,1R01CA178546-01A1,,The mechanisms driving brain oncogenesis by FGFR-TACC gene fusions,"IAVARONE, ANTONIO",COLUMBIA UNIVERSITY HEALTH SCIENCES,NY,"$375,952"
Brain Cancer,2014,NCI,1R44CA183287-01A1,,A NOVEL TARGETED DELIVERY SYSTEM FOR CANCER TREATMENT AND DIAGNOSIS,"MURASKI, JOHN","ENDURX PHARMACEUTICALS, INC.",NV,"$222,359"
Brain Cancer,2014,NCI,5F30CA180411-02,,Enhancing dendritic cell migration to drive potent anti-tumor immune responses,"BATICH, KRISTEN",DUKE UNIVERSITY,NC,"$47,676"
Brain Cancer,2014,NINDS,1F31NS089106-01,,The Role of Phosphor-RPS6 and Translational Regulation in Glioma,"HORNSTEIN, NICHOLAS",COLUMBIA UNIVERSITY HEALTH SCIENCES,NY,"$47,676"
Brain Cancer,2014,NCI,1F32CA189647-01,,"Stem Cell Phenotype, GLUT3 expression, and Metabolic Stress Resistance in Gliobla","HUBERT, CHRISTOPHER",CLEVELAND CLINIC LERNER COM-CWRU,OH,"$51,530"
Brain Cancer,2014,NINDS,1F32NS089203-01,,Cellular and molecular mechanisms regulating glial growth control and survival,"COUTINHO-BUDD, JAEDA",UNIV OF MASSACHUSETTS MED SCH WORCESTER,MA,"$53,282"
Brain Cancer,2014,NCI,1F30CA183430-01A1,,OCT to Distinguish b/t Tumor & Non-Tumor Tissue in Infiltrating Brain Cancer,"KUT, CARMEN",JOHNS HOPKINS UNIVERSITY,MD,"$47,676"
Brain Cancer,2014,FIC,2U19TW008163-06,7107,AP 4. Drug Screening and Pharmacology,"SCHMIDT, ERIC",OREGON HEALTH & SCIENCE UNIVERSITY,OR,"$101,625"
Brain Cancer,2014,NCCAM,2U19TW008163-06,7107,AP 4. Drug Screening and Pharmacology,"SCHMIDT, ERIC",OREGON HEALTH & SCIENCE UNIVERSITY,OR,"$17,588"
Brain Cancer,2014,NCI,2U19TW008163-06,7107,AP 4. Drug Screening and Pharmacology,"SCHMIDT, ERIC",OREGON HEALTH & SCIENCE UNIVERSITY,OR,"$4,221"
Brain Cancer,2014,NCI,1F32CA189741-01,,The role of ATRX and H3.3 mutations in pediatric glioblastoma,"ANASTAS, JAMIE",CHILDREN'S HOSPITAL CORPORATION,MA,"$33,330"
Brain Cancer,2014,NCI,1F30CA183510-01A1,,Targeting epigenetic regulation to disrupt glioma stem cell maintenance.,"MILLER, TYLER",CLEVELAND CLINIC LERNER COM-CWRU,OH,"$47,676"
Brain Cancer,2014,NINDS,1F31NS086367-01A1,,Identifying the Second Hit in MYC-driven Medulloblastoma; a Role for Gfi Proteins,"LEE, CATHERINE",SANFORD-BURNHAM MEDICAL RESEARCH INSTIT,CA,"$31,902"
Brain Cancer,2014,NCI,1R01CA189623-01,,"Human-Enzyme Mediated, Systemic Depletion of Cystine for Cancer Treatment.","GEORGIOU, GEORGE","UNIVERSITY OF TEXAS, AUSTIN",TX,"$580,448"
Brain Cancer,2014,NINDS,1R01NS089272-01,,Energy Stress in Brain Tumor Initiating Stem Cells,"RICH, JEREMY",CLEVELAND CLINIC LERNER COM-CWRU,OH,"$346,719"
Brain Cancer,2014,NCI,4R00CA172695-02,,Noninvasive measurement of oncogenic signaling pathways with 89Zr-transferrin,"EVANS, MICHAEL","UNIVERSITY OF CALIFORNIA, SAN FRANCISCO",CA,"$241,256"
Brain Cancer,2014,NCI,1R01CA171652-01A1,,Instructive Cues in Glioblastoma Hierarchies,"RICH, JEREMY",CLEVELAND CLINIC LERNER COM-CWRU,OH,"$420,976"
Brain Cancer,2014,NCI,1R01CA189524-01,,Novel DGKalpha inhibitors and immunotherapy for GBM and melanoma brain metastasis,"PUROW, BENJAMIN",UNIVERSITY OF VIRGINIA,VA,"$493,581"
Brain Cancer,2014,NCI,1U24CA180924-01A1,,Tools to Analyze Morphology and Spatially Mapped Molecular Data,"SALTZ, JOEL",STATE UNIVERSITY NEW YORK STONY BROOK,NY,"$671,891"
Brain Cancer,2014,NCI,3P30CA023108-35S3,5667,IMMUNOLOGY AND CANCER IMMUNOTHERAPY RESEARCH PROGRAM,"NOELLE, RANDOLPH",DARTMOUTH COLLEGE,NH,"$124,350"
Brain Cancer,2014,NINDS,4R00NS073735-03,,Local Proliferation of Glia and their Interaction with Blood Vessels,"GE, WOO-PING",UT SOUTHWESTERN MEDICAL CENTER,TX,"$249,000"
Brain Cancer,2014,NCI,1R01CA190121-01,,(PQ #4) Single cell barcoding for studies of study clonal evolution in glioblasto,"VERHAAK, ROELAND",UNIVERSITY OF TX MD ANDERSON CAN CTR,TX,"$332,000"
Brain Cancer,2014,NCI,3R01CA047135-24S1,,Merging Marine-Derived Cytotoxic Natural Products With Experimental Therapeutics,"CREWS, PHIL",UNIVERSITY OF CALIFORNIA SANTA CRUZ,CA,"$82,796"
Brain Cancer,2014,NINDS,1R01NS089815-01,,Targeting the Novel PI5P4K Pathway to Induce Glioblastoma Senescence,"SASAKI, ATSUO",UNIVERSITY OF CINCINNATI,OH,"$330,679"
Brain Cancer,2014,NINDS,1R01NS089868-01,,"MYCN, mTOR and translation control in medulloblastoma","WEISS, WILLIAM","UNIVERSITY OF CALIFORNIA, SAN FRANCISCO",CA,"$632,206"
Brain Cancer,2014,NCI,1R01CA190997-01,,The role of CHD5 in chromatin-mediated regulation of neural stem cells and glioma,"MILLS, ALEA",COLD SPRING HARBOR LABORATORY,NY,"$634,545"
Brain Cancer,2014,NINDS,1K99NS089780-01,,Identification of transcription factors that regulate astrocyte differentiation,"ZHANG, YE",STANFORD UNIVERSITY,CA,"$90,000"
Brain Cancer,2014,NINDS,1R03NS090151-01,,Glioma induced alterations in neuronal transcription and translation,"CANOLL, PETER",COLUMBIA UNIVERSITY HEALTH SCIENCES,NY,"$80,000"
Brain Cancer,2014,NCI,1P50CA190991-01,5450,"Biostatistics, Informatics, and Data Coordination","HERNDON, JAMES",DUKE UNIVERSITY,NC,"$225,590"
Brain Cancer,2014,NCI,1P50CA190991-01,5451,Clinical Trial Operations,"DESJARDINS, ANNICK",DUKE UNIVERSITY,NC,"$149,149"
Brain Cancer,2014,NCI,1P50CA190991-01,5452,"Biospecimen, Pathology, and Immune Monitoring","MCLENDON, ROGER",DUKE UNIVERSITY,NC,"$209,775"
Brain Cancer,2014,NCI,1P50CA190991-01,5453,Administrative Core,"SAMPSON, JOHN",DUKE UNIVERSITY,NC,"$210,341"
