Category,FY,Funding IC,Project Number,Sub Project #,Project Title,PI Name,Org Name,State / Country,Amount
Brain Cancer,2013,NCI,5R44CA112966-04,,An Integrated CT-based Image-Guided Neurosurgical System,"LI, SENHU","XORAN TECHNOLOGIES, INC.",MI,"$901,469"
Brain Cancer,2013,NCI,5U01CA160882-02,,Non-neoplastic cell types dictate gliomagenesis and,"HAMBARDZUMYAN, DOLARES",CLEVELAND CLINIC LERNER COM-CWRU,OH,"$515,843"
Brain Cancer,2013,NIDDK,5R01DK096556-02,,Roles of autophagy-mediated pathways in the pathogenesis and treatment of TSC,"HENSKE, ELIZABETH",BRIGHAM AND WOMEN'S HOSPITAL,MA,"$352,002"
Brain Cancer,2013,NCI,5R03CA168400-02,,Identifying underlying mechanisms of intracellular changes in response to caregiv,"FLINT, MELANIE",UNIVERSITY OF PITTSBURGH AT PITTSBURGH,PA,"$71,793"
Brain Cancer,2013,NIGMS,5P20GM103650-02,5248,Project 5,"ZHU, XIAOSHAN",UNIVERSITY OF NEVADA RENO,NV,"$273,025"
Brain Cancer,2013,NINDS,5R01NS073610-02,,Molecular Motors and Glioma Dispersion,"ROSENFELD, STEVEN",CLEVELAND CLINIC LERNER COM-CWRU,OH,"$334,407"
Brain Cancer,2013,NCI,5F32CA162919-02,,Identification of the protein homeostasis network that controls the quality contr,"LIVINGSTON, CHRISTINE",STANFORD UNIVERSITY,CA,"$53,942"
Brain Cancer,2013,NCI,5U54CA151652-04,8813,Carbon Nanotube-based Microbeam Radiation Therapy for Human Brain Cancer,"ZHOU, OTTO",UNIV OF NORTH CAROLINA CHAPEL HILL,NC,"$145,310"
Brain Cancer,2013,NINDS,5R01NS073132-04,,The effects of the unfolded protein response on medulloblastoma,"LIN, WENSHENG",UNIVERSITY OF MINNESOTA,MN,"$320,863"
Brain Cancer,2013,NCI,5R01CA111754-09,,Elucidating the Function of the NF1 Tumor Suppressor and its Effector Pathways in,"CICHOWSKI, KAREN",BRIGHAM AND WOMEN'S HOSPITAL,MA,"$267,627"
Brain Cancer,2013,NCI,5P20CA151129-03,,CONTEMPORARY THERAPEUTICS FOR ANAPLASTIC GLIOMAS,"GILLESPIE, G.",UNIVERSITY OF ALABAMA AT BIRMINGHAM,AL,"$700,000"
Brain Cancer,2013,NINDS,5U01NS069997-04,,Neural Stem Cell Based Virotherapy for Malignant Glioma,"LESNIAK, MACIEJ",UNIVERSITY OF CHICAGO,IL,"$1,138,522"
Brain Cancer,2013,NINDS,5R01NS073831-04,,Role of mTORC2 in GBM - development of a novel therapeutic mTOR kinase inhibitor,"MISCHEL, PAUL",LUDWIG INSTITUTE  FOR CANCER RES  LTD,CA,"$337,006"
Brain Cancer,2013,NCI,5P50CA093459-09,6717,Effects of a Novel Phospho-STAT2 inhibitor for Treatment of Stage IV Melanoma,"HEIMBERGER, AMY",UT MD ANDERSON CANCER CTR,TX,"$277,339"
Brain Cancer,2013,NCI,5P50CA140388-05,8762,GLIPR1-ATM Protein Therapy for Prostate Cancer,"THOMPSON, TIMOTHY",UT MD ANDERSON CANCER CTR,TX,"$235,187"
Brain Cancer,2013,NCI,5R03CA162970-02,,Neurocognitive and Family Functioning at End of Therapy in Pediatric Brain Tumor,"HOCKING, MATTHEW",CHILDREN'S HOSP OF PHILADELPHIA,PA,"$78,725"
Brain Cancer,2013,NIBIB,5R01EB012099-05,,Dual-Receptor Targeted Nanoparticles for Photodynamic Therapy of Brain Cancer,"BROOME, ANN-MARIE",MEDICAL UNIVERSITY OF SOUTH CAROLINA,SC,"$244,324"
Brain Cancer,2013,NIGMS,5R01GM088266-04,,RSK-2 regulates integrin-mediated adhesion and migration,"RAMOS, JOE",UNIVERSITY OF HAWAII AT MANOA,HI,"$349,048"
Brain Cancer,2013,NINDS,5R01NS078402-02,,Deciphering mechanisms of perivascular tumor cell invasion in glioblastoma,"MCCARTY, JOSEPH",UT MD ANDERSON CANCER CTR,TX,"$370,992"
Brain Cancer,2013,NCI,1R01CA177476-01,,Brain tumors with regulatory T-cells treated with EGFRvIII-specific T-cells,"SAMPSON, JOHN",DUKE UNIVERSITY,NC,"$374,823"
Brain Cancer,2013,NCI,5F31CA171566-02,,Molecular mediators of tumor suppression for the PTPRD phosphatase in gliomas,"ORTIZ, BERENICE",SLOAN-KETTERING INST CAN RES,NY,"$42,232"
Brain Cancer,2013,NCI,5U54CA151819-04,8878,"Organ-specific, Blood Protein Biomarkers for an Informative Diagnosis of Brain an","HOOD, LEROY",INSTITUTE FOR SYSTEMS BIOLOGY,WA,"$649,409"
Brain Cancer,2013,NCI,5U54CA151819-04,8881,The Heterogeneity of Glioblastoma Multiforme and its Applications towards the Dev,"MISCHEL, PAUL",UNIVERSITY OF CALIFORNIA LOS ANGELES,CA,"$339,145"
Brain Cancer,2013,NCI,5U54CA151819-04,8883,Administrative Core,"HEATH, JAMES",CALIFORNIA INSTITUTE OF TECHNOLOGY,CA,"$104,293"
Brain Cancer,2013,NCI,5U54CA151880-04,5057,Nanostructured Matrices for Cancer Cell Biology,"MRKSICH, MILAN",NORTHWESTERN UNIVERSITY,IL,"$250,020"
Brain Cancer,2013,NCI,5U54CA151880-04,5059,Preclinical Validation of Polyvalent siRNA Gold Nanoparticle Conjugates as anti-G,"STEGH, ALEXANDER",NORTHWESTERN UNIVERSITY,IL,"$160,627"
Brain Cancer,2013,NCI,5T32CA151022-04,,Training Program in Translational Brain Tumor Research,"PIEPER, RUSSELL",UNIVERSITY OF CALIFORNIA SAN FRANCISCO,CA,"$205,179"
Brain Cancer,2013,NIDA,5R01DA014486-12,,Cannabinoid Signaling System in Microglial Cell,"STELLA, NEPHI",UNIVERSITY OF WASHINGTON,WA,"$290,123"
Brain Cancer,2013,NCI,5U01CA141556-05,,Understanding and Eliminating Oncogenic EGFR Signaling in Malignant Glioma,"CHAREST, ALAIN",TUFTS MEDICAL CENTER,MA,"$619,594"
Brain Cancer,2013,NCI,5K08CA163765-02,,The effects of dexamethasone on tumor and microglial cells in glioma,"JONES, TERREIA",UNIVERSITY OF TENNESSEE HEALTH SCI CTR,TN,"$142,750"
Brain Cancer,2013,NCI,5R21CA167354-02,,"Cell invasion, motility, and proliferation level estimate maps in gliomas","ELLINGSON, BENJAMIN",UNIVERSITY OF CALIFORNIA LOS ANGELES,CA,"$157,427"
Brain Cancer,2013,NCI,5U01CA141549-05,,Targeting Stoma-Tumor Co-Dependency for Glioma Therapy,"GUTMANN, DAVID",WASHINGTON UNIVERSITY,MO,"$709,767"
Brain Cancer,2013,NCI,5R00CA158066-04,,Dissecting the Role of Src Family Kinases in Breast Cancer Brain Metastasis,"ZHANG, SIYUAN",UNIVERSITY OF NOTRE DAME,IN,"$226,314"
Brain Cancer,2013,NCI,5R01CA163737-02,,Investigating Cancer Stem Cells - Niche Interactions in Brain Tumor,"FAN, XING",UNIVERSITY OF MICHIGAN,MI,"$211,947"
Brain Cancer,2013,NCI,5R43CA165452-02,,Targeting a new GPCR to treat glioblastomas,"HORNE, ERIC","STELLA THERAPEUTICS, INC.",WA,"$107,283"
Brain Cancer,2013,NCI,1R33CA177462-01,,Meso-plex miRNA and protein profiling for cancer diagnostics using chip-integrate,"BAILEY, RYAN",UNIVERSITY OF ILLINOIS URBANA-CHAMPAIGN,IL,"$347,739"
Brain Cancer,2013,NCI,5R01CA129553-06,,Monitoring Early Treatment Response of Human Primary Brain Tumors by Sodium MRI,"THULBORN, KEITH",UNIVERSITY OF ILLINOIS,IL,"$148,250"
Brain Cancer,2013,NCI,5R01CA151933-04,,The Meningioma Consortium: Genome-Wide Association Study,"CLAUS, ELIZABETH",YALE UNIVERSITY,CT,"$597,958"
Brain Cancer,2013,NCI,5R01CA133257-05,,Exercise-mediated protection against brain metastases,"TOBOREK, MICHAL",UNIVERSITY OF MIAMI SCHOOL OF MEDICINE,FL,"$51,839"
Brain Cancer,2013,NCI,5R00CA151412-04,,NK cell-myeloid cell crosstalk in patients with cancer,"CRANE, COURTNEY",SEATTLE CHILDREN'S HOSPITAL,WA,"$232,677"
Brain Cancer,2013,NINDS,5U01NS059821-04,,Translational Development of Replication-Competent Retrovirus Vectors,"KASAHARA, NORIYUKI",UNIVERSITY OF CALIFORNIA LOS ANGELES,CA,$1
Brain Cancer,2013,NINDS,5R01NS080944-02,,Molecular Mechanisms of IDH1-mediated Gliomagenesis,"MELLINGHOFF, INGO",SLOAN-KETTERING INST CAN RES,NY,"$378,936"
Brain Cancer,2013,NCI,5R01CA155521-02,,Elucidate and Modulate TGF-b Signaling in NK Cells for Glioma Treatment,"YU, JIANHUA",OHIO STATE UNIVERSITY,OH,"$297,451"
Brain Cancer,2013,NCI,5R01CA164295-02,,Exploration of Activity of RAD001 in vivo in Vestibular Schwannomas and Meningiom,"KARAJANNIS, MATTHIAS",NEW YORK UNIVERSITY SCHOOL OF MEDICINE,NY,"$269,641"
Brain Cancer,2013,NCI,5R01CA174452-02,,Validation of PROMIS Measures in Children with Brain Tumors,"LAI, JIN-SHEI",NORTHWESTERN UNIVERSITY AT CHICAGO,IL,"$285,545"
Brain Cancer,2013,NIBIB,5R21EB013795-02,,Voxelwise analysis of imaging response to therapy in neuro-oncology,"SCHWARTZMAN, ARMIN",DANA-FARBER CANCER INST,MA,"$206,281"
Brain Cancer,2013,NIBIB,5K01EB016071-02,,A Microfluidic System for Image-Guided RNA-Seq of Single Cells in Glioblastoma,"SIMS, PETER",COLUMBIA UNIVERSITY HEALTH SCIENCES,NY,"$172,750"
Brain Cancer,2013,NCI,5F31CA165479-02,,Cellular plasticity and survival mechanisms in medulloblastoma stem cells,"YOO, RONNIE",HARVARD UNIVERSITY (MEDICAL SCHOOL),MA,"$29,531"
Brain Cancer,2013,NCI,5F30CA165736-02,,"Role of NIAM, A Putative Cancer Gene, in Chromosomal Instability and Glioblastoma","FRANCIS-REED, SARA",UNIVERSITY OF IOWA,IA,"$28,158"
Brain Cancer,2013,NCI,5U01CA140230-05,,Quantitative Biomarker Imaging for Early Therapy Response Assessment in Cancer,"MOUNTZ, JAMES",UNIVERSITY OF PITTSBURGH AT PITTSBURGH,PA,"$104,190"
Brain Cancer,2013,NCI,5F32CA165881-02,,Glioblastoma PDT Design: Nanoagent Uptake and Tumor Oxygenation based dosimetry,"MALLIDI, SRIVALLEESHA",MASSACHUSETTS GENERAL HOSPITAL,MA,"$53,942"
Brain Cancer,2013,NCI,5R01CA172048-02,,In vivo detection of involvement of endogenous BM progenitor cells in glioma,"ARBAB, ALI",HENRY FORD HEALTH SYSTEM,MI,"$285,749"
Brain Cancer,2013,NINDS,5R01NS080963-02,,Chemical Probes Targeting Gliomas with IDH Mutation,"SONG, YONGCHENG",BAYLOR COLLEGE OF MEDICINE,TX,"$330,928"
Brain Cancer,2013,NINDS,5R01NS081117-02,,Heparan sulfate proteoglycans as critical regulators of brain cancer malignancy,"PHILLIPS, JOANNA",UNIVERSITY OF CALIFORNIA SAN FRANCISCO,CA,"$331,770"
Brain Cancer,2013,NINDS,5R01NS077921-02,,Influence of Anti-Angiogenic Therapy on Drug Delivery to Brain Tumors,"ELMQUIST, WILLIAM",UNIVERSITY OF MINNESOTA,MN,"$476,586"
Brain Cancer,2013,NIBIB,5R01EB015870-02,,MINIR-II: Minimally Invasive Neurosurgical Intracranial Robot,"DESAI, JAYDEV",UNIVERSITY OF MARYLAND COLLEGE PK CAMPUS,MD,"$448,278"
Brain Cancer,2013,NCI,1R01CA178200-01,,Impact of 18F-FDOPA-PET on neurosurgery and radiotherapy of glioma patients,"LAACK, NADIA",MAYO CLINIC ROCHESTER,MN,"$336,555"
Brain Cancer,2013,NINDS,1R01NS083767-01,,Targeting MELK-mediated EZH2 signaling in glioma stem cells,"NAKANO, ICHIRO",OHIO STATE UNIVERSITY,OH,"$268,082"
Brain Cancer,2013,NCI,5P30CA046592-25,6476,Xenograft,"WICHA, MAX",UNIVERSITY OF MICHIGAN,MI,"$58,820"
Brain Cancer,2013,NINDS,1R01NS083629-01,,Novel adhesion mechanisms in glioblastoma stem cells,"LATHIA, JUSTIN",CLEVELAND CLINIC LERNER COM-CWRU,OH,"$360,361"
Brain Cancer,2013,NCI,1R01CA177796-01,,TWEAK-Fn14 HTS compound screening,"TRAN, NHAN",TRANSLATIONAL GENOMICS RESEARCH INST,AZ,"$421,457"
Brain Cancer,2013,NCI,1K07CA178100-01,,A Prospective Study of Social Competence in Pediatric Brain Tumor Survivors,"HOCKING, MATTHEW",CHILDREN'S HOSP OF PHILADELPHIA,PA,"$117,201"
Brain Cancer,2013,NCI,5U54CA143798-05,5200,Developing Mathmatical Framework to Uncover the Sequence of Genetic Events During,"MICHOR, FRANZISKA",SLOAN-KETTERING INST CAN RES,NY,"$621,050"
Brain Cancer,2013,NCI,5U54CA143798-05,5199,Education & Training,"MICHOR, FRANZISKA",SLOAN-KETTERING INST CAN RES,NY,"$48,187"
Brain Cancer,2013,NCI,5U54CA143798-05,5201,The Cell-Of-Origin of Human Cancers,"HOLLAND, ERIC",SLOAN-KETTERING INST CAN RES,NY,"$403,421"
Brain Cancer,2013,NCI,5U54CA143798-05,5202,Novel Tools to Predict and Prevent the Emergence of Resistance Against Targeted,"MICHOR, FRANZISKA",SLOAN-KETTERING INST CAN RES,NY,"$440,774"
Brain Cancer,2013,NCI,5U54CA143798-05,5203,Single Cell Measurement Core Facility,"ALTAN-BONNET, GREGOIRE",SLOAN-KETTERING INST CAN RES,NY,"$317,975"
Brain Cancer,2013,NCI,5U54CA143798-05,5204,Outreach and Dissemination,"MICHOR, FRANZISKA",SLOAN-KETTERING INST CAN RES,NY,"$34,721"
Brain Cancer,2013,NCI,5U54CA143798-05,6147,Center Organization and Infrastructure Unit,"MICHOR, FRANZISKA",DANA-FARBER CANCER INST,MA,"$137,642"
Brain Cancer,2013,NCI,5U54CA143798-05,6148,Pilot Projects/Trans-Network,"MICHOR, FRANZISKA",DANA-FARBER CANCER INST,MA,"$123,682"
Brain Cancer,2013,NCI,5P01CA042045-24,5363,Cellular Proliferation is a Robust Pharmacodynamic Endpoint,"SPENCE, ALEXANDER",UNIVERSITY OF WASHINGTON,WA,"$140,604"
Brain Cancer,2013,NCI,5P50CA108961-08,5339,Overcoming Therapy Resistance in Glioblastoma,"SARKARIA, JANN",MAYO CLINIC ROCHESTER,MN,"$244,389"
Brain Cancer,2013,NCI,5P50CA108961-08,5340,Optimizing Measles Virotherapy in the Treatment of Gliomas,"GALANIS, EVANTHIA",MAYO CLINIC ROCHESTER,MN,"$211,214"
Brain Cancer,2013,NCI,5P50CA108961-08,5341,Identification and Targeting of Mediators of Glioma Invasion,"LOFTUS, JOSEPH",MAYO CLINIC ROCHESTER,MN,"$192,174"
Brain Cancer,2013,NCI,5P50CA108961-08,5342,Combining Anti-invasive and Anti-angiogenic Therapies for the Treatment of,"ANASTASIADIS, PANAGIOTIS",MAYO CLINIC ROCHESTER,MN,"$315,362"
Brain Cancer,2013,NCI,5P50CA108961-08,5343,Administration,"O'NEILL, BRIAN",MAYO CLINIC ROCHESTER,MN,"$52,365"
Brain Cancer,2013,NCI,5P50CA108961-08,5344,Biostatistics Core,"BALLMAN, KARLA",MAYO CLINIC ROCHESTER,MN,"$215,314"
Brain Cancer,2013,NCI,5P50CA108961-08,5345,Pathology and Tissue Procurement,"GIANNINI, CATERINA",MAYO CLINIC ROCHESTER,MN,"$128,194"
Brain Cancer,2013,NCI,5P50CA108961-08,5346,Animal Core,"SARKARIA, JANN",MAYO CLINIC ROCHESTER,MN,"$403,110"
Brain Cancer,2013,NCI,5P50CA108961-08,5347,Clinical Research Core,"BUCKNER, JAN",MAYO CLINIC ROCHESTER,MN,"$148,331"
Brain Cancer,2013,NCI,5P50CA108961-08,5348,Developmental Research Program,"O'NEILL, BRIAN",MAYO CLINIC ROCHESTER,MN,"$86,887"
Brain Cancer,2013,NCI,5P50CA108961-08,5349,Career Development Program,"O'NEILL, BRIAN",MAYO CLINIC ROCHESTER,MN,"$87,067"
Brain Cancer,2013,NCI,1K99CA178190-01,,Apoptotic Proteins as Molecular Modulators of Stem Cell Fate,"GAMA, VIVIAN",UNIV OF NORTH CAROLINA CHAPEL HILL,NC,"$110,956"
Brain Cancer,2013,NCI,5P30CA082103-15,6388,Neurologic Oncology,"MCCORMICK, FRANK",UNIVERSITY OF CALIFORNIA SAN FRANCISCO,CA,"$96,543"
Brain Cancer,2013,NCI,5P30CA082103-15,6393,Pediatric Malignancies,"MCCORMICK, FRANK",UNIVERSITY OF CALIFORNIA SAN FRANCISCO,CA,"$96,543"
Brain Cancer,2013,NCI,7U54CA163167-03,5273,The Proneural Perivascular Niche and Therapeutic Response,"HOLLAND, ERIC",FRED HUTCHINSON CAN RES CTR,WA,"$240,436"
Brain Cancer,2013,NCI,7U54CA163167-03,5274,Brain Metastasis Microenvironment and Mechanisms,"MASSAGUE, JOAN",FRED HUTCHINSON CAN RES CTR,WA,"$240,435"
Brain Cancer,2013,NCI,7U54CA163167-03,5275,Endothelial-Derived Angiocrine Factors in Progression of Brain Tumors,"RAFI, SHAHIN",FRED HUTCHINSON CAN RES CTR,WA,"$406,336"
Brain Cancer,2013,NCI,7U54CA163167-03,5276,Administrative Core,"HOLLAND, ERIC",FRED HUTCHINSON CAN RES CTR,WA,"$43,869"
Brain Cancer,2013,NCI,7U54CA163167-03,5277,Pathology Core,"HUSE, JASON",FRED HUTCHINSON CAN RES CTR,WA,"$17,999"
Brain Cancer,2013,NCI,1K22CA178269-01,,Quantify treatment response in IDH1 mutant glioma patients with metabolic MRI,"ANDRONESI, OVIDIU",MASSACHUSETTS GENERAL HOSPITAL,MA,"$200,552"
Brain Cancer,2013,NCI,5P01CA159992-03,5313,MRI Methods for Guiding Focused Ultrasound in the Brain,"PAULY, KIM",STANFORD UNIVERSITY,CA,"$186,903"
Brain Cancer,2013,NINDS,1R21NS084084-01,,Novel small-molecule inhibitors of Wee1 kinase for medulloblastoma treatment,"REIGAN, PHILIP",UNIVERSITY OF COLORADO DENVER,CO,"$231,750"
Brain Cancer,2013,NCI,1R21CA178365-01,,Apoptosis driven by elastase inhibitor: new approach to detection and study.,"DIDENKO, VLADIMIR",BAYLOR COLLEGE OF MEDICINE,TX,"$191,944"
Brain Cancer,2013,NINDS,1R01NS083937-01,,High throughput screen for selective inhibitors of cyclophilin B,"BRAM, RICHARD",MAYO CLINIC ROCHESTER,MN,"$400,363"
Brain Cancer,2013,NINDS,1R21NS084357-01,,"Highly specific, temporally controllable mouse genetic tools for investigating in","ZONG, HUI",UNIVERSITY OF VIRGINIA,VA,"$197,500"
Brain Cancer,2013,NCI,5F31CA167863-02,,The Roles of Microglia and Macrophage Populations in the Glioma Microenvironment,"BOWMAN, ROBERT",SLOAN-KETTERING INST CAN RES,NY,"$42,232"
Brain Cancer,2013,NINDS,1R21NS084275-01,,Inhibiting glioma invasion using targeted nanoparticles,"LOWENSTEIN, PEDRO",UNIVERSITY OF MICHIGAN,MI,"$191,514"
Brain Cancer,2013,NCI,1R15CA173617-01A1,,Smart Intraoperative Guidance for Pediatric Brain Tumor Surgery,"LIN, WEI-CHIANG",FLORIDA INTERNATIONAL UNIVERSITY,FL,"$355,812"
Brain Cancer,2013,NINDS,1R15NS084293-01,,Adaptive EdU Therapy for Brain Tumors,"LAYWELL, ERIC",FLORIDA STATE UNIVERSITY,FL,"$430,586"
Brain Cancer,2013,NCI,2R01CA127612-06,,MR Metabolic Markers for Evaluation of Patients with Recurrent Glioma,"NELSON, SARAH",UNIVERSITY OF CALIFORNIA SAN FRANCISCO,CA,"$344,986"
Brain Cancer,2013,NCI,1R01CA172455-01A1,,New 3D tumor models to rapidly test drugs for brain cancer therapy,"ZHANG, MIQIN",UNIVERSITY OF WASHINGTON,WA,"$266,843"
Brain Cancer,2013,NINDS,1R01NS086875-01A1,,Role of Parkinson's disease gene PARK2 in GBM oncogenesis and genomic instability,"CHAN, TIMOTHY",SLOAN-KETTERING INST CAN RES,NY,"$386,750"
Brain Cancer,2013,NCI,1R01CA172651-01A1,,Regulation of a DNA damage response network in glioblastoma,"MINN, ANDY",UNIVERSITY OF PENNSYLVANIA,PA,"$343,754"
Brain Cancer,2013,NCI,2R01CA120439-06A1,,Small Molecule Activators of Procaspases as Anti-Cancer Agents,"HERGENROTHER, PAUL",UNIVERSITY OF ILLINOIS URBANA-CHAMPAIGN,IL,"$451,618"
Brain Cancer,2013,NCI,1R01CA172986-01A1,,Modeling and microsystems approach to glioma invasion,"ODDE, DAVID",UNIVERSITY OF MINNESOTA,MN,"$567,197"
Brain Cancer,2013,NCI,1R01CA172723-01A1,,Predicting deficits in social competence for pediatric brain tumor survivors,"VANNATTA, KATHRYN",RESEARCH INST NATIONWIDE CHILDREN'S HOSP,OH,"$623,670"
Brain Cancer,2013,NCI,2R44CA136017-04,,SapC-DOPS Nanovesicles for Treating Glioblastoma Multiforme,"XU, KEVIN","BEXION PHARMACEUTICALS, INC.",KY,"$960,270"
Brain Cancer,2013,NCI,1K24CA172123-01A1,,A research and training program for junior clinicians in treating metastatic mela,"KLUGER, HARRIET",YALE UNIVERSITY,CT,"$156,084"
Brain Cancer,2013,NCI,1R21CA170284-01A1,,Advanced MRI methods for detecting pseudo-progression of glioblastomas,"POPTANI, HARISH",UNIVERSITY OF PENNSYLVANIA,PA,"$345,136"
Brain Cancer,2013,RMAP,1UH2TR000931-01,,exRNA Biomarkers for Human Glioma,"CARTER, BOB",UNIVERSITY OF CALIFORNIA,CA,"$499,999"
Brain Cancer,2013,NCI,1R03CA173798-01A1,,"Methylmercury exposure, mercury metabolism genotypes, and risk of adult glioma","EGAN, KATHLEEN",H. LEE MOFFITT CANCER CTR & RES INST,FL,"$84,250"
Brain Cancer,2013,NCI,1R01CA161953-01A1,,Multifunctional nanoparticles to improve treatment of human glioblastoma,"ZHANG, MIQIN",UNIVERSITY OF WASHINGTON,WA,"$309,247"
Brain Cancer,2013,NINDS,2R01NS055089-06A1,,Effectively Targeting Notch in Hypoxic Brain Tumor Cells,"EBERHART, CHARLES",JOHNS HOPKINS UNIVERSITY,MD,"$364,276"
Brain Cancer,2013,NCI,1R01CA169368-01A1,,Therapeutic Exploitation of Mutant BRAF for Astrocytoma,"HOUGHTON, PETER",RESEARCH INST NATIONWIDE CHILDREN'S HOSP,OH,"$318,997"
Brain Cancer,2013,NCI,5F32CA159709-02,,PTPMT1 Regulates Cancer Cell Bioenergetics by Suppressing Oxidative Metabolism,"LANNING, NATHAN",VAN ANDEL RESEARCH INSTITUTE,MI,"$52,190"
Brain Cancer,2013,NCI,4R00CA154889-03,,Mechanisms of subtelomere recombination in telomerase deficient tumors,"MORRISH, TAMMY",UNIVERSITY OF TOLEDO HEALTH SCI CAMPUS,OH,"$234,060"
Brain Cancer,2013,NCI,1P50CA165962-01A1,7254,Targeting the Vasular System,"BATCHELOR, TRACY",MASSACHUSETTS GENERAL HOSPITAL,MA,"$276,199"
Brain Cancer,2013,NCI,1P50CA165962-01A1,7255,Targeting the PI3K Signaling Axis,"ROBERTS, THOMAS",DANA-FARBER CANCER INST,MA,"$404,673"
Brain Cancer,2013,NCI,1P50CA165962-01A1,7257,Targeting the IDH Pathway,"KAELIN, WILLIAM",DANA-FARBER CANCER INST,MA,"$326,224"
Brain Cancer,2013,NCI,1P50CA165962-01A1,7258,Targeting the OLIG2 Transcription Factor,"STILES, CHARLES",DANA-FARBER CANCER INST,MA,"$288,558"
Brain Cancer,2013,NCI,1P50CA165962-01A1,7259,Pathology Core,"LIGON, KEITH",DANA-FARBER CANCER INST,MA,"$346,548"
Brain Cancer,2013,NCI,1P50CA165962-01A1,7261,Biostatistics Core,"FINKELSTEIN, DIANNE",MASSACHUSETTS GENERAL HOSPITAL,MA,"$132,472"
Brain Cancer,2013,NCI,1P50CA165962-01A1,7262,Administration Core,"BATCHELOR, TRACY",MASSACHUSETTS GENERAL HOSPITAL,MA,"$258,580"
Brain Cancer,2013,NCI,1P50CA165962-01A1,7263,Developmental Research Program,"BATCHELOR, TRACY",MASSACHUSETTS GENERAL HOSPITAL,MA,"$58,623"
Brain Cancer,2013,NCI,1P50CA165962-01A1,7264,Career Development Program,"BATCHELOR, TRACY",MASSACHUSETTS GENERAL HOSPITAL,MA,"$58,623"
Brain Cancer,2013,NCI,2P50CA127001-06,7297,Tropism Enhanced Oncolytic Adenovirus for the Treatment of Brain Tumors,"FUEYO, JUAN",UT MD ANDERSON CANCER CTR,TX,"$285,917"
Brain Cancer,2013,NCI,2P50CA127001-06,7298,Targeting the PI3K Pathway in Malignant Glioma,"YUNG, W K",UT MD ANDERSON CANCER CTR,TX,"$225,166"
Brain Cancer,2013,NCI,2P50CA127001-06,7299,Predictive Markers to Personalize Medicine for Malignant Glioma,"ALDAPE, KENNETH",UT MD ANDERSON CANCER CTR,TX,"$237,011"
Brain Cancer,2013,NCI,2P50CA127001-06,7300,Targeting Malignant Gliomas with a Novel Inhibitor of the STAT3 Pathway,"HEIMBERGER, AMY",UT MD ANDERSON CANCER CTR,TX,"$245,058"
Brain Cancer,2013,NCI,2P50CA127001-06,7301,Administrative Core,"LANG, FREDERICK",UT MD ANDERSON CANCER CTR,TX,"$161,832"
Brain Cancer,2013,NCI,2P50CA127001-06,7302,Pathology and Biorepository Core,"ALDAPE, KENNETH",UT MD ANDERSON CANCER CTR,TX,"$151,459"
Brain Cancer,2013,NCI,2P50CA127001-06,7303,Biostatistics and Bioinformatics Core,"HESS, KENNETH",UT MD ANDERSON CANCER CTR,TX,"$107,205"
Brain Cancer,2013,NCI,2P50CA127001-06,7304,Clinical Core,"GILBERT, MARK",UT MD ANDERSON CANCER CTR,TX,"$115,430"
Brain Cancer,2013,NCI,2P50CA127001-06,7305,Animal Core,"DE GROOT, JOHN",UT MD ANDERSON CANCER CTR,TX,"$242,680"
Brain Cancer,2013,NCI,2P50CA127001-06,7306,Developmental Research Program,"LANG, FREDERICK",UT MD ANDERSON CANCER CTR,TX,"$135,282"
Brain Cancer,2013,NCI,2P50CA127001-06,7307,Career Development Program,"FUEYO, JUAN",UT MD ANDERSON CANCER CTR,TX,"$135,282"
Brain Cancer,2013,NCI,2P01CA118816-06A1,7518,Improved Management of GBM by Integrating Imaging and Tissue Analysis,"NELSON, SARAH",UNIVERSITY OF CALIFORNIA SAN FRANCISCO,CA,"$579,566"
Brain Cancer,2013,NCI,2P01CA118816-06A1,7519,Image Guided Genome-Epigenome Analysis of Tumor Heterogeneity and Evolution,"COSTELLO, JOSEPH",UNIVERSITY OF CALIFORNIA SAN FRANCISCO,CA,"$161,790"
Brain Cancer,2013,NCI,2P01CA118816-06A1,7521,Hyperpolarized 13C MRSI Monitoring of Pyruvate Metabolism to Assess Drug Action,"PIEPER, RUSSELL",UNIVERSITY OF CALIFORNIA SAN FRANCISCO,CA,"$545,642"
Brain Cancer,2013,NCI,2P01CA118816-06A1,7522,Administrative and Clinical Services Core,"CHANG, SUSAN",UNIVERSITY OF CALIFORNIA SAN FRANCISCO,CA,"$212,045"
Brain Cancer,2013,NCI,2P01CA118816-06A1,7528,Program as an Integrated Effort,"CHANG, SUSAN",UNIVERSITY OF CALIFORNIA SAN FRANCISCO,CA,"$376,326"
Brain Cancer,2013,NCI,2P01CA118816-06A1,7530,Progress During the Current Funding Period,"CHANG, SUSAN",UNIVERSITY OF CALIFORNIA SAN FRANCISCO,CA,"$263,474"
Brain Cancer,2013,NCI,1R01CA179956-01,,(PQC5) Detecting small clusters of tumor cells with a PTPmu probe,"BRADY-KALNAY, SUSANN",CASE WESTERN RESERVE UNIVERSITY,OH,"$645,638"
Brain Cancer,2013,RMAP,1U19CA179563-01,7604,Mechanisms of exRNA Trafficking,"BREAKEFIELD, XANDRA",MASSACHUSETTS GENERAL HOSPITAL,,"$414,536"
Brain Cancer,2013,RMAP,1U19CA179563-01,7605,Transfer of microRNA regulators from glioblastoma to brain microenvironment,"BREAKEFIELD, XANDRA",MASSACHUSETTS GENERAL HOSPITAL,,"$414,537"
Brain Cancer,2013,RMAP,1U19CA179563-01,7609,Mouse models of glioma to study functional exRNA transfer to the microenvironmen,"BREAKEFIELD, XANDRA",MASSACHUSETTS GENERAL HOSPITAL,,"$418,480"
Brain Cancer,2013,RMAP,1U19CA179563-01,7612,Intravital Microscopy Core,"BREAKEFIELD, XANDRA",MASSACHUSETTS GENERAL HOSPITAL,,"$414,534"
Brain Cancer,2013,NCI,1R41CA173976-01A1,,Neuroimaging tools for presurgical brain mapping,"DEYOE, EDGAR",PRISM CLINICAL IMAGING INC.,WI,"$272,918"
Brain Cancer,2013,NCI,1F31CA174052-01A1,,Overcoming Inferior Quality of Vaccine Responses After Alkylating Chemotherapy,"LITTERMAN, ADAM",UNIVERSITY OF MINNESOTA,MN,"$33,367"
Brain Cancer,2013,NCI,1F31CA180319-01,,Quantitative MRSI for the prediction of response to chemoradiation therapy in GBM,"CORDOVA, JAMES",EMORY UNIVERSITY,GA,"$47,232"
Brain Cancer,2013,NCI,1R21CA180063-01,,(PQ6) Molecular Mechanisms of Dormancy in MYC-Driven Medulloblastoma,"PEI, YANXIN",SANFORD-BURNHAM MEDICAL RESEARCH INSTIT,CA,"$254,475"
Brain Cancer,2013,NCI,1F31CA180299-01,,Immune effector-mediated killing of CNS tumors in the GL261 model of glioblastoma,"RENNER, DANIELLE",MAYO CLINIC ROCHESTER,MN,"$40,932"
Brain Cancer,2013,NCI,1F31CA180358-01,,MKP-1 Effects on HIF-1alpha and Glycolytic Metabolism in Glioblastoma multiforme,"MILLS, BRADLEY",UNIVERSITY OF ROCHESTER,NY,"$42,232"
Brain Cancer,2013,NCI,1R43CA171740-01A1,,Innovative high throughput tunable filter for widefield biomedical Raman imaging,"ZHU, LEYUN","AGILTRON, INC.",MA,"$246,228"
Brain Cancer,2013,NCI,1R41CA165626-01A1,,A Novel Brachytherapy Agent for GBM,"CALZONE, FRANK","APPLIED INTEGRIN SCIENCES, INC.",CA,"$299,937"
Brain Cancer,2013,NCI,1F30CA180411-01,,Enhancing dendritic cell migration to drive potent anti-tumor immune responses,"BATICH, KRISTEN",DUKE UNIVERSITY,NC,"$47,232"
Brain Cancer,2013,NCI,2R01CA122930-06A1,,Regulatory T Cells and Oncolytic Virotherapy of Glioma,"LESNIAK, MACIEJ",UNIVERSITY OF CHICAGO,IL,"$318,015"
Brain Cancer,2013,NCI,1F31CA174196-01A1,,Invasion of glioblastoma multiforme (GBM) cells in organotypic brain slices,"BINDER, ZEV",JOHNS HOPKINS UNIVERSITY,MD,"$42,232"
Brain Cancer,2013,NCI,1R01CA169117-01A1,,Targeting Ferritin in Glioblastoma,"RICH, JEREMY",CLEVELAND CLINIC LERNER COM-CWRU,OH,"$546,861"
Brain Cancer,2013,NINDS,3R01NS075995-02S1,,Na-K-Cl cotransporter in Glioblastoma Multiforme,"SUN, DANDAN",UNIVERSITY OF PITTSBURGH AT PITTSBURGH,PA,"$21,794"
Brain Cancer,2013,NCI,1U24CA180918-01,,Quantitative Image Informatics for Cancer Research (QIICR),"KIKINIS, RON",BRIGHAM AND WOMEN'S HOSPITAL,MA,"$724,331"
