Category,FY,Funding IC,Project Number,Sub Project #,Project Title,PI Name,Org Name,State / Country,Amount
Brain Cancer,2014,NCI,5R01CA151522-05,,A20 Promotes Glioma Stem Cell Mediated Tumorigenesis,"HJELMELAND, ANITA",UNIVERSITY OF ALABAMA AT BIRMINGHAM,AL,"$229,598"
Brain Cancer,2014,NCI,1R21CA185870-01,,Posterior cerebellar resection and pain processing in the pediatric brain,"MOULTON, ERIC",CHILDREN'S HOSPITAL CORPORATION,MA,"$49,859"
Brain Cancer,2014,OD,1R21CA185870-01,,Posterior cerebellar resection and pain processing in the pediatric brain,"MOULTON, ERIC",CHILDREN'S HOSPITAL CORPORATION,MA,"$141,450"
Brain Cancer,2014,NCI,1R01CA174737-01A1,,MOLECULAR BASIS FOR THE IMPACT OF SEX ON BRAIN TUMORIGENESIS,"RUBIN, JOSHUA",WASHINGTON UNIVERSITY,MO,"$316,264"
Brain Cancer,2014,NCI,5R01CA109467-09,,Genomic Analysis of Medulloblastomas,"POMEROY, SCOTT",CHILDREN'S HOSPITAL CORPORATION,MA,"$695,766"
Brain Cancer,2014,NCI,5R01CA154915-04,,MR Metabolic Imaging of Response to Targeted Therapies in GBM,"RONEN, SABRINA","UNIVERSITY OF CALIFORNIA, SAN FRANCISCO",CA,"$476,562"
Brain Cancer,2014,NCI,5R01CA172651-02,,Regulation of a DNA damage response network in glioblastoma,"MINN, ANDY",UNIVERSITY OF PENNSYLVANIA,PA,"$324,948"
Brain Cancer,2014,NCI,5R21CA178365-02,,Apoptosis driven by elastase inhibitor: new approach to detection and study.,"DIDENKO, VLADIMIR",BAYLOR COLLEGE OF MEDICINE,TX,"$165,089"
Brain Cancer,2014,NINDS,5K08NS070928-04,,Modeling Apoptotic Suppression in a Mouse Model of Brain Tumors,"RAO, GANESH",UNIVERSITY OF TX MD ANDERSON CAN CTR,TX,"$185,355"
Brain Cancer,2014,NCI,5F31CA180358-02,,MKP-1 Effects on HIF-1alpha and Glycolytic Metabolism in Glioblastoma multiforme,"MILLS, BRADLEY",UNIVERSITY OF ROCHESTER,NY,"$42,676"
Brain Cancer,2014,NCI,5P30CA082103-16,6388,Neurologic Oncology,"MCCORMICK, FRANK","UNIVERSITY OF CALIFORNIA, SAN FRANCISCO",CA,$137
Brain Cancer,2014,NCI,5P30CA082103-16,6393,Pediatric Malignancies,"MCCORMICK, FRANK","UNIVERSITY OF CALIFORNIA, SAN FRANCISCO",CA,$137
Brain Cancer,2014,NCI,5R01CA120439-07,,Small Molecule Activators of Procaspases as Anti-Cancer Agents,"HERGENROTHER, PAUL",UNIVERSITY OF ILLINOIS URBANA-CHAMPAIGN,IL,"$446,391"
Brain Cancer,2014,NCI,5R03CA173798-02,,"Methylmercury exposure, mercury metabolism genotypes, and risk of adult glioma","EGAN, KATHLEEN",H. LEE MOFFITT CANCER CTR & RES INST,FL,"$81,723"
Brain Cancer,2014,NINDS,5R01NS081117-03,,Heparan sulfate proteoglycans as critical regulators of brain cancer malignancy,"PHILLIPS, JOANNA","UNIVERSITY OF CALIFORNIA, SAN FRANCISCO",CA,"$342,347"
Brain Cancer,2014,NHLBI,1R01HL119984-01A1,,Regulation of endothelial cell junctions by VEGF and angiopoietin,"HOROWITZ, ARIE",CLEVELAND CLINIC LERNER COM-CWRU,OH,"$396,250"
Brain Cancer,2014,NCI,2R01CA137488-19A1,,Two Compartment Models to Improve Brain Tumor Therapy,"NEUWELT, EDWARD",OREGON HEALTH & SCIENCE UNIVERSITY,OR,"$485,308"
Brain Cancer,2014,NCI,5P01CA163205-02,7345,Development of a Novel Class of Highly Specific and Effective Oncolytic HSV Vect,"GLORIOSO, JOSEPH",UNIVERSITY OF PITTSBURGH,PA,"$355,635"
Brain Cancer,2014,NCI,5P01CA163205-02,7346,Intracellular Host Tumor Responses to oHSVs and Avenues to Overcome These,"CHIOCCA, E.",OHIO STATE UNIVERSITY,OH,"$360,760"
Brain Cancer,2014,NCI,5P01CA163205-02,7347,The Tumor Microenvironmental Barrier to Effective Viral Oncolysis,"KAUR, BALVEEN",OHIO STATE UNIVERSITY,OH,"$238,568"
Brain Cancer,2014,NCI,5P01CA163205-02,7348,NK Innate Immunity and Oncolytic Virus Therapy,"CALIGIURI, MICHAEL",OHIO STATE UNIVERSITY,OH,"$235,606"
Brain Cancer,2014,NCI,5P01CA163205-02,7349,Administration and Biostatistics Core,"CHIOCCA, E.",OHIO STATE UNIVERSITY,OH,"$119,740"
Brain Cancer,2014,NCI,5P01CA163205-02,7350,Pre-Clinical Vector Production Core,"GOINS, WILLIAM",UNIVERSITY OF PITTSBURGH,PA,"$168,622"
Brain Cancer,2014,NCI,5P01CA163205-02,7351,Malignant Gliomas Biorepository Core,"NAKANO, ICHIRO",OHIO STATE UNIVERSITY,OH,"$133,615"
Brain Cancer,2014,NIBIB,2R01EB009062-05,,"Stable, High Relaxivity MRI Contrast Agents","CARAVAN, PETER",MASSACHUSETTS GENERAL HOSPITAL,MA,"$558,977"
Brain Cancer,2014,NCI,5R01CA154345-04,,Oxygen as a master immunologic switch,"PENNELL, CHRISTOPHER",UNIVERSITY OF MINNESOTA,MN,"$303,925"
Brain Cancer,2014,NCI,5R01CA178200-02,,Impact of 18F-FDOPA-PET on neurosurgery and radiotherapy of glioma patients,"LAACK, NADIA",MAYO CLINIC ROCHESTER,MN,"$319,731"
Brain Cancer,2014,NINDS,2R01NS042645-11A1,,Predicting brain tumor progression via multiparametric image analysis and modelin,"DAVATZIKOS, CHRISTOS",UNIVERSITY OF PENNSYLVANIA,PA,"$560,015"
Brain Cancer,2014,NCI,2P30CA023100-28,6391,Planning and Evaluation,"LIPPMAN, SCOTT",UNIVERSITY OF CALIFORNIA SAN DIEGO,CA,"$33,797"
Brain Cancer,2014,NCI,1R01CA175391-01A1,,Intraoperative confocal microscopy for quantitative delineation of low-grade glio,"LIU, JONATHAN",STATE UNIVERSITY NEW YORK STONY BROOK,NY,"$355,962"
Brain Cancer,2014,NCI,1R01CA174761-01A1,,Role of acetyl-CoA in linking cancer cell metabolism and epigenetics,"WELLEN, KATHRYN",UNIVERSITY OF PENNSYLVANIA,PA,"$332,000"
Brain Cancer,2014,NCI,1R01CA176836-01A1,,Metabolic Therapy of GBM guided by MRS of hyperpolarized 13C-pyruvate,"RECHT, LAWRENCE",STANFORD UNIVERSITY,CA,"$575,027"
Brain Cancer,2014,NCI,1R01CA172391-01A1,,Targeting N-linked Glycosylation to Enhance Radiation Therapy,"CONTESSA, JOSEPH",YALE UNIVERSITY,CT,"$397,474"
Brain Cancer,2014,NCI,5P30CA046592-26,6476,Xenograft,"WICHA, MAX",UNIVERSITY OF MICHIGAN,MI,"$89,864"
Brain Cancer,2014,NINDS,1R01NS083795-01A1,,Using Cell-Penetrant Peptides to Target ATF5 in Mouse Glioma Models,"ANGELASTRO, JAMES",UNIVERSITY OF CALIFORNIA AT DAVIS,CA,"$323,802"
Brain Cancer,2014,NCI,5R01CA172723-02,,Predicting deficits in social competence for pediatric brain tumor survivors,"VANNATTA, KATHRYN",RESEARCH INST NATIONWIDE CHILDREN'S HOSP,OH,"$567,340"
Brain Cancer,2014,NCI,2R01CA131313-06,,Genetic Mouse Models of Glioma,"PARADA, LUIS",UT SOUTHWESTERN MEDICAL CENTER,TX,"$397,314"
Brain Cancer,2014,NINDS,1R01NS082554-01A1,,Pathway-Specific NF-kappaB Regulatory Networks in Glioma,"SITCHERAN, RAQUEL",TEXAS A&M UNIVERSITY HEALTH SCIENCE CTR,TX,"$294,973"
Brain Cancer,2014,NINDS,2R01NS056218-07A1,,Effects of Radiation on Brain Microvasculature and Cognition,"SONNTAG, WILLIAM",UNIVERSITY OF OKLAHOMA HLTH SCIENCES CTR,OK,"$357,599"
Brain Cancer,2014,NCI,1R01CA179071-01A1,,Investigation of tumor suppressive miR-148a in IDH mutant gliomas,"LAI, ALBERT",UNIVERSITY OF CALIFORNIA LOS ANGELES,CA,"$319,550"
Brain Cancer,2014,NINDS,5K08NS075144-05,,Modulation of the Blood-Tumor Barrier Through Targeted Suppression of Claudin 5,"GRANT, GERALD",STANFORD UNIVERSITY,CA,"$121,068"
Brain Cancer,2014,NCI,1K23CA169021-01A1,,Evaluation of impact of anti-VEGF drugs on concomitant chemotherapy in GBM,"GERSTNER, ELIZABETH",MASSACHUSETTS GENERAL HOSPITAL,MA,"$179,280"
Brain Cancer,2014,NCI,1R21CA186140-01,,A Phase I Study of CED of Liposomal-Irinotecan using imaging in High Grade Glioma,"BUTOWSKI, NICHOLAS","UNIVERSITY OF CALIFORNIA, SAN FRANCISCO",CA,"$324,935"
Brain Cancer,2014,NCI,5R01CA160782-04,,Discovery and Validation of Tumor Immunoevasion Mechanisms,"LARGAESPADA, DAVID",UNIVERSITY OF MINNESOTA,MN,"$176,610"
Brain Cancer,2014,NCI,5R01CA161210-05,,Retrotransposon instability in glioblastoma multiforme,"BOEKE, JEF",NEW YORK UNIVERSITY SCHOOL OF MEDICINE,NY,"$272,929"
Brain Cancer,2014,NCI,5R01CA161953-02,,Multifunctional nanoparticles to improve treatment of human glioblastoma,"ZHANG, MIQIN",UNIVERSITY OF WASHINGTON,WA,"$300,458"
Brain Cancer,2014,NCI,5K08CA163961-03,,Combined Pre & Intraoperative Brain Tumor Imaging Strategy using a Dual-Modality,"KIRCHER, MORITZ",SLOAN-KETTERING INST CAN RESEARCH,NY,"$178,740"
Brain Cancer,2014,NCI,5R01CA164371-04,,Patient-specific predictive modeling that integrates advanced cancer imaging,"KINAHAN, PAUL",UNIVERSITY OF WASHINGTON,WA,"$830,694"
Brain Cancer,2014,NCI,1R21CA186169-01,,Improving extent of glioblastoma resection by combining volumetric MRSI and 5-ALA,"SHIM, HYUNSUK",EMORY UNIVERSITY,GA,"$336,932"
Brain Cancer,2014,NINDS,5R21NS084084-02,,Novel small-molecule inhibitors of Wee1 kinase for medulloblastoma treatment,"REIGAN, PHILIP",UNIVERSITY OF COLORADO DENVER,CO,"$191,193"
Brain Cancer,2014,NINDS,5R21NS084357-02,,"Highly specific, temporally controllable mouse genetic tools for investigating in","ZONG, HUI",UNIVERSITY OF VIRGINIA,VA,"$234,630"
Brain Cancer,2014,NINDS,5R01NS083629-02,,Novel adhesion mechanisms in glioblastoma stem cells,"LATHIA, JUSTIN",CLEVELAND CLINIC LERNER COM-CWRU,OH,"$342,967"
Brain Cancer,2014,NCI,5R01CA163737-03,,Investigating Cancer Stem Cells - Niche Interactions in Brain Tumor,"FAN, XING",UNIVERSITY OF MICHIGAN,MI,"$218,710"
Brain Cancer,2014,NIDA,5R01DA014486-13,,Cannabinoid Signaling System in Microglial Cell,"STELLA, NEPHI",UNIVERSITY OF WASHINGTON,WA,"$309,000"
Brain Cancer,2014,NINDS,5R01NS077921-03,,Influence of Anti-Angiogenic Therapy on Drug Delivery to Brain Tumors,"ELMQUIST, WILLIAM",UNIVERSITY OF MINNESOTA,MN,"$488,787"
Brain Cancer,2014,NCI,1R21CA178578-01A1,,Fluorescence lifetime technique for detection of radiation necrosis vs gliom,"MARCU, LAURA",UNIVERSITY OF CALIFORNIA AT DAVIS,CA,"$196,906"
Brain Cancer,2014,NIBIB,1R21EB018750-01A1,,Photodynamic Therapy Mediated by Cerenkov Light Emitted from Radiopharmaceut,"MARCU, LAURA",UNIVERSITY OF CALIFORNIA AT DAVIS,CA,"$179,450"
Brain Cancer,2014,NCI,5R01CA158079-04,,"MRI Assessment of Tumor Perfusion, Permeability and Cellularity","QUARLES, CHRISTOPHER",VANDERBILT UNIVERSITY,TN,"$307,677"
Brain Cancer,2014,NINDS,2R01NS036692-14A1,,Role of Cl-Channels and Transporters in Tumor-Associated Epilepsy,"SONTHEIMER, HARALD",UNIVERSITY OF ALABAMA AT BIRMINGHAM,AL,"$405,039"
Brain Cancer,2014,NCI,1R03CA176799-01A1,,New Aminothiol Prevention of X-Ray-Induced Mouse Mutagenesis and Tumorigenesis,"FAHL, WILLIAM",UNIVERSITY OF WISCONSIN-MADISON,WI,"$75,250"
Brain Cancer,2014,NCI,5U01CA151815-05,,Nanoconjugate based on polymalic acid for brain tumor treatment,"LJUBIMOVA, JULIA",CEDARS-SINAI MEDICAL CENTER,CA,"$457,921"
Brain Cancer,2014,NCI,5K08CA155764-04,,The Significance of Isocitrate Dehydrogenase Mutations in Gliomas,"HORBINSKI, CRAIG",UNIVERSITY OF KENTUCKY,KY,"$171,644"
Brain Cancer,2014,NCI,5R01CA177796-02,,TWEAK-Fn14 HTS compound screening,"TRAN, NHAN",TRANSLATIONAL GENOMICS RESEARCH INST,AZ,"$383,429"
Brain Cancer,2014,NCI,5R01CA158800-04,,PET/CT Imaging of Malignant Brain Tumors with 124I-NM404,"WEICHERT, JAMEY",UNIVERSITY OF WISCONSIN-MADISON,WI,"$296,414"
Brain Cancer,2014,NCI,5R01CA154256-05,,Optimizing Induction Conditions for Immunotherapeutic CTL,"KRUSE, CAROL",UNIVERSITY OF CALIFORNIA LOS ANGELES,CA,"$382,596"
Brain Cancer,2014,NIGMS,5SC2GM095410-02,,GAP JUNCTION INTERCELLULAR COMMUNICATION AND POLYAMINES,"KUCHERYAVYKH, YURIY",UNIVERSIDAD CENTRAL DEL CARIBE,PR,"$142,258"
Brain Cancer,2014,NCI,5P30CA047904-26,6482,ANIMAL FACILITY,"NEWSOME, JOSEPH",UNIVERSITY OF PITTSBURGH AT PITTSBURGH,PA,"$78,661"
Brain Cancer,2014,NCI,5P30CA091842-13,6588,Translational and Clinical Research,"MOLEY, JEFFREY",WASHINGTON UNIVERSITY,MO,"$61,003"
Brain Cancer,2014,NCI,5R01CA170653-03,,"Cadherin11 in cancer & rheumatoid arthritis: Common target, common therapies? (5)","BYERS, STEPHEN",GEORGETOWN UNIVERSITY,DC,"$566,047"
Brain Cancer,2014,NCI,5R01CA174452-03,,Validation of PROMIS Measures in Children with Brain Tumors,"LAI, JIN-SHEI",NORTHWESTERN UNIVERSITY AT CHICAGO,IL,"$290,100"
Brain Cancer,2014,NCI,5R03CA167695-02,,Investigating MicroRNAs and Their Regulatory Networks in Glioblastoma,"ZHAO, ZHONGMING",VANDERBILT UNIVERSITY,TN,"$76,145"
Brain Cancer,2014,NCI,5F31CA174211-02,,Role of microRNA-124 in counteracting glioblastoma adaptation to cellular stress,"MUCAJ, VERA",UNIVERSITY OF PENNSYLVANIA,PA,"$42,676"
Brain Cancer,2014,NCI,5R01CA155769-04,,Role of Receptor for Advanced Glycation End Product (RAGE) Pathway in Brain Tumor,"BADIE, BEHNAM",CITY OF HOPE/BECKMAN RESEARCH INSTITUTE,CA,"$338,142"
Brain Cancer,2014,NIGMS,5R01GM067946-12,,"Signal Termination by PHLPP, PH domain Leucine-rich repeat Protein Phosphatase","NEWTON, ALEXANDRA",UNIVERSITY OF CALIFORNIA SAN DIEGO,CA,"$446,400"
Brain Cancer,2014,NIGMS,5SC3GM096948-03,,Identifying Key Genes that cause Aggressive Brain Cancer,"YOO, CHANGWON",FLORIDA INTERNATIONAL UNIVERSITY,FL,"$108,750"
Brain Cancer,2014,NCI,5U54CA151819-05,8878,"Organ-specific, Blood Protein Biomarkers for an Informative Diagnosis of Brain an","HOOD, LEROY",INSTITUTE FOR SYSTEMS BIOLOGY,WA,"$664,991"
Brain Cancer,2014,NCI,5U54CA151819-05,8881,The Heterogeneity of Glioblastoma Multiforme and its Applications towards the Dev,"MISCHEL, PAUL",UNIVERSITY OF CALIFORNIA LOS ANGELES,CA,"$349,354"
Brain Cancer,2014,NCI,5U54CA151819-05,8883,Administrative Core,"HEATH, JAMES",CALIFORNIA INSTITUTE OF TECHNOLOGY,CA,"$107,769"
Brain Cancer,2014,NCI,5R25CA153954-05,,The University of Kentucky Cancer Nanotechnology Training Center (UK CNTC),"ANDERSON, BRADLEY",UNIVERSITY OF KENTUCKY,KY,"$313,570"
Brain Cancer,2014,NICHD,5P30HD004612-44,7684,Stem Cells,"SUN, YI",UNIVERSITY OF CALIFORNIA LOS ANGELES,CA,"$142,253"
Brain Cancer,2014,NICHD,5P30HD004612-44,7685,Cell Biology and Cellular Imaging,"DE VELLIS, JEAN",UNIVERSITY OF CALIFORNIA LOS ANGELES,CA,"$256,684"
Brain Cancer,2014,NCI,1R01CA180699-01A1,,Targeting diacylglycerol kinases in glioblastoma,"PUROW, BENJAMIN",UNIVERSITY OF VIRGINIA,VA,"$408,495"
Brain Cancer,2014,NCI,5F30CA165892-03,,The role of gremlin in regulating the differentiation of glioma stem cells,"YAN, KENNETH",CLEVELAND CLINIC LERNER COM-CWRU,OH,"$47,676"
Brain Cancer,2014,NCI,5U54CA151880-05,5057,Nanostructured Matrices for Cancer Cell Biology,"MRKSICH, MILAN",NORTHWESTERN UNIVERSITY,IL,"$265,557"
Brain Cancer,2014,NCI,5U54CA151880-05,5059,Preclinical Validation of Polyvalent siRNA Gold Nanoparticle Conjugates as anti-G,"STEGH, ALEXANDER",NORTHWESTERN UNIVERSITY,IL,"$169,408"
Brain Cancer,2014,NCI,5R01CA155521-03,,Elucidate and Modulate TGF-b Signaling in NK Cells for Glioma Treatment,"YU, JIANHUA",OHIO STATE UNIVERSITY,OH,"$306,944"
Brain Cancer,2014,NEI,5K23EY022673-03,,Visual outcome measures in children with optic pathway gliomas,"AVERY, ROBERT",CHILDREN'S RESEARCH INSTITUTE,DC,"$229,113"
Brain Cancer,2014,NLM,5K22LM011576-02,,Multiscale Framework for Molecular Heterogeneity Analysis,"COOPER, LEE",EMORY UNIVERSITY,GA,"$162,303"
Brain Cancer,2014,NINDS,5R01NS052634-10,,Amino Acid Transport and the Biology of Human Gliomas,"SONTHEIMER, HARALD",UNIVERSITY OF ALABAMA AT BIRMINGHAM,AL,"$317,263"
Brain Cancer,2014,NINDS,5R01NS073870-05,,Defining the role of BRAF in glioma initiation and maintenance,"HOLMEN, SHERI",UNIVERSITY OF UTAH,UT,"$322,678"
Brain Cancer,2014,NCI,5U54CA151652-05,8813,Carbon Nanotube-based Microbeam Radiation Therapy for Human Brain Cancer,"ZHOU, OTTO",UNIV OF NORTH CAROLINA CHAPEL HILL,NC,"$166,846"
Brain Cancer,2014,NCI,5U01CA160045-03,,Objective decision support environment for clinical trials,"ERICKSON, BRADLEY",MAYO CLINIC ROCHESTER,MN,"$503,175"
Brain Cancer,2014,RMAP,5UH2TR000931-02,,exRNA Biomarkers for Human Glioma,"CARTER, BOB",UNIVERSITY OF CALIFORNIA SAN DIEGO,CA,"$494,879"
Brain Cancer,2014,NCI,5U01CA140204-04,,Multi-Modality Quantitiative Imaging for Evaluation of Response to Cancer Therapy,"WAHL, RICHARD",JOHNS HOPKINS UNIVERSITY,MD,"$641,994"
Brain Cancer,2014,NCI,5K08CA154790-04,,PET TUMOR AND PROLIFERATION IMAGING VIA CATIONIC AMINO ACID TRANSPORT,"MCCONATHY, JONATHAN",WASHINGTON UNIVERSITY,MO,"$157,715"
Brain Cancer,2014,NINDS,5R01NS073132-05,,The effects of the unfolded protein response on medulloblastoma,"LIN, WENSHENG",UNIVERSITY OF MINNESOTA,MN,"$329,174"
Brain Cancer,2014,NCI,1R41CA183150-01A1,,AutoRegister: A system for enhancing the accuracy of tumor change detection,"SCHMANSKY, NICHOLAS","CORTICOMETRICS, LLC",MA,"$225,000"
Brain Cancer,2014,NCI,5R00CA157948-04,,Microenvironmental regulation of the cancer stem cell phenotype by integrin a6,"LATHIA, JUSTIN",CLEVELAND CLINIC LERNER COM-CWRU,OH,"$241,529"
Brain Cancer,2014,NCI,5R01CA172986-02,,Modeling and microsystems approach to glioma invasion,"ODDE, DAVID",UNIVERSITY OF MINNESOTA,MN,"$418,606"
Brain Cancer,2014,NINDS,5R01NS077555-04,,Cyclophilin B as a therapeutic target in glioblastoma,"BRAM, RICHARD",MAYO CLINIC ROCHESTER,MN,"$341,518"
Brain Cancer,2014,NCI,2R44CA144817-02A1,,Nanoparticle-based Sensitizer for Radiation Therapy of Glioblastoma,"UNGER, EVAN","NUVOX PHARMA, LLC",AZ,"$1,000,000"
Brain Cancer,2014,NINDS,1R43NS086335-01A1,,Molecular Imaging???Based Monitoring of Tumor-Selective Virus Replication,"JOLLY, DOUGLAS","TOCAGEN, INC.",CA,"$224,741"
Brain Cancer,2014,NCI,5R21CA170284-02,,Advanced MRI methods for detecting pseudo-progression of glioblastomas,"POPTANI, HARISH",UNIVERSITY OF PENNSYLVANIA,PA,"$320,232"
Brain Cancer,2014,NCI,5U01CA172027-02,,Quantitative MRSI to predict early response to SAHA therapy in new GBM management,"SHIM, HYUNSUK",EMORY UNIVERSITY,GA,"$626,579"
Brain Cancer,2014,NCI,5R21CA180063-02,,(PQ6) Molecular Mechanisms of Dormancy in MYC-Driven Medulloblastoma,"PEI, YANXIN",SANFORD-BURNHAM MEDICAL RESEARCH INSTIT,CA,"$205,701"
Brain Cancer,2014,NIGMS,5SC2GM102040-02,,Microglia promote dispersal of glioma cells through Pyk2 intracellular signaling,"KUCHERYAVYKH, LILIA",UNIVERSIDAD CENTRAL DEL CARIBE,PR,"$132,982"
Brain Cancer,2014,NINDS,5R01NS061070-09,,Hedgehog:YAP:IGF2/mTOR axis in cerebellar precursor division and medulloblastoma,"KENNEY, ANNA",EMORY UNIVERSITY,GA,"$337,837"
Brain Cancer,2014,NINDS,5R01NS076759-04,,Suppression of Glioblastoma Stem Cells by Kruppel-Like Factor 9,"LATERRA, JOHN",HUGO W. MOSER RES INST KENNEDY KRIEGER,MD,"$320,942"
Brain Cancer,2014,NCI,2U19CA021239-35,7130,Exploratory Phase I/II Clinical Studies to Improve the Therapeutic Ratio of,"SHIH, HELEN",MASSACHUSETTS GENERAL HOSPITAL,MA,"$215,805"
Brain Cancer,2014,NCI,5K24CA125440-08,,Clinical and Molecular Studies of Malignant Brain Tumors,"BATCHELOR, TRACY",MASSACHUSETTS GENERAL HOSPITAL,MA,"$185,972"
Brain Cancer,2014,NCI,5F32CA165881-03,,Glioblastoma PDT Design: Nanoagent Uptake and Tumor Oxygenation based dosimetry,"MALLIDI, SRIVALLEESHA",MASSACHUSETTS GENERAL HOSPITAL,MA,"$56,978"
Brain Cancer,2014,NCI,5U01CA168878-03,,Extracellular Sulfatases As Novel Biomarkers For Early Detection of Cancer,"LEMJABBAR-ALAOUI, HASSAN","UNIVERSITY OF CALIFORNIA, SAN FRANCISCO",CA,"$424,543"
Brain Cancer,2014,NCI,1F31CA180422-01A1,,Glycocalyx and NCOR2-Notch-Mediated Stemness in Glioblastoma Aggressiveness,"MIROSHNIKOVA, YEKATERINA","UNIVERSITY OF CALIFORNIA, SAN FRANCISCO",CA,"$36,530"
Brain Cancer,2014,NIDCD,1F32DC013953-01,,High-density electrocorticography to understand cortical speech arrest sites,"ROLSTON, JOHN","UNIVERSITY OF CALIFORNIA, SAN FRANCISCO",CA,"$56,978"
Brain Cancer,2014,NCI,5R01CA098503-09,,Dissecting Glioma Genesis through a Glial-Specific Mouse Model,"ZHANG, WEI",UNIVERSITY OF TX MD ANDERSON CAN CTR,TX,"$245,251"
Brain Cancer,2014,NINDS,5R01NS079715-03,,Study of a Novel Deubiquitylase in Medulloblastoma,"GOPALAKRISHNAN, VIDYA",UNIVERSITY OF TX MD ANDERSON CAN CTR,TX,"$342,168"
Brain Cancer,2014,NINDS,5R21NS082542-02,,Generation of TWIST1 reporters through characterization of TWIST1 dependent netwo,"MIKHEEV, ANDREI",UNIVERSITY OF WASHINGTON,WA,"$215,325"
Brain Cancer,2014,NCI,1R01CA181429-01A1,,Radiation and Receptor Targeted RadioTheranostic Nanoparticles for Glioblastoma,"DORSEY, JAY",UNIVERSITY OF PENNSYLVANIA,PA,"$496,830"
Brain Cancer,2014,NCI,5F30CA165736-03,,"Role of NIAM, A Putative Cancer Gene, in Chromosomal Instability and Glioblastoma","FRANCIS-REED, SARA",UNIVERSITY OF IOWA,IA,"$23,638"
Brain Cancer,2014,NINDS,2R01NS064607-06,,OV therapy induced changes in tumor secretome and their impact on therapy,"KAUR, BALVEEN",OHIO STATE UNIVERSITY,OH,"$336,602"
Brain Cancer,2014,NINDS,1R21NS087867-01,,Role and Therapeutic Value of AHR in Inflammatory Macrophages during GBM,"QUINTANA, FRANCISCO",BRIGHAM AND WOMEN'S HOSPITAL,MA,"$258,926"
Brain Cancer,2014,NINDS,2R01NS049251-08,,Multimodal Registration of the Brain's Cortical Surface,"MIGA, MICHAEL",VANDERBILT UNIVERSITY,TN,"$566,111"
Brain Cancer,2014,NCI,5R01CA127612-07,,MR Metabolic Markers for Evaluation of Patients with Recurrent Glioma,"NELSON, SARAH","UNIVERSITY OF CALIFORNIA, SAN FRANCISCO",CA,"$336,443"
Brain Cancer,2014,NCI,5R01CA159811-03,,Modulation of Oncogenic Signaling in Glioblastomas,"CHENG, SHI-YUAN",NORTHWESTERN UNIVERSITY AT CHICAGO,IL,"$310,970"
Brain Cancer,2014,NCI,5F31CA167863-03,,The Roles of Microglia and Macrophage Populations in the Glioma Microenvironment,"BOWMAN, ROBERT",SLOAN-KETTERING INST CAN RESEARCH,NY,"$42,676"
Brain Cancer,2014,NCI,1F31CA186668-01,,A Novel Approach to Treating Glioblastoma through Activation of the Liver X Recep,"VILLA, GENARO",LUDWIG INSTITUTE  FOR CANCER RES  LTD,CA,"$34,393"
Brain Cancer,2014,NCI,5R00CA151412-05,,NK cell-myeloid cell crosstalk in patients with cancer,"CRANE, COURTNEY",SEATTLE CHILDREN'S HOSPITAL,WA,"$238,341"
Brain Cancer,2014,NINDS,1R01NS087913-01,,Metabolism Informs Intertumoral & Intratumoral Heterogeneity,"RICH, JEREMY",CLEVELAND CLINIC LERNER COM-CWRU,OH,"$426,906"
Brain Cancer,2014,NCI,5P01CA042045-25,5363,Cellular Proliferation is a Robust Pharmacodynamic Endpoint,"SPENCE, ALEXANDER",UNIVERSITY OF WASHINGTON,WA,"$143,154"
Brain Cancer,2014,NCI,5R33CA177462-02,,Meso-plex miRNA and protein profiling for cancer diagnostics using chip-integrate,"BAILEY, RYAN",UNIVERSITY OF ILLINOIS URBANA-CHAMPAIGN,IL,"$316,643"
Brain Cancer,2014,NCI,5F31CA180299-02,,Immune effector-mediated killing of CNS tumors in the GL261 model of glioblastoma,"RENNER, DANIELLE",MAYO CLINIC ROCHESTER,MN,"$41,376"
Brain Cancer,2014,NINDS,5R01NS069964-05,,Role of TEMs in brain tumor dispersal,"GOMEZ-MANZANO, CANDELARIA",UNIVERSITY OF TX MD ANDERSON CAN CTR,TX,"$335,325"
Brain Cancer,2014,NINDS,5R01NS083937-02,,High throughput screen for selective inhibitors of cyclophilin B,"BRAM, RICHARD",MAYO CLINIC ROCHESTER,MN,"$392,671"
Brain Cancer,2014,NCI,5P01CA154291-03,6712,Targeting Immunosuppression Pathways to Enhance Brain Tumor Immunotherapy,"SAMPSON, JOHN",DUKE UNIVERSITY,NC,"$667,257"
Brain Cancer,2014,NCI,5P01CA154291-03,6713,EGFRwt and EGFRvlll Dual-Specific Immunotoxin for Glioblastoma Multiforme,"BIGNER, DARELL",DUKE UNIVERSITY,NC,"$638,550"
Brain Cancer,2014,NCI,5P01CA154291-03,6714,Imaging,"BARBORIAK, DANIEL",DUKE UNIVERSITY,NC,"$740,483"
Brain Cancer,2014,NCI,5P01CA154291-03,6725,Clinical Support,"VREDENBURGH, JAMES",DUKE UNIVERSITY,NC,"$887,848"
Brain Cancer,2014,NCI,5P01CA154291-03,6727,Administration,"BIGNER, DARELL",DUKE UNIVERSITY,NC,"$51,144"
Brain Cancer,2014,NIBIB,5K01EB016071-03,,A Microfluidic System for Image-Guided RNA-Seq of Single Cells in Glioblastoma,"SIMS, PETER",COLUMBIA UNIVERSITY HEALTH SCIENCES,NY,"$172,750"
Brain Cancer,2014,NCI,5P50CA086438-14,5216,Tumor Evolution and Changes in Metabolism,"KOUTCHER, JASON",SLOAN-KETTERING INST CAN RESEARCH,NY,"$222,837"
Brain Cancer,2014,NCI,5R00CA160775-03,,Genetically-Modified Neural Stem Cell Based Virotherapy for Invasive Gliomas,"AHMED, ATIQUE",UNIVERSITY OF CHICAGO,IL,"$236,853"
Brain Cancer,2014,NIBIB,5R01EB015870-03,,MINIR-II: Minimally Invasive Neurosurgical Intracranial Robot,"DESAI, JAYDEV","UNIV OF MARYLAND, COLLEGE PARK",MD,"$533,622"
Brain Cancer,2014,NCI,5T32CA151022-05,,Training Program in Translational Brain Tumor Research,"PIEPER, RUSSELL","UNIVERSITY OF CALIFORNIA, SAN FRANCISCO",CA,"$212,402"
Brain Cancer,2014,NINDS,5R21NS081594-02,,Dynamic Magnetic Targeting of Activated Brain Macrophages for Glioma Therapy,"BADIE, BEHNAM",CITY OF HOPE/BECKMAN RESEARCH INSTITUTE,CA,"$195,117"
Brain Cancer,2014,NCI,5K07CA157923-04,,Neurocognitive Outcomes Following Proton Beam Radiation Therapy for Treatment of,"KAHALLEY, LISA",BAYLOR COLLEGE OF MEDICINE,TX,"$148,746"
Brain Cancer,2014,NCI,5P50CA114747-10,5348,Image-Guided Resection to Improve Outcome for Children with Medulloblastoma,"CONTAG, CHRISTOPHER",STANFORD UNIVERSITY,CA,"$140,138"
Brain Cancer,2014,NCI,5K99CA178190-02,,Apoptotic Proteins as Molecular Modulators of Stem Cell Fate,"GAMA, VIVIAN",UNIV OF NORTH CAROLINA CHAPEL HILL,NC,"$110,956"
Brain Cancer,2014,NCI,5R01CA161404-03,,CHRONIC CONVECTION ENHANCED DELIVERY (CED) OF TOPOTECAN FOR GLIOBLASTOMA,"BRUCE, JEFFREY",COLUMBIA UNIVERSITY HEALTH SCIENCES,NY,"$576,100"
Brain Cancer,2014,NCI,5R01CA179956-02,,(PQC5) Detecting small clusters of tumor cells with a PTPmu probe,"BRADY-KALNAY, SUSANN",CASE WESTERN RESERVE UNIVERSITY,OH,"$598,485"
Brain Cancer,2014,NCI,5P01CA159992-04,5313,MRI Methods for Guiding Focused Ultrasound in the Brain,"PAULY, KIM",STANFORD UNIVERSITY,CA,"$188,400"
Brain Cancer,2014,NCI,5P50CA108961-09,5339,Influence of DNA repair on PARP Inhibitor efficacy In GBM,"SARKARIA, JANN",MAYO CLINIC ROCHESTER,MN,"$276,757"
Brain Cancer,2014,NCI,5P50CA108961-09,5340,Optimizing Measles Virotherapy in the Treatment of Gliomas,"GALANIS, EVANTHIA",MAYO CLINIC ROCHESTER,MN,"$286,203"
Brain Cancer,2014,NCI,5P50CA108961-09,5341,Histone Modification and GBM Therapy,"LOFTUS, JOSEPH",MAYO CLINIC ROCHESTER,MN,"$133,829"
Brain Cancer,2014,NCI,5P50CA108961-09,5342,Clinical Relevance of Chromosome 5p/9p/20q/8q Germline Alterations in Glioma,"ANASTASIADIS, PANAGIOTIS",MAYO CLINIC ROCHESTER,MN,"$369,782"
Brain Cancer,2014,NCI,5P50CA108961-09,5343,Administration,"O'NEILL, BRIAN",MAYO CLINIC ROCHESTER,MN,"$79,190"
Brain Cancer,2014,NCI,5P50CA108961-09,5344,Biostatistics Core,"BALLMAN, KARLA",MAYO CLINIC ROCHESTER,MN,"$190,739"
Brain Cancer,2014,NCI,5P50CA108961-09,5345,Pathology and Tissue Procurement,"GIANNINI, CATERINA",MAYO CLINIC ROCHESTER,MN,"$90,579"
