Category,FY,Funding IC,Project Number,Sub Project #,Project Title,PI Name,Org Name,State / Country,Amount
Brain Cancer,2013,NINDS,5F30NS064686-04,,Polymer mediated delivery of siRNA for malignant glioma treatment,"KHORMAEE, SARIAH",HARVARD UNIVERSITY (MEDICAL SCHOOL),MA,"$47,232"
Brain Cancer,2013,OD,1S10OD012304-01,,Orbitrap Elite High-Resolution Mass Spectrometer for Proteomics and Metabolomics,"HAWKE, DAVID",UT MD ANDERSON CANCER CTR,TX,"$877,433"
Brain Cancer,2013,NINDS,5F31NS074597-02,,Regulation of the Vasculature by Invading Glioma Cells,"WATKINS, STACEY",UNIVERSITY OF ALABAMA AT BIRMINGHAM,AL,"$34,632"
Brain Cancer,2013,NINR,5R01NR011044-05,,Patient and Health Care System Outcomes Following EEA,"SHERWOOD, PAULA",UNIVERSITY OF PITTSBURGH AT PITTSBURGH,PA,"$464,669"
Brain Cancer,2013,NCI,5R01CA139099-04,,Molecular Combinatorial Therapy of Glioblastoma Multiforme,"DEBINSKI, WALDEMAR",WAKE FOREST UNIVERSITY HEALTH SCIENCES,NC,"$281,376"
Brain Cancer,2013,NCI,5R01CA127935-05,,Boronated nucleosides for neutron capture therapy of brain tumors,"TJARKS, WERNER",OHIO STATE UNIVERSITY,OH,"$253,674"
Brain Cancer,2013,NINDS,5K08NS062907-05,,Characterization of GEFT AS a Novel Glioblastoma Oncogene,"CHHEDA, MILAN",SLOAN-KETTERING INST CAN RES,NY,"$184,610"
Brain Cancer,2013,NINDS,5K08NS059790-06,,Brain Enriched MicroRNA 128a and 9/9+: Impact on medulloblastoma pathogenesis,"VIBHAKAR, RAJEEV",UNIVERSITY OF COLORADO DENVER,CO,"$187,380"
Brain Cancer,2013,NCI,5R01CA136808-03,,TWIST1 as a target for inhibition of glioma invasion,"ROSTOMILY, ROBERT",UNIVERSITY OF WASHINGTON,WA,"$323,783"
Brain Cancer,2013,NCI,5R01CA025000-34,,CD8+ T Cell-Mediated Immunotherapy of Autochthonous SV40 T Antigen-Induced Tumors,"SCHELL, TODD",PENNSYLVANIA STATE UNIVERSITY,PA,"$351,876"
Brain Cancer,2013,NCI,5R01CA136574-05,,Hedgehog Pathway Blockade by Small-Molecule Gli Antagonists,"CHEN, JAMES",STANFORD UNIVERSITY,CA,"$307,455"
Brain Cancer,2013,NCI,5R01CA072937-11,,Interactions Between Cytotoxic and Antiangiogenic Drugs,"GALLO, JAMES",MOUNT SINAI SCHOOL OF MEDICINE,NY,"$215,281"
Brain Cancer,2013,NCI,5R01CA096856-10,,Novel role of STAT3 in NPM/ALK-induced oncogenesis,"WASIK, MARIUSZ",UNIVERSITY OF PENNSYLVANIA,PA,"$272,958"
Brain Cancer,2013,NCI,5R01CA138734-04,,Validation of microRNA Targets in Glioma,"KRICHEVSKY, ANNA",BRIGHAM AND WOMEN'S HOSPITAL,MA,"$330,591"
Brain Cancer,2013,NCI,5P30CA016042-38,5641,Tumor Immunology,"BRAUN, JONATHAN",UNIVERSITY OF CALIFORNIA LOS ANGELES,CA,"$141,874"
Brain Cancer,2013,NCI,5U01HG006485-02,,Incorporation of Genomic Sequencing into Pediatric Cancer Care,"PLON, SHARON",BAYLOR COLLEGE OF MEDICINE,TX,"$752,993"
Brain Cancer,2013,NHGRI,5U01HG006485-02,,Incorporation of Genomic Sequencing into Pediatric Cancer Care,"PLON, SHARON",BAYLOR COLLEGE OF MEDICINE,TX,"$920,324"
Brain Cancer,2013,NCI,4U10CA011488-43,,EORTC HEADQUARTERS,"LACOMBE, DENIS",EUROPEAN ORG/RES/TREATMENT/CANCER,BELGIU,"$250,025"
Brain Cancer,2013,NIGMS,5R01GM058008-14,,Spatial Analysis of Molecules in Tissue using MALDI-MS,"CAPRIOLI, RICHARD",VANDERBILT UNIVERSITY MED CTR,TN,"$414,588"
Brain Cancer,2013,NCI,5R01CA164746-02,,A causal role for asymmetric cell division defects in glioma initiation,"PETRITSCH, CLAUDIA",UNIVERSITY OF CALIFORNIA SAN FRANCISCO,CA,"$301,353"
Brain Cancer,2013,NINDS,5R01NS074388-03,,Rescuing radiation-induced cognitive deficits through cranial transplantation of,"LIMOLI, CHARLES",UNIVERSITY OF CALIFORNIA IRVINE,CA,"$410,445"
Brain Cancer,2013,NIGMS,5R00GM084460-05,,Coordinating Translesion DNA Synthesis Opposite Damaged DNA,"EOFF, ROBERT",UNIV OF ARKANSAS FOR MED SCIS,AR,"$234,636"
Brain Cancer,2013,NINDS,5R01NS040511-14,,Oligodendrocyte Lineage Gene Function in the CNS,"ROWITCH, DAVID",UNIVERSITY OF CALIFORNIA SAN FRANCISCO,CA,"$416,260"
Brain Cancer,2013,NCI,5R01CA109106-07,,MRI Diffusion in Tumors Using Oscillating Gradients,"GORE, JOHN",VANDERBILT UNIVERSITY MED CTR,TN,"$210,381"
Brain Cancer,2013,NINDS,5R01NS057711-06,,Engineering the Brain Immune System for Tumor Therapy,"CASTRO, MARIA",UNIVERSITY OF MICHIGAN,MI,"$367,641"
Brain Cancer,2013,NCI,5R01CA154348-03,,Measles Virotherapy and radiovirotherapy in the Treatment of recurrent gliomas,"GALANIS, EVANTHIA",MAYO CLINIC ROCHESTER,MN,"$309,001"
Brain Cancer,2013,NCI,5R01CA140614-04,,Molecular and Cellular Characterization of Prognostic Immune Response in Childhoo,"FOREMAN, NICHOLAS",UNIVERSITY OF COLORADO DENVER,CO,"$289,474"
Brain Cancer,2013,NCI,5R01CA149461-03,,Molecular mechanisms of GBM radioresistance and strategies for radiosensitization,"BURMA, SANDEEP",UT SOUTHWESTERN MEDICAL CENTER,TX,"$310,130"
Brain Cancer,2013,NCI,5R01CA156177-03,,Targeted Photoactivable Nanocells: Image-based Drug Delivery and Dosimetry in GBM,"HASAN, TAYYABA",MASSACHUSETTS GENERAL HOSPITAL,MA,"$467,509"
Brain Cancer,2013,NCI,5R01CA154754-03,,Engineering and Evaluation of Human L-Methionase for Cancer Therapy,"GEORGIOU, GEORGE","UNIVERSITY OF TEXAS, AUSTIN",TX,"$403,071"
Brain Cancer,2013,NCI,5R01CA129446-05,,ADAM 17 and glioma-tumor progression and treatment,"JIANG, FENG",HENRY FORD HEALTH SYSTEM,MI,"$274,338"
Brain Cancer,2013,NCI,5R01CA138401-03,,HSP27: A modulator and therapeutic target of SPARC-induced glioma invasion.,"REMPEL, SANDRA",HENRY FORD HEALTH SYSTEM,MI,"$113,311"
Brain Cancer,2013,NCI,5R01CA063366-18,,"HEF1 Coordination of Cell Cycle, Migration, and Invasion in Cancer","GOLEMIS, ERICA",RESEARCH INST OF FOX CHASE CAN CTR,PA,"$306,415"
Brain Cancer,2013,NCI,5R01CA152883-04,,Brain Endothelial TNF-R1 Can Function to Inhibit Angiogenesis,"GLADSON, CANDECE",CLEVELAND CLINIC LERNER COM-CWRU,OH,"$334,173"
Brain Cancer,2013,NCI,5R01CA074145-16,,High-Grade Astrocytoma-specific Molecular Targeting,"DEBINSKI, WALDEMAR",WAKE FOREST UNIVERSITY HEALTH SCIENCES,NC,"$230,637"
Brain Cancer,2013,NCI,5R01CA129687-05,,Molecular mechanisms of TRAIL resistance in glioblastoma,"HAO, CHUNHAI",EMORY UNIVERSITY,GA,"$293,258"
Brain Cancer,2013,NCI,5R01CA097124-10,,REST/NRSF-mediated medulloblastoma tumorigenesis,"MAJUMDER, SADHAN",UT MD ANDERSON CANCER CTR,TX,"$251,390"
Brain Cancer,2013,NCI,5R01CA157980-03,,Mechanisms of the Stromal Response to Smoothened Inhibition in Pancreatic Cancer,"OLIVE, KENNETH",COLUMBIA UNIVERSITY HEALTH SCIENCES,NY,"$314,031"
Brain Cancer,2013,NCI,5R01CA120813-07,,Modulation of Microglia and T Cell Interactions in Malignant Glioma,"HEIMBERGER, AMY",UT MD ANDERSON CANCER CTR,TX,"$247,317"
Brain Cancer,2013,NCI,5R01CA136803-05,,Investigation of Notch-inhibiting microRNAs in glioma,"PUROW, BENJAMIN",UNIVERSITY OF VIRGINIA,VA,"$286,408"
Brain Cancer,2013,NCI,5R01CA140102-04,,Translation of smart contrast agents for brain tumor characterization by MR,"HYDER, DEWAN SYED",YALE UNIVERSITY,CT,"$328,540"
Brain Cancer,2013,NCI,5R01CA133091-05,,Mycn and Medulloblastoma,"WEISS, WILLIAM",UNIVERSITY OF CALIFORNIA SAN FRANCISCO,CA,"$292,312"
Brain Cancer,2013,NCI,5R01CA154130-04,,Targeting Brain Tumor Stem Cells Through Novel Therapeutic Combinations,"RICH, JEREMY",CLEVELAND CLINIC LERNER COM-CWRU,OH,"$412,678"
Brain Cancer,2013,NINDS,5R21NS076176-02,,Cortical organization of object knowledge before and after brain surgery,"MAHON, BRADFORD",UNIVERSITY OF ROCHESTER,NY,"$186,366"
Brain Cancer,2013,NIGMS,1SC2GM095410-01A1,,GAP JUNCTION INTERCELLULAR COMMUNICATION AND POLYAMINES,"KUCHERYAVYKH, YURIY",UNIVERSIDAD CENTRAL DEL CARIBE,PR,"$142,258"
Brain Cancer,2013,NINDS,5R01NS062219-04,,Preventing Glioma Cancer Stem Cell Dispersal Using Cdc2 Kinase Inhibitors,"JOHNSON, MARK",BRIGHAM AND WOMEN'S HOSPITAL,MA,"$344,234"
Brain Cancer,2013,NINDS,5R01NS070289-04,,Cytomegalovirus Gene Expression and Strain Variability in Glioma Pathogenesis,"SOROCEANU, LILIANA",CALIFORNIA PACIFIC MED CTR RES INSTITUTE,CA,"$358,965"
Brain Cancer,2013,NINDS,5R01NS055140-06,,Novel Immunotherapy of Glioma using miR-17-92 Transfected T Cells,"OKADA, HIDEHO",UNIVERSITY OF PITTSBURGH AT PITTSBURGH,PA,"$313,660"
Brain Cancer,2013,RMAP,5R03DA033980-02,,High-throughput screen for specific small-molecule inhibitors of HIF-2A activity,"KOH, MEI YEE",UT MD ANDERSON CANCER CTR,TX,"$3,950"
Brain Cancer,2013,NIAID,5R01AI082295-05,,Regulation of CXCR4 by cognate and non-cognate ligands,"LOLIS, ELIAS",YALE UNIVERSITY,CT,"$381,186"
Brain Cancer,2013,NCI,1U01CA172027-01,,Quantitative MRSI to predict early response to SAHA therapy in new GBM management,"SHIM, HYUNSUK",EMORY UNIVERSITY,GA,"$671,166"
Brain Cancer,2013,NCI,1R01CA173077-01,,In vivo imaging of encapsulated stem cells in mouse models of tumor resection,"SHAH, KHALID",MASSACHUSETTS GENERAL HOSPITAL,MA,"$334,659"
Brain Cancer,2013,NCI,1R01CA172392-01,,Mechanisms of PPM1D in medulloblastoma tumorigenesis and invasion,"CASTELLINO, ROBERT",EMORY UNIVERSITY,GA,"$323,700"
Brain Cancer,2013,NCI,1R01CA172845-01,,Metabolic Reprogramming in Brain Tumors,"RONEN, SABRINA",UNIVERSITY OF CALIFORNIA SAN FRANCISCO,CA,"$633,200"
Brain Cancer,2013,NINDS,5R01NS066955-04,,The Role of White Matter Progenitors in Glioma Formation and Progression,"CANOLL, PETER",COLUMBIA UNIVERSITY HEALTH SCIENCES,NY,"$333,064"
Brain Cancer,2013,NINDS,5R01NS077388-02,,Magnetic-vortex microdiscs for glioma therapy,"LESNIAK, MACIEJ",UNIVERSITY OF CHICAGO,IL,"$513,562"
Brain Cancer,2013,NCI,5P30CA014236-39,6408,Neuro-Oncology,"BIGNER, DARELL",DUKE UNIVERSITY,NC,"$26,285"
Brain Cancer,2013,NINDS,5R01NS065547-04,,NEUROFIBROMIN REGULATION OF NEURAL STEM CELL FUNCTION IN VITRO AND IN VIVO,"GUTMANN, DAVID",WASHINGTON UNIVERSITY,MO,"$314,445"
Brain Cancer,2013,NINDS,5R21NS078642-02,,Truncated NK1R in GBM: Pharmacology and Relationship with Patient Survival,"KWATRA, MADAN",DUKE UNIVERSITY,NC,"$189,381"
Brain Cancer,2013,NCI,1K99CA172695-01,,Noninvasive measurement of oncogenic signaling pathways with 89Zr-transferrin,"EVANS, MICHAEL",SLOAN-KETTERING INST CAN RES,NY,"$90,819"
Brain Cancer,2013,NCI,1K99CA172700-01,,Targeting glioma stem cells by perturbation of telomere maintenance mechanisms,"HU, JIAN",UT MD ANDERSON CANCER CTR,TX,"$119,491"
Brain Cancer,2013,NINDS,5R01NS037704-14,,Molecular Markers as Predictors of Outcome in Gliomas,"POLLACK, IAN",UNIVERSITY OF PITTSBURGH AT PITTSBURGH,PA,"$321,512"
Brain Cancer,2013,NINDS,5F31NS076269-02,,The PDGF alpha neural progenitor cells of the subventricular zone contributes to,"MOORE, LISAMARIE",UNIV OF MED/DENT OF NJ-NJ MEDICAL SCHOOL,NJ,"$42,232"
Brain Cancer,2013,NCI,1R03CA172923-01,,The Role of Post Traumatic Stress and Substance P in Melanoma Brain Metastasis,"TUN KYI, ADRIAN",BETH ISRAEL DEACONESS MEDICAL CENTER,MA,"$87,000"
Brain Cancer,2013,NCI,5R03CA165071-02,,Exploring the relationship of Vitamin D and childhood brain tumors,"BHATTI, PARVEEN",FRED HUTCHINSON CAN RES CTR,WA,"$82,720"
Brain Cancer,2013,NINDS,5R01NS074387-04,,Crosstalk between glioma cells & immune cells in the tumor microenvironment: Ther,"CASTRO, MARIA",UNIVERSITY OF MICHIGAN,MI,"$362,892"
Brain Cancer,2013,NINDS,5F31NS074713-02,,Cholesterol Homeostasis in Malignant Glioma,"KOLAR, ELIZABETH",HUGO W. MOSER RES INST KENNEDY KRIEGER,MD,"$42,232"
Brain Cancer,2013,NINDS,5P50NS020023-30,8624,TARGETED RADIOTHERAPHY OF BRAIN TUMORE USING MODULAR RECOMBINANT,"ZALUTSKY, MICHAEL",DUKE UNIVERSITY,NC,"$48,305"
Brain Cancer,2013,NINDS,5P50NS020023-30,8625,ENHANCING GLIOMA IMMUNOTHERAPY WITH TEMODAR-INDUCED LYMPHOPENIA AND A MULTIVALENT,"SAMPSON, JOHN",DUKE UNIVERSITY,NC,"$205,204"
Brain Cancer,2013,NINDS,5P50NS020023-30,8626,TRANSLATIONAL CLINICAL TRIALS FOR PRIMARY CNS TUMORS,"REARDON, DAVID",DUKE UNIVERSITY,NC,"$491,231"
Brain Cancer,2013,NINDS,5P50NS020023-30,8627,"IND, REGULATORY AND BIOINFORMATICS","BIGNER, DARELL",DUKE UNIVERSITY,NC,"$150,976"
Brain Cancer,2013,NINDS,5P50NS020023-30,8628,"BRAIN TUMOR BIOREPOSITORY, HISTOPATHOLOGY, AND IMMUNOLOGIC MONITORING","MCLENDON, ROGER",DUKE UNIVERSITY,NC,"$175,064"
Brain Cancer,2013,NINDS,5P50NS020023-30,8629,ADMINISTRATIVE CORE,"BIGNER, DARELL",DUKE UNIVERSITY,NC,"$131,088"
Brain Cancer,2013,NINDS,5R01NS044687-30,,Opening of the blood-brain barrier to antitumor agents,"NEUWELT, EDWARD",OREGON HEALTH & SCIENCE UNIVERSITY,OR,"$600,336"
Brain Cancer,2013,NINDS,5R01NS032677-21,,Genetically Engineered Viruses for Brain Tumor Therapy,"MARTUZA, ROBERT",MASSACHUSETTS GENERAL HOSPITAL,MA,"$356,869"
Brain Cancer,2013,NINDS,5F31NS079047-02,,Merlin regulation of spinal cord NSC function,"GARCIA, CYNTHIA",WASHINGTON UNIVERSITY,MO,"$28,480"
Brain Cancer,2013,NCI,1R01CA173593-01,,Comprehensive Evaluation of OGSE DWI for Assessing Tumor Treatment Response,"GORE, JOHN",VANDERBILT UNIVERSITY MED CTR,TN,"$258,960"
Brain Cancer,2013,NCI,5R01CA075080-15,,"Cancer-Associated, Interdependent Regulation of mTOR, AKT, and IKK/NF-kappaB","BALDWIN, ALBERT",UNIV OF NORTH CAROLINA CHAPEL HILL,NC,"$277,527"
Brain Cancer,2013,NCI,5R01CA138922-04,,Developing diagnostic and therapeutic stem cells for cancer therapy,"SHAH, KHALID",MASSACHUSETTS GENERAL HOSPITAL,MA,"$332,994"
Brain Cancer,2013,NCI,5R01CA133322-05,,Strategies to improve the antiglioma action of IFN-?: a role for NF-kB inhibition,"PFEFFER, LAWRENCE",UNIVERSITY OF TENNESSEE HEALTH SCI CTR,TN,"$477,152"
Brain Cancer,2013,NCI,5R01CA131313-05,,Genetic Mouse Models of Glioma,"PARADA, LUIS",UT SOUTHWESTERN MEDICAL CENTER,TX,"$365,222"
Brain Cancer,2013,NINDS,5K08NS077978-02,,Aerobic glycolysis regulates apoptosis in neurogenesis and medulloblastoma,"GERSHON, TIMOTHY",UNIV OF NORTH CAROLINA CHAPEL HILL,NC,"$176,618"
Brain Cancer,2013,NCI,5R01CA135329-05,,MRI Biomarkers of Response in Cerebral Tumors,"EWING, JAMES",HENRY FORD HEALTH SYSTEM,MI,"$288,525"
Brain Cancer,2013,NIGMS,5R01GM095948-03,,Control of Hedgehog Signal Transduction by Neuropilin,"SCOTT, MATTHEW",STANFORD UNIVERSITY,CA,"$290,750"
Brain Cancer,2013,NIGMS,2R01GM049500-15A1,,Differential Mapping of Stem Cells in Tumors,"LUBMAN, DAVID",UNIVERSITY OF MICHIGAN,MI,"$290,114"
Brain Cancer,2013,NCI,5R01CA158534-02,,Targeting the JAK/STAT-3 Pathway Signaling Axis in Glioma,"BENVENISTE, ETTY",UNIVERSITY OF ALABAMA AT BIRMINGHAM,AL,"$285,749"
Brain Cancer,2013,NCI,5R01CA163834-02,,Mechanisms of Metabolic Gene Mutations in Cancer,"XIONG, YUE",UNIV OF NORTH CAROLINA CHAPEL HILL,NC,"$288,674"
Brain Cancer,2013,NCI,5R01CA138437-04,,Improving Delivery of Molecularly-Targeted Therapy to Invasive Glioma Cells,"ELMQUIST, WILLIAM",UNIVERSITY OF MINNESOTA,MN,"$288,640"
Brain Cancer,2013,NCI,2R01CA111996-06A1,,Quantification of Tumor Malignancy with MRI,"BOADA, FERNANDO",NEW YORK UNIVERSITY SCHOOL OF MEDICINE,NY,"$281,688"
Brain Cancer,2013,NCI,5R21CA164935-02,,Ultrasound-assisted convection-enhanced drug delivery to the brain,"OLBRICHT, WILLIAM",CORNELL UNIVERSITY,NY,"$152,752"
Brain Cancer,2013,NINDS,5R01NS070024-04,,Role of NKCC1 on Brain Tumor Stem Cell Migration After EGF and Slit-2 Stimulation,"QUINONES-HINOJOSA, ALFREDO",JOHNS HOPKINS UNIVERSITY,MD,"$464,279"
Brain Cancer,2013,NCI,1R01CA166171-01A1,,Academic-Industrial Partnership to Develop Clinical Brain Cancer Imaging,"ZHOU, JINYUAN",JOHNS HOPKINS UNIVERSITY,MD,"$491,404"
Brain Cancer,2013,NCI,2R01CA047135-23A1,,Merging Marine-Derived Cytotoxic Natural Products With Experimental Therapeutics,"CREWS, PHIL",UNIVERSITY OF CALIFORNIA SANTA CRUZ,CA,"$678,352"
Brain Cancer,2013,NCI,1R01CA163722-01A1,,Defining mechanisms of extracellular communication for cancer therapy,"VAN MEIR, ERWIN",EMORY UNIVERSITY,GA,"$323,700"
Brain Cancer,2013,NCI,1R01CA166413-01A1,,Mechanisms and Function of Autophagy in Cancer,"JIANG, XUEJUN",SLOAN-KETTERING INST CAN RES,NY,"$366,860"
Brain Cancer,2013,NCI,1R01CA166379-01A1,,MR-Guided Precision Conformal Ablation Therapy for Brain Tumors,"FISCHER, GREGORY",WORCESTER POLYTECHNIC INSTITUTE,MA,"$652,276"
Brain Cancer,2013,NCI,1R01CA160593-01A1,,Survival Bump Hunting for Finding Informative Subgroups in High Dimensional Data.,"RAO, J",UNIVERSITY OF MIAMI SCHOOL OF MEDICINE,FL,"$268,926"
Brain Cancer,2013,NINDS,5R01NS078092-02,,A Novel Model of Medulloblastoma to Define Cancer Pathways and Molecular Targets,"LU, QING",UT SOUTHWESTERN MEDICAL CENTER,TX,"$335,639"
Brain Cancer,2013,NCI,1R03CA167695-01A1,,Investigating MicroRNAs and Their Regulatory Networks in Glioblastoma,"ZHAO, ZHONGMING",VANDERBILT UNIVERSITY MED CTR,TN,"$78,041"
Brain Cancer,2013,NCI,5R01CA084469-14,,CpG methylation and mutation,"PFEIFER, GERD",CITY OF HOPE/BECKMAN RESEARCH INSTITUTE,CA,"$266,077"
Brain Cancer,2013,NCI,5R01CA133483-05,,Radiation-induced brain injury and cognitive dysfunction in aging rats,"RIDDLE, DAVID",WAKE FOREST UNIVERSITY HEALTH SCIENCES,NC,"$297,989"
Brain Cancer,2013,NCI,5R01CA057683-20,,Toward  a molecular classification of human gliomas,"LOUIS, DAVID",MASSACHUSETTS GENERAL HOSPITAL,MA,"$283,710"
Brain Cancer,2013,NCI,5U01CA137443-05,,Adult Brain Tumor Consortium (ABTC),"GROSSMAN, STUART",JOHNS HOPKINS UNIVERSITY,MD,"$1,698,364"
Brain Cancer,2013,NCI,5R01CA116708-09,,Cath B and uPAR si RNA constructs regressed glioma growth,"O'BRYAN, JOHN",UNIVERSITY OF ILLINOIS,IL,"$310,632"
Brain Cancer,2013,NCI,5R01CA138409-05,,Inhibition of matrix proteases to sensitize medulloblastoma cells to radiation,"GARTEL, ANDREI",UNIVERSITY OF ILLINOIS,IL,"$297,042"
Brain Cancer,2013,NCI,5R01CA052689-23,,Genetic and molecular epidemiology of adult glioma,"WRENSCH, MARGARET",UNIVERSITY OF CALIFORNIA SAN FRANCISCO,CA,"$1,345,020"
Brain Cancer,2013,NINDS,5K08NS072234-03,,Mechanisms of Chemotherapy Induced Cognitive Defects,"BOTA, DANIELA",UNIVERSITY OF CALIFORNIA IRVINE,CA,"$175,068"
Brain Cancer,2013,NIAID,5R01AI048034-14,,Regulation of NF-Kappa B,"VERMA, INDER",SALK INSTITUTE FOR BIOLOGICAL STUDIES,CA,"$672,082"
Brain Cancer,2013,NCI,5R01CA149107-03,,Regulation of Asymmetric Cellular Division in Glioma Stem Cells,"BRAT, DANIEL",EMORY UNIVERSITY,GA,"$368,948"
Brain Cancer,2013,NCI,5R01CA149128-03,,CED of Nanoparticles Loading with Novel Agents for Improved Treatment of Gliomas,"SALTZMAN, W",YALE UNIVERSITY,CT,"$290,527"
Brain Cancer,2013,NCI,5P01CA087634-10,7889,Early Estimation of Breat Tumor Response to Therapy,"MEYER, CHARLES",UNIVERSITY OF MICHIGAN,MI,"$196,419"
Brain Cancer,2013,NCI,5R01CA122759-05,,"Stem Cells, Progenitors, and the Origin of Medulloblastoma","WECHSLER-REYA, ROBERT",SANFORD-BURNHAM MEDICAL RESEARCH INSTIT,CA,"$361,979"
Brain Cancer,2013,NCI,5R01CA160216-02,,Understanding Mechanisms of Resistance to Anti-angiogenic Treatments,"ARBAB, ALI",HENRY FORD HEALTH SYSTEM,MI,"$434,211"
Brain Cancer,2013,NCI,5R01CA160965-02,,5-hydroxymethylcytosine in human cancer,"PFEIFER, GERD",CITY OF HOPE/BECKMAN RESEARCH INSTITUTE,CA,"$327,684"
Brain Cancer,2013,NCI,5R01CA150355-04,,CD44 Antagonists in Targeted and Combinational Therapy for Glioblastoma,"YU, QIN",MOUNT SINAI SCHOOL OF MEDICINE,NY,"$18,455"
Brain Cancer,2013,NCI,5R01CA129541-07,,An Investigation of Radial Glia as the Source of Ependymoma Stem Cells,"GILBERTSON, RICHARD",ST. JUDE CHILDREN'S RESEARCH HOSPITAL,TN,"$303,174"
Brain Cancer,2013,NCI,5R01CA140220-04,,Lysophospholipids in Radiation Induced Signal Transduction in Malignant Gliomas,"HALLAHAN, DENNIS",WASHINGTON UNIVERSITY,MO,"$287,582"
Brain Cancer,2013,NCI,5R01CA133571-04,,Coordinately regulated alternative splicing in DNA damage and cancer,"CHANDLER, DAWN",RESEARCH INST NATIONWIDE CHILDREN'S HOSP,OH,"$245,202"
Brain Cancer,2013,NINDS,5F31NS074638-03,,Role of genome organizer Satb1 in Shh-dependent proliferation and tumorigenesis,"CHENG, FRANCES",VANDERBILT UNIVERSITY MED CTR,TN,"$26,906"
Brain Cancer,2013,NCI,5R01CA154710-03,,The Role of the PI3K-AKT Pathway in Melanoma Brain Metastasis,"DAVIES, MICHAEL",UT MD ANDERSON CANCER CTR,TX,"$308,179"
Brain Cancer,2013,OD,1S10OD010344-01A1,,Vevo LAZR Photoacoustic and Ultrasound Imaging System,"GAMBHIR, SANJIV",STANFORD UNIVERSITY,CA,"$521,938"
Brain Cancer,2013,OD,1S10OD016316-01,,Leica LMD 7000 Laser Capture Microdissection Microscope,"JANZ, SIEGFRIED",UNIVERSITY OF IOWA,IA,"$216,933"
Brain Cancer,2013,NCI,5R01CA138517-04,,Characterizing the Role of NF-kB in Promoting Glioma Tumorigenicity,"NOZELL, SUSAN",UNIVERSITY OF ALABAMA AT BIRMINGHAM,AL,"$280,641"
Brain Cancer,2013,NCI,1R01CA167413-01A1,,Molecular Fluorescence-Guided Surgery Platform,"POGUE, BRIAN",DARTMOUTH COLLEGE,NH,"$568,695"
Brain Cancer,2013,NCI,5R01CA138643-03,,Optical Imaging of Chemotherapy for Brain Tumors,"JOSHI, SHAILENDRA",COLUMBIA UNIVERSITY HEALTH SCIENCES,NY,"$451,634"
Brain Cancer,2013,NCI,5R01CA142823-04,,"IR signaling through PP6, a potential molecular target for radiosensitization","LARNER, JAMES",UNIVERSITY OF VIRGINIA,VA,"$327,788"
Brain Cancer,2013,NCI,5R21CA166853-02,,Tissue-specific Roles of Axin in Canonical Wnt Signaling and Tumorigenesis,"ANDERSON, KATHRYN",SLOAN-KETTERING INST CAN RES,NY,"$186,970"
Brain Cancer,2013,NCI,5F32CA168330-02,,Role of Ascl1 in glioma,"VUE, TOU YIA",UT SOUTHWESTERN MEDICAL CENTER,TX,"$52,190"
Brain Cancer,2013,NIGMS,5R01GM098643-02,,Comparative HTS to identify small molecule effectors of cell fate specification,"RYDER, SEAN",UNIV OF MASSACHUSETTS MED SCH WORCESTER,MA,"$298,436"
Brain Cancer,2013,NINDS,5R01NS071197-03,,Stem cell mediated targeting of tumor cells and associated vasculature in gliomas,"SHAH, KHALID",MASSACHUSETTS GENERAL HOSPITAL,MA,"$365,329"
Brain Cancer,2013,NINDS,5R01NS063971-05,,Detecting invading glioma cells through in vivo molecular imaging of the cell sur,"BRADY-KALNAY, SUSANN",CASE WESTERN RESERVE UNIVERSITY,OH,"$354,264"
Brain Cancer,2013,NINDS,5R01NS072414-03,,RNAi screen of the glioblastoma stem cell kinome under hypoxia and normoxia,"COCHRAN, BRENT",TUFTS UNIVERSITY BOSTON,MA,"$348,305"
Brain Cancer,2013,NCI,5R21CA161704-02,,"Inhibiting glioma dispersal using non-toxic, natural products","KUO, JOHN",UNIVERSITY OF WISCONSIN-MADISON,WI,"$184,618"
Brain Cancer,2013,NINDS,5R21NS075509-02,,Osteopontin-mediated invasion and dissemination in central nervous system lymphom,"TUN, HAN",MAYO CLINIC  JACKSONVILLE,FL,"$186,969"
Brain Cancer,2013,NCI,5R01CA122617-08,,Regulatory mechanisms and role of the PI3K-TSC-mTOR signaling network in tumors,"MANNING, BRENDAN",HARVARD UNIVERSITY (SCH OF PUBLIC HLTH),MA,"$242,810"
Brain Cancer,2013,NCI,5R01CA159324-03,,Preoperative Image Updating for Guidance During Brain Tumor Resection,"PAULSEN, KEITH",DARTMOUTH COLLEGE,NH,"$488,775"
Brain Cancer,2013,NCI,5U01CA081457-15,,Pediatric Brain Tumor Consortium (PBTC),"BOYETT, JAMES",ST. JUDE CHILDREN'S RESEARCH HOSPITAL,TN,"$2,089,813"
Brain Cancer,2013,NCI,5R01CA135038-05,,Autophagy in Brain Tumor,"YANG, JIN-MING",PENNSYLVANIA STATE UNIVERSITY,PA,"$304,364"
Brain Cancer,2013,NCI,5R21CA167302-02,,Inhibition of Autophagy Enhances Anti-Angiogenic Efficacy in Intracranial Glioma,"PIKE, MARTIN",OREGON HEALTH & SCIENCE UNIVERSITY,OR,"$157,427"
Brain Cancer,2013,NCI,5P01CA142536-03,8357,Druggable Genetic Lesions in Pediatric Astrocytoma,"HAHN, WILLIAM",DANA-FARBER CANCER INST,MA,"$311,514"
Brain Cancer,2013,NCI,5P01CA142536-03,8358,Olig2 Antagonists for  Targeted Therapy of Pediatric Astrocytomas,"STILES, CHARLES",DANA-FARBER CANCER INST,MA,"$317,459"
Brain Cancer,2013,NCI,5P01CA142536-03,8359,Specialized Niches for Pediatric Astrocytoma Cells,"SEGAL, ROSALIND",DANA-FARBER CANCER INST,MA,"$337,627"
Brain Cancer,2013,NCI,5P01CA142536-03,8360,Shared Resources Core,"LIGON, KEITH",DANA-FARBER CANCER INST,MA,"$301,946"
Brain Cancer,2013,NCI,5P01CA142536-03,8361,Administrative Core,"SEGAL, ROSALIND",DANA-FARBER CANCER INST,MA,"$228,444"
Brain Cancer,2013,NCI,1P01CA163205-01A1,7345,Development of a Novel Class of Highly Specific and Effective Oncolytic HSV Vect,"GLORIOSO, JOSEPH",UNIVERSITY OF PITTSBURGH,PA,"$332,981"
Brain Cancer,2013,NCI,1P01CA163205-01A1,7346,Intracellular Host Tumor Responses to oHSVs and Avenues to Overcome These,"CHIOCCA, E.",OHIO STATE UNIVERSITY,OH,"$342,662"
Brain Cancer,2013,NCI,1P01CA163205-01A1,7347,The Tumor Microenvironmental Barrier to Effective Viral Oncolysis,"KAUR, BALVEEN",OHIO STATE UNIVERSITY,OH,"$317,159"
Brain Cancer,2013,NCI,1P01CA163205-01A1,7348,NK Innate Immunity and Oncolytic Virus Therapy,"CALIGIURI, MICHAEL",OHIO STATE UNIVERSITY,OH,"$312,775"
Brain Cancer,2013,NCI,1P01CA163205-01A1,7349,Administration and Biostatistics Core,"CHIOCCA, E.",OHIO STATE UNIVERSITY,OH,"$132,705"
Brain Cancer,2013,NCI,1P01CA163205-01A1,7350,Pre-Clinical Vector Production Core,"GOINS, WILLIAM",UNIVERSITY OF PITTSBURGH,PA,"$134,980"
Brain Cancer,2013,NCI,1P01CA163205-01A1,7351,Malignant Gliomas Biorepository Core,"NAKANO, ICHIRO",OHIO STATE UNIVERSITY,OH,"$148,663"
Brain Cancer,2013,NCI,5R01CA150153-03,,Enhancing Viral Oncolysis with Vasculostatin Gene Delivery,"KAUR, BALVEEN",OHIO STATE UNIVERSITY,OH,"$380,007"
Brain Cancer,2013,NCI,5R01CA116020-07,,Inhibitor-sensitive and -resistant EGFR mutants from lung cancer and glioblastoma,"ECK, MICHAEL",DANA-FARBER CANCER INST,MA,"$307,204"
Brain Cancer,2013,NINDS,5R01NS052563-06,,Neural Progenitor Genes and Brain Tumors,"KORNBLUM, HARLEY",UNIVERSITY OF CALIFORNIA LOS ANGELES,CA,"$325,085"
Brain Cancer,2013,NINDS,5R01NS066278-04,,Role of MELK in glioblastomas,"TERSKIKH, ALEXEY",SANFORD-BURNHAM MEDICAL RESEARCH INSTIT,CA,"$393,223"
Brain Cancer,2013,NINDS,5R01NS070315-04,,Molecular Targeting of L1CAM to Inhibit Glioblastoma Stem Cell Invasion,"BAO, SHIDENG",CLEVELAND CLINIC LERNER COM-CWRU,OH,"$324,789"
Brain Cancer,2013,NCI,5R01CA138587-05,,Regulatory T Cells in Malignant Glioma,"LESNIAK, MACIEJ",UNIVERSITY OF CHICAGO,IL,"$295,150"
Brain Cancer,2013,NCI,1R01CA166172-01A1,,Indirubins: novel anti-invasive and anti-angiogenic drugs for malignant gliomas,"CHIOCCA, E.",BRIGHAM AND WOMEN'S HOSPITAL,MA,"$365,719"
Brain Cancer,2013,NCI,1R01CA167967-01A1,,Identification of Melanoma Brain Metastasis Tumor Biomarkers,"HOON, DAVE",JOHN WAYNE CANCER INSTITUTE,CA,"$382,423"
