Category,FY,Funding IC,Project Number,Sub Project #,Project Title,PI Name,Org Name,State / Country,Amount
Breast Cancer,2010,NCI,5R01CA135380-02,,Small-molecule Inhibition of the Interactions of the Urokinase Receptor:  A Targe,"MEROUEH, SAMY",INDIANA UNIV-PURDUE UNIV AT INDIANAPOLIS,IN,"$255,640"
Breast Cancer,2010,NCI,5R01CA125636-04,,The Fanconi Anemia-BRCA Pathway And Chemosensitivity of Human Cancer,"TANIGUCHI, TOSHIYASU",FRED HUTCHINSON CANCER RESEARCH CENTER,WA,"$320,565"
Breast Cancer,2010,NIBIB,5R01EB002109-13,,Multi-Spectral Parallel-Plate Diffuse Optical Breast Tomography,"YODH, ARJUN",UNIVERSITY OF PENNSYLVANIA,PA,"$506,153"
Breast Cancer,2010,NCI,7R01CA129359-04,,Integrin-Mediated Regulation of TGF-Beta Signaling and Tumorigenesis,"SCHIEMANN, WILLIAM",CASE WESTERN RESERVE UNIVERSITY,OH,"$298,300"
Breast Cancer,2010,NCI,5R21CA140841-02,,Improving the Specificity of Dynamic MRI in Breast Cancer Diagnosis,"SHEN, DINGGANG",UNIVERSITY OF NORTH CAROLINA CHAPEL HILL,NC,"$195,360"
Breast Cancer,2010,NCI,5R01CA129561-02,,Dedicated High-Performance Breast PET/CT,"BADAWI, RAMSEY",UNIVERSITY OF CALIFORNIA DAVIS,CA,"$705,048"
Breast Cancer,2010,NHLBI,5R01HL088649-03,,Signal Transduction in the Heart after Cancer Therapy,"GABRIELSON, KATHLEEN",JOHNS HOPKINS UNIVERSITY,MD,"$410,000"
Breast Cancer,2010,NCI,5R01CA121211-04,,Dietary Chemopreventive Components/Oncogene Interaction and Cancer,"ZHANG, RUIWEN",UNIVERSITY OF ALABAMA AT BIRMINGHAM,AL,"$275,500"
Breast Cancer,2010,NCI,5U10CA035101-25,,Iowa Oncology Research Association,"BEHRENS, ROBERT",IOWA ONCOLOGY RESEARCH ASSOCIATION,IA,"$685,544"
Breast Cancer,2010,NCI,5R01CA094196-06,,Development of a PEM-PET-CT Breast Imaging and Biopsy Device,"RAYLMAN, RAYMOND",WEST VIRGINIA UNIVERSITY,WV,"$469,195"
Breast Cancer,2010,NCI,5R01CA140667-02,,Small Molecule Inhibitors of the Transcriptional Activators ESX and NF-kB,"MAPP, ANNA",UNIVERSITY OF MICHIGAN AT ANN ARBOR,MI,"$305,815"
Breast Cancer,2010,NCI,5R01CA131333-03,,WISER Sister,"SCHMITZ, KATHRYN",UNIVERSITY OF PENNSYLVANIA,PA,"$655,705"
Breast Cancer,2010,NCI,5R01CA109355-05,,Functions of Histone Ubiquitination and Methylation,"SUN, ZU-WEN",VANDERBILT UNIVERSITY,TN,"$238,105"
Breast Cancer,2010,NCI,5R01CA122756-03,,Cell Cycle/Apoptosis Gene Variants and Breast Cancer Risk,"CAI, QIUYIN",VANDERBILT UNIVERSITY,TN,"$541,925"
Breast Cancer,2010,NCI,5R01CA077876-14,,Genetic Susceptibility of Estrogen Induced Mammary Cancer,"SHULL, JAMES",UNIVERSITY OF WISCONSIN MADISON,WI,"$358,672"
Breast Cancer,2010,NCI,5R01CA140296-02,,Identification of Novel Cancer Selective Compounds in 3D Tumor Organoid Assays,"SIGMAN, MATTHEW",UNIVERSITY OF UTAH,UT,"$312,288"
Breast Cancer,2010,NCI,7R01CA127650-04,,Korean Immigrants & Mammography-Culture-Specific Health Intervention (KIM-CHI),"LEE, EUNICE",UNIVERSITY OF CALIFORNIA LOS ANGELES,CA,"$307,483"
Breast Cancer,2010,NCI,5R01CA066163-16,,CD44/Variant Cytoskeleton in Breast Cancer Progression,"BOURGUIGNON, LILLY",NORTHERN CALIFORNIA INSTITUTE RES & EDUC,CA,"$243,832"
Breast Cancer,2010,NCI,5R01CA135179-02,,INTERNET DECISION SUPPORT FOR BRCA1/BRCA2 CARRIERS,"SCHWARTZ, MARC",GEORGETOWN UNIVERSITY,DC,"$438,917"
Breast Cancer,2010,NCI,5F32CA130329-03,,Tumor-stroma interactions during metastasis,"MASON, STEVEN",SLOAN-KETTERING INSTITUTE FOR CANCER RES,NY,"$52,154"
Breast Cancer,2010,NCI,5R01CA125455-03,,Mindfulness Based Stress Reduction for Psycho-Immune Dysregulation in Cancer,"MATHEWS, HERBERT",LOYOLA UNIVERSITY CHICAGO,IL,"$472,673"
Breast Cancer,2010,NCI,5R01CA025836-31,,Radiopharmaceuticals for Breast Tumor Imaging and Therapy,"KATZENELLENBOGEN, JOHN",UNIVERSITY OF ILLINOIS URBANA-CHAMPAIGN,IL,"$438,152"
Breast Cancer,2010,NCI,5U10CA107612-07,,Minority Based Community Clinical Oncology Program at Meharry Medical College,"WOLFF, STEVEN",MEHARRY MEDICAL COLLEGE,TN,"$277,506"
Breast Cancer,2010,NCI,5R01CA098787-06,,ANTICANCER DRUG DISCOVERY THAT TARGETS TUMOR HYPOXIA,"NAGLE, DALE",UNIVERSITY OF MISSISSIPPI,MS,"$270,237"
Breast Cancer,2010,NCI,5R01CA138993-02,,Glycolipid-anchored cytokines as breast cancer membrane vaccine adjuvants,"SELVARAJ, PERIASAMY",EMORY UNIVERSITY,GA,"$321,625"
Breast Cancer,2010,NCI,5R42CA123932-04,,Tendrils: A Multimedia Intervention for Women's Sexual Dysfunction after Cancer,"SCHOVER, LESLIE","DIGITAL SCIENCE TECHNOLOGIES, LLC",PA,"$328,230"
Breast Cancer,2010,NICHD,5R01HD007857-39,,Sex Hormone Receoptor Components and the Cell Genome,"O'MALLEY, BERT",BAYLOR COLLEGE OF MEDICINE,TX,"$465,223"
Breast Cancer,2010,NCCAM,1R01AT005873-01,,Breast Cancer Integrative Oncology: Prospective Matched Controlled Outcomes Study,"STANDISH, LEANNA",BASTYR UNIVERSITY,WA,"$593,668"
Breast Cancer,2010,NCI,5R01CA097085-09,,MOLECULAR MECHANISMS OF TUMOR-INDUCED TOLERANCE,"CHEN, LIEPING",JOHNS HOPKINS UNIVERSITY,MD,"$363,450"
Breast Cancer,2010,NCI,5R01CA091713-08,,"Combined Digital X-Ray, Optical, and Ultrasound Breast Imaging","CARSON, PAUL",UNIVERSITY OF MICHIGAN AT ANN ARBOR,MI,"$799,846"
Breast Cancer,2010,NCI,5R01CA136658-02,,NR1D1 pathway in breast cancer,"CONKLIN, DOUGLAS",STATE UNIVERSITY OF NEW YORK AT ALBANY,NY,"$314,363"
Breast Cancer,2010,NCI,5R00CA127462-05,,Role of Cancer Stem Cells in Malignant Progression of Ductal Carcinoma in Situ.,"BEHBOD, FARIBA",UNIVERSITY OF KANSAS MEDICAL CENTER,KS,"$249,000"
Breast Cancer,2010,NCI,5R01CA138804-02,,Role of PALB2 in the DNA damage response and breast cancer suppression,"XIA, BING",UNIV OF MED/DENT NJ-R W JOHNSON MED SCH,NJ,"$323,700"
Breast Cancer,2010,NCI,5R01CA127258-04,,The BCA2 Ubiquitin E3 Ligase as a Target in Breast Cancer,"BURGER, ANGELIKA",WAYNE STATE UNIVERSITY,MI,"$237,232"
Breast Cancer,2010,NCI,5R01CA120003-03,,Integrated Biochip Sensors for Detection of Cancer,"BASHIR, RASHID",UNIVERSITY OF ILLINOIS URBANA-CHAMPAIGN,IL,"$522,748"
Breast Cancer,2010,NCI,5R01CA115267-05,,2D Silicon Transducer Compression Plates for Breast Ultrasound,"THOMENIUS, KAI",GENERAL ELECTRIC GLOBAL RESEARCH CTR,NY,"$825,643"
Breast Cancer,2010,NCI,5R01CA133049-03,,Tamoxifen biotransformation pathway pharmacogenomics,"GOETZ, MATTHEW",MAYO CLINIC,MN,"$257,715"
Breast Cancer,2010,NCI,5R01CA118384-05,,Mechanisms of Receptor Tyrosine Kinase Inhibition,"SWEENEY, COLLEEN",UNIVERSITY OF CALIFORNIA DAVIS,CA,"$209,581"
Breast Cancer,2010,NCI,5R03CA139548-02,,The Vitamin D Pathway and Mammographic Breast Density in Postmenopausal Women,"TRENTHAM-DIETZ, AMY",UNIVERSITY OF WISCONSIN MADISON,WI,"$73,474"
Breast Cancer,2010,NCI,5R21CA133884-02,,"A Neoadjuvant Trial of Anastrazole and A Novel SRC Inhibitor, AZD0530, for LABC","SLINGERLAND, JOYCE",UNIVERSITY OF MIAMI SCHOOL OF MEDICINE,FL,"$297,018"
Breast Cancer,2010,NCI,5R21CA134813-02,,Stress management and vaccine response among women at risk for breast cancer,"MCGREGOR, BONNIE",FRED HUTCHINSON CANCER RESEARCH CENTER,WA,"$271,040"
Breast Cancer,2010,NCI,5R01CA120120-04,,Admixture Mapping for Breast Cancer in Latinas,"ZIV, ELAD",UNIVERSITY OF CALIFORNIA SAN FRANCISCO,CA,"$559,501"
Breast Cancer,2010,NCI,5R01CA124558-03,,Genetic Factors for Breast Cancer- A genome Wide Study,"ZHENG, WEI",VANDERBILT UNIVERSITY,TN,"$630,840"
Breast Cancer,2010,NIDDK,5R01DK084055-02,,Molecular mechanisms of fatty liver disease: role of the protein DBC1,"CHINI, EDUARDO",MAYO CLINIC,MN,"$373,973"
Breast Cancer,2010,NCI,5R01CA134460-03,,"Serum 25(OH)D, Vitamin D Intake, and Breast Cancer Recurrence in the WHEL Study","JACOBS, ELIZABETH",UNIVERSITY OF ARIZONA,AZ,"$196,177"
Breast Cancer,2010,NCI,5R01CA125112-03,,"Role of iNOS, Nitric Oxide & Arginase in Statin-Mediated Toxicity in Cancer Cells","KALYANARAMAN, BALARAMAN",MEDICAL COLLEGE OF WISCONSIN,WI,"$314,363"
Breast Cancer,2010,NCI,5U10CA069974-15,,Clinical Oncology Program Biostatistical Center,"COSTANTINO, JOSEPH",UNIVERSITY OF PITTSBURGH AT PITTSBURGH,PA,"$4,011,354"
Breast Cancer,2010,NIEHS,5U01ES015986-04,,Environmental Epigenetics and Stem/Progenitor Cell Injury,"HUANG, TIM",OHIO STATE UNIVERSITY,OH,"$386,424"
Breast Cancer,2010,NIEHS,5U01ES016003-04,,Genomic and Proteomic Biomarkers of Biological Responses to Exposure,"LAMARTINIERE, CORAL",UNIVERSITY OF ALABAMA AT BIRMINGHAM,AL,"$471,237"
Breast Cancer,2010,NCI,5R01CA096710-07,,Role of NFAT and NFAT-Induced Genes in Carcinoma,"TOKER, ALEX",BETH ISRAEL DEACONESS MEDICAL CENTER,MA,"$304,354"
Breast Cancer,2010,NCI,7R01CA118306-03,,"ATF3, a stress-inducible gene, in tumorigenesis and metastasis","HAI, TSONWIN",OHIO STATE UNIVERSITY,OH,"$255,000"
Breast Cancer,2010,NCI,5R01CA126618-08,,Role of Protein S14 in Normal and Neoplastic Mammary Gland,"KINLAW, WILLIAM",DARTMOUTH COLLEGE,NH,"$252,803"
Breast Cancer,2010,NCI,5R01CA124940-04,,SHP2-Mediated Synergy Between EGFR/HER2 and Beta Catenin in Breast Oncogenesis,"AGAZIE, YEHENEW",WEST VIRGINIA UNIVERSITY,WV,"$250,515"
Breast Cancer,2010,NCI,5R01CA090744-09,,Human aldo-keto reductases and nuclear receptor action,"PENNING, TREVOR",UNIVERSITY OF PENNSYLVANIA,PA,"$254,602"
Breast Cancer,2010,NCI,5R01CA136590-02,,Development of The Prairie Technologies MPLSM to image cancer models in vivo,"KEELY, PATRICIA",UNIVERSITY OF WISCONSIN MADISON,WI,"$494,615"
Breast Cancer,2010,NCI,5R01CA131990-03,,Proteolytic Pathways in Progression of Pre-Malignant Breast Disease,"SLOANE, BONNIE",WAYNE STATE UNIVERSITY,MI,"$317,972"
Breast Cancer,2010,NCI,7R01CA141090-02,,Informatics methods for identifying breast cancer control genes and proteins,"PARVIN, JEFFREY",OHIO STATE UNIVERSITY,OH,"$457,200"
Breast Cancer,2010,NICHD,5R01HD058614-03,,Regulation of Cellular Zn Redistribution:  A Role of ZnT2,"KELLEHER, SHANNON",PENNSYLVANIA STATE UNIVERSITY-UNIV PARK,PA,"$349,937"
Breast Cancer,2010,NIGMS,5R01GM026782-33,,Natural Products Synthesis via Cycloaddition Reactions,"ROUSH, WILLIAM",SCRIPPS FLORIDA,FL,"$406,331"
Breast Cancer,2010,NCI,5R01CA129769-02,,OLDER BREAST CANCER PATIENTS: RISK FOR COGNITIVE DECLINE,"MANDELBLATT, JEANNE",GEORGETOWN UNIVERSITY,DC,"$833,064"
Breast Cancer,2010,NCI,5R41CA137960-02,,Iron oxide nanoparticle probes for target specific MR molecular imaging,"WANG, Y","OCEAN NANOTECH, LLC",AR,"$242,892"
Breast Cancer,2010,NCI,5U10CA045450-24,,Atlanta Regional Community Clinical Oncology Program (ARCCOP),"SEAY, THOMAS",ST. JOSEPH'S HOSPITAL,GA,"$499,999"
Breast Cancer,2010,NCI,5R01CA125152-04,,Breast Cancer Chemoprevention Potential of Common Spices,"GUPTA, RAMESH",UNIVERSITY OF LOUISVILLE,KY,"$281,200"
Breast Cancer,2010,NIBIB,5R01EB002138-08,,Breast CT scanner for earlier cancer detection,"BOONE, JOHN",UNIVERSITY OF CALIFORNIA DAVIS,CA,"$1,117,004"
Breast Cancer,2010,NCI,5R01CA097098-08,,Oncogenic Signaling by DF3/MUC1 in Human Breast Cancer,"KUFE, DONALD",DANA-FARBER CANCER INSTITUTE,MA,"$369,968"
Breast Cancer,2010,NIEHS,5R01ES015739-04,,P53-dependent responses to toxicants in parous and nulliparous breast,"JERRY, D",UNIVERSITY OF MASSACHUSETTS AMHERST,MA,"$360,179"
Breast Cancer,2010,NCI,5K01CA109567-05,,New Strategies for Photoimmunodetection/therapy,"SAVELLANO, MARK",DARTMOUTH COLLEGE,NH,"$165,779"
Breast Cancer,2010,NIBIB,5R01EB007966-03,,A Boundary Element Method for MRI/NIR Tomography and Image-guided Fluorescence,"SRINIVASAN, SUBHADRA",DARTMOUTH COLLEGE,NH,"$363,886"
Breast Cancer,2010,NCI,5R01CA140959-02,,Enabling family communication about cancer - Do you know your Kin Facts?,"BODURTHA, JOANN",VIRGINIA COMMONWEALTH UNIVERSITY,VA,"$306,279"
Breast Cancer,2010,NCI,1R21CA147967-01,,Label free imaging of blood smears and tissue biopsies,"POPESCU, GABRIEL",UNIVERSITY OF ILLINOIS URBANA-CHAMPAIGN,IL,"$175,198"
Breast Cancer,2010,NCI,1R01CA148996-01,,Epigenetic Regulation in Hypoxic Cancer Cells,"GLAZER, PETER",YALE UNIVERSITY,CT,"$343,413"
Breast Cancer,2010,FIC,1R03TW008624-01,,Inflammatory Breast Cancer: Factors Contributing to Dissemination,"SLOANE, BONNIE",WAYNE STATE UNIVERSITY,MI,"$64,550"
Breast Cancer,2010,NCI,5R01CA111289-04,,Quantitative Ultrasonic Imaging of the Breast,"O'BRIEN, WILLIAM",UNIVERSITY OF ILLINOIS URBANA-CHAMPAIGN,IL,"$915,946"
Breast Cancer,2010,NIAID,5K24AI067794-05,,Infectious Disease & Healthcare Epidemiology Mentoring,"FRASER, VICTORIA",WASHINGTON UNIVERSITY,MO,"$142,147"
Breast Cancer,2010,NCI,5R01CA121876-04,,Study on the intracellular Network of TBX3,"HUANG, TAOSHENG",UNIVERSITY OF CALIFORNIA IRVINE,CA,"$225,512"
Breast Cancer,2010,NCI,5R01CA119165-04,,Study of GPR30: a novel estrogen receptor linked to breast cancer.,"FILARDO, EDWARD",RHODE ISLAND HOSPITAL,RI,"$292,011"
Breast Cancer,2010,NCI,5R01CA090902-07,,Stem cells and perinatal factors for breast cancer risk,"HSIEH, CHUNG-CHENG",UNIV OF MASSACHUSETTS MED SCH WORCESTER,MA,"$394,183"
Breast Cancer,2010,NIEHS,5U01ES016048-04,,"Macronutrients, Mitochondria and Blood Metabolome/Proteome Disease Risk Profiles","KRISTAL, BRUCE",BRIGHAM AND WOMEN'S HOSPITAL,MA,"$431,098"
Breast Cancer,2010,NHLBI,5R44HL069553-06,,Device for Promoting Survival of Congested Tissue Flaps,"RUSSELL, JOHN","SPECTROCON, LLC",WI,"$639,098"
Breast Cancer,2010,NCI,5R01CA064277-12,,Shanghai Breast Cancer Study,"ZHENG, WEI",VANDERBILT UNIVERSITY,TN,"$523,902"
Breast Cancer,2010,NCI,5R01CA124545-03,,TRAIL Receptor Signaling in Human Tumors,"THORBURN, ANDREW",UNIVERSITY OF COLORADO DENVER,CO,"$426,028"
Breast Cancer,2010,NCI,5R01CA114017-05,,Role of YB-1 in EGFR regulation and breast cancer,"BERQUIN, ISABELLE",WAKE FOREST UNIVERSITY HEALTH SCIENCES,NC,"$190,274"
Breast Cancer,2010,NCI,5K07CA118269-05,,"Decision-making regarding radiation therapy in breast cancer""","PUNGLIA, RINAA",DANA-FARBER CANCER INSTITUTE,MA,"$136,890"
Breast Cancer,2010,NCI,5F32CA134180-03,,The role of SUMO-dependent protein protein interaction in DNA double strand break,"LI, YI-JIA",CITY OF HOPE/BECKMAN RESEARCH INSTITUTE,CA,"$59,918"
Breast Cancer,2010,NCI,5U10CA107586-07,,MCG Minority-Based Community Clinical Oncology Program,"JILLELLA, ANAND",MEDICAL COLLEGE OF GEORGIA (MCG),GA,"$509,490"
Breast Cancer,2010,NCI,1R01CA148671-01,,The role of HEF1 protein in division and invasion of metastatic breast cancer,"PUGACHEVA, ELENA",WEST VIRGINIA UNIVERSITY,WV,"$297,040"
Breast Cancer,2010,NCI,1R01CA148053-01,,A university-industry partnership for improving the imaging performance of digita,"ZHAO, WEI",STATE UNIVERSITY NEW YORK STONY BROOK,NY,"$383,224"
Breast Cancer,2010,NCI,5R01CA128978-03,,A genome-wide association study for breast cancer in BRCA1 mutation carriers,"COUCH, FERGUS",MAYO CLINIC,MN,"$1,070,366"
Breast Cancer,2010,NCI,1R01CA149045-01,,Use and Outcomes of Radiation Therapy for Medicare Patients with Common Cancers,"GROSS, CARY",YALE UNIVERSITY,CT,"$663,470"
Breast Cancer,2010,NCI,5R03CA136080-02,,Studying the Daily Lives of Couples Coping with Breast Cancer,"LAURENCEAU, JEAN-PHILIPPE",UNIVERSITY OF DELAWARE,DE,"$78,521"
Breast Cancer,2010,NIGMS,1R01GM093121-01,,RhoC GTPase regulates leading edge protrusion dynamics in breast carcinomas,"HODGSON, LOUIS",ALBERT EINSTEIN COL OF MED YESHIVA UNIV,NY,"$315,400"
Breast Cancer,2010,NCI,5R01CA088799-10,,ECM-Mediated Apoptosis in p53 (-) HMECs,"SEEWALDT, VICTORIA",DUKE UNIVERSITY,NC,"$222,477"
Breast Cancer,2010,NCI,5R01CA058420-17,,A Follow-up Study for Causes of Illness in Black Women,"ROSENBERG, LYNN",BOSTON UNIVERSITY MEDICAL CAMPUS,MA,"$1,766,131"
Breast Cancer,2010,NCI,5R01CA122086-04,,Mechanisms of MMP-Induced Malignancy in Breast Cells,"RADISKY, DEREK",MAYO CLINIC  JACKSONVILLE,FL,"$286,900"
Breast Cancer,2010,NCI,5R44CA130391-03,,Human Proteome Arrays for Auto-Antibody Identification in Clinical Cancer Studies,"KENTEN, JOHN","MESO SCALE DIAGNOSTICS, LLC",MD,"$80,251"
Breast Cancer,2010,NCI,5R01CA097214-07,,Regulation of Genomic Instability in Early Breast Cancer,"TLSTY, THEA",UNIVERSITY OF CALIFORNIA SAN FRANCISCO,CA,"$263,486"
Breast Cancer,2010,NCI,5K23CA121994-05,,The PI3K/PTEN/AKT Signal Transduction Cascade in Breast Cancer,"GONZALEZ-ANGULO, ANA",UNIVERSITY OF TEXAS MD ANDERSON CAN CTR,TX,"$136,080"
Breast Cancer,2010,NICHD,4R00HD056965-03,,The Role of Primary Cilia in Mammary Gland Biology,"MCDERMOTT, KIMBERLY",UNIVERSITY OF ARIZONA,AZ,"$249,000"
Breast Cancer,2010,NIBIB,1R01EB011591-01,,Passive Flow Control for Integrated Genomic Analysis Microchips,"BEGLEY, MATTHEW",UNIVERSITY OF CALIFORNIA SANTA BARBARA,CA,"$340,253"
Breast Cancer,2010,NCI,1R01CA148761-01,,Therapeutic Targeting of Breast Cancer Tumor Initiating Cells,"ROSEN, JEFFREY",BAYLOR COLLEGE OF MEDICINE,TX,"$464,834"
Breast Cancer,2010,NCI,1R01CA148759-01,,Defining the Molecular Mechanisms of KLF17 Regulation and Function in EMT,"HUANG, QIHONG",WISTAR INSTITUTE,PA,"$365,245"
Breast Cancer,2010,NCI,5R01CA117874-04,,Mechanisms of Resistance to Cell Cycle Checkpoint Kinase Inhibitors,"EASTMAN, ALAN",DARTMOUTH COLLEGE,NH,"$303,810"
Breast Cancer,2010,NCI,5R01CA136859-02,,Enhancing physical activity after breast cancer diagnosis: randomized trial,"ROGERS, LAURA",SOUTHERN ILLINOIS UNIVERSITY SCH OF MED,IL,"$682,529"
Breast Cancer,2010,NCI,5R01CA137914-02,,In Vivo Bioimaging Model to Study Inducible Drug Resistance in Cancer,"KANE, SUSAN",CITY OF HOPE/BECKMAN RESEARCH INSTITUTE,CA,"$344,450"
Breast Cancer,2010,NCI,5K12CA090628-10,,Paul Calabresi Program in Clinical-Translational Research at Mayo Clinic,"HARTMANN, LYNN",MAYO CLINIC,MN,"$1,075,932"
Breast Cancer,2010,NICHD,1R21HD065062-01,,Asymmetric Cell Division and Mammary Gland Development,"ZHONG, WEIMIN",YALE UNIVERSITY,CT,"$248,250"
Breast Cancer,2010,NCI,1R01CA148791-01,,Reducing Breast Cancer Recurrence with Weight Loss: A Vanguard Trial,"ROCK, CHERYL",UNIVERSITY OF CALIFORNIA SAN DIEGO,CA,"$1,379,539"
Breast Cancer,2010,NCI,1R01CA149614-01,,IMMEDIATE VS DELAYED RECONSTRUCTION AND BREAST CANCER SURGERY COMPLICATIONS,"OLSEN, MARGARET",WASHINGTON UNIVERSITY,MO,"$325,010"
Breast Cancer,2010,NCI,5R01CA115281-05,,Stability of prolactin receptor and prolactin signaling,"FUCHS, SERGE",UNIVERSITY OF PENNSYLVANIA,PA,"$255,767"
Breast Cancer,2010,NCI,5R01CA138521-02,,Phase II Study of Topical Imiquimod and Weekly Abraxane for the Treatment of Brea,"SALAZAR, LUPE",UNIVERSITY OF WASHINGTON,WA,"$285,827"
Breast Cancer,2010,NCI,5R01CA136664-02,,Dissecting the opposing roles of alpha-3 integrin in metastasis,"STIPP, CHRISTOPHER",UNIVERSITY OF IOWA,IA,"$309,057"
Breast Cancer,2010,NCI,5R01CA133004-02,,Racial Differences in BRCA1/2 Testing: Patients or Providers?,"ARMSTRONG, KATRINA",UNIVERSITY OF PENNSYLVANIA,PA,"$570,178"
Breast Cancer,2010,NIGMS,1U01GM092676-01,,Pharmacogenetics in Rural and Underserved Populations,"THUMMEL, KENNETH",UNIVERSITY OF WASHINGTON,WA,"$2,156,000"
Breast Cancer,2010,NCI,5R01CA100366-07,,Non-genomic actions of estrogen in breast cancer,"LEVIN, ELLIS",SOUTHERN CALIFORNIA INST FOR RES/EDUC,CA,"$232,441"
Breast Cancer,2010,NCI,5K01CA133138-03,,Promoting Mammography in African American Women Visiting the Emergency Department,"HATCHER, JENNIFER",UNIVERSITY OF KENTUCKY,KY,"$136,190"
Breast Cancer,2010,NCI,5R01CA062483-27,,Aromatase and Breast Cancer,"BRODIE, ANGELA",UNIVERSITY OF MARYLAND BALTIMORE,MD,"$309,836"
Breast Cancer,2010,NCI,5T32CA090221-08,,Translational Breast Cancer Research Training Program,"FUQUA, SUZANNE",BAYLOR COLLEGE OF MEDICINE,TX,"$194,626"
Breast Cancer,2010,NCI,5R00CA127772-04,,Genetic approaches to next-generation breast cancer therapy,"SILVA, JOSE",COLUMBIA UNIVERSITY HEALTH SCIENCES,NY,"$248,999"
Breast Cancer,2010,NCI,2U10CA080775-12,,Eastern Cooperative Oncology Group,"ATKINS, MICHAEL",BETH ISRAEL DEACONESS MEDICAL CENTER,MA,"$104,956"
Breast Cancer,2010,NCI,2U10CA049883-22,,Eastern Cooperative Oncology Group,"LOEHRER, PATRICK",INDIANA UNIV-PURDUE UNIV AT INDIANAPOLIS,IN,"$294,857"
Breast Cancer,2010,NCI,2U10CA014958-36,,EASTERN COOPERATIVE ONCOLOGY GROUP,"SPARANO, JOSEPH",ALBERT EINSTEIN COL OF MED YESHIVA UNIV,NY,"$127,404"
Breast Cancer,2010,NCI,5U10CA052667-20,,San Juan Minority - Based Community Clinical Oncology Program,"BAEZ, LUIS",SAN JUAN HEALTH DEPARTMENT,PR,"$252,182"
Breast Cancer,2010,NIEHS,5R21ES017112-02,,Effects of the circadian clock and light on the production of estrogens,"LOCKLEY, STEVEN",BRIGHAM AND WOMEN'S HOSPITAL,MA,"$44,055"
Breast Cancer,2010,NCI,5R01CA109675-03,,"Spatial, Temporal, Social Disparities in Breast Cancer","SCHOOTMAN, MARIO",WASHINGTON UNIVERSITY,MO,"$344,722"
Breast Cancer,2010,NCI,5R01CA098706-07,,Transport of Large Molecules and Viral Vectors in Tumors: Effects of Cytotoxic an,"BOUCHER, YVES",MASSACHUSETTS GENERAL HOSPITAL,MA,"$287,384"
Breast Cancer,2010,NCI,5R01CA040355-26,,Heat and Radiation Effects on Tumor Microcirculation,"DEWHIRST, MARK",DUKE UNIVERSITY,NC,"$341,264"
Breast Cancer,2010,NCI,5R01CA140288-02,,Raman Spectroscopy for Guidance of Stereotactic Breast Biopsies for Microcalcific,"FITZMAURICE, MARYANN",CASE WESTERN RESERVE UNIVERSITY,OH,"$333,751"
Breast Cancer,2010,NCI,5R01CA137023-02,,The Role of BRCA1/BARD1 in Basal-like Breast Cancer,"BAER, RICHARD",COLUMBIA UNIVERSITY HEALTH SCIENCES,NY,"$333,954"
Breast Cancer,2010,NCI,5R01CA134964-03,,Determinants and risks of use and overuse of expensive oncology drugs,"HERSHMAN, DAWN",COLUMBIA UNIVERSITY HEALTH SCIENCES,NY,"$260,820"
Breast Cancer,2010,NIEHS,5R21ES016889-02,,Radiation and Genomic Instability in Finite Lifespan Human Mammary Epithelium,"KRONENBERG, AMY",UNIVERSITY OF CALIF-LAWRENC BERKELEY LAB,CA,"$269,034"
Breast Cancer,2010,NIEHS,1R03ES018884-01,,Role of local P450 enzymes in chemical carcinogenesis in mouse mammary gland,"GU, JUN",WADSWORTH CENTER,NY,"$68,096"
Breast Cancer,2010,NCI,1R21CA149783-01,,Stat3 Probes that Target Breast Cancer Stem Cells,"TWEARDY, DAVID",BAYLOR COLLEGE OF MEDICINE,TX,"$200,318"
Breast Cancer,2010,NCI,1R21CA137703-01A1,,Development of a Hand-Held Cancer Biomarker Monitor,"LIU, GUODONG",NORTH DAKOTA STATE UNIVERSITY,ND,"$156,056"
Breast Cancer,2010,NIBIB,5R01EB009055-03,,High-Resolution Whole-Breast MRI at 3.0T,"HARGREAVES, BRIAN",STANFORD UNIVERSITY,CA,"$542,524"
Breast Cancer,2010,NCI,5K05CA092395-10,,Cancer Control in Older Adults,"SILLIMAN, REBECCA",BOSTON MEDICAL CENTER,MA,"$148,568"
Breast Cancer,2010,NCI,5R01CA124634-04,,Different active sites of the proteasome as drug targets in cancer,"KISSELEV, ALEXEI",DARTMOUTH COLLEGE,NH,"$273,429"
Breast Cancer,2010,NIBIB,1K99EB011889-01,,Time Resolved Breast Imaging Using a Combined MRI and Optical Tomography Approach,"CARP, STEFAN",MASSACHUSETTS GENERAL HOSPITAL,MA,"$95,310"
Breast Cancer,2010,NCI,1K23CA148893-01,,Enhancing T-Cell Responses with the Glutathione Mimetic NOV-002 in Breast Cancer,"MONTERO, ALBERTO",UNIVERSITY OF MIAMI SCHOOL OF MEDICINE,FL,"$159,625"
Breast Cancer,2010,NCI,5R03CA137824-02,,Pesticide Use & Breast Cancer Risk in Large Cohort of Female Agriculture Workers,"ENGEL, LAWRENCE",SLOAN-KETTERING INSTITUTE FOR CANCER RES,NY,"$94,800"
Breast Cancer,2010,NCI,5R01CA090466-09,,Structural Studies of Growth Factor Receptor Function,"LEAHY, DANIEL",JOHNS HOPKINS UNIVERSITY,MD,"$222,384"
Breast Cancer,2010,NCI,5R33CA132022-03,,Molecular Analysis of Steroid Hormone Receptors with X-ray Crystallography,"NETTLES, KENDALL",SCRIPPS RESEARCH INSTITUTE,CA,"$409,659"
Breast Cancer,2010,NCI,2U10CA016116-37,,Eastern Cooperative Oncology Group,"FORASTIERE, ARLENE",JOHNS HOPKINS UNIVERSITY,MD,"$281,505"
Breast Cancer,2010,NCI,5R03CA141564-02,,Role of microRNAs in initiation and progression of breast cancer,"SEMPERE, LORENZO",DARTMOUTH COLLEGE,NH,"$79,000"
Breast Cancer,2010,NCI,5R01CA038683-25,,Aryl and Alcohol Sulfotransferases in Drug Metabolism,"DUFFEL, MICHAEL",UNIVERSITY OF IOWA,IA,"$221,064"
Breast Cancer,2010,NCI,5K05CA096940-09,,Cancer Control at the Intersection of Aging Research,"MANDELBLATT, JEANNE",GEORGETOWN UNIVERSITY,DC,"$159,165"
Breast Cancer,2010,NCI,1R01CA131350-01A2,,The Role of Peroxiredoxin1 & Reactive Oxygen Species in Breast Tumor Initiation,"NEUMANN, CAROLA",MEDICAL UNIVERSITY OF SOUTH CAROLINA,SC,"$306,063"
Breast Cancer,2010,NCI,1R21CA149550-01,,HMGA1 in Tumor Progression in Breast Cancer,"RESAR, LINDA",JOHNS HOPKINS UNIVERSITY,MD,"$214,020"
Breast Cancer,2010,NCI,5R44CA125924-03,,Development of a 3D mammotomograph with novel techniques to overcome limitations,"MCKINLEY, RANDOLPH","ZUMATEK, INC.",NC,"$289,108"
Breast Cancer,2010,NCI,5R03CA139557-02,,Maternal-Fetal Nutrition Controls Expression of Cell Cycle Genes in Offspring,"PAN, YUAN-XIANG",UNIVERSITY OF ILLINOIS URBANA-CHAMPAIGN,IL,"$73,149"
Breast Cancer,2010,NCI,5K05CA092002-07,,Mentoring and Research in Cancer Epidemiology,"WEISS, NOEL",UNIVERSITY OF WASHINGTON,WA,"$156,254"
Breast Cancer,2010,NCI,5R03CA135700-02,,Combined hormone replacement therapy use in relation to breast cancer mortality.,"WEISS, NOEL",UNIVERSITY OF WASHINGTON,WA,"$63,000"
Breast Cancer,2010,NCI,5R01CA134598-02,,Next Generation Digital Breast Tomosynthesis Scanner,"ZHOU, OTTO",UNIVERSITY OF NORTH CAROLINA CHAPEL HILL,NC,"$483,944"
Breast Cancer,2010,NIEHS,5F30ES016975-03,,Ceramide Synthases CERS5 and CERS6 Regulate Pathways of Programmed Cell Death,"MULLEN, THOMAS",MEDICAL UNIVERSITY OF SOUTH CAROLINA,SC,"$36,590"
Breast Cancer,2010,NCI,5R21CA133668-02,,Stable isotopomer analysis of anabolic metabolic pathways in breast cancer,"LANE, ANDREW",UNIVERSITY OF LOUISVILLE,KY,"$162,800"
Breast Cancer,2010,NCI,5R21CA142537-02,,Reactivation of breast cancer micrometastases by senescent bone marrow stroma,"WIEDER, ROBERT",UNIV OF MED/DENT OF NJ-NJ MEDICAL SCHOOL,NJ,"$171,600"
Breast Cancer,2010,NCI,5K07CA134547-02,,Mammography in Women with Intellectual Disabilities,"WILKINSON, JOANNE",BOSTON MEDICAL CENTER,MA,"$169,235"
Breast Cancer,2010,NCI,5R01CA106671-07,,Strategies to Enhance Virotherapy for Breast Cancer,"ZHANG, XIAOLIU",UNIVERSITY OF HOUSTON,TX,"$224,996"
Breast Cancer,2010,NCI,5R03CA137666-02,,CANCER AND CHANGING TRENDS IN US MORTALITY INEQUITIES: 1960-2004,"KRIEGER, NANCY",HARVARD UNIVERSITY (SCH OF PUBLIC HLTH),MA,"$81,750"
