Category,FY,Funding IC,Project Number,Sub Project #,Project Title,PI Name,Org Name,State / Country,Amount
Liver Cancer,2010,NIDDK,5R01DK074419-05,,Pathophysiological Interpretations of Dynamic PET/CT of Molecular Liver Biology,"KEIDING, SUSANNE",AARHUS UNIVERSITY HOSPITAL,DENMAR,"$157,681"
Liver Cancer,2010,NCI,5R01CA134892-02,,Lipid-Peroxidation Induced Cyclic Adducts in Hepatocarcinogenesis,"CHUNG, FUNG-LUNG",GEORGETOWN UNIVERSITY,DC,"$445,590"
Liver Cancer,2010,NIAID,5R01AI079060-02,,Immunological Priming to Hepatitis B Virus,"ISOGAWA, MASANORI",SCRIPPS RESEARCH INSTITUTE,CA,"$470,003"
Liver Cancer,2010,NIDDK,5K01DK079875-04,,Cholangiocyte microRNAs Regulate Mcl-1 and Cell Death,"MOTT, JUSTIN",MAYO CLINIC,MN,"$129,201"
Liver Cancer,2010,NCI,5R01CA112215-05,,Chip-Based Diagnosis of Problematic Liver Tumors,"YEATMAN, TIMOTHY",H. LEE MOFFITT CANCER CTR & RES INST,FL,"$436,661"
Liver Cancer,2010,NIAID,5R01AI079031-03,,Discovery of potent human antibodies for prevention of (recurrent) HCV infection,"LAW, MANSUN",SCRIPPS RESEARCH INSTITUTE,CA,"$469,013"
Liver Cancer,2010,NCI,5R01CA113899-05,,Function of a molecular target of cancer chemoprevention,"TEMPLETON, DENNIS",UNIVERSITY OF VIRGINIA CHARLOTTESVILLE,VA,"$261,115"
Liver Cancer,2010,NIDDK,1R01DK088375-01,,Accurate Measurement of Renal Function in Cirrhosis,"LEE, VIVIAN",NEW YORK UNIVERSITY SCHOOL OF MEDICINE,NY,"$582,867"
Liver Cancer,2010,NIDDK,5R01DK076986-04,,Integrative genomic analysis in hepatocellular carcinoma,"LLOVET, JOSEP",MOUNT SINAI SCHOOL OF MEDICINE,NY,"$245,305"
Liver Cancer,2010,NIEHS,5R01ES014641-05,,Lipid peroxidation product induced DNA damage in the p53 gene and liver cancer,"TANG, ERIC MOON-SHONG",NEW YORK UNIVERSITY SCHOOL OF MEDICINE,NY,"$357,947"
Liver Cancer,2010,NCI,5R21CA133601-02,,Raf Kinase Inhibitory Protein (RKIP): A New Hepatocellular Carcinoma Tumor Suppre,"SEDIVY, JOHN",BROWN UNIVERSITY,RI,"$212,520"
Liver Cancer,2010,NIDDK,5K01DK077137-04,,The role of adiponectin in hepatocelluar carcinoma,"SAXENA, NEERAJ",EMORY UNIVERSITY,GA,"$131,229"
Liver Cancer,2010,NCI,5R01CA126809-03,,Functional MRI Monitoring of Hepatic Chemoembolization,"OMARY, REED",NORTHWESTERN UNIVERSITY,IL,"$313,325"
Liver Cancer,2010,NIAID,5K08AI079406-03,,Novel antviral targets in Hepatitis C virus NS4B protein,"EINAV, SHIRIT",STANFORD UNIVERSITY,CA,"$130,599"
Liver Cancer,2010,NCI,5K25CA127524-03,,Biomarker Discovery for Hepatitis C Progression using Machine Learning Techniques,"SPRATT, HEIDI",UNIVERSITY OF TEXAS MEDICAL BR GALVESTON,TX,"$131,421"
Liver Cancer,2010,NIAID,5R01AI077757-02,,Mechanisms of Immune Evasion by Hepatitis C Virus,"COX, ANDREA",JOHNS HOPKINS UNIVERSITY,MD,"$405,900"
Liver Cancer,2010,NIDDK,1F30DK088385-01,,The Molecular Mechanism of Antibody Neutralization of Hepatitis C Virus,"SABO, MICHELLE",WASHINGTON UNIVERSITY,MO,"$28,109"
Liver Cancer,2010,NCI,5R44CA134169-03,,Precisely Shaped Acoustic Ablation of Tumors Under 3D Ultrasound Image Guidance,"BURDETTE, EVERETTE","ACOUSTIC MEDSYSTEMS, INC.",IL,"$1,000,000"
Liver Cancer,2010,NCI,1F31CA150658-01,,MRI for In Vivo Quantification of Yttrium-90 Microsphere Biodistribution,"ADEYANJU, OYINLOLU",NORTHWESTERN UNIVERSITY,IL,"$31,692"
Liver Cancer,2010,NCI,5R25CA129042-03,,Asian American Liver Cancer Education Program in  Maryland,"JUON, HEE-SOON",JOHNS HOPKINS UNIVERSITY,MD,"$276,891"
Liver Cancer,2010,NIAAA,5R01AA008169-21,,HCV in Alcoholics,"WANDS, JACK",RHODE ISLAND HOSPITAL,RI,"$367,988"
Liver Cancer,2010,NIAID,5F32AI084448-02,,Hepatitis C virus host interactions in micropatterened hepatocyte co-cultures,"SHEAHAN, TIMOTHY",ROCKEFELLER UNIVERSITY,NY,"$50,474"
Liver Cancer,2010,NCI,5K25CA140791-02,,Protein interactions underlying Fas-mediated DISC in Cholangiocarcinoma,"SONG, YUHUA",UNIVERSITY OF ALABAMA AT BIRMINGHAM,AL,"$154,060"
Liver Cancer,2010,NCI,5R21CA128633-02,,Dysregulation of the Tumor Microenvironment in Hepatocellular Carcinoma,"ROBERTS, LEWIS",MAYO CLINIC,MN,"$199,452"
Liver Cancer,2010,NIAID,1U19AI088790-01,8022,Mechanisms of effective innate immunity in HCV treatment,"RYAN, JAMES",UNIVERSITY OF CALIFORNIA SAN FRANCISCO,CA,"$171,953"
Liver Cancer,2010,NIAID,1U19AI088790-01,8023,Mechanisms of effective adaptive immunity in HCV treatment,"MCCUNE, JOSEPH",UNIVERSITY OF CALIFORNIA SAN FRANCISCO,CA,"$126,674"
Liver Cancer,2010,NIAID,2U19AI066328-06,8030,Immune Escape Strategies in Hepatitis C,"ROSEN, HUGO",UNIVERSITY OF COLORADO AT DENVER,CO,"$239,846"
Liver Cancer,2010,NIAID,2U19AI066328-06,8031,Role of HCV* Hepatocyte in Regulation of Antiviral T cell Immunity,"HAHN, YOUNG",UNIVERSITY OF VIRGINIA CHARLOTTESVILLE,VA,"$232,343"
Liver Cancer,2010,NIAID,1U19AI088778-01,8052,Mechanism Of Interferon Induction By The Hepatitis C Virus,"CHISARI, FRANCIS",SCRIPPS RESEARCH INSTITUTE,CA,"$414,449"
Liver Cancer,2010,NIDDK,5R01DK056029-12,,Chemokine regulation of liver injury and recovery,"LENTSCH, ALEX",UNIVERSITY OF CINCINNATI,OH,"$373,032"
Liver Cancer,2010,NCI,5R01CA064239-16,,Anti-angiogenic Barriers to Tumor Development,"CRAWFORD, SUSAN",NORTHSHORE UNIV HEALTHSYSTEM RES INST,IL,"$262,838"
Liver Cancer,2010,NIAAA,5F31AA017811-03,,Hepatitis B Virus X protein and Alcohol Regulation of Cell Cycle Progression,"GEARHART, TRICIA",DREXEL UNIVERSITY,PA,"$27,663"
Liver Cancer,2010,NCI,5F31CA130116-04,,Determining the Progenitor-Like Capacity of Liver Cancer Cells in vivo.,"PAULK, NICOLE",OREGON HEALTH AND SCIENCE UNIVERSITY,OR,"$41,380"
Liver Cancer,2010,NIDDK,5F30DK083235-03,,Targeting the WntBeta-catenin Pathway in Liver Cancer,"THOMPSON, MICHAEL",UNIVERSITY OF PITTSBURGH AT PITTSBURGH,PA,"$46,380"
Liver Cancer,2010,NIAID,5R01AI079150-02,,"Cyclosporine, Cyclophilins and HCV Replication","TANG, HENGLI",FLORIDA STATE UNIVERSITY,FL,"$324,543"
Liver Cancer,2010,NCI,5R01CA135069-02,,Glycans in Hepatocellular Carcinoma,"GOLDMAN, RADOSLAV",GEORGETOWN UNIVERSITY,DC,"$406,276"
Liver Cancer,2010,NCI,2R01CA053596-20A1,,"Retinoids, Nuclear Receptors, and Hepatocyte Proliferation","WAN, YU-JUI",UNIVERSITY OF KANSAS MEDICAL CENTER,KS,"$329,615"
Liver Cancer,2010,NCI,5R01CA120372-05,,Phase I Clinical Translation Trial of Oncolytic rVSV-F Virotherapy for HCC,"WOO, SAVIO",MOUNT SINAI SCHOOL OF MEDICINE,NY,"$488,385"
Liver Cancer,2010,NIDDK,5U01DK082916-03,,Effect of HBV DNA Methylation and the Mutant 1762T/1764A on Viral Load and HCC,"SCHWARZ, KATHLEEN",JOHNS HOPKINS UNIVERSITY,MD,"$379,361"
Liver Cancer,2010,NIDDK,5U01DK082843-03,,Optimal Long-term Outcome of Chronic Hepatitis B,"KIM, W. RAY",MAYO CLINIC,MN,"$523,159"
Liver Cancer,2010,NIDDK,5U01DK082919-03,,Harvard Hepatitis B Consortium,"LAU, DARYL",BETH ISRAEL DEACONESS MEDICAL CENTER,MA,"$329,691"
Liver Cancer,2010,NIDDK,5U01DK082867-03,,The North Carolina Hepatitis Beta Clinical Research Network,"FRIED, MICHAEL",UNIVERSITY OF NORTH CAROLINA CHAPEL HILL,NC,"$320,450"
Liver Cancer,2010,NIDDK,5U01DK082927-03,,HBV Research Network Database Protocol and Clinical Trial Study Proposals,"HAN, STEVEN-HUY",UNIVERSITY OF CALIFORNIA LOS ANGELES,CA,"$279,514"
Liver Cancer,2010,NIAAA,5R01AA018857-02,,Nanog-positive cancer stem cells in and liver oncogenesis by alcohol and HCV,"MACHIDA, KEIGO",UNIVERSITY OF SOUTHERN CALIFORNIA,CA,"$380,903"
Liver Cancer,2010,NIAAA,5R43AA018600-02,,Metallodrugs Targeting HCV Protease,"COWAN, ADA","METALLOPHARM, LLC",OH,"$222,025"
Liver Cancer,2010,RMAP,5R01DK085713-02,,Modeling human hepatotropic infections in complex tissue organoids,"RICE, CHARLES",ROCKEFELLER UNIVERSITY,NY,"$1,126,288"
Liver Cancer,2010,NIDDK,5U01DK062531-09,,Adult to Adult Living Donor Liver Transplantation,"FISHER, ROBERT",VIRGINIA COMMONWEALTH UNIVERSITY,VA,"$135,120"
Liver Cancer,2010,NCI,5K01CA140861-02,,The Role of EGF in Human Hepatocellular Transformation,"FUCHS, BRYAN",MASSACHUSETTS GENERAL HOSPITAL,MA,"$140,601"
Liver Cancer,2010,NCI,5K23CA139005-02,,Optimizing localized therapy for primary liver cancer: a clinical trial and model,"MIKSAD, REBECCA",BETH ISRAEL DEACONESS MEDICAL CENTER,MA,"$169,209"
Liver Cancer,2010,NCRR,5R01RR025386-02,,Mass Spectrometry Strategies to Identify Lipid Biomarkers of Disease,"REID, GAVIN",MICHIGAN STATE UNIVERSITY,MI,"$338,580"
Liver Cancer,2010,NCI,1K08CA151414-01,,Immunosuppressive Network of Human Hepatocellular Carcinoma,"WELLING, THEODORE",UNIVERSITY OF MICHIGAN AT ANN ARBOR,MI,"$174,960"
Liver Cancer,2010,NIDDK,1K08DK088951-01,,Examination of the Relationship of Host Cholesterol Biosynthesis to Chronic HCV I,"PENG, LEE",MASSACHUSETTS GENERAL HOSPITAL,MA,"$158,949"
Liver Cancer,2010,NCI,1R21CA152559-01,,"Initiation, persistence, and progression of hepatocellular carcinoma","SCHMIDT, EDWARD",MONTANA STATE UNIVERSITY (BOZEMAN),MT,"$190,143"
Liver Cancer,2010,NIAAA,1R21AA019740-01,,Peripherally Selective CB1 Receptor Antagonists for Alcoholic Liver Disease,"MAITRA, RANGAN",RESEARCH TRIANGLE INSTITUTE,NC,"$273,333"
Liver Cancer,2010,NIDDK,1R03DK089130-01,,Adiponectin as a protective adipocytokine against leptin signaling in hepatocellu,"SAXENA, NEERAJ",EMORY UNIVERSITY,GA,"$77,500"
Liver Cancer,2010,NCI,1R21CA152589-01,,Sex Chromosomes and Gender Disparity in HBV-Related Hepatocellular Carcinoma,"LAU, YUN-FAI CHRIS",NORTHERN CALIFORNIA INSTITUTE RES & EDUC,CA,"$225,635"
Liver Cancer,2010,NIEHS,5F31ES017391-02,,The Effect of Dietary Fat on Benzo(a)pyrene Induced Colon Cancer in Apc Min Mice,"DIGGS, DEACQUNITA",MEHARRY MEDICAL COLLEGE,TN,"$36,076"
Liver Cancer,2010,NCI,1R01CA138698-01A2,,Epidemiologic Study of Hepatocellular Carcinoma in the US,"YU, HERBERT",YALE UNIVERSITY,CT,"$1,271,082"
Liver Cancer,2010,NCI,1R01CA136567-01A2,,Decoding the MST1 and MST2 kinases in cellular physiology and tumor suppression,"AVRUCH, JOSEPH",MASSACHUSETTS GENERAL HOSPITAL,MA,"$686,752"
Liver Cancer,2010,NCI,1R01CA141047-01A2,,MRI of Iron-labeled Microsphere Biodistribution for Radioembolization Dosimetry,"LARSON, ANDREW",NORTHWESTERN UNIVERSITY,IL,"$307,276"
Liver Cancer,2010,NIGMS,1R01GM086746-01A2,,Quantitative analysis of LC-MS data for peptide and glycan biomarker discovery,"RESSOM, HABTOM",GEORGETOWN UNIVERSITY,DC,"$268,625"
Liver Cancer,2010,NIAID,1R01AI080659-01A2,,Mechanistic Studies of HCV E2,"MARCOTRIGIANO, JOSEPH",RUTGERS THE ST UNIV OF NJ NEW BRUNSWICK,NJ,"$374,200"
Liver Cancer,2010,NCI,1K24CA139570-01A2,,A Multidisciplinary and Translational Approach to Hepatobiliary Malignancy,"NELSON, DAVID",UNIVERSITY OF FLORIDA,FL,"$186,209"
Liver Cancer,2010,NCI,1R21CA143748-01A1,,Regulation of hepatic NKT cells by CDld+ liver cells,"EXLEY, MARK",BETH ISRAEL DEACONESS MEDICAL CENTER,MA,"$226,853"
Liver Cancer,2010,NCI,1R21CA143714-01A1,,Inhibition of B-Catenin Signaling for Treatment of Hepatocellular Carcinoma,"SIMON, JULIAN",FRED HUTCHINSON CANCER RESEARCH CENTER,WA,"$229,680"
Liver Cancer,2010,NCI,1R21CA153147-01A1,,Role of Autotaxin in HCV-associated Hepatocellular Carcinoma,"KAUSHIK-BASU, NEERJA",UNIV OF MED/DENT OF NJ-NJ MEDICAL SCHOOL,NJ,"$169,650"
Liver Cancer,2010,NCI,1R01CA153073-01,,The Effect of Aflatoxin Regulation on Global Liver Cancer Risk,"WU, FELICIA",UNIVERSITY OF PITTSBURGH AT PITTSBURGH,PA,"$230,269"
Liver Cancer,2010,NCI,1R01CA140369-01A2,,Modulation of liver cancer by PPARbeta/delta,"PETERS, JEFFREY",PENNSYLVANIA STATE UNIVERSITY-UNIV PARK,PA,"$302,537"
Liver Cancer,2010,NCI,1R03CA153099-01,,Inflammation Variants and Risk of Hepatocellular Carcinoma in HBV Patients,"YANG, HUSHAN",THOMAS JEFFERSON UNIVERSITY,PA,"$77,350"
Liver Cancer,2010,NIDDK,1R01DK087877-01A1,,Detection of Liver Fibrosis Using IVIM Diffusion and DCE MRI in HCV,"TAOULI, BACHIR",MOUNT SINAI SCHOOL OF MEDICINE,NY,"$415,798"
Liver Cancer,2010,NCI,1R21CA153176-01,,Metabolomic and Integromic Approaches to Identify Fingerprints for Early Detectio,"RESSOM, HABTOM",GEORGETOWN UNIVERSITY,DC,"$200,318"
Liver Cancer,2010,NIDDK,3F30DK082151-01S1,,Regulation of hepcidin and iron metabolism in liver disease,"GOODNOUGH, JULIA",UNIVERSITY OF CALIFORNIA LOS ANGELES,CA,"$30,826"
Liver Cancer,2010,NIDDK,5F30DK082151-02,,Regulation of hepcidin and iron metabolism in liver disease,"GOODNOUGH, JULIA",UNIVERSITY OF CALIFORNIA LOS ANGELES,CA,"$31,030"
Liver Cancer,2010,NIAID,1F32AI091207-01,,Characterization and Consequences of HCV Interaction with Host Lipoproteins,"SCULL, MARGARET",ROCKEFELLER UNIVERSITY,NY,"$45,590"
Liver Cancer,2010,NCI,1R13DK089751-01,,"Liver Growth, Injury and Metabolism: Basic and Applied Biology","MONGA, SATDARSHAN",FEDERATION OF AMER SOC FOR EXPER BIOLOGY,MD,"$5,000"
Liver Cancer,2010,NIAAA,1R13DK089751-01,,"Liver Growth, Injury and Metabolism: Basic and Applied Biology","MONGA, SATDARSHAN",FEDERATION OF AMER SOC FOR EXPER BIOLOGY,MD,"$5,000"
Liver Cancer,2010,NIDDK,1R13DK089751-01,,"Liver Growth, Injury and Metabolism: Basic and Applied Biology","MONGA, SATDARSHAN",FEDERATION OF AMER SOC FOR EXPER BIOLOGY,MD,"$30,000"
Liver Cancer,2010,NCI,1R43CA153822-01,,Novel Reagents For The Detection Of Low Abundance Cancer Specific Glycoforms,"CIOCCI, MICHAEL","TOPH BIOLOGICALS, INC.",PA,"$194,005"
Liver Cancer,2010,NCI,1R03CA143656-01A1,,Histone methyltransferase G9a in liver pathophysiology and carcinogenesis,"LU, HONG",UNIVERSITY OF KANSAS MEDICAL CENTER,KS,"$75,000"
Liver Cancer,2010,NICHD,1F31HD068611-01,,The Role of HNF4alpha in Cell Proliferation,"VUONG, LINH",UNIVERSITY OF CALIFORNIA RIVERSIDE,CA,"$31,561"
Liver Cancer,2010,NCI,7R01CA094076-09,,ROLE OF ENZYME INDUCTION IN CANCER CHEMOPREVENTION,"KENSLER, THOMAS",UNIVERSITY OF PITTSBURGH AT PITTSBURGH,PA,"$397,876"
Liver Cancer,2010,NIDDK,1R01DK090317-01,,Clinical Outcomes and the HCV Core Gene,"BRANCH, ANDREA",MOUNT SINAI SCHOOL OF MEDICINE,NY,"$423,750"
Liver Cancer,2010,NIMHD,1R01MD005819-01,,Prevention of hepatocellular carcinoma in vulnerable communities in Texas,"PHILLIPS, TIMOTHY",TEXAS A&M UNIVERSITY SYSTEM,TX,"$380,046"
Liver Cancer,2010,NCI,3R01CA118165-04S1,,Role of inflammation in tumor promotion and progression,"KARIN, MICHAEL",UNIVERSITY OF CALIFORNIA SAN DIEGO,CA,"$32,187"
Liver Cancer,2010,NCI,5P30CA077598-12,5746,Carcinogenesis & Chemoprevention,"HECHT, STEPHEN",UNIVERSITY OF MINNESOTA TWIN CITIES,MN,"$30,006"
Liver Cancer,2010,NIDDK,1R01DK083479-01A2,,Hepatitis C Virus-Induced Liver Pathogenesis,"SIDDIQUI, ALEEM",UNIVERSITY OF CALIFORNIA SAN DIEGO,CA,"$386,250"
Liver Cancer,2010,NIEHS,3R44ES012618-05S1,,Predictive Genes Sets For Chemically-Induced Liver Cancer,"NAUGHTON, BRIAN","REGENEMED, INC.",CA,"$100,000"
Liver Cancer,2010,NIEHS,5P42ES016465-02,6110,Project 1: Environmental PAH Mixtures as Skin and Transplacental Carcinogens,"BAIRD, WILLIAM",OREGON STATE UNIVERSITY,OR,"$329,560"
Liver Cancer,2010,NIAAA,1F32AA020150-01,,ROLE OF S-ADENOSYLMETHIONINE ON UBC9 AND SUMOYLATION IN LIVER CANCER AND ALCOHOLI,"TOMASI, MARIA",UNIVERSITY OF SOUTHERN CALIFORNIA,CA,"$47,906"
Liver Cancer,2010,NIAAA,1R01AA020211-01,,Role of the Gut Microbiota and TLR4 in Alcoholic Hepatocarcinogenesis,"SCHWABE, ROBERT",COLUMBIA UNIVERSITY HEALTH SCIENCES,NY,"$431,663"
Liver Cancer,2010,NCI,5P01CA123328-04,0001,TRANSGENIC MICE AS A MODEL FOR HBV REPLICATION AND ONCOGENESIS,"OU, J.-H. JAMES",UNIVERSITY OF SOUTHERN CALIFORNIA,CA,"$308,240"
Liver Cancer,2010,NCI,5P01CA123328-04,0002,HEPATIC CARCINOGENESIS INDUCED BY HEPATITIS B VIRUS PreS2 MUTANT,"YEN, TIEN-SZE",NORTHERN CALIFORNIA INSTITUTE RES & EDUC,CA,"$492,192"
Liver Cancer,2010,NCI,5P01CA123328-04,0003,Role of Inflammation and DNA Damage-Repair in HCV Carcinogenesis,"LAI, MICHAEL",UNIVERSITY OF SOUTHERN CALIFORNIA,CA,"$281,866"
Liver Cancer,2010,NIEHS,5P01ES006052-17,0005,RESEARCH PROJECT 1: Chemical and Viral Biomarkers of Exposure and Risk (Groopman),"GROOPMAN, JOHN",JOHNS HOPKINS UNIVERSITY,MD,"$412,617"
Liver Cancer,2010,NIMHD,5P60MD000538-08,0004,Hepatitis B infection & hepatocellular carcinoma in Asian Americans,"POLLACK, HENRY",NEW YORK UNIVERSITY SCHOOL OF MEDICINE,NY,"$498,905"
Liver Cancer,2010,NCI,5S06GM008012-40,0010,Identifying Tumor-Associated Antigens for Detection of Hepatocellular Carcinoma,"ZHANG, JIANYING",UNIVERSITY OF TEXAS EL PASO,TX,"$11,043"
Liver Cancer,2010,NIGMS,5S06GM008012-40,0010,Identifying Tumor-Associated Antigens for Detection of Hepatocellular Carcinoma,"ZHANG, JIANYING",UNIVERSITY OF TEXAS EL PASO,TX,"$97,355"
Liver Cancer,2010,NCI,Y1CN4002-9-0-1,,Diet-induced hypomethylation in the preneoplastic liver,NO PI IDENTIFIED,NIH,,"$80,000"
Liver Cancer,2010,NIAAA,3R01AA008169-20S2,,HCV in Alcoholics,"WANDS, JACK",RHODE ISLAND HOSPITAL,RI,"$11,802"
Liver Cancer,2010,NIAID,1R56AI078881-01A1,,Collaborative Integration of HCV Molecular Virology and Mathematical Modeling,"UPRICHARD, SUSAN",UNIVERSITY OF ILLINOIS AT CHICAGO,IL,"$420,869"
Liver Cancer,2010,NCI,3R01CA131133-03S1,,Viral Vaccine Vectors to Prevent Hepatocellular Carcinoma,"ROBEK, MICHAEL",YALE UNIVERSITY,CT,"$47,381"
Liver Cancer,2010,NCI,4R33CA121051-03,,MR Spectroscopy to Evaluate Liver Repopulation by Transplanted Hepatocytes,"GUHA, CHANDAN",ALBERT EINSTEIN COL OF MED YESHIVA UNIV,NY,"$490,349"
Liver Cancer,2010,NCI,5P01CA059827-15,0009,INDIVIDUALIZED DOSE ESCALATION IN VOLUME-EFFECT ORGANS,"LAWRENCE, THEODORE",UNIVERSITY OF MICHIGAN AT ANN ARBOR,MI,"$408,009"
Liver Cancer,2010,NCI,5P01CA084203-07,7850,Clinical Photodynamic Therapy for Pancreatic and Biliary Tract Cancer,"PEREIRA, STEPHEN",UNIVERSITY OF LONDON,UK,"$219,611"
Liver Cancer,2010,NIAID,5U19AI082642-02,8115,Dendritic cell-based vaccination against hepatitis C,"GREGORY, STEPHEN",UNIVERSITY OF RHODE ISLAND,RI,"$610,608"
Liver Cancer,2010,NIAID,3R01AI077757-02S1,,Mechanisms of Immune Evasion by Hepatitis C Virus,"COX, ANDREA",JOHNS HOPKINS UNIVERSITY,MD,"$49,446"
Liver Cancer,2010,NCI,3U01CA084951-10S4,,Early Detection of Liver Cancer,"BLOCK, TIMOTHY",DREXEL UNIVERSITY,PA,"$154,000"
Liver Cancer,2010,NCI,5U54CA126513-05,0002,Stromal Myofibroblasts in Hepatic Carcinogenesis,"BRENNER, DAVID",COLUMBIA UNIVERSITY,NY,"$274,030"
Liver Cancer,2010,NCI,5U54CA126513-05,0003,Epigenetics and Genetics of Stromal Cells in Liver and Gastric Cancer,"TYCKO, BENJAMIN",COLUMBIA UNIVERSITY HEALTH SCIENCES,NY,"$156,589"
Liver Cancer,2010,NCI,5P20CA150343-02,5626,Hepatitis C and Tumor Suppressors in Hepatocellular,"LEMON, STANLEY",UNIVERSITY OF KENTUCKY,KY,"$291,609"
Liver Cancer,2010,NCI,3R44CA134169-03S1,,Precisely Shaped Acoustic Ablation of Tumors Under 3D Ultrasound Image Guidance,"BURDETTE, EVERETTE","ACOUSTIC MEDSYSTEMS, INC.",IL,"$85,424"
Liver Cancer,2010,NIAAA,3R01AA009231-18S1,,Alcohol-induced liver fibrosis:an in vitro model,"ROJKIND, MARCOS",GEORGE WASHINGTON UNIVERSITY,DC,"$20,000"
Liver Cancer,2010,NCI,7P01CA130821-03,0002,"Cross Regulation of TGFB/elf, B-catenin and Vitamin D Pathways in Gastrointestina","BYERS, STEPHEN",GEORGETOWN UNIVERSITY,DC,"$224,740"
Liver Cancer,2010,NCI,7P01CA130821-03,0003,Cellular Interactions between TGF-B Pathway Members and TERT and c-Myc in Gastroi,"MISHRA, BIBHUTI",GEORGETOWN UNIVERSITY,DC,"$226,406"
Liver Cancer,2010,NCI,3R25CA129042-03S1,,Asian American Liver Cancer Education Program in  Maryland,"JUON, HEE-SOON",JOHNS HOPKINS UNIVERSITY,MD,"$54,509"
Liver Cancer,2010,NIDDK,1R56DK090350-01,,Development of MR-based biomarker panels for NAFLD - A NASH CRN Ancillary Study,"SIRLIN, CLAUDE",UNIVERSITY OF CALIFORNIA SAN DIEGO,CA,"$597,273"
Liver Cancer,2010,NIDDK,3P30DK041296-22S1,,Liver Pathobiology and Gene Theraphy Research Core Center,"SHAFRITZ, DAVID",ALBERT EINSTEIN COL OF MED YESHIVA UNIV,NY,"$99,919"
Liver Cancer,2010,NIDDK,1ZIADK054509-13,,Immunology of Acute and Chronic Viral Hepatitis in Humans,"REHERMANN, BARBARA",NIH,,"$543,182"
Liver Cancer,2010,NIDDK,1ZIADK056012-04,,Functions of SMAD4 in development and cancers,"DENG, CHUXIA",NIH,,"$330,677"
Liver Cancer,2010,NIDDK,1ZIADK075013-05,,"Nonalcoholic Steatohepatitis: Natural History, Pathogenesis and Therapy","LIANG, T. JAKE",NIH,,"$389,808"
Liver Cancer,2010,NIEHS,1ZIAES102925-01,,Inorganics as Early Life Carcinogens,"WAALKES, MICHAEL",NIH,,"$665,404"
Liver Cancer,2010,NINR,1ZIANR000018-02,,Symptom Distress Mechanisms in Digestive Disorders,"HENDERSON, WENDY",NIH,,"$149,903"
Liver Cancer,2010,NCI,5P01CA109091-05,0002,Community-based Hep B Intervention for Hmong Adults,"CHEN, MOON",UNIVERSITY OF CALIFORNIA DAVIS,CA,"$379,042"
Liver Cancer,2010,NIAID,1ZIAAI000999-04,,Molecular Mechanisms of Pathogenesis of Acute and Chronic Liver Diseases,"FARCI, PATRIZIA",NIH,,"$551,347"
Liver Cancer,2010,NIAID,1ZIAAI001015-04,,Pathogenesis of Parenteral Viral Hepatitis,"PURCELL, ROBERT",NIH,,"$706,246"
Liver Cancer,2010,NCI,1ZIABC005177-30,,Interaction of Chemical Carcinogens and Chemotherapeutic Agents with DNA,"POIRIER, MIRIAM",NIH,,"$832,354"
Liver Cancer,2010,NCI,1ZIABC005317-27,,Role of Selenium in Development and Health,"HATFIELD, DOLPH",NIH,,"$382,855"
Liver Cancer,2010,NCI,1ZIABC005352-28,,Mechanisms in Perinatal Carcinogenesis,"ANDERSON, LUCY",NIH,,"$708,799"
Liver Cancer,2010,NCI,1ZIABC005453-26,,Cellular and Molecular Biology of the Hepatic Stem Cell Compartment,"THORGEIRSSON, SNORRI",NIH,,"$400,949"
Liver Cancer,2010,NCI,1ZIABC005488-25,,Mechanisms of Inorganic Carcinogenesis,"WAALKES, MICHAEL",NIH,,"$828,727"
Liver Cancer,2010,NCI,1ZIABC005708-19,,Xenobiotic Receptors,"GONZALEZ, FRANK",NIH,,"$1,350,062"
Liver Cancer,2010,NCI,1ZIABC010038-15,,Molecular Cytogenetics of Solid Tumors,"POPESCU, NICOLAE",NIH,,"$1,095,529"
Liver Cancer,2010,NCI,1ZIABC010649-06,,Immunotherapy Strategies for Gastrointestinal and Hepatocellular Cancer,"KAMMULA, UDAI",NIH,,"$410,668"
Liver Cancer,2010,NCI,1ZIABC010793-04,,"Role of inflammation, innate resistance, and immunity in carcinogenesis.","TRINCHIERI, GIORGIO",NIH,,"$1,479,814"
Liver Cancer,2010,NCI,1ZIABC010876-03,,The role of cancer stem cells in liver cancer heterogeneity and subtypes,"WANG, XIN",NIH,,"$566,077"
Liver Cancer,2010,NCI,1ZIABC010877-03,,The identification of human hepatocellular carcinoma metastasis genes,"WANG, XIN",NIH,,"$566,077"
Liver Cancer,2010,NCI,1ZIABC010891-03,,Antibody Therapy of Cancer,"HO, MITCHELL",NIH,,"$464,972"
Liver Cancer,2010,NCI,1ZIABC010893-03,,Tumor models for the study of inflammation and oncogenesis,"WILTROUT, ROBERT",NIH,,"$296,239"
Liver Cancer,2010,NCI,1ZIABC010997-03,,Purification of a Novel Antibody Against Solid Organ Cancer Stem Cells,"AVITAL, ITZHAK",NIH,,"$130,092"
Liver Cancer,2010,NCI,1ZIABC011005-03,,Isolation and Purification of Cancer Stem Cells Based on Functional Appraoch,"AVITAL, ITZHAK",NIH,,"$260,183"
Liver Cancer,2010,NCI,1ZIABC011031-03,,Cancer stem cells and human liver cancer,"THORGEIRSSON, SNORRI",NIH,,"$400,949"
Liver Cancer,2010,NCI,1ZIABC011170-02,,Comparative Functional Genomics,"THORGEIRSSON, SNORRI",NIH,,"$400,949"
Liver Cancer,2010,NCI,1ZIABC011173-02,,Genomic Classification of Human Liver Cancer,"THORGEIRSSON, SNORRI",NIH,,"$801,897"
Liver Cancer,2010,NCI,1ZIABC011175-02,,Validation of Therapeutic Target Genes in Human Liver Cancer,"THORGEIRSSON, SNORRI",NIH,,"$534,598"
Liver Cancer,2010,NCI,1ZIABC011251-01,,Molecular Genetic Epidemiology of Primary Hepatocellular Carcinoma,"BUETOW, KENNETH",NIH,,"$1,138,470"
Liver Cancer,2010,NCI,1ZIACP005782-16,,Epidemiology of Oncogenic Viruses,"O'BRIEN, THOMAS",NIH,,"$546,673"
Liver Cancer,2010,NCI,1ZIACP010158-10,,Studies of Rare Cancers,"BRINTON, LOUISE",NIH,,"$934,284"
Liver Cancer,2010,NIEHS,N01ES55536-12-0-1,,Studies to Evaluate the Toxicological Potential of Test Articles,"TAYLOR, LU",BATTELLE MEMORIAL INSTITUTE,OH,"$1,519,001"
Liver Cancer,2010,NCRR,5M01RR000065-48,6388,CLINICAL TRIAL: HEP C ANTIVIRAL LONG-TERM TREATMENT  AGAINST CIRRHOSIS (HALT-C),"STERLING, RICHARD",VIRGINIA COMMONWEALTH UNIVERSITY,VA,"$46,710"
Liver Cancer,2010,NCRR,5M01RR000827-35,6775,"A PHASE II, RANDOMIZED, CONTROLLED TRIAL OF THE SAFETY AND EFFICACY OF S-ADENOSY","HOEFS, JOHN",UNIVERSITY OF CALIFORNIA SAN DIEGO,CA,"$6,213"
Liver Cancer,2010,NCRR,5P20RR021940-05,7504,ROLE OF HNF4ALPHA IN REGULATION OF HEPATOCYTE PROLIFERATION,"APTE, UDAYAN",UNIVERSITY OF KANSAS MEDICAL CENTER,KS,"$198,452"
Liver Cancer,2010,NCRR,5P20RR017695-07,7738,GROWTH REGULATION OF LIVER PROGENITOR CELLS,"SANDERS, JENNIFER",RHODE ISLAND HOSPITAL,RI,"$206,908"
Liver Cancer,2010,NCRR,5P20RR016443-11,8232,"HEPATITIS B VIRUS/HEPATITIS DELTA VIRUS INFECTION, ITS RELATION TO PATHOGENESIS","GUDIMA, SEVERIN",UNIVERSITY OF KANSAS MEDICAL CENTER,KS,"$276,695"
Liver Cancer,2010,NCRR,5P41RR000862-37,5051,INVESTIGATIONS OF THE FUNCTION OF NS4B OF HCV,"RICE, CHARLES",ROCKEFELLER UNIVERSITY,NY,"$1,167"
Liver Cancer,2010,NCRR,2P41RR001614-28,5739,O-GLCNAC MODIFICATION SITES IN HEPATIC AND PANCREATIC CELLS,"BURLINGAME, ALMA",UNIVERSITY OF CALIFORNIA SAN FRANCISCO,CA,"$45,927"
Liver Cancer,2010,NCRR,2P41RR009784-16,5788,REAL TIME MR THERMOMETRY FOR MONITORING FOCUSED ULTRASOUND IN THE LIVER,"HOLBROOK, ANDREW",STANFORD UNIVERSITY,CA,"$9,250"
Liver Cancer,2010,NCRR,5P41RR011823-15,7288,IDENTIFICATION OF NOVEL HOST FACTORS INTERACTING WITH NS5A PROTEIN OF HCV,"SIDDIQUI, ALEEM",UNIVERSITY OF WASHINGTON,WA,"$2,425"
Liver Cancer,2010,NCRR,5P41RR005959-21,7513,INJURY-RELATED MORPHOGENIC PATHWAY SIGNALING AND HEPATOCARCINOGENESIS,"DIEHL, ANNA MAE",DUKE UNIVERSITY,NC,"$5,460"
Liver Cancer,2010,NCRR,5P41RR013461-12,7602,ROLE OF GENETIC AND NON-GENETIC MECHANISMS IN FURAN RISK,"DEKANT, WOLFGANG",UNIVERSITY OF CALIF-LAWRNC LVRMR NAT LAB,CA,"$8,496"
Liver Cancer,2010,NCRR,5P51RR013986-12,8569,HBV RESOLUTION IN CHIMPANZEES,"LANFORD, ROBERT",SOUTHWEST FOUNDATION FOR BIOMEDICAL RES,TX,"$92,735"
Liver Cancer,2010,OD,5P51RR013986-12,8569,HBV RESOLUTION IN CHIMPANZEES,"LANFORD, ROBERT",SOUTHWEST FOUNDATION FOR BIOMEDICAL RES,TX,"$9,600"
Liver Cancer,2010,NCRR,5P51RR013986-12,8591,PROTEIN BIOMARKERS FOR EARLY DETECTION OF LIVER CANCER,"LANFORD, ROBERT",SOUTHWEST FOUNDATION FOR BIOMEDICAL RES,TX,"$22,219"
