Category,FY,Funding IC,Project Number,Sub Project #,Project Title,PI Name,Org Name,State / Country,Amount
Lung Cancer,2014,NCI,5R01CA155260-04,,Translational phosphoproteomics for lung cancer,"GERBER, SCOTT",DARTMOUTH COLLEGE,NH,"$318,015"
Lung Cancer,2014,NCI,5R01CA157850-04,,Rationally designed targeted therapeutic approaches for NSCLC,"DEGREGORI, JAMES",UNIVERSITY OF COLORADO DENVER,CO,"$295,150"
Lung Cancer,2014,NIEHS,5R03ES023028-02,,Chromium and Hedgehog signaling,"SUN, HONG",NEW YORK UNIVERSITY SCHOOL OF MEDICINE,NY,"$83,902"
Lung Cancer,2014,NHLBI,5R01HL111190-03,,FGF9 REGULATION OF LUNG DEVELOPMENT AND PATHOGENESIS OF PLEUROPULMONARY BLASTOMA,"ORNITZ, DAVID",WASHINGTON UNIVERSITY,MO,"$497,577"
Lung Cancer,2014,NCI,5U54CA163109-04,5393,Investigating the Tumor Microenvironment in Tumor Progression and Metastasisin Lu,"JACKS, TYLER",MASSACHUSETTS INSTITUTE OF TECHNOLOGY,MA,"$228,596"
Lung Cancer,2014,NCI,5P30CA091842-13,6599,Proteomics Core,"TOWNSEND, REID",WASHINGTON UNIVERSITY,MO,"$143,963"
Lung Cancer,2014,NCI,5R01CA152005-05,,An Integrated Nano-Cell Delivery Platform of Theranostics for Lung Cancers,"MOHAPATRA, SHYAM",UNIVERSITY OF SOUTH FLORIDA,FL,"$286,998"
Lung Cancer,2014,NCI,5K08CA160658-04,,"""Comparative gene resequencing in mouse cancer models""","MCFADDEN, DAVID",MASSACHUSETTS GENERAL HOSPITAL,MA,"$180,360"
Lung Cancer,2014,NCI,5R21CA178229-02,,Role of PD-1/PDL-1 in Lung Carcinogenesis and Therapy,"LU, BO",THOMAS JEFFERSON UNIVERSITY,PA,"$163,507"
Lung Cancer,2014,NCI,5R01CA136851-06,,Targeting ALK and ROS1 in Lung Cancer,"JANNE, PASI",DANA-FARBER CANCER INST,MA,"$320,259"
Lung Cancer,2014,NCI,5R01CA170386-03,,Novel Pathogen Associated Cancers (PQ12),"GALLOWAY, DENISE",FRED HUTCHINSON CANCER RESEARCH CENTER,WA,"$722,856"
Lung Cancer,2014,NIBIB,5R41EB015775-02,,Image-Based Quantification and Analysis of Longitudinal Lung Nodule Deformations,"CAHILL, NATHAN","KITWARE, INC.",NY,"$195,227"
Lung Cancer,2014,NCI,5R01CA155196-04,,Personalizing NSCLC Therapy: Exploiting KRAS activated pathways,"HERBST, ROY",YALE UNIVERSITY,CT,"$541,243"
Lung Cancer,2014,RMAP,5R01CA163255-04,,Succinylation and Malonylation as Novel Protein Modifications in Cancer,"LIN, HENING",CORNELL UNIVERSITY,NY,"$585,105"
Lung Cancer,2014,NIA,5R21AG042894-02,,Translational meta-analysis for elderly lung cancer patients,"WANG, XIAOFEI",DUKE UNIVERSITY,NC,"$166,321"
Lung Cancer,2014,NCI,5R01CA135257-07,,Drug Resistance in Lung Cancer,"JANNE, PASI",DANA-FARBER CANCER INST,MA,"$341,447"
Lung Cancer,2014,OD,5R01CA142649-05,,Developing a Post-carcinogen Lung Cancer Chemopreventive Agent,"XING, CHENGGUO",UNIVERSITY OF MINNESOTA,MN,"$200,000"
Lung Cancer,2014,NIGMS,5SC3GM084834-06,,Theoretical study of structure-function correlations of Aquaporin V and mutants,"CHEN, LIAO",UNIVERSITY OF TEXAS SAN ANTONIO,TX,"$110,250"
Lung Cancer,2014,NCI,5K08CA154787-04,,Genetic Modifiers such as Fas Regulate Tumor-Cell Dependence on Mutant EGFR,"BIVONA, TREVER","UNIVERSITY OF CALIFORNIA, SAN FRANCISCO",CA,"$168,480"
Lung Cancer,2014,NCI,5K08CA151651-05,,MicroRNA-200 family regulation by the apical-basal polarity complexes in EMT and,"GIBBONS, DON",UNIVERSITY OF TX MD ANDERSON CAN CTR,TX,"$170,640"
Lung Cancer,2014,NCI,5R01CA164783-04,,Molecular biomarkers of airway and lung linking COPD and Lung Cancer,"SPIRA, AVRUM",BOSTON UNIVERSITY MEDICAL CAMPUS,MA,"$499,578"
Lung Cancer,2014,NCI,5U54CA151881-05,5122,Combination Anticancer Nanopreparations of Novel Proapoptotic Drug and siRNA,"TORCHILIN, VLADIMIR",NORTHEASTERN UNIVERSITY,MA,"$721,016"
Lung Cancer,2014,NCI,5U54CA151881-05,5126,Develop and High-Throughput Screening of Targeted Anticancer Nanomedicines,"PETRENKO, VALERY",AUBURN UNIVERSITY AT AUBURN,AL,"$294,427"
Lung Cancer,2014,NCI,5K08CA138918-05,,Synthetic-Lethal-Based Targeted Therapy for Oncogenic KRAS-Driven Cancer,"BARBIE, DAVID",DANA-FARBER CANCER INST,MA,"$178,200"
Lung Cancer,2014,NCI,5P50CA148110-05,6237,"SURGICAL DISPARITIES IN LUNG, PROSTATE, BREAST AND COLORECTAL CANCER IN AI/ANS","FLUM, DAVID",UNIVERSITY OF WASHINGTON,WA,"$197,176"
Lung Cancer,2014,NCI,5U54CA151652-05,8811,Therapeutic Targeting of the Ras Pathway By Nanoparticle Delivery of siRNA,"HUANG, LEAF",UNIV OF NORTH CAROLINA CHAPEL HILL,NC,"$149,253"
Lung Cancer,2014,NCI,5U54CA151652-05,8812,Translational Nanosystems for Improved Lung Cancer Treatment with Small Molecules,"MUMPER, RUSSELL",UNIV OF NORTH CAROLINA CHAPEL HILL,NC,"$312,891"
Lung Cancer,2014,NCI,5U54CA151652-05,8816,Targeting Ligand Core,"LIU, RIHE",UNIV OF NORTH CAROLINA CHAPEL HILL,NC,"$77,073"
Lung Cancer,2014,NCI,5R01CA168485-04,,Extension of Radiotherapy Research,"MEYN, RAYMOND",UNIVERSITY OF TX MD ANDERSON CAN CTR,TX,"$285,013"
Lung Cancer,2014,NIGMS,5R01GM100387-03,,Transfer Rule Learning for Knowledge Based Biomarker Discovery and Predictive Bio,"GOPALAKRISHNAN, VANATHI",UNIVERSITY OF PITTSBURGH AT PITTSBURGH,PA,"$302,234"
Lung Cancer,2014,NCI,5K08CA151649-05,,Dissection of microRNA-21s role in non-small cell lung cancer,"HATLEY, MARK",ST. JUDE CHILDREN'S RESEARCH HOSPITAL,TN,"$168,480"
Lung Cancer,2014,NCI,1R01CA183296-01A1,,Histone Methyltransferases as a Target for Lung Cancer Prevention,"BELINSKY, STEVEN",LOVELACE BIOMEDICAL & ENVIRONMENTAL RES,NM,"$576,204"
Lung Cancer,2014,NCI,1R43CA174037-01A1,,Chemical optimization of a novel class of USP7 inhibitor for cancer treatment,"WEINSTOCK, JOSEPH","PROGENRA, INC.",PA,"$224,974"
Lung Cancer,2014,NCI,1R43CA177025-01A1,,Synergy between MAG-1 and Cyclophosphamide for Treatment of Recurrent SCLC,"PANG, ROY","WOOMERA THERAPEUTICS, INC.",NH,"$149,819"
Lung Cancer,2014,NCI,5K07CA168883-02,,Telephone Symptom Management for Advanced Lung Cancer Patients and Caregivers,"MOSHER, CATHERINE",INDIANA UNIV-PURDUE UNIV AT INDIANAPOLIS,IN,"$136,445"
Lung Cancer,2014,NCI,1R43CA186496-01,,Treatment of non-small cell lung cancer with a CCL14 monoclonal antibody,"WARREN, SARAH",ONCOFACTOR CORPORATION,WA,"$220,191"
Lung Cancer,2014,NCI,5K08CA158425-04,,Assessing the Notch Pathway as a Therapeutic Target in Lung Cancer Adenocarcinoma,"HASSAN, KHALED",UNIVERSITY OF MICHIGAN,MI,"$174,960"
Lung Cancer,2014,NIGMS,5R01GM067193-11,,Eukaryotic Post-Translational Modifications,"KELLEHER, NEIL",NORTHWESTERN UNIVERSITY,IL,"$328,795"
Lung Cancer,2014,NCI,5F31CA180669-02,,Investigating the not so minor role of the minor isoform Kras4A in cancer,"WESTCOTT, PETER","UNIVERSITY OF CALIFORNIA, SAN FRANCISCO",CA,"$36,091"
Lung Cancer,2014,NCI,5R01CA120528-09,,Validation of Prognostic and Diagnostic Molecular Tests in Mesothelioma,"BUENO, RAPHAEL",BRIGHAM AND WOMEN'S HOSPITAL,MA,"$335,146"
Lung Cancer,2014,NCI,5K08CA163677-03,,Genomic Discovery and Targeted Therapeutics in Squamous Cell Lung Cancer,"HAMMERMAN, PETER",DANA-FARBER CANCER INST,MA,"$177,120"
Lung Cancer,2014,NIBIB,5U01EB012493-05,,Point-of care Microfluidics for Early Detection of Cancer,"TONER, MEHMET",MASSACHUSETTS GENERAL HOSPITAL,MA,"$2,185,654"
Lung Cancer,2014,NCI,5R01CA140550-05,,"SIAH2-Dependent Proteolysis in Cell Migration, Tumor Growth and Cancer Metastasis","TANG, AMY",EASTERN VIRGINIA MEDICAL SCHOOL,VA,"$417,420"
Lung Cancer,2014,NCI,5U44CA165024-03,,Engineered imaging nanoparticles for real-time detection of cancer in the tumor b,"LEE, W DAVID","LUMICELL DIAGNOSTICS, INC.",MA,"$207,388"
Lung Cancer,2014,NCI,2U19CA021239-35,7129,Assessment of Effectiveness of IMPT vs. IMRT through Phase II Randomized Clinical Trials,"MINSKY, BRUCE",UNIVERSITY OF TX MD ANDERSON CAN CTR,TX,"$391,126"
Lung Cancer,2014,NCI,1F31CA180511-01A1,,Defining an LKB1-regulated motility switch in cancer cell invasion and metastasis,"TEPE, JESSICA",EMORY UNIVERSITY,GA,"$42,676"
Lung Cancer,2014,NCI,5R01CA141769-04,,Inflammation Pathways and COPD in the Development of Lung Cancer,"SCHWARTZ, ANN",WAYNE STATE UNIVERSITY,MI,"$1,866,387"
Lung Cancer,2014,NCI,5F32CA165856-03,,Understanding the role of SKP2 in small cell lung cancer progression,"NICOLAY, BRANDON",MASSACHUSETTS GENERAL HOSPITAL,MA,"$55,094"
Lung Cancer,2014,NCI,5U01CA168878-03,,Extracellular Sulfatases As Novel Biomarkers For Early Detection of Cancer,"LEMJABBAR-ALAOUI, HASSAN","UNIVERSITY OF CALIFORNIA, SAN FRANCISCO",CA,"$424,543"
Lung Cancer,2014,NCI,5R01CA172468-03,,Dual Targeting of the p53 pathway for development of anti-cancer therapy,"LU, HUA",TULANE UNIVERSITY OF LOUISIANA,LA,"$303,351"
Lung Cancer,2014,NIGMS,5SC1CA173069-03,,Anti-Tumorigenic Potential of Novel Digitoxin Analogues,"IYER, ANAND",HAMPTON UNIVERSITY,VA,"$251,230"
Lung Cancer,2014,NCI,1F30CA180607-01A1,,Characterization of AMH as part of a novel TGF-beta signaling loop,"BECK, TIM",DREXEL UNIVERSITY,PA,"$41,170"
Lung Cancer,2014,NCI,1F30CA186640-01,,Integration of Glycolysis with the Epithelial-Mesenchymal Transition,"SPAULDING, ROBERT",UNIVERSITY OF LOUISVILLE,KY,"$31,702"
Lung Cancer,2014,NCI,1F31CA186510-01,,Spatiotemporal analysis of Osteopontin in lung cancer,"FISCHER, KARI",WEILL MEDICAL COLL OF CORNELL UNIV,NY,"$42,676"
Lung Cancer,2014,NCI,5K23CA164015-04,,Novel systemic therapy to improve clinical outcome in small cell lung cancer,"OWONIKOKO, TAOFEEK",EMORY UNIVERSITY,GA,"$162,853"
Lung Cancer,2014,NCI,5P01CA120964-08,7579,LKB1/AMPK signaling and Peutz-Jeghers syndrome,"CANTLEY, LEWIS",BETH ISRAEL DEACONESS MEDICAL CENTER,MA,"$198,305"
Lung Cancer,2014,NCI,5P01CA120964-08,7580,Integrated analyses of cancers harboring STK11 vs. TSC1/2 vs. PTEN Loss,"KWIATKOWSKI, DAVID",BRIGHAM AND WOMEN'S HOSPITAL,MA,"$463,273"
Lung Cancer,2014,NCI,5P01CA120964-08,7268,LKB1/AMPK signaling and Peutz-Jeghers syndrome,"SHAW, REUBEN",BETH ISRAEL DEACONESS MEDICAL CENTER,MA,"$263,723"
Lung Cancer,2014,NCI,1R01CA182506-01A1,,Sirt2 Directs Kras IR Cell Resistance and Tumorigenesis,"VASILOPOULOS, ATHANASIOS",NORTHWESTERN UNIVERSITY AT CHICAGO,IL,"$320,588"
Lung Cancer,2014,NCI,5P01CA129243-08,6647,Targeting the ERK Pathway in KRAS-and BRAF-Driven Lung Cancers,"ROSEN, NEAL",SLOAN-KETTERING INST CAN RESEARCH,NY,"$240,985"
Lung Cancer,2014,NCI,5P01CA129243-08,6646,Mediators of Lung Adenocarcinoma Metastasis,"MASSAGUE, JOAN",SLOAN-KETTERING INST CAN RESEARCH,NY,"$245,804"
Lung Cancer,2014,NCI,5P01CA129243-08,6860,Mechanisms and Modulators of Sensitivity and Resistance to EGFR Inhibitors in Lu,"PAO, WILLIAM",SLOAN-KETTERING INST CAN RESEARCH,NY,"$382,626"
Lung Cancer,2014,NCI,5P01CA129243-08,6861,Lung Cancer Drivers and Dependencies as Therapeutic Targets,"LOWE, SCOTT",SLOAN-KETTERING INST CAN RESEARCH,NY,"$357,605"
Lung Cancer,2014,NCI,5P01CA129243-08,6862,Molecular Profiling and Pathology,"LADANYI, MARC",SLOAN-KETTERING INST CAN RESEARCH,NY,"$205,000"
Lung Cancer,2014,NCI,5P01CA129243-08,6863,Biostatistics and Bioinformatics,"SHEN, RONGLAI",SLOAN-KETTERING INST CAN RESEARCH,NY,"$133,013"
Lung Cancer,2014,NCI,5P01CA129243-08,6864,Administration Core,"KRIS, MARK",SLOAN-KETTERING INST CAN RESEARCH,NY,"$119,774"
Lung Cancer,2014,NCI,5K07CA178120-02,,PREDICTIVE MODELING IN LUNG CANCER,"PURI, VARUN",WASHINGTON UNIVERSITY,MO,"$157,687"
Lung Cancer,2014,NCI,5U01CA152662-05,,Validation of Biomarkers of Risk for the Early Detection of Lung Cancer,"MASSION, PIERRE",VANDERBILT UNIVERSITY,TN,"$598,467"
Lung Cancer,2014,NCI,5K23CA157631-04,,CT Volume Measurement of Lung Cancer treated with Erlotinib: Genomic Correlation,"NISHINO, MIZUKI",BRIGHAM AND WOMEN'S HOSPITAL,MA,"$180,360"
Lung Cancer,2014,NCI,5U01CA151452-05,,COMBINATORIAL-DESIGNED NANO-PLATFORMS TO OVERCOME TUMOR DRUG RESISTANCE,"AMIJI, MANSOOR",NORTHEASTERN UNIVERSITY,MA,"$400,638"
Lung Cancer,2014,NCI,5R01CA151989-04,,Telomeres and lung cancer incidence and survival,"DOHERTY, JENNIFER",FRED HUTCHINSON CANCER RESEARCH CENTER,WA,"$479,954"
Lung Cancer,2014,NCI,5R01CA169102-02,,Personalized Motion Management for truly 4D Lung Stereotactic Body Radiotherapy,"SAWANT, AMIT",UT SOUTHWESTERN MEDICAL CENTER,TX,"$509,590"
Lung Cancer,2014,NCI,5R21CA180016-02,,(PQB6) Accurate Comparative Genome-wide Analysis of Primary Tumors and Metastases,"WOTTON, DAVID",UNIVERSITY OF VIRGINIA,VA,"$166,671"
Lung Cancer,2014,RMAP,5R01CA163256-04,,Contrast-Enhanced and Image-Guided Surgery of Lung Cancer,"NIE, SHUMING",EMORY UNIVERSITY,GA,"$1,319,727"
Lung Cancer,2014,NCI,5F31CA171675-02,,Role of TAB1-TAK1 signaling in tumor-associated macrophage survival,"MIHALY, SEPTEMBER",NORTH CAROLINA STATE UNIVERSITY RALEIGH,NC,"$32,287"
Lung Cancer,2014,NCI,5R01CA157409-03,,A Decision Aid with HRQL Assessment to Reduce Costs in the Treatment of NSCLC,"HOLLEN, PATRICIA",UNIVERSITY OF VIRGINIA,VA,"$607,647"
Lung Cancer,2014,NIGMS,5P20GM103639-03,7851,MOLECULAR DETERMINANTS OF GEMCITABINE (Franklin Hays),"HAYS, FRANKLIN",UNIVERSITY OF OKLAHOMA HLTH SCIENCES CTR,OK,"$211,970"
Lung Cancer,2014,NCI,5U54CA153605-05,7802,Research Project,"PATTEN, CHRISTI",MAYO CLINIC ROCHESTER,MN,"$396,742"
Lung Cancer,2014,NIGMS,5SC1CA161676-04,,Targeted Nanocarriers for Treatment of Lung Cancer,"SACHDEVA, MANDIP",FLORIDA AGRICULTURAL AND MECHANICAL UNIV,FL,"$283,240"
Lung Cancer,2014,NCI,5P01CA154291-03,6711,Targeted Radiotherapy of Neoplastic Meningitis using Monoclonal Antibodies Label,"ZALUTSKY, MICHAEL",DUKE UNIVERSITY,NC,"$484,382"
Lung Cancer,2014,NCCAM,5K01AT007559-02,,Couple-Based Mind-Body Program for Lung Cancer Patients and their Partners,"MILBURY, KATHRIN",UNIVERSITY OF TX MD ANDERSON CAN CTR,TX,"$130,369"
Lung Cancer,2014,NCI,5R01CA143111-05,,Screening Lung Cancer by Ultra Low-Dose Computed Tomography,"LIANG, JEROME",STATE UNIVERSITY NEW YORK STONY BROOK,NY,"$304,658"
Lung Cancer,2014,NCI,5R01CA172592-02,,Targeting RET in Lung Cancer,"JANNE, PASI",DANA-FARBER CANCER INST,MA,"$525,531"
Lung Cancer,2014,NCI,5U01CA152956-05,,Comparative Modeling of Lung Cancer Control Policies,"KONG, CHUNG",MASSACHUSETTS GENERAL HOSPITAL,MA,"$1,326,517"
Lung Cancer,2014,NCI,5U01CA154969-04,,Clinically-Relevant Regulatory Networks in the Lung Tumor Microenvironment,"PLEVRITIS, SYLVIA",STANFORD UNIVERSITY,CA,"$533,147"
Lung Cancer,2014,NCI,5R01CA152099-04,,Inflammation and Immunosuppression in Lung Cancer,"YAN, CONG",INDIANA UNIV-PURDUE UNIV AT INDIANAPOLIS,IN,"$300,048"
Lung Cancer,2014,NCI,5U54CA151459-05,8856,Magneto-Nano Diagnostic and Analytical Devices for Cancer,"WANG, SHAN",STANFORD UNIVERSITY,CA,"$236,780"
Lung Cancer,2014,NCI,5U54CA151459-05,8857,Nanotechnologies for Comprehensive Single Cancer Cell Analysis,"QUAKE, STEPHEN",STANFORD UNIVERSITY,CA,"$496,597"
Lung Cancer,2014,NCI,5U54CA151459-05,8858,Integration of Nano-Molecular Imaging and Nanosensors,"GAMBHIR, SANJIV",STANFORD UNIVERSITY,CA,"$155,794"
Lung Cancer,2014,NCI,5P50CA114747-10,5347,Monitoring Response to Targeted Therapy in Non-Small Cell Lung Cancer Using 18F..,"GAMBHIR, SANJIV",STANFORD UNIVERSITY,CA,"$853,818"
Lung Cancer,2014,NCI,5P50CA114747-10,5349,Multi-Modality Imaging of Oncogene Addiction,"FELSHER, DEAN",STANFORD UNIVERSITY,CA,"$144,404"
Lung Cancer,2014,NCI,5U54CA163071-03,7987,Molecular Biology of Lung Cancer among Puerto Ricans,"SANTIAGO, PEDRO",PONCE SCHOOL OF MEDICINE,PR,"$183,964"
Lung Cancer,2014,NCI,7R01CA141144-05,,Fibroblast Activation Protein in the Tumor Microenvironment in Lung Cancer,"PURE', ELLEN",UNIVERSITY OF PENNSYLVANIA,PA,"$297,775"
Lung Cancer,2014,NCI,5U54CA163068-03,8053,Molecular Biology of Lung Cancer among Puerto Ricans,"CRESS, DOUG",H. LEE MOFFITT CANCER CTR & RES INST,FL,"$205,662"
Lung Cancer,2014,NIGMS,5K25GM093233-04,,Low Cost Diagnosis of Disease using Synthetic DNA Reactions,"HUGHES, WILLIAM",BOISE STATE UNIVERSITY,ID,"$136,807"
Lung Cancer,2014,NCI,5P50CA090440-14,5226,Vitamin D3 Modulation of Inflammation and Lung Cancer Risk,"DIERGAARDE, BRENDA",UNIVERSITY OF PITTSBURGH AT PITTSBURGH,PA,"$94,028"
Lung Cancer,2014,NCI,5P50CA090440-14,5225,Selective Targeting of Estrogen Pathways in Lung Cancer Using Biomarkers,"SIEGFRIED, JILL",UNIVERSITY OF PITTSBURGH AT PITTSBURGH,PA,"$301,861"
Lung Cancer,2014,NCI,5P50CA090440-14,5227,Lung Cancer Risk Prediction in the Pittsburgh Lung Screening Study (PLuSS) Cohort,"BIGBEE, WILLIAM",UNIVERSITY OF PITTSBURGH AT PITTSBURGH,PA,"$309,932"
Lung Cancer,2014,NCI,5P50CA090440-14,5228,Targeting Neutrophil Elastase in Lung Cancer,"SHAPIRO, STEVEN",UNIVERSITY OF PITTSBURGH AT PITTSBURGH,PA,"$330,231"
Lung Cancer,2014,NCI,5P50CA090440-14,5229,Administrative Core,"SIEGFRIED, JILL",UNIVERSITY OF PITTSBURGH AT PITTSBURGH,PA,"$173,286"
Lung Cancer,2014,NCI,5P50CA090440-14,5230,Core B: Clinical Core,"WEISSFELD, JOEL",UNIVERSITY OF PITTSBURGH AT PITTSBURGH,PA,"$565,654"
Lung Cancer,2014,NCI,5P50CA090440-14,5231,Tissue and Blood Bank Core,"DACIC, SANJA",UNIVERSITY OF PITTSBURGH AT PITTSBURGH,PA,"$150,271"
Lung Cancer,2014,NCI,5P50CA090440-14,5232,BIOSTATISTICS/BIOINFORMATICS CORE,"LAND, STEPHANIE",UNIVERSITY OF PITTSBURGH AT PITTSBURGH,PA,"$236,736"
Lung Cancer,2014,NCI,5U01CA155340-04,,One-carbon metabolism biomarkers and lung cancer risk,"BRENNAN, PAUL",INTERNATIONAL AGENCY FOR RES ON CANCER,FR,"$771,081"
Lung Cancer,2014,NHLBI,5F32HL117581-02,,Mechanisms of Lkb1 function in lymphocytes in the context of Kras activation,"SOUROULLAS, GEORGE",UNIV OF NORTH CAROLINA CHAPEL HILL,NC,"$55,094"
Lung Cancer,2014,NCI,5UH2CA169111-02,,Biomarkers of polyoma virus infection and lung cancer among non-smokers,"BOFFETTA, PAOLO",ICAHN SCHOOL OF MEDICINE AT MOUNT SINAI,NY,"$194,370"
Lung Cancer,2014,NCI,5R01CA180126-02,,(PQB4) Age-cancer interplay of genome and epi-genome in human lung,"VIJG, JAN",ALBERT EINSTEIN COLLEGE OF MEDICINE,NY,"$679,887"
Lung Cancer,2014,NCI,5R00CA151968-05,,Functional Characterization of Hmga2 in Lung Cancer Progression,"WINSLOW, MONTE",STANFORD UNIVERSITY,CA,"$237,269"
Lung Cancer,2014,NCI,7R01CA133253-05,,Lung cancer heterogeneity and its impact on drug resistance.,"ALTSCHULER, STEVEN","UNIVERSITY OF CALIFORNIA, SAN FRANCISCO",CA,"$232,575"
Lung Cancer,2014,NCI,5R01CA136635-06,,ROLE OF DNA METHYLTRANSFERASE 3B IN LUNG TUMORIGENESIS,"MAO, LI",UNIVERSITY OF MARYLAND BALTIMORE,MD,"$157,870"
Lung Cancer,2014,NIBIB,1U01EB018753-01,,Accelerated statistical image reconstruction methods for X-ray CT,"FESSLER, JEFFREY",UNIVERSITY OF MICHIGAN,MI,"$508,518"
Lung Cancer,2014,NCI,7P01CA090890-10,6522,Transplacental Chemoprevention of Lung Tumors and Lymphomas,"WILLIAMS, DAVID",OREGON STATE UNIVERSITY,OR,"$260,425"
Lung Cancer,2014,NCI,5R01CA155284-04,,Optical Nanoscale Analysis of Buccal Cells: Transforming Lung Cancer Screening,"BACKMAN, VADIM",NORTHWESTERN UNIVERSITY,IL,"$527,979"
Lung Cancer,2014,NCI,5U54CA151838-05,5099,Screening DNA Methylation in Bodily Fluids for Early Cancer Diagnostics,"WANG, TZA-HUEI",JOHNS HOPKINS UNIVERSITY,MD,"$1,074,602"
Lung Cancer,2014,NCI,5U54CA151838-05,5101,Non-Invasive Quantification of Vaccine-Mediated Antigen Delivery to,"LEVITSKY, HYAM",JOHNS HOPKINS UNIVERSITY,MD,"$184,189"
Lung Cancer,2014,NCI,5U54CA151838-05,5102,Mucus Penetrating Nanoparticles for Small Cell Lung Cancer,"HANES, JUSTIN",JOHNS HOPKINS UNIVERSITY,MD,"$179,452"
Lung Cancer,2014,NCI,5R03CA178843-02,,Green tea effects on gene expression in tobacco users,"SCHWARTZ, JOEL",UNIVERSITY OF ILLINOIS AT CHICAGO,IL,"$77,358"
Lung Cancer,2014,NCI,5U54CA156732-05,5439,Racial Disparities in Depression and Mental Healthcare Utilization in Lung Cancer,"CANNON, SHEILA",UNIVERSITY OF MASSACHUSETTS BOSTON,MA,"$2,836"
Lung Cancer,2014,NCI,5R21CA173211-02,,Feasibility of grape seed extract for lung cancer chemoprevention,"MAO, JENNY",BIOMEDICAL RESEARCH INSTITUTE OF NEW MEX,NM,"$26,283"
Lung Cancer,2014,NCI,5U01CA152751-05,,The UCLA - Boston University Lung Cancer Biomarker Development Laboratory,"DUBINETT, STEVEN",UNIVERSITY OF CALIFORNIA LOS ANGELES,CA,"$598,984"
Lung Cancer,2014,NIBIB,5R37EB000244-35,,Controlled Release of Macromolecules,"LANGER, ROBERT",MASSACHUSETTS INSTITUTE OF TECHNOLOGY,MA,"$378,300"
Lung Cancer,2014,NCI,5K07CA175063-02,,The Impact of the Medicare Modernization Act of 2003 on Cancer Care,"PARSONS, HELEN",UNIVERSITY OF TEXAS HLTH SCIENCE CENTER,TX,"$127,999"
Lung Cancer,2014,NCI,5R21CA179403-02,,Plasma RNA based Early Lung Cancer Detection by Tethered Cationic Lipoplex Assay,"LEE, LY",OHIO STATE UNIVERSITY,OH,"$194,941"
Lung Cancer,2014,NHLBI,5P50HL120100-02,8207,Project 3: Mouse Models of Smoking-related Diseases: What is the Best,"DOERSCHUK, CLAIRE",UNIV OF NORTH CAROLINA CHAPEL HILL,NC,"$19,646"
Lung Cancer,2014,NCI,5R33CA173373-02,,Clinical validation of the HD-CTC fluid biopsy in early detection of lung cancer.,"KUHN, PETER",SCRIPPS RESEARCH INSTITUTE,CA,"$521,105"
Lung Cancer,2014,NIBIB,5R01EB016983-02,,High-throughput molecular-specific cell nanocytology for cancer screening,"SUBRAMANIAN, HARIHARAN",NORTHWESTERN UNIVERSITY,IL,"$324,483"
Lung Cancer,2014,NCI,5R01CA172921-02,,Use of Genetically Engineered T cells Targeting Tumor Stroma to Treat Lung Cancer,"ALBELDA, STEVEN",UNIVERSITY OF PENNSYLVANIA,PA,"$346,942"
Lung Cancer,2014,NCI,5P30CA177558-02,8626,PROJECT 2. Planning and Evaluation,"EVERS, BERNARD",UNIVERSITY OF KENTUCKY,KY,"$59,419"
Lung Cancer,2014,NCI,2P01CA087971-11A1,5032,Project 1: A Randomized Clinical Trial for Patients with,"FRIEDBERG, JOSEPH",UNIVERSITY OF PENNSYLVANIA,PA,"$264,496"
Lung Cancer,2014,NCI,2P01CA087971-11A1,5033,Project 2: Evaluation and Augmentation of Anti-tumoral Immune Responses Induced b,"ALBELDA, STEVEN",UNIVERSITY OF PENNSYLVANIA,PA,"$203,801"
Lung Cancer,2014,NCI,2P01CA087971-11A1,5034,Project 3: Evaluating and Modulating the Negative Impact of Surgically-Induced Cytokines on Tumor Response to Photodynamic Therapy,"CENGEL, KEITH",NIH,,"$202,308"
Lung Cancer,2014,NCI,5R01CA172211-02,,Integrative Analysis to Identify Therapeutic Targets for Lung Cancer,"XIAO, GUANGHUA",UT SOUTHWESTERN MEDICAL CENTER,TX,"$320,027"
Lung Cancer,2014,NCI,5R01CA175370-02,,Notch ligands in regulation of anti-cancer immunity,"CARBONE, DAVID",OHIO STATE UNIVERSITY,OH,"$304,831"
Lung Cancer,2014,NCI,5R44CA168158-03,,Development of sEphB4-HSA as Novel Therapeutic in Cancer,"KRASNOPEROV, VALERY","VASGENE THERAPEUTICS, INC",CA,"$589,768"
Lung Cancer,2014,NIBIB,5R21EB017952-02,,Multi-lumen steerable needles for transoral access to lung nodules,"ALTEROVITZ, RON",UNIV OF NORTH CAROLINA CHAPEL HILL,NC,"$176,043"
Lung Cancer,2014,NCI,7P01CA163223-02,7601,Microenvironmental Nutrient Availability and Immunomodulation in Lung Cancer Cel,"FAN, TERESA",UNIVERSITY OF KENTUCKY,KY,"$273,326"
Lung Cancer,2014,NCI,7P01CA163223-02,7602,Determining Tumor Metabolism and Biochemical Mechanism of beta-glucan Action in,"YAN, JUN",UNIVERSITY OF KENTUCKY,KY,"$261,521"
Lung Cancer,2014,NCI,7P01CA163223-02,7603,Determining Molecular Mechanisms of NSCLC and Response to beta-glucan,"LANE, ANDREW",UNIVERSITY OF KENTUCKY,KY,"$256,974"
Lung Cancer,2014,NCI,7P01CA163223-02,7604,"Administration, Bioinformatics and Biostatistics Core","LANE, ANDREW",UNIVERSITY OF KENTUCKY,KY,"$136,099"
Lung Cancer,2014,NCI,7P01CA163223-02,7605,Stable Isotope Resolved Metabolomics Analytical Shared Core,"HIGASHI, RICHARD",UNIVERSITY OF KENTUCKY,KY,"$308,521"
Lung Cancer,2014,NCI,5U54CA132378-07,5835,Taxi Particulate Matter Study (Zhang/Jans),"HUBBARD, KAREN",CITY COLLEGE OF NEW YORK,NY,"$106,603"
Lung Cancer,2014,NCI,2P50CA070907-16A1,5890,Molecular Signatures for Individualizing Lung Cancer Therapy,"MINNA, JOHN",UT SOUTHWESTERN MEDICAL CENTER,TX,"$397,276"
Lung Cancer,2014,NCI,2P50CA070907-16A1,5891,Epidemiologic Studies of Germline Polymorphisms in miRNA Pathways: Risk of Lung Cancer Development and Recurrence,"WU, XIFENG",UNIVERSITY OF TX MD ANDERSON CAN CTR,TX,"$424,704"
Lung Cancer,2014,NCI,2P50CA070907-16A1,5892,Preclinical Development and Clinical Testing of MEK and PI3K Targeted Therapy for KRAS-mutant NSCLC,"SCAGLIONI, PIER",UT SOUTHWESTERN MEDICAL CENTER,TX,"$302,512"
Lung Cancer,2014,NCI,2P50CA070907-16A1,5893,Therapeutic Targeting of Telomerase in Lung Cancer Stem Cells,"SHAY, JERRY",UT SOUTHWESTERN MEDICAL CENTER,TX,"$192,937"
Lung Cancer,2014,NCI,2P50CA070907-16A1,5894,Administrative Core,"MINNA, JOHN",UT SOUTHWESTERN MEDICAL CENTER,TX,"$173,223"
Lung Cancer,2014,NCI,2P50CA070907-16A1,5895,Tissue Resources and Molecular Pathology,"WISTUBA, IGNACIOO",UT SOUTHWESTERN MEDICAL CENTER,TX,"$239,944"
Lung Cancer,2014,NCI,2P50CA070907-16A1,5896,Biostatistics and Bioinformatics Core,"XIE, YANG",UT SOUTHWESTERN MEDICAL CENTER,TX,"$278,105"
Lung Cancer,2014,NCI,2P50CA070907-16A1,5897,Developmental Research Program,"MINNA, JOHN",UT SOUTHWESTERN MEDICAL CENTER,TX,"$76,649"
Lung Cancer,2014,NCI,2P50CA070907-16A1,5898,Career Development Program,"MINNA, JOHN",UT SOUTHWESTERN MEDICAL CENTER,TX,"$76,649"
Lung Cancer,2014,NCI,1K99CA187035-01,,Triggering the dopamine pathway to inhibit lung cancer progression,"HOEPPNER, LUKE",MAYO CLINIC ROCHESTER,MN,"$134,923"
Lung Cancer,2014,NCI,1R01CA187143-01,,A Psychosocial Intervention for the Caregivers of Advanced Lung Cancer Patients,"BADR, HODA",ICAHN SCHOOL OF MEDICINE AT MOUNT SINAI,NY,"$522,597"
Lung Cancer,2014,NCI,5F31CA180689-02,,Characterization of the SUMO ligase PIAS1 in tumor progression and metastasis,"CONSTANZO, JERFIZ",UT SOUTHWESTERN MEDICAL CENTER,TX,"$30,188"
Lung Cancer,2014,NCI,1K99CA187317-01,,Investigating Wnt and Lgr5 signaling as regulators of lung cancer heterogeneity,"TAMMELA, TUOMAS",MASSACHUSETTS INSTITUTE OF TECHNOLOGY,MA,"$122,873"
Lung Cancer,2014,NCI,1R01CA187457-01,,Identifying Mechanisms of Sox2-Driven Squamous Cell Lung Cancer,"OLIVER, TRUDY",UNIVERSITY OF UTAH,UT,"$309,175"
Lung Cancer,2014,NCI,1K07CA187071-01,,Evaluating the Effectiveness of Lung Cancer Screening in Patients with COPD,"KALE, MINAL",ICAHN SCHOOL OF MEDICINE AT MOUNT SINAI,NY,"$167,509"
Lung Cancer,2014,NCI,1R01CA177786-01A1,,Novel mechanisms of oncogenic transformation in lung cancer,"EISCHEN, CHRISTINE",VANDERBILT UNIVERSITY,TN,"$325,775"
