Category,FY,Funding IC,Project Number,Sub Project #,Project Title,PI Name,Org Name,State / Country,Amount
Lung Cancer,2014,NCI,5R01CA129771-05,,Tobacco cessation interventions with Ohio Appalachian smokers,"WEWERS, MARY",OHIO STATE UNIVERSITY,OH,"$438,869"
Lung Cancer,2014,NCI,5R01CA096679-09,,LUNG TRAJECTORY MAPPING FOR RADIATION THERAPY,"LOW, DANIEL",UNIVERSITY OF CALIFORNIA LOS ANGELES,CA,"$309,722"
Lung Cancer,2014,NCI,5R01CA138528-05,,Role of the noncanonical WNT pathway in non-small cell lung cancer,"WINN, ROBERT",UNIVERSITY OF ILLINOIS AT CHICAGO,IL,"$261,578"
Lung Cancer,2014,NIEHS,5R01ES021110-03,,Inflammasomes in pathogenesis of mesothelioma,"SHUKLA, ARTI",UNIVERSITY OF VERMONT & ST AGRIC COLLEGE,VT,"$339,694"
Lung Cancer,2014,NIEHS,5R01ES019584-03,,Long-term Air Pollution Exposure and Mortality in the NIH-AARP Cohort,"THURSTON, GEORGE",NEW YORK UNIVERSITY SCHOOL OF MEDICINE,NY,"$399,638"
Lung Cancer,2014,NCI,2R01CA124495-07,,Identification and targeting of the signaling pathways underlying lung cancer.,"KISSIL, JOSEPH",SCRIPPS FLORIDA,FL,"$425,250"
Lung Cancer,2014,NIEHS,2R01ES016893-06,,Particulate Cr(VI) Toxicology in Human Lung Epithelial Cells and Fibroblasts,"WISE, JOHN",UNIVERSITY OF SOUTHERN MAINE,ME,"$333,340"
Lung Cancer,2014,NEI,5F32EY022558-02,,Understanding and enhancing visual search performance in complex scenes,"VO, MELISSA",BRIGHAM AND WOMEN'S HOSPITAL,MA,"$56,978"
Lung Cancer,2014,NCI,5R01CA154699-05,,Mechanistic Elaboration of Fragility in the Cancer Cell Mitotic Spindle,"WHITEHURST, ANGELIQUE",UT SOUTHWESTERN MEDICAL CENTER,TX,"$304,430"
Lung Cancer,2014,NCI,5R01CA102142-10,,Role of POZ-zinc finger proteins in tumorigenesis.,"PANDOLFI, PIER PAOLO",BETH ISRAEL DEACONESS MEDICAL CENTER,MA,"$321,009"
Lung Cancer,2014,NCI,5R01CA140409-05,,Development of Small Molecule Radiation Sensitizers,"FREEMAN, MICHAEL",VANDERBILT UNIVERSITY,TN,"$332,658"
Lung Cancer,2014,NCI,5R01CA140515-05,,Tyrosine Kinase Signaling in Cancer Cell Metabolism,"CHEN, JING",EMORY UNIVERSITY,GA,"$305,027"
Lung Cancer,2014,NCI,5R01CA108610-09,,Peroxisome Proliferator-Activated Receptor (gamma) in Lung Cancer,"NEMENOFF, RAPHAEL",UNIVERSITY OF COLORADO DENVER,CO,"$288,476"
Lung Cancer,2014,NCI,5P30CA016520-38,5523,Tobacco and Environmental Carcinogenesis Program,"LERMAN, CARYN",UNIVERSITY OF PENNSYLVANIA,PA,"$135,765"
Lung Cancer,2014,NIEHS,5R01ES020357-03,,Mitigation of asbestos induced alveolar epithelial cell injury,"KAMP, DAVID",NORTHWESTERN UNIVERSITY AT CHICAGO,IL,"$325,156"
Lung Cancer,2014,NCI,5R01CA136799-05,,Regulation of Ras and Rho Family GTPases in Lung Cancer,"WILLIAMS, CAROL",MEDICAL COLLEGE OF WISCONSIN,WI,"$296,760"
Lung Cancer,2014,NIDCR,5R01DE013173-13,,Tumor Suppressor Qualities and Mechanisms of LZAP Activity,"YARBROUGH, WENDELL",YALE UNIVERSITY,CT,"$416,250"
Lung Cancer,2014,NCI,5R01CA109038-09,,"NKX2-1, A Candidate Lineage Survival Oncogene in Lung Adenocarcinoma","MEYERSON, MATTHEW",DANA-FARBER CANCER INST,MA,"$411,644"
Lung Cancer,2014,NCI,5R01CA162226-02,,Eicosanoids in Lung Cancer: Progression and Metastasis,"NEMENOFF, RAPHAEL",UNIVERSITY OF COLORADO DENVER,CO,"$310,970"
Lung Cancer,2014,NCI,5R01CA164273-03,,Identification of Resistance Mechanisms to Anaplastic Lymphoma Kinase Inhibitors,"SHAW, ALICE",MASSACHUSETTS GENERAL HOSPITAL,MA,"$341,282"
Lung Cancer,2014,NIMHD,5R01MD005892-03,,Improving Resection Rates among African Americans with NSCLC,"FORD, MARVELLA",MEDICAL UNIVERSITY OF SOUTH CAROLINA,SC,"$368,750"
Lung Cancer,2014,NCI,5R01CA143167-05,,DICER1 and the Pleuropulmonary Blastoma Family Cancer Syndrome,"HILL, DANA",CHILDREN'S RESEARCH INSTITUTE,DC,"$321,058"
Lung Cancer,2014,NCI,5R01CA172560-02,,Mechanisms of action of the Smyd3 methyltransferase in cancer cells,"GOZANI, OR",STANFORD UNIVERSITY,CA,"$443,781"
Lung Cancer,2014,NIEHS,5R01ES010807-14,,Molecular Mechanisms of Complex Mixture Toxicity,"PUGA, ALVARO",UNIVERSITY OF CINCINNATI,OH,"$447,496"
Lung Cancer,2014,NCI,5R01CA155061-04,,Multifunctional PEG Hydrogel Nano/Microparticles for Targeted Treatment of NSCLC,"SINKO, PATRICK","RUTGERS, THE STATE UNIV OF N.J.",NJ,"$358,638"
Lung Cancer,2014,NCI,5R03CA167696-02,,Interaction of Vitamin D & Vitamin A with Lung Cancer Risk in Non-Smoking Females,"NEUHOUSER, MARIAN",FRED HUTCHINSON CANCER RESEARCH CENTER,WA,"$85,360"
Lung Cancer,2014,NCI,5R01CA140416-05,,Antifolate activators of AMP-dependent protein kinase,"MORAN, RICHARD",VIRGINIA COMMONWEALTH UNIVERSITY,VA,"$280,918"
Lung Cancer,2014,NCI,5P30CA006516-49,6055,Lung Cancer,"CHRISTIANI, DAVID",HARVARD SCHOOL OF PUBLIC HEALTH,MA,"$87,730"
Lung Cancer,2014,NCI,5R01CA167516-02,,HuR Targeted Nanotherapy for Lung Cancer,"RAMESH, RAJAGOPAL",UNIVERSITY OF OKLAHOMA HLTH SCIENCES CTR,OK,"$366,314"
Lung Cancer,2014,NCI,5R01CA112557-09,,Molecular Mechanisms of Nickel-induced Tumorigenicity.,"HUANG, CHUANSHU",NEW YORK UNIVERSITY SCHOOL OF MEDICINE,NY,"$271,505"
Lung Cancer,2014,NCI,5R01CA144034-05,,Prospective studies of cancer etiology and prevention in Shanghai and Singapore,"YUAN, JIAN-MIN",UNIVERSITY OF PITTSBURGH AT PITTSBURGH,PA,"$1,149,583"
Lung Cancer,2014,NCI,5R01CA097061-11,,Chemical genetic profiling of engineered tumor cells,"STOCKWELL, BRENT",COLUMBIA UNIV NEW YORK MORNINGSIDE,NY,"$339,671"
Lung Cancer,2014,NCI,1U10CA180950-01,,ECOG-ACRIN Thoracic Malignancies Integrated Translational Science Center,"RAMALINGAM, SURESH",EMORY UNIVERSITY,GA,"$600,000"
Lung Cancer,2014,NCI,5R01CA138759-05,,Stat3 Downstream Genes as Lung Adenocarcinoma Biomarkers,"YAN, CONG",INDIANA UNIV-PURDUE UNIV AT INDIANAPOLIS,IN,"$333,241"
Lung Cancer,2014,NCI,5R01CA172229-02,,AMPK and AMPK-related kinases in lung cancer development and treatment,"SHAW, REUBEN",SALK INSTITUTE FOR BIOLOGICAL STUDIES,CA,"$390,474"
Lung Cancer,2014,NCI,1U10CA180868-01,,NRG ONCOLOGY NETWORK GROUP OPERATIONS CENTER,"WOLMARK, NORMAN","NRG ONCOLOGY FOUNDATION, INC.",PA,"$18,813,807"
Lung Cancer,2014,NCI,5R21CA164521-02,,Novel Methods to Reduce Children's Secondhand Smoke Exposure,"WAGENER, THEODORE",UNIVERSITY OF OKLAHOMA HLTH SCIENCES CTR,OK,"$138,547"
Lung Cancer,2014,NCI,5R01CA073756-15,,Ras-Induced Lung Cancer: Key Roles for IKK and NF-kappaB,"BALDWIN, ALBERT",UNIV OF NORTH CAROLINA CHAPEL HILL,NC,"$244,798"
Lung Cancer,2014,NCI,5R01CA149363-05,,Novel nanoparticles for siRNA delivery,"HUANG, LEAF",UNIV OF NORTH CAROLINA CHAPEL HILL,NC,"$285,192"
Lung Cancer,2014,NCI,5R01CA149668-05,,Targeting apoptosis via chemical design of Bcl-2 antagonists,"PELLECCHIA, MAURIZIO",SANFORD-BURNHAM MEDICAL RESEARCH INSTIT,CA,"$380,712"
Lung Cancer,2014,NCI,5R03CA167727-02,,Lung Cancer Prevention by Quercetin Through IL-6 Secretion & Signaling,"CHEN, WENSHU",LOVELACE BIOMEDICAL & ENVIRONMENTAL RES,NM,"$104,760"
Lung Cancer,2014,NCI,5R01CA102353-09,,Molecular Approaches to Early Detection of Lung Cancer,"MASSION, PIERRE",VANDERBILT UNIVERSITY,TN,"$198,513"
Lung Cancer,2014,NCI,5R01CA140492-05,,Regulation of Tumorigenesis and therapeutic resistance by Nrf2 in lung cancer,"BISWAL, SHYAM",JOHNS HOPKINS UNIVERSITY,MD,"$319,261"
Lung Cancer,2014,NCI,5R01CA169338-02,,Rational Combined Inhibition of NF-kB and EGFR to Optimize Lung Cancer Treatment,"BIVONA, TREVER","UNIVERSITY OF CALIFORNIA, SAN FRANCISCO",CA,"$246,817"
Lung Cancer,2014,NCI,5R01CA151433-05,,Multimodal Image-Guided Intervention System for Lung-Cancer Diagnosis and Staging,"HIGGINS, WILLIAM",PENNSYLVANIA STATE UNIVERSITY-UNIV PARK,PA,"$369,397"
Lung Cancer,2014,NCI,5R01CA100853-10,,Mechanisms of Chemoprevention by Isothiocyanates,"CHUNG, FUNG-LUNG",GEORGETOWN UNIVERSITY,DC,"$306,405"
Lung Cancer,2014,NIEHS,5R01ES015010-08,,The protective role of Nrf2 against arsenic-induced toxicity and carcinogenicity,"ZHANG, DONNA",UNIVERSITY OF ARIZONA,AZ,"$287,100"
Lung Cancer,2014,NCI,5R01CA047135-24,,Merging Marine-Derived Cytotoxic Natural Products With Experimental Therapeutics,"CREWS, PHIL",UNIVERSITY OF CALIFORNIA SANTA CRUZ,CA,"$626,963"
Lung Cancer,2014,NCI,5R01CA154755-04,,Inhaled DNA demethylating therapy for lung cancer and bronchial premalignancy,"PEREZ-SOLER, ROMAN",ALBERT EINSTEIN COLLEGE OF MEDICINE,NY,"$483,713"
Lung Cancer,2014,NCI,5R01CA166054-02,,Effect of anti-S phase agents on human chromosomes,"DUTTA, ANINDYA",UNIVERSITY OF VIRGINIA,VA,"$318,015"
Lung Cancer,2014,NCI,5R21CA170063-02,,QUANTITATIVE DETECTION OF CLINICALLY ACTIONABLE MUTATIONS IN LUNG CANCER,"WATSON, MARK",WASHINGTON UNIVERSITY,MO,"$128,273"
Lung Cancer,2014,NCI,5F32CA157197-03,,Array of Resistive Sensors for Detecting Lung Cancer in Exhaled Air,"MIRICA, KATHERINE",MASSACHUSETTS INSTITUTE OF TECHNOLOGY,MA,"$53,282"
Lung Cancer,2014,NCI,5R01CA166119-02,,Consistent anatomy registration for lung cancer adaptive radiation therapy,"HUGO, GEOFFREY",VIRGINIA COMMONWEALTH UNIVERSITY,VA,"$297,298"
Lung Cancer,2014,NCI,2P01CA059827-16A1,5909,Response-driven Treatment of Non-Small Cell Lung Cancer,"HAYMAN, JAMES",UNIVERSITY OF MICHIGAN,MI,"$284,610"
Lung Cancer,2014,NCI,5R01CA102707-10,,Inhibition  of Cytochrome c-induced Caspase Activation,"KORNBLUTH, SALLY",DUKE UNIVERSITY,NC,"$255,163"
Lung Cancer,2014,NIEHS,5R01ES017009-05,,Nicotinic Receptor Ligands and Tobacco-induced Lung Cancer,"GRANDO, SERGEI",UNIVERSITY OF CALIFORNIA-IRVINE,CA,"$337,400"
Lung Cancer,2014,NIGMS,5R01GM098453-03,,"Design, Synthesis, and Evaluation of Lactate Dehydrogenase Inhibitors","HERGENROTHER, PAUL",UNIVERSITY OF ILLINOIS URBANA-CHAMPAIGN,IL,"$423,781"
Lung Cancer,2014,NCI,5R01CA172660-02,,The Role of p53-inducible Sesn1 and Sesn2 genes in lung carcinogenesis,"BUDANOV, ANDREI",VIRGINIA COMMONWEALTH UNIVERSITY,VA,"$276,250"
Lung Cancer,2014,NCI,5R01CA142842-05,,Sensitive and Specific Molecular Imaging of Pulmonary Nodules,"DRIEHUYS, BASTIAAN",DUKE UNIVERSITY,NC,"$297,813"
Lung Cancer,2014,NIMHD,5P20MD006738-03,6474,Targeted Nanocarrier Combination Based Therapy for Lung Cancer,"SACHDEVA, MANDIP",FLORIDA AGRICULTURAL AND MECHANICAL UNIV,FL,"$145,024"
Lung Cancer,2014,NIMHD,5P20MD006738-03,6539,Research Core,"SACHDEVA, MANDIP",FLORIDA AGRICULTURAL AND MECHANICAL UNIV,FL,"$145,022"
Lung Cancer,2014,NIGMS,5R01GM076343-09,,Structural Basis of Cytochrome P450 Activity,"SCOTT, EMILY",UNIVERSITY OF KANSAS LAWRENCE,KS,"$314,385"
Lung Cancer,2014,NHLBI,1R01HL121267-01,,Mutant Surfactant - Induced TGF-beta Secretion in Lung Fibrosis,"GARCIA, CHRISTINE",UT SOUTHWESTERN MEDICAL CENTER,TX,"$513,604"
Lung Cancer,2014,NCI,5R01CA140571-04,,Pro-Oncogenic Role of LKB1 in NSCLC,"ZHOU, WEI",EMORY UNIVERSITY,GA,"$311,976"
Lung Cancer,2014,NCI,5R01CA158941-04,,HAT Inhibition to Impair Foxp3+ Treg Function and Boost Anti-Tumor Immunity,"HANCOCK, WAYNE",CHILDREN'S HOSP OF PHILADELPHIA,PA,"$333,413"
Lung Cancer,2014,NCI,7R01CA149462-05,,A genomewide study of lung cancer in never smokers,"GORLOVA, OLGA",DARTMOUTH COLLEGE,NH,"$435,109"
Lung Cancer,2014,NCI,5P30CA046934-26,8115,"LUNG, HEAD AND NECK CANCERS","MILLER, YORK",UNIVERSITY OF COLORADO DENVER,CO,"$33,430"
Lung Cancer,2014,NCI,1R21CA181291-01,,Discovery of Homologous Recombination DNA Repair Deficiency in Lung Tumor,"DUAN, WENRUI",OHIO STATE UNIVERSITY,OH,"$167,204"
Lung Cancer,2014,NCI,5R01CA090687-13,,Cyclin-Dependent Kinase Inhibition During S Phase,"SHAPIRO, GEOFFREY",DANA-FARBER CANCER INST,MA,"$296,988"
Lung Cancer,2014,NCI,5R01CA151601-04,,"Nicotine, nicotinic receptors and lung cancer","SPINDEL, ELIOT",OREGON HEALTH & SCIENCE UNIVERSITY,OR,"$425,326"
Lung Cancer,2014,NCI,5R21CA164764-02,,EARLY DETECTION OF LUNG CANCER USING METABOLOMIC LIPID PROFILING,"DENG, YOUPING",RUSH UNIVERSITY MEDICAL CENTER,IL,"$193,675"
Lung Cancer,2014,NCI,5U01CA143062-05,,Radiomics of NSCLC,"GILLIES, ROBERT",H. LEE MOFFITT CANCER CTR & RES INST,FL,"$491,302"
Lung Cancer,2014,NCI,5R01CA152301-05,,Predicting Adjuvant Chemotherapy Response in Lung Cancer,"XIE, YANG",UT SOUTHWESTERN MEDICAL CENTER,TX,"$327,218"
Lung Cancer,2014,NCI,5R01CA142794-05,,Characterization and therapeutic targeting of HIF in LKB1 - deficient lung cancer,"KIM, WILLIAM",UNIV OF NORTH CAROLINA CHAPEL HILL,NC,"$287,693"
Lung Cancer,2014,NCI,5R21CA175603-02,,Modeling the KIF5B-RET Fusion Gene of Lung Cancer in Vivo,"WU, JIE",H. LEE MOFFITT CANCER CTR & RES INST,FL,"$213,296"
Lung Cancer,2014,NIEHS,5R01ES009132-12,,Molecular mechanism of cytochrome P4501A1 expression.,"MOORTHY, BHAGAVATULA",BAYLOR COLLEGE OF MEDICINE,TX,"$350,386"
Lung Cancer,2014,NCI,5R01CA154365-04,,Identification and Characterization of Gene Fusions in Lung Adenocarcinoma,"BEER, DAVID",UNIVERSITY OF MICHIGAN,MI,"$278,426"
Lung Cancer,2014,NCI,5F32CA157082-03,,The Role of de novo Cytosine DNA Methyltransferases 3a & 3b in Gene Methylation,"TENENG, IVO",LOVELACE BIOMEDICAL & ENVIRONMENTAL RES,NM,"$59,717"
Lung Cancer,2014,NCI,5R01CA157450-04,,Regulation of Lung Cancer Metastasis by miR-200,"KURIE, JONATHAN",UNIVERSITY OF TX MD ANDERSON CAN CTR,TX,"$319,845"
Lung Cancer,2014,NIGMS,5SC2CA179928-02,,Bioactive lipids in lung carcinogenesis: A modulatory role for CYP2S1,"ROWLAND, AARON",NEW MEXICO STATE UNIVERSITY LAS CRUCES,NM,"$141,620"
Lung Cancer,2014,NCI,5U54CA112967-10,6515,Mitogenesis Networks,"WHITE, FOREST",MASSACHUSETTS INSTITUTE OF TECHNOLOGY,MA,"$1,002,336"
Lung Cancer,2014,NCI,5R01CA148805-04,,The Role of p21-Activated Kinases in Malignant Mesothelioma,"CHERNOFF, JONATHAN",RESEARCH INST OF FOX CHASE CAN CTR,PA,"$359,276"
Lung Cancer,2014,NCI,5R01CA158540-03,,Functional characterization of the long non-coding RNA Scirocco in development an,"MARTINEZ, ERNEST",UNIVERSITY OF CALIFORNIA RIVERSIDE,CA,"$299,054"
Lung Cancer,2014,NCI,5R01CA142787-05,,Role of DOK family proteins in lung tumor suppression,"PANDOLFI, PIER PAOLO",BETH ISRAEL DEACONESS MEDICAL CENTER,MA,"$339,713"
Lung Cancer,2014,NCI,5UM1CA173642-02,,Women's Health Initiative Cancer Survivor Cohort,"ANDERSON, GARNET",FRED HUTCHINSON CANCER RESEARCH CENTER,WA,"$2,232,714"
Lung Cancer,2014,NCI,1R21CA182111-01,,Reducing Lung Cancer Survivor Anxiety (RELAX) with Brief Device-Guided Breathing,"DANHAUER, SUZANNE",WAKE FOREST UNIVERSITY HEALTH SCIENCES,NC,"$133,690"
Lung Cancer,2014,NCI,5R01CA160593-02,,Survival Bump Hunting for Finding Informative Subgroups in High Dimensional Data.,"RAO, J",UNIVERSITY OF MIAMI SCHOOL OF MEDICINE,FL,"$250,249"
Lung Cancer,2014,NCI,1R03CA172954-01A1,,Evaluation of T Cell Response to Cisplatin Resistant NSCLC,"YANNELLI, JOHN",UNIVERSITY OF KENTUCKY,KY,"$75,000"
Lung Cancer,2014,NCI,5R01CA077337-13,,Genesis and Consequences of Aberrant DNA Methylation,"VERTINO, PAULA",EMORY UNIVERSITY,GA,"$291,495"
Lung Cancer,2014,NCI,5R01CA163293-03,,Pulmonary Rehabiltation before Lung Cancer Resection,"BENZO, ROBERTO",MAYO CLINIC ROCHESTER,MN,"$313,066"
Lung Cancer,2014,NCI,5R01CA166615-02,,Chemoprevention of inflammation-driven lung cancer,"KASSIE, FEKADU",UNIVERSITY OF MINNESOTA,MN,"$305,938"
Lung Cancer,2014,NCI,5R01CA160470-03,,Biochemical and Cell-Based HTS Assays for RGS17 Inhibitors,"ROMAN, DAVID",UNIVERSITY OF IOWA,IA,"$303,925"
Lung Cancer,2014,NCI,5R01CA039504-28,,Aldo-Keto Reductases and PAH Metabolism/Activation,"PENNING, TREVOR",UNIVERSITY OF PENNSYLVANIA,PA,"$216,784"
Lung Cancer,2014,NCI,5R03CA171663-02,,Targeting both intrinsic and extrinsic apoptosis by FLLL-12 in lung cancer,"AMIN, A.R.M.",EMORY UNIVERSITY,GA,"$75,660"
Lung Cancer,2014,NCI,5R01CA087546-14,,Lung Cancer Prevention Mechanisms,"DMITROVSKY, ETHAN",DARTMOUTH COLLEGE,NH,"$106,169"
Lung Cancer,2014,NCI,5U54CA112962-10,8629,Broad Institute Center for Cancer Systems Biology,"GOLUB, TODD","BROAD INSTITUTE, INC.",MA,"$2,106,778"
Lung Cancer,2014,NCI,5R01CA161585-03,,Targeting Galectin-1 with radiation in lung cancer,"LE, QUYNH-THU",STANFORD UNIVERSITY,CA,"$317,077"
Lung Cancer,2014,NCI,5R01CA166661-03,,Natural mutagenesis of human genomes by endogenous retrotransposons,"DEVINE, SCOTT",UNIVERSITY OF MARYLAND BALTIMORE,MD,"$308,958"
Lung Cancer,2014,NCI,5R01CA163896-03,,In vivo murine models of metastasis for therapeutic testing,"SHARPLESS, NORMAN",UNIV OF NORTH CAROLINA CHAPEL HILL,NC,"$388,202"
Lung Cancer,2014,NCI,5R01CA172253-02,,Dissemination and implementation of a corrective intervention to improve mediasti,"OSAROGIAGBON, RAYMOND",UNIVERSITY OF MEMPHIS,TN,"$454,797"
Lung Cancer,2014,NCI,5R01CA175336-02,,Molecular Dissection of Lung Cancer Progression and Metastasis,"WINSLOW, MONTE",STANFORD UNIVERSITY,CA,"$319,310"
Lung Cancer,2014,NCI,1R01CA175691-01A1,,Pathogenesis of Malignant Mesothelioma by the Human Polycomb Complex BAP1-ASXL,"TESTA, JOSEPH",RESEARCH INST OF FOX CHASE CAN CTR,PA,"$527,579"
Lung Cancer,2014,NCI,1R01CA174786-01A1,,Signaling and Targeting of 6-Phosphogluconate Dehydrogenase in Human Cancers,"CHEN, JING",EMORY UNIVERSITY,GA,"$335,236"
Lung Cancer,2014,NCI,5R01CA092025-13,,Benzo[a]pyrene metabolism: phenotyping and genotyping,"HECHT, STEPHEN",UNIVERSITY OF MINNESOTA,MN,"$364,576"
Lung Cancer,2014,NCI,5R00CA149144-04,,The Role of Sulfiredoxin in Tumorigenesis and Cancer Progression.,"WEI, QIOU",UNIVERSITY OF KENTUCKY,KY,"$231,146"
Lung Cancer,2014,NHLBI,5R01HL112212-03,,Reducing Environmental Tobacco Smoke Exposure in Public Housing,"LEVY, DOUGLAS",MASSACHUSETTS GENERAL HOSPITAL,MA,"$678,731"
Lung Cancer,2014,NCI,1R01CA175360-01A1,,The role of deubiquitinating enzyme USP33 in Slit-Robo signaling in lung cancer,"WU, JANE",NORTHWESTERN UNIVERSITY AT CHICAGO,IL,"$456,700"
Lung Cancer,2014,NCI,5R01CA169259-02,,Overcoming resistance to tyrosine kinase inhibitors in lung cancer,"KOBAYASHI, SUSUMU",BETH ISRAEL DEACONESS MEDICAL CENTER,MA,"$350,219"
Lung Cancer,2014,NCI,5R01CA121210-08,,Overcoming acquired resistance to EGFR inhibitors in lung cancer,"LOVLY, CHRISTINE",VANDERBILT UNIVERSITY,TN,"$293,717"
Lung Cancer,2014,NCI,5R01CA126801-06,,Role of CREB in Lung Cancer Development,"KOO, JA SEOK",YALE UNIVERSITY,CT,"$327,750"
Lung Cancer,2014,NCI,5R01CA166480-03,,Functional role of the MUC1-C oncoprotein in non-small cell lung cancer,"KUFE, DONALD",DANA-FARBER CANCER INST,MA,"$518,175"
Lung Cancer,2014,NIMHD,5P20MD006881-03,6380,Determinants and Consequences of Second-hand Smoke Exposure in African American,"DAVIS, SHARON",MOREHOUSE SCHOOL OF MEDICINE,GA,"$147,482"
Lung Cancer,2014,NCI,5F32CA168330-03,,Role of Ascl1 in glioma,"VUE, TOU YIA",UT SOUTHWESTERN MEDICAL CENTER,TX,"$55,094"
Lung Cancer,2014,NCI,5R01CA168761-02,,Chemical disruption of Wnt-mediated signal transduction,"LUM, LAWRENCE",UT SOUTHWESTERN MEDICAL CENTER,TX,"$450,087"
Lung Cancer,2014,NIBIB,5R01EB007049-08,,"Avoiding clearance to maximize dose: Shape, Flexibility, and a ""Marker of Self""","DISCHER, DENNIS",UNIVERSITY OF PENNSYLVANIA,PA,"$349,200"
Lung Cancer,2014,NIGMS,5R01GM079719-08,,Enabling new translational discoveries using a genomic data-driven nosology,"BUTTE, ATUL",STANFORD UNIVERSITY,CA,"$637,505"
Lung Cancer,2014,NCI,5R21CA169979-02,,ACTIVITY-BASED KINASE DISCOVERY IN SMALL CELL LUNG CANCER,"HAURA, ERIC",H. LEE MOFFITT CANCER CTR & RES INST,FL,"$182,868"
Lung Cancer,2014,NCI,1R21CA176256-01A1,,Role of SIRT1 in Lung Cancer Prevention by Beta-Cryptoxanthin,"WANG, XIANG-DONG",TUFTS UNIVERSITY BOSTON,MA,"$197,055"
Lung Cancer,2014,NCI,5R01CA164147-03,,Role of HDAC6 in platinum resistance of non-small cell lung cancer,"ZHANG, XIAOHONG",UNIVERSITY OF SOUTH FLORIDA,FL,"$301,223"
Lung Cancer,2014,NCI,5P01CA138338-05,7507,Multiethnic Genome Scan of Metabolic Phenotypes,"LE MARCHAND, LOIC",UNIVERSITY OF HAWAII AT MANOA,HI,"$943,323"
Lung Cancer,2014,NCI,5P01CA138338-05,7509,Nicotine and NNK Glucuronidation Pathways on Smokers,"MURPHY, SHARON",UNIVERSITY OF MINNESOTA,MN,"$99,555"
Lung Cancer,2014,NCI,5P01CA138338-05,7511,"Ethnic/Racial Differences in 1, 3-Bitadiene Metabolism and DNA Adduct Formation","TRETYAKOVA, NATALIA",UNIVERSITY OF MINNESOTA,MN,"$121,428"
Lung Cancer,2014,NCI,5P01CA138338-05,7512,Ethnic/Racial Differences in DNA Repair,"PETERSON, LISA",UNIVERSITY OF MINNESOTA,MN,"$121,425"
Lung Cancer,2014,NCI,5P01CA138338-05,7514,Metabolism of NNK among African Americans,"HATSUKAMI, DOROTHY",UNIVERSITY OF MINNESOTA,MN,"$121,382"
Lung Cancer,2014,NCI,5P01CA138338-05,7515,Administrative Core,"HECHT, STEPHEN",UNIVERSITY OF MINNESOTA,MN,"$29,202"
Lung Cancer,2014,NCI,5P01CA138338-05,7516,Tobacco Smoke Constituent Biomarker Core,"HECHT, STEPHEN",UNIVERSITY OF MINNESOTA,MN,"$288,809"
Lung Cancer,2014,NCI,5P01CA138338-05,7517,Biostatistics Core,"STRAM, DANIEL",UNIVERSITY OF SOUTHERN CALIFORNIA,CA,"$225,731"
Lung Cancer,2014,NCI,1R03CA179019-01A1,,End of Treatment Transition to Follow-Up Care among Early Stage Lung Cancer Survi,"WEAVER, KATHRYN",WAKE FOREST UNIVERSITY HEALTH SCIENCES,NC,"$76,750"
Lung Cancer,2014,NCI,1R21CA175983-01A1,,Developing a Lung Cancer Screening Registry in a State with a High Smoking Rate,"HENDERSON, LOUISE",UNIV OF NORTH CAROLINA CHAPEL HILL,NC,"$198,360"
Lung Cancer,2014,NCI,1R21CA175618-01A1,,Role of Telmisartan on Intra-Tumoral Distribution of Targeted Nanoparticles,"SACHDEVA, MANDIP",FLORIDA AGRICULTURAL AND MECHANICAL UNIV,FL,"$182,126"
Lung Cancer,2014,NCI,5R01CA150980-03,,Accountability for Cancer Care through Undoing Racism and Equity (ACCURE),"ENG, EUGENIA",UNIV OF NORTH CAROLINA CHAPEL HILL,NC,"$478,893"
Lung Cancer,2014,NCI,5UM1CA167462-02,,INFRASRUCTURE SUPPORT AND DATA ENHANCEMENTS FOR THE CARET BIOREPOSITORY,"GOODMAN, GARY",FRED HUTCHINSON CANCER RESEARCH CENTER,WA,"$560,214"
Lung Cancer,2014,NCI,1R21CA175839-01A1,,Defining the Cellular Target of Radiation Therapy,"KIRSCH, DAVID",DUKE UNIVERSITY,NC,"$204,885"
Lung Cancer,2014,NCI,1R21CA173880-01A1,,Development and feasibility testing of a lung cancer screening decision aid,"BYRNE, MARGARET",UNIVERSITY OF MIAMI SCHOOL OF MEDICINE,FL,"$209,464"
Lung Cancer,2014,NCI,5R01CA142858-04,,Control of lung cancer invasion and metastasis by vimentin,"MARCUS, ADAM",EMORY UNIVERSITY,GA,"$311,976"
Lung Cancer,2014,NCI,5R01CA157510-04,,Mechanisms of chemotherapy response and tumor re-initiation in lung cancer,"SWEET-CORDERO, ERIC",STANFORD UNIVERSITY,CA,"$329,693"
Lung Cancer,2014,NCI,5R01CA088932-12,,Regulation of Telomerase by Sphingolipid Signaling in Lung Cancer,"OGRETMEN, BESIM",MEDICAL UNIVERSITY OF SOUTH CAROLINA,SC,"$199,660"
Lung Cancer,2014,NCI,5R01CA160522-03,,Therapeutic potential of mTOR kinase inhibitors in lung cancer,"SUN, SHI-YONG",EMORY UNIVERSITY,GA,"$311,976"
Lung Cancer,2014,NCI,5R01CA172058-02,,"Population studies of cigarette smoking, other tobacco use, and lung cancer","MESSER, KAREN",UNIVERSITY OF CALIFORNIA SAN DIEGO,CA,"$196,207"
Lung Cancer,2014,OD,1S10OD016355-01A1,,Pannoramic 250 BF Flash Tissue Microarray system,"BOYD, KELLI",VANDERBILT UNIVERSITY,TN,"$453,300"
Lung Cancer,2014,NCI,5R01CA116020-08,,Inhibitor-sensitive and -resistant EGFR mutants from lung cancer and glioblastoma,"ECK, MICHAEL",DANA-FARBER CANCER INST,MA,"$317,009"
Lung Cancer,2014,NCI,5R01CA122794-09,,In vivo analysis of EGFR mutant driven lung cancers responses to radiation therap,"WONG, KWOK KIN",DANA-FARBER CANCER INST,MA,"$273,761"
Lung Cancer,2014,NIEHS,5R01ES017328-05,,Bridging Inflammation and Cigarette Smoke-associated Lung Carcinogenesis by MUC1,"LIN, YONG",LOVELACE BIOMEDICAL & ENVIRONMENTAL RES,NM,"$422,842"
Lung Cancer,2014,NCI,5R01CA163772-02,,Lung Adenocarcinoma Invasion Genomics,"POWELL, CHARLES",ICAHN SCHOOL OF MEDICINE AT MOUNT SINAI,NY,"$549,723"
Lung Cancer,2014,NCI,5R21CA174873-02,,Targeting Mu Opioid Receptors in non-Small Cell Lung Cancer,"LEVER, JOHN",UNIVERSITY OF MISSOURI-COLUMBIA,MO,"$134,391"
Lung Cancer,2014,NIGMS,5R01GM046993-20,,Molecular Genetics of Sensory Organ Development,"POSAKONY, JAMES",UNIVERSITY OF CALIFORNIA SAN DIEGO,CA,"$301,335"
Lung Cancer,2014,NCI,5R01CA140594-06,,Therapeutic strategies for specific subsets of KRAS mutant lung cancers,"WONG, KWOK KIN",DANA-FARBER CANCER INST,MA,"$496,876"
Lung Cancer,2014,NCI,5R01CA173469-02,,Developing Selective EphA2 Inhibitors for the treatment of Cancer,"GRAY, NATHANAEL",DANA-FARBER CANCER INST,MA,"$508,812"
Lung Cancer,2014,NCI,5T32CA174648-02,,"Training in Translational Research of Lung, Head and Neck Cancer","WANG, XIAO-JING",UNIVERSITY OF COLORADO DENVER,CO,"$442,776"
Lung Cancer,2014,NCI,5R01CA175577-02,,LuIII parvovirus targets glioma,"VAN DEN POL, ANTHONY",YALE UNIVERSITY,CT,"$335,123"
Lung Cancer,2014,NCI,1R43CA183360-01,,"Immune-based brain cancer diagnostic for rapid, accurate disease classification","SYKES, KATHRYN","HEALTHTELL, INC.",AZ,"$225,000"
Lung Cancer,2014,NCI,1R43CA180316-01A1,,A dual acting drug for enhancing radiotherapeutic benefit,"NORRIS, ANDREW","BCN BIOSCIENCES, LLC",CA,"$209,208"
Lung Cancer,2014,NHLBI,5R01HL107882-04,,Overlapping Airway Basal Cell Transcriptome Reprogramming in COPD and Lung Cancer,"CRYSTAL, RONALD",WEILL MEDICAL COLL OF CORNELL UNIV,NY,"$1,039,556"
Lung Cancer,2014,NIEHS,5R01ES018883-05,,HIF-alphia in Cr(VI) carcinogenesis,"ZHANG, ZHUO",UNIVERSITY OF KENTUCKY,KY,"$327,477"
Lung Cancer,2014,NCI,5R01CA173754-02,,Benefits and Harms of Lung Cancer Screening in HIV Infection,"CROTHERS, KRISTINA",UNIVERSITY OF WASHINGTON,WA,"$483,682"
Lung Cancer,2014,NIEHS,1P42ES023720-01,7653,Biomedical Project 4 - Animal Models of Mesothelioma,"TESTA, JOSEPH",UNIVERSITY OF PENNSYLVANIA,PA,"$347,473"
Lung Cancer,2014,NIEHS,1P42ES023720-01,7654,Biomedical Project 5 - Chemoprevention of Asbestos-induced Lung Diseases,"CHRISTOFIDOU-SOLOMIDOU, MELPO",UNIVERSITY OF PENNSYLVANIA,PA,"$298,285"
Lung Cancer,2014,NIEHS,1P42ES023720-01,7655,Biomedical Project 6 - Biomarkers of Asbestos Exposure,"BLAIR, IAN",UNIVERSITY OF PENNSYLVANIA,PA,"$285,215"
Lung Cancer,2014,NIEHS,5R01ES017777-05,,The Epigenetic Mechanism of Arsenic Lung Carcinogenesis - Role of MicroRNAs,"YANG, CHENGFENG",MICHIGAN STATE UNIVERSITY,MI,"$335,635"
