Category,FY,Funding IC,Project Number,Sub Project #,Project Title,PI Name,Org Name,State / Country,Amount
Pancreatic Cancer,2017,NCI,5P20CA192996-03,5666,Pilot 2: Organoids to investigate Pancreatic Cancer in under represented minorities,"TUVESON, DAVID",COLD SPRING HARBOR LABORATORY,NY,"$58,786"
Pancreatic Cancer,2017,NCI,5P20CA192994-03,5669,Administrative Core,"LI, ELLEN",STATE UNIVERSITY NEW YORK STONY BROOK,NY,"$125,667"
Pancreatic Cancer,2017,NCI,5P20CA192994-03,5671,Pilot Project Research Project 2,"LI, ELLEN",STATE UNIVERSITY NEW YORK STONY BROOK,NY,"$93,568"
Pancreatic Cancer,2017,NCI,5U01CA202241-03,,ECM geometrical and mechanical properties modulate RTK signaling,"GROVES, JAY",UNIVERSITY OF CALIFORNIA BERKELEY,CA,"$756,191"
Pancreatic Cancer,2017,NCI,1R01CA210637-01A1,,Role of PD2/Paf1 in Pancreatic Acinar to Ductal Metaplasia,"PONNUSAMY, MOORTHY",UNIVERSITY OF NEBRASKA MEDICAL CENTER,NE,"$373,823"
Pancreatic Cancer,2017,NCI,5F32CA210396-02,,Development of 18F-based Pretargeted PET imaging strategies for the PET imaging of cancer,"MEYER, JAN-PHILIP",SLOAN-KETTERING INST CAN RESEARCH,NY,"$57,066"
Pancreatic Cancer,2017,NCI,5R01CA207110-02,,Prospective immune profiling using methylation markers and pancreatic cancer risk,"MICHAUD, DOMINIQUE",TUFTS UNIVERSITY BOSTON,MA,"$804,995"
Pancreatic Cancer,2017,NCI,5R01CA195473-03,,Repurposing Disulfiram:  A Novel Strategy to Help Cancer Patients Regain Muscle,"JATOI, AMINAH",MAYO CLINIC ROCHESTER,MN,"$466,544"
Pancreatic Cancer,2017,NCI,1R01CA217207-01,,The Development And Progression Of IPMN To PDA In The Context Of Inactivated Activin Signaling,"SU, GLORIA",COLUMBIA UNIVERSITY HEALTH SCIENCES,NY,"$454,195"
Pancreatic Cancer,2017,NCI,5R01CA182495-04,,Fingerprinting Invasive Membrane Protrusions to Discover Metastatic Signatures,"KLEMKE, RICHARD",UNIVERSITY OF CALIFORNIA SAN DIEGO,CA,"$376,399"
Pancreatic Cancer,2017,NCI,5R01CA208517-02,,Determinants of pancreatic cancer and malignant melanoma phenotypes in CDKN2A hereditary kindreds,"PETERSEN, GLORIA",MAYO CLINIC ROCHESTER,MN,"$590,577"
Pancreatic Cancer,2017,NCI,5U54CA210190-02,5200,Core 2: Cell and Whole Animal Genome Engineering,"LARGAESPADA, DAVID",UNIVERSITY OF MINNESOTA,MN,"$62,538"
Pancreatic Cancer,2017,NCI,5U54CA210190-02,5201,Project 1: Physical modeling and dynamics of tumor cell migration mechanics,"ODDE, DAVID",UNIVERSITY OF MINNESOTA,MN,"$551,240"
Pancreatic Cancer,2017,NCI,5U01CA196403-03,,Imaging and Molecular Correlates of Progression in Cystic Neoplasms of the Pancreas,"MAITRA, ANIRBAN",UNIVERSITY OF TX MD ANDERSON CAN CTR,TX,"$787,123"
Pancreatic Cancer,2017,NCI,5U01CA198846-03,,UCLA Multifunctional Mesoporous Silica Nanoparticle Platform for Treatment of Pancreas Cancer,"NEL, ANDRE",UNIVERSITY OF CALIFORNIA LOS ANGELES,CA,"$476,683"
Pancreatic Cancer,2017,NCI,5R01CA193650-03,,The adaptive kinome in pancreatic cancer,"YEH, JEN JEN",UNIV OF NORTH CAROLINA CHAPEL HILL,NC,"$593,093"
Pancreatic Cancer,2017,NCI,5R01CA187678-04,,PET Imaging-guided Personalized Therapy in Pancreatic Cancer,"RADU, CAIUS",UNIVERSITY OF CALIFORNIA LOS ANGELES,CA,"$585,018"
Pancreatic Cancer,2017,NCI,5R01CA190092-04,,(PQA-4) Organoid Omics To Detect And Defeat Ductal Pancreatic Cancer,"TUVESON, DAVID",COLD SPRING HARBOR LABORATORY,NY,"$552,684"
Pancreatic Cancer,2017,NCI,5R01CA199064-02,,Tumor subtypes and therapy response in pancreatic cancer,"YEH, JEN JEN",UNIV OF NORTH CAROLINA CHAPEL HILL,NC,"$600,010"
Pancreatic Cancer,2017,NCI,5R01CA199646-02,,Optimizing Ultrasound Enhanced Delivery of Therapeutics,"FORSBERG, FLEMMING",THOMAS JEFFERSON UNIVERSITY,PA,"$624,449"
Pancreatic Cancer,2017,NCI,5R01CA183459-04,,Targeting Mucin and EGFR Axis in Pancreatic Cancer,"BATRA, SURINDER",UNIVERSITY OF NEBRASKA MEDICAL CENTER,NE,"$311,659"
Pancreatic Cancer,2017,NCI,5R01CA188464-04,,Epigenetic priming in pancreatic cancer chemotherapy,"GOVINDARAJAN, RAJGOPAL",OHIO STATE UNIVERSITY,OH,"$319,550"
Pancreatic Cancer,2017,NIDDK,5K01DK098285-05,,Resolving the role of nicotine-mediated phosphorylation on pancreatic fibrosis,"PAULO, JOAO",HARVARD MEDICAL SCHOOL,MA,"$126,751"
Pancreatic Cancer,2017,NCI,5P50CA174521-03,5336,Project 1: Theranostics in Neuroendocrine Tumors,"MENDA, YUSUF",UNIVERSITY OF IOWA,IA,"$303,328"
Pancreatic Cancer,2017,NCI,5P50CA174521-03,5337,Project 2: Molecular Mechanisms and Biomarkers of Neuroendocrine Tumors,"QUELLE, DAWN",UNIVERSITY OF IOWA,IA,"$300,301"
Pancreatic Cancer,2017,NCI,5P30CA068485-22,7794,Gastrointestinal Cancer Research Program (GI) (Project-005),"BERLIN, JORDAN",VANDERBILT UNIVERSITY,TN,"$87,030"
Pancreatic Cancer,2017,NCI,5R01CA208644-02,,(PQ11) Targeting STING in the context of chemoradiation therapy to overcome poor preexisting immunity in mouse models of pancreatic cancer.,"CRITTENDEN, MARKA",PROVIDENCE PORTLAND MEDICAL CENTER,OR,"$377,438"
Pancreatic Cancer,2017,NIAAA,5R01AA024698-02,,Alcohol Carcinogenesis,"SRIVASTAVA, RAKESH",LSU HEALTH SCIENCES CENTER,LA,"$328,500"
Pancreatic Cancer,2017,NCI,1R43CA213863-01A1,,A Scalable Blood-based Pancreatic Cancer Test for High-Risk Screening,"FREEDMAN, DAVID","NANOVIEW DIAGNOSTICS, INC.",MA,"$225,001"
Pancreatic Cancer,2017,RMAP,1DP2CA228042-01,,Dissecting tumor metabolic heterogeneity in vivo,"BIRSOY, KIVANC",ROCKEFELLER UNIVERSITY,NY,"$2,542,500"
Pancreatic Cancer,2017,NCI,5R44CA200186-03,,Molecular MR Imaging of the Desmoplastic Response in Pancreatic Cancer,"HUMBLET, VALERIE","COLLAGEN MEDICAL, LLC",MA,"$1,002,483"
Pancreatic Cancer,2017,NCI,1U54CA217377-01,8362,Biospecimens and Patient-derived xenografts,"WEINSTOCK, DAVID",MASSACHUSETTS INSTITUTE OF TECHNOLOGY,MA,"$145,250"
Pancreatic Cancer,2017,NCI,1U54CA217377-01,8365,Project 1: Systematic discovery of cell-intrinsic mechanisms of cancer drug resistance,"MANALIS, SCOTT",MASSACHUSETTS INSTITUTE OF TECHNOLOGY,MA,"$653,390"
Pancreatic Cancer,2017,NCI,1U54CA217377-01,8366,Project 2: 	: Systematic discovery of cell-extrinsic mechanisms of cancer drug resistance,"SHALEK, ALEX",MASSACHUSETTS INSTITUTE OF TECHNOLOGY,MA,"$614,870"
Pancreatic Cancer,2017,NCI,5U01DK108326-03,,"ALTERED MICROBIOME IN PANCREATITIS, DIABETES AND PANCREATIC CANCER","FISHER, WILLIAM",BAYLOR COLLEGE OF MEDICINE,TX,"$190,000"
Pancreatic Cancer,2017,NIDDK,5U01DK108326-03,,"ALTERED MICROBIOME IN PANCREATITIS, DIABETES AND PANCREATIC CANCER","FISHER, WILLIAM",BAYLOR COLLEGE OF MEDICINE,TX,"$237,950"
Pancreatic Cancer,2017,NCI,5U01DK108288-03,,"The Exocrine and Endocrine Pancreas in Type 2 Diabetes, Pancreatitis and Cancer","CHARI, SURESH",MAYO CLINIC ROCHESTER,MN,"$190,000"
Pancreatic Cancer,2017,NIDDK,5U01DK108288-03,,"The Exocrine and Endocrine Pancreas in Type 2 Diabetes, Pancreatitis and Cancer","CHARI, SURESH",MAYO CLINIC ROCHESTER,MN,"$239,300"
Pancreatic Cancer,2017,NCI,5U01DK108306-03,,Consortium for the Study of Pancreatitis: Pittsburgh Clinical Center,"YADAV, DHIRAJ",UNIVERSITY OF PITTSBURGH AT PITTSBURGH,PA,"$190,000"
Pancreatic Cancer,2017,NIDDK,5U01DK108306-03,,Consortium for the Study of Pancreatitis: Pittsburgh Clinical Center,"YADAV, DHIRAJ",UNIVERSITY OF PITTSBURGH AT PITTSBURGH,PA,"$218,242"
Pancreatic Cancer,2017,NCI,5U01DK108328-03,,"Consortium for the Study of Chronic Pancreatitis, Diabetes and Pancreatic Cancer: Coordinating and Data Management Center (CSCPDPC-CDMC)","FENG, ZIDING",UNIVERSITY OF TX MD ANDERSON CAN CTR,TX,"$400,000"
Pancreatic Cancer,2017,NIDDK,5U01DK108328-03,,"Consortium for the Study of Chronic Pancreatitis, Diabetes and Pancreatic Cancer: Coordinating and Data Management Center (CSCPDPC-CDMC)","FENG, ZIDING",UNIVERSITY OF TX MD ANDERSON CAN CTR,TX,"$1,152,014"
Pancreatic Cancer,2017,NCI,5U01DK108314-03,,"Pathophysiology, Epidemiology, and Prevention of Pancreatogenic Diabetes","PANDOL, STEPHEN",CEDARS-SINAI MEDICAL CENTER,CA,"$190,000"
Pancreatic Cancer,2017,NIDDK,5U01DK108314-03,,"Pathophysiology, Epidemiology, and Prevention of Pancreatogenic Diabetes","PANDOL, STEPHEN",CEDARS-SINAI MEDICAL CENTER,CA,"$255,753"
Pancreatic Cancer,2017,NCI,5U01DK108323-03,,Indiana University (IU) Clinical Center for Chronic Pancreatitis Clinical Research Network,"FOGEL, EVAN",INDIANA UNIV-PURDUE UNIV AT INDIANAPOLIS,IN,"$190,000"
Pancreatic Cancer,2017,NIDDK,5U01DK108323-03,,Indiana University (IU) Clinical Center for Chronic Pancreatitis Clinical Research Network,"FOGEL, EVAN",INDIANA UNIV-PURDUE UNIV AT INDIANAPOLIS,IN,"$231,253"
Pancreatic Cancer,2017,NCI,5U01DK108300-03,,"A Clinical Center to Study Immunological and Hormonal Biomarkers for the Diagnosis, Prediction and Treatment of Chronic Pancreatitis and its associated development to Diabetes and Pancreas Cancer","PARK, WALTER",STANFORD UNIVERSITY,CA,"$190,000"
Pancreatic Cancer,2017,NIDDK,5U01DK108300-03,,"A Clinical Center to Study Immunological and Hormonal Biomarkers for the Diagnosis, Prediction and Treatment of Chronic Pancreatitis and its associated development to Diabetes and Pancreas Cancer","PARK, WALTER",STANFORD UNIVERSITY,CA,"$214,605"
Pancreatic Cancer,2017,NCI,5U01DK108320-03,,"U01-Consortium for the Study of Chronic Pancreatitis, Diabetes and Pancreatic Cancer Clinical Centers","FORSMARK, CHRISTOPHER",UNIVERSITY OF FLORIDA,FL,"$190,000"
Pancreatic Cancer,2017,NIDDK,5U01DK108320-03,,"U01-Consortium for the Study of Chronic Pancreatitis, Diabetes and Pancreatic Cancer Clinical Centers","FORSMARK, CHRISTOPHER",UNIVERSITY OF FLORIDA,FL,"$198,805"
Pancreatic Cancer,2017,NCI,5U01DK108327-03,,The Ohio State University Pancreatic Disorders Network (OSU-PDN),"CONWELL, DARWIN",OHIO STATE UNIVERSITY,OH,"$190,000"
Pancreatic Cancer,2017,NIDDK,5U01DK108327-03,,The Ohio State University Pancreatic Disorders Network (OSU-PDN),"CONWELL, DARWIN",OHIO STATE UNIVERSITY,OH,"$252,874"
Pancreatic Cancer,2017,NCI,5U01DK108332-03,,"Chronic Pancreatitis, Diabetes and Pancreatic Cancer: A Prospective Approach","VAN DEN EEDEN, STEPHEN",KAISER FOUNDATION RESEARCH INSTITUTE,CA,"$190,000"
Pancreatic Cancer,2017,NIDDK,5U01DK108332-03,,"Chronic Pancreatitis, Diabetes and Pancreatic Cancer: A Prospective Approach","VAN DEN EEDEN, STEPHEN",KAISER FOUNDATION RESEARCH INSTITUTE,CA,"$209,658"
Pancreatic Cancer,2017,NCI,5U24CA210986-02,,Center of Excellence for High Throughput Proteogenomic Characterization,"CARR, STEVEN","BROAD INSTITUTE, INC.",MA,"$1,288,045"
Pancreatic Cancer,2017,NIDDK,5K08DK105326-03,,The Role of NR5A2 in Pancreas Development and Disease,"NISSIM, SAHAR",BRIGHAM AND WOMEN'S HOSPITAL,MA,"$170,640"
Pancreatic Cancer,2017,NHGRI,5R21HG009010-02,,An Integrated Microfluidics Platform for Rapid and Sensitive Exosome RNA,"CHANG, HSUEH-CHIA",UNIVERSITY OF NOTRE DAME,IN,"$193,125"
Pancreatic Cancer,2017,NCI,5R50CA211506-02,,Preclinical Models for Cancer Therapeutic Development,"PARK, YOUNGKYU",COLD SPRING HARBOR LABORATORY,NY,"$174,117"
Pancreatic Cancer,2017,NIBIB,5R01EB020125-03,,Theranostic nanoparticles for detection and treatment of pancreatic cancer,"MCNALLY, LACEY",WAKE FOREST UNIVERSITY HEALTH SCIENCES,NC,"$74,421"
Pancreatic Cancer,2017,NIGMS,5R01EB020125-03,,Theranostic nanoparticles for detection and treatment of pancreatic cancer,"MCNALLY, LACEY",WAKE FOREST UNIVERSITY HEALTH SCIENCES,NC,"$320,000"
Pancreatic Cancer,2017,NCI,5R50CA211462-02,,Critical resources provided by UNMC RAP biorepository stimulate cancer research,"GRANDGENETT, PAUL",UNIVERSITY OF NEBRASKA MEDICAL CENTER,NE,"$106,754"
Pancreatic Cancer,2017,NCI,5R50CA211437-02,,Revealing cancer metabolism via mass spectrometry and isotope tracers,"LU, WENYUN",PRINCETON UNIVERSITY,NJ,"$108,427"
Pancreatic Cancer,2017,NIAMS,5R21AR071021-02,,Modeling muscle wasting in cancer cachexia,"GUTTRIDGE, DENIS",OHIO STATE UNIVERSITY,OH,"$169,400"
Pancreatic Cancer,2017,NIDDK,5R01DK060694-16,,Networks for functional regulation of pancreatic acinar-ductal metaplasia and epithelial plasticity,"RUSTGI, ANIL",UNIVERSITY OF PENNSYLVANIA,PA,"$362,250"
Pancreatic Cancer,2017,NCI,7R01CA188048-03,,Investigating a novel glutamine metabolism pathway in pancreatic cancer,"KIMMELMAN, ALEC",NEW YORK UNIVERSITY SCHOOL OF MEDICINE,NY,"$333,525"
Pancreatic Cancer,2017,NCI,5F31CA210627-02,,Functional Interrogation of Kdm6a-Dependent Tumor Suppression during Pancreatic Cancer,"WINTERS, IAN",STANFORD UNIVERSITY,CA,"$35,431"
Pancreatic Cancer,2017,NCI,1U01CA217665-01,,Peptide-based targeted molecular imaging for early detection in pancreatic cancer,"SUTCLIFFE, JULIE",UNIVERSITY OF CALIFORNIA AT DAVIS,CA,"$650,375"
Pancreatic Cancer,2017,NCI,5R21CA209366-02,,Identifying insulin resistance biomarkers and metabolomic signature as predictors of precursors to pancreatic cancer,"ZHANG, JIANJUN",INDIANA UNIV-PURDUE UNIV AT INDIANAPOLIS,IN,"$171,281"
Pancreatic Cancer,2017,NIBIB,1P41EB024495-01,5626,Imaging Agents for Inflammatory Components of Malignancy,"POMPER, MARTIN",JOHNS HOPKINS UNIVERSITY,MD,"$259,734"
Pancreatic Cancer,2017,NCI,5P01CA117969-12,8397,Core A: Pathology Core,"MAITRA, ANIRBAN",UNIVERSITY OF TX MD ANDERSON CAN CTR,TX,"$89,149"
Pancreatic Cancer,2017,NCI,5P01CA117969-12,8398,Core B: Preclinical Therapeutics Core,"BENES, CYRIL",UNIVERSITY OF TX MD ANDERSON CAN CTR,TX,"$96,117"
Pancreatic Cancer,2017,NCI,5P01CA117969-12,8399,Core C: Computational Core,"FUTREAL, ANDREW",UNIVERSITY OF TX MD ANDERSON CAN CTR,TX,"$73,621"
Pancreatic Cancer,2017,NCI,5P01CA117969-12,8400,Core D: Administrative Core,"DEPINHO, RONALD",UNIVERSITY OF TX MD ANDERSON CAN CTR,TX,"$31,509"
Pancreatic Cancer,2017,NCI,5P01CA117969-12,8401,Project 1: Targeting Metabolic Dependencies in PDAC,"DEPINHO, RONALD",UNIVERSITY OF TX MD ANDERSON CAN CTR,TX,"$227,876"
Pancreatic Cancer,2017,NCI,5P01CA117969-12,8402,Project 2: Role of lysosomal scavenging in PDAC metabolism,"BARDEESY, NABEEL",UNIVERSITY OF TX MD ANDERSON CAN CTR,TX,"$292,025"
Pancreatic Cancer,2017,NCI,5P01CA117969-12,8403,Project 3: The Functional Contribution of Tumor Immunity in PDAC,"KALLURI, RAGHU",UNIVERSITY OF TX MD ANDERSON CAN CTR,TX,"$183,081"
Pancreatic Cancer,2017,NCI,5P01CA203657-02,8379,Project 1: Mutation-specific vulnerabilities for KRAS-targeted therapy,"DER, CHANNING",UNIV OF NORTH CAROLINA CHAPEL HILL,NC,"$124,398"
Pancreatic Cancer,2017,NCI,5P01CA203657-02,8381,Project 3: Mechanisms and therapeutic targeting of NRAS in melanoma,"COX, ADRIENNE",UNIV OF NORTH CAROLINA CHAPEL HILL,NC,"$144,071"
Pancreatic Cancer,2017,NCI,1U01CA217842-01,,Integrative bioinformatics and functional characterization of oncogenic driver aberrations in cancer,"MILLS, GORDON",UNIVERSITY OF TX MD ANDERSON CAN CTR,TX,"$739,551"
Pancreatic Cancer,2017,NCI,3R01CA186043-03S1,,Musashi-mediated control of pancreatic cancer growth and progression,"REYA, TANNISHTHA",UNIVERSITY OF CALIFORNIA SAN DIEGO,CA,"$53,663"
Pancreatic Cancer,2017,NCI,5U54CA210181-02,5158,Administrative Core,"FERRARI, MAURO",METHODIST HOSPITAL RESEARCH INSTITUTE,TX,"$486,539"
Pancreatic Cancer,2017,NCI,5U54CA210181-02,5159,Transport Oncophysics Core,"FERRARI, MAURO",METHODIST HOSPITAL RESEARCH INSTITUTE,TX,"$447,272"
Pancreatic Cancer,2017,NCI,5U54CA210181-02,5161,Microenvironmental Transport for Immunotherapy in Pancreatic Cancer,"FLEMING, JASON",METHODIST HOSPITAL RESEARCH INSTITUTE,TX,"$234,409"
Pancreatic Cancer,2017,NCI,5P30CA013330-45,6910,Experimental Therapeutics,"GOLDMAN, ISRAEL",ALBERT EINSTEIN COLLEGE OF MEDICINE,NY,"$315,258"
Pancreatic Cancer,2017,NCI,5P30CA015704-42,5445,Research Program: Gastrointestinal Cancer,"GRADY, WILLIAM",FRED HUTCHINSON CANCER RESEARCH CENTER,WA,"$118,761"
Pancreatic Cancer,2017,NCI,5P50CA127297-09,5480,Inhibition of CDK5 as a Treatment for Pancreatic Cancer,"HOLLINGSWORTH, MICHAEL",UNIVERSITY OF NEBRASKA MEDICAL CENTER,NE,"$379,900"
Pancreatic Cancer,2017,NCI,5P50CA127297-09,5481,Novel Target(s) in the Radiosensitization of Pancreatic Cancer,"BATRA, SURINDER",UNIVERSITY OF NEBRASKA MEDICAL CENTER,NE,"$378,716"
Pancreatic Cancer,2017,NCI,5P50CA127297-09,5482,Novel Strategies for Pancreatic Cancer Treatment,"BLACK, JENNIFER",UNIVERSITY OF NEBRASKA MEDICAL CENTER,NE,"$379,899"
Pancreatic Cancer,2017,NCI,5P50CA127297-09,5483,Targeting Metabolic Alterations to Improve Survival in Pancreatic Cancer,"SINGH, PANKAJ",UNIVERSITY OF NEBRASKA MEDICAL CENTER,NE,"$379,895"
Pancreatic Cancer,2017,NCI,5P50CA127297-09,5484,Administrative Core,"HOLLINGSWORTH, MICHAEL",UNIVERSITY OF NEBRASKA MEDICAL CENTER,NE,"$260,600"
Pancreatic Cancer,2017,NCI,5P50CA127297-09,5485,Tissue Core,"BRIDGE, JULIA",UNIVERSITY OF NEBRASKA MEDICAL CENTER,NE,"$279,029"
Pancreatic Cancer,2017,NCI,5P50CA127297-09,5486,Biostatistics,"YU, FANG",UNIVERSITY OF NEBRASKA MEDICAL CENTER,NE,"$82,856"
Pancreatic Cancer,2017,NCI,5P50CA127297-09,5487,Developmental Research Program,"HOLLINGSWORTH, MICHAEL",UNIVERSITY OF NEBRASKA MEDICAL CENTER,NE,"$98,730"
Pancreatic Cancer,2017,NCI,5P50CA127297-09,5488,Career Development Program,"HOLLINGSWORTH, MICHAEL",UNIVERSITY OF NEBRASKA MEDICAL CENTER,NE,"$139,758"
Pancreatic Cancer,2017,NCI,1K08CA218690-01,,Defining diverse roles of p53 in pancreatic cancer,"KIM, MICHAEL",UNIVERSITY OF TX MD ANDERSON CAN CTR,TX,"$170,640"
Pancreatic Cancer,2017,NCI,1R21CA205660-01A1,,Improving the radiation therapeutic ratio by inhibiting proinflammatory cytokines,"KIM, JAE HO",HENRY FORD HEALTH SYSTEM,MI,"$195,859"
Pancreatic Cancer,2017,NCI,1K08CA218420-01,,Functional interrogation of epigenetic vulnerabilities in KRAS-mutant pancreatic cancer,"AGUIRRE, ANDREW",DANA-FARBER CANCER INST,MA,"$177,120"
Pancreatic Cancer,2017,NCI,1R21CA218495-01,,Inhibition of Stromal-Derived DKK3 to Enhance the Response of Pancreatic Cancer to Immunotherapy,"HWANG, ROSA",UNIVERSITY OF TX MD ANDERSON CAN CTR,TX,"$208,800"
Pancreatic Cancer,2017,NCI,1U01CA213862-01A1,,Nanovaccine platforms to combat pancreatic cancer,"NARASIMHAN, BALAJI",IOWA STATE UNIVERSITY,IA,"$566,261"
Pancreatic Cancer,2017,NCI,1R01CA218513-01,,Development and application of asymmetric-flow field-flow (AF4) technology in fractionation and characterization of exosome subpopulations and novel nanoveiscles in pancreatic cancer model,"LYDEN, DAVID",WEILL MEDICAL COLL OF CORNELL UNIV,NY,"$472,052"
Pancreatic Cancer,2017,NCI,1R21CA218968-01,,Novel model to study PDAC using normal human pancreatic tissue,"WANG, PEI",UNIVERSITY OF TEXAS HLTH SCIENCE CENTER,TX,"$199,013"
Pancreatic Cancer,2017,NCI,1R03CA201738-01A1,,Role of CRABP-II in pancreatic cancer metastasis,"YU, SHUILIANG",CASE WESTERN RESERVE UNIVERSITY,OH,"$80,000"
Pancreatic Cancer,2017,NCI,1R01CA211070-01A1,,The Pancreatic Cancer Microenvironment,"KANG, RUI",UNIVERSITY OF PITTSBURGH AT PITTSBURGH,PA,"$325,020"
Pancreatic Cancer,2017,NCI,3R01CA075059-19S1,,Dysregulation of TGF Beta Action Pancreatic Cancer,"KORC, MURRAY",INDIANA UNIV-PURDUE UNIV AT INDIANAPOLIS,IN,"$49,543"
Pancreatic Cancer,2017,NCI,3R01CA175772-04S1,,Targeting tumor-stromal interaction for pancreatic cancer therapy,"SINGH, AJAY",UNIVERSITY OF SOUTH ALABAMA,AL,"$158,135"
Pancreatic Cancer,2017,NCI,3R01CA181385-04S1,,Stellate cells and their progenitor precursors in pancreas cancer progression,"PROVENZANO, PAOLO",UNIVERSITY OF MINNESOTA,MN,"$102,872"
Pancreatic Cancer,2017,NCI,3R01CA186885-04S1,,Targeting BET Bromodomain in Pancreatic Cancer,"MUNSHI, HIDAYATULLAH",NORTHWESTERN UNIVERSITY AT CHICAGO,IL,"$116,835"
Pancreatic Cancer,2017,NCI,3P20CA192994-03S1,,1/2: Partnership to study racial/ethnic differences in GI cancer biology,"LI, ELLEN",STATE UNIVERSITY NEW YORK STONY BROOK,NY,"$63,140"
Pancreatic Cancer,2017,NCI,1R01CA211098-01A1,,Thrombin-dependent mechanisms of pancreatic ductal adenocarcinoma disease,"FLICK, MATTHEW",CINCINNATI CHILDRENS HOSP MED CTR,OH,"$431,066"
Pancreatic Cancer,2017,NCI,4R00CA188259-03,,Regulation of cancer cell metabolism and growth by the pancreatic tumor stroma,"SHERMAN, MARA",OREGON HEALTH & SCIENCE UNIVERSITY,OR,"$249,000"
Pancreatic Cancer,2017,NCI,1R01CA220236-01,,Wnt/?-catenin Signaling in Pancreatic Oncogenesis,"XIE, KEPING",UNIVERSITY OF TX MD ANDERSON CAN CTR,TX,"$366,000"
Pancreatic Cancer,2017,NCI,1R21CA213114-01A1,,Reprogramming Tumor-Associated Macrophages in PDAC with MicroRNA Nano-Vectors,"AMIJI, MANSOOR",NORTHEASTERN UNIVERSITY,MA,"$170,738"
Pancreatic Cancer,2017,NIGMS,1R35GM124958-01,,Chromatin Dynamics and Genome Regulation,"BANASZYNSKI, LAURA",UT SOUTHWESTERN MEDICAL CENTER,TX,"$405,000"
Pancreatic Cancer,2017,NCI,2R01CA155620-06A1,,RON Receptor in Pancreatic Cancer Biology and Therapy,"LOWY, ANDREW",UNIVERSITY OF CALIFORNIA SAN DIEGO,CA,"$306,943"
Pancreatic Cancer,2017,NCI,1R01CA212086-01A1,,Optimizing the Treatment of Pancreatic Adenocarcinoma,"HUR, CHIN",MASSACHUSETTS GENERAL HOSPITAL,MA,"$398,519"
Pancreatic Cancer,2017,NCI,3R01CA200755-02S1,,Exploring the Role of Mitochondrial Fission in Pancreatic Tumorigenesis,"KASHATUS, DAVID",UNIVERSITY OF VIRGINIA,VA,"$191,853"
Pancreatic Cancer,2017,NCI,1R01CA211082-01A1,,Optical imaging of pancreas cancer organoids for drug development and personalized treatment,"SKALA, MELISSA","MORGRIDGE INSTITUTE FOR RESEARCH, INC.",WI,"$648,387"
Pancreatic Cancer,2017,NCI,1R35CA209960-01A1,,Molecular Imaging and Theranostics of Cancer,"BHUJWALLA, ZAVER",JOHNS HOPKINS UNIVERSITY,MD,"$691,623"
Pancreatic Cancer,2017,NCI,3R01CA189209-03S1,,Radio-immunotherapy to Target Cancer Stem Cells in Solid Tumor Malignancies,"MURPHY, WILLIAM",UNIVERSITY OF CALIFORNIA AT DAVIS,CA,"$70,981"
Pancreatic Cancer,2017,NCI,4R00CA197816-03,,The SMYD3-ERK5 signaling module in pancreatic cancer,"MAZUR, PAWEL",UNIVERSITY OF TX MD ANDERSON CAN CTR,TX,"$249,000"
Pancreatic Cancer,2017,NCI,1R21CA220625-01,,Targeting hyaluronan synthesis and signaling with BET inhibitors in pancreatic cancer,"KUMAR, KRISHAN",NORTHWESTERN UNIVERSITY AT CHICAGO,IL,"$206,190"
Pancreatic Cancer,2017,NCI,3R01CA151588-07S1,,"Mechanisms of Pancreatic Inflammation, Tissue Repair and Carcinogenesis","PASCA DI MAGLIANO, MARINA",UNIVERSITY OF MICHIGAN,MI,"$72,605"
Pancreatic Cancer,2017,NCI,1F30CA220680-01,,Physiological Role of Dynamin-Related Protein 1 in Pancreatic Ductal Adenocarcinoma,"NAGDAS, SARBAJEET",UNIVERSITY OF VIRGINIA,VA,"$31,485"
Pancreatic Cancer,2017,NCI,1F31CA220750-01,,At the nexus of redox and signaling pathways: regulation of NAD+ kinase,"SCHILD, TANYA",WEILL MEDICAL COLL OF CORNELL UNIV,NY,"$44,044"
Pancreatic Cancer,2017,NIDDK,1R13DK114948-01,,2017 Pancreatic Diseases Gordon Research Conference,"SIMEONE, DIANE",GORDON RESEARCH CONFERENCES,RI,"$20,000"
Pancreatic Cancer,2017,NCI,1F32CA221005-01,,Targeting CDK4/6 for pancreatic cancer treatment,"GOODWIN, CRAIG",UNIV OF NORTH CAROLINA CHAPEL HILL,NC,"$56,694"
Pancreatic Cancer,2017,NCI,1F31CA221066-01,,Examining the Heterogeneity of Fibroblasts in the Pancreatic Microenvironment,"GARCIA, PALOMA",UNIVERSITY OF MICHIGAN,MI,"$31,793"
Pancreatic Cancer,2017,NCI,1F31CA220970-01,,"Image-guided, sonoporation-enhanced immunotherapy for pancreatic cancer treatment","FIX, SAMANTHA",UNIV OF NORTH CAROLINA CHAPEL HILL,NC,"$35,005"
Pancreatic Cancer,2017,NCI,1F32CA221114-01,,Examination of ceramide signaling in the crosstalk between pancreatic cancer cells and the tumor microenvironment,"HENDLEY, AUDREY","UNIVERSITY OF CALIFORNIA, SAN FRANCISCO",CA,"$56,694"
Pancreatic Cancer,2017,NCI,1F32CA221094-01,,The role of p120ctn in PDAC epithelial-to-mesenchymal transition and metastasis,"PITARRESI, JASON",UNIVERSITY OF PENNSYLVANIA,PA,"$56,334"
Pancreatic Cancer,2017,NCI,1F31CA213731-01A1,,Pathophysiological role and therapeutic potential of microRNA-29 in pancreatic cancer autophagy,"KWON, JASON",INDIANA UNIV-PURDUE UNIV AT INDIANAPOLIS,IN,"$29,255"
Pancreatic Cancer,2017,NCI,1F31CA220937-01,,The Novel Role of REST in the Development of Pancreatic Ductal Adenocarcinoma,"BRAY, JULIE",UNIVERSITY OF FLORIDA,FL,"$38,743"
Pancreatic Cancer,2017,NCI,1U01CA216468-01A1,,Enhancing Chemoradiation Efficacy through Unbiased Drug Discovery Approaches,"LIN, STEVEN",UNIVERSITY OF TX MD ANDERSON CAN CTR,TX,"$596,334"
Pancreatic Cancer,2017,NIDDK,1R13DK115223-01,,"PancreasFest 2017 Detection, Assessment and Management of Complex Pancreatic Disorders","WHITCOMB, DAVID",UNIVERSITY OF PITTSBURGH AT PITTSBURGH,PA,"$10,000"
Pancreatic Cancer,2017,NCI,1R01CA216987-01A1,,K-Ras sumoylation in cell proliferation and transformation,"DAI, WEI",NEW YORK UNIVERSITY SCHOOL OF MEDICINE,NY,"$514,857"
Pancreatic Cancer,2017,NCI,1R01CA208205-01A1,,Reengineering obesity-induced abnormal microenvironment to improve PDAC treatment,"FUKUMURA, DAI",MASSACHUSETTS GENERAL HOSPITAL,MA,"$495,129"
Pancreatic Cancer,2017,NCI,3F32CA210421-01S1,,Understanding cell intrinsic and context dependent metabolic adaptations of cancer cell,"DANAI, LAURA",MASSACHUSETTS INSTITUTE OF TECHNOLOGY,MA,"$2,212"
Pancreatic Cancer,2017,NCI,3F32CA200078-01A1S1,,Chemical genetic investigation of metastatic seeding in pancreatic ductal adenocarcinoma using novel multiplexed in vivo screening,"SCHULZE, CHRISTOPHER",STANFORD UNIVERSITY,CA,$316
Pancreatic Cancer,2017,NCI,4R00CA208032-02,,Deciphering the role of Lin28b in pancreatic cancer to guide therapeutic discovery,"KUGEL, SITA",FRED HUTCHINSON CANCER RESEARCH CENTER,WA,"$249,000"
Pancreatic Cancer,2017,NCI,3F32CA200313-02S1,,K-Ras mutant-specific vulnerabilities for novel pancreatic cancer therapies,"HOBBS, GUY",UNIV OF NORTH CAROLINA CHAPEL HILL,NC,$948
Pancreatic Cancer,2017,NCI,1R43CA221400-01,,Novel monobody therapy for pancreatic cancer,"YU, BO","LARIX BIOSCIENCE, LLC",CA,"$224,981"
Pancreatic Cancer,2017,NCI,1R43CA217400-01A1,,First-in-class TREM-1 inhibitors in combination therapy for pancreatic cancer,"SIGALOV, ALEXANDER","SIGNABLOK, INC.",MA,"$224,672"
Pancreatic Cancer,2017,OD,3R01CA164964-03S1,,Prospective Study of Human Oral Microbiome and Pancreatic Cancer Risk,"AHN, JIYOUNG",NEW YORK UNIVERSITY SCHOOL OF MEDICINE,NY,"$169,500"
