Category,FY,Funding IC,Project Number,Sub Project #,Project Title,PI Name,Org Name,State / Country,Amount
Heart Disease - Coronary Heart Disease,2010,NHLBI,5R01HL089824-03,,Stem Cell Therapy,"WANG, YIGANG",UNIVERSITY OF CINCINNATI,OH,"$390,000"
Heart Disease - Coronary Heart Disease,2010,NHLBI,5R01HL052141-14,,Protein Kinase C Isozymes in Ischemic Heart,"MOCHLY-ROSEN, DARIA",STANFORD UNIVERSITY,CA,"$395,896"
Heart Disease - Coronary Heart Disease,2010,NHLBI,5R01HL085887-04,,Coronary Artery Regulation by Small Conduction Ca2+-activated K+ Channels,"TAYLOR, MARK",UNIVERSITY OF SOUTH ALABAMA,AL,"$257,250"
Heart Disease - Coronary Heart Disease,2010,NHLBI,5R37HL061690-13,,Targeting GRK2 (BARK1) in Heart Failure,"KOCH, WALTER",THOMAS JEFFERSON UNIVERSITY,PA,"$386,250"
Heart Disease - Coronary Heart Disease,2010,NHLBI,5R01HL063811-10,,AMP-activated protein kinase in the ischemic heart,"YOUNG, LAWRENCE",YALE UNIVERSITY,CT,"$413,750"
Heart Disease - Coronary Heart Disease,2010,NHLBI,5R01HL093579-02,,Nitrite Mediated Cardioprotection,"LEFER, DAVID",EMORY UNIVERSITY,GA,"$387,500"
Heart Disease - Coronary Heart Disease,2010,NHLBI,2R01HL062552-09A2,,"Exercise, Diabetes, & Coronary Smooth Muscle Ca2+","STUREK, MICHAEL",INDIANA UNIV-PURDUE UNIV AT INDIANAPOLIS,IN,"$466,156"
Heart Disease - Coronary Heart Disease,2010,NHLBI,5R01HL092305-02,,Inflammation and Oxidative Stress in Hyperglycemic Exacerbation of Infarct Size,"FRENCH, BRENT",UNIVERSITY OF VIRGINIA CHARLOTTESVILLE,VA,"$378,697"
Heart Disease - Coronary Heart Disease,2010,NHLBI,5U01HL085057-05,,Preoperative Therapy for Prevention of Postoperative Low Cardiac Output Syndrome,"BENSON, D",CHILDREN'S HOSPITAL MED CTR (CINCINNATI),OH,"$291,300"
Heart Disease - Coronary Heart Disease,2010,NHLBI,5R01HL089930-02,,Genetic and Cellular Basis of Resistance/Sensitivity to Myocardial Ischemia,"JACOB, HOWARD",MEDICAL COLLEGE OF WISCONSIN,WI,"$589,147"
Heart Disease - Coronary Heart Disease,2010,NHLBI,5R01HL092101-02,,Polymer Therapy for Ischemic Mitral Regurgitation,"HUNG, JUDY",MASSACHUSETTS GENERAL HOSPITAL,MA,"$424,815"
Heart Disease - Coronary Heart Disease,2010,NHLBI,2R01HL084312-05,,Molecular Regulation of Atherosclerosis Regression,"FISHER, EDWARD",NEW YORK UNIVERSITY SCHOOL OF MEDICINE,NY,"$689,147"
Heart Disease - Coronary Heart Disease,2010,NHLBI,5R01HL082640-05,,LV Strain Quantification from 4D Echocardiography,"DUNCAN, JAMES",YALE UNIVERSITY,CT,"$1,405,731"
Heart Disease - Coronary Heart Disease,2010,NHLBI,5U01HL068281-10,,Randomized Clinical Trials for Pediatric Heart Disease,"SAUL, J",MEDICAL UNIVERSITY OF SOUTH CAROLINA,SC,"$283,532"
Heart Disease - Coronary Heart Disease,2010,NHLBI,5U01HL068269-10,,Pediatric Heart Network North Carolina Consortium,"LI, JENNIFER",DUKE UNIVERSITY,NC,"$291,474"
Heart Disease - Coronary Heart Disease,2010,NHLBI,5R01HL092048-02,,CT-Based Diagnosis of Diffuse Coronary Artery Disease,"KASSAB, GHASSAN",INDIANA UNIV-PURDUE UNIV AT INDIANAPOLIS,IN,"$409,672"
Heart Disease - Coronary Heart Disease,2010,NHLBI,1R21HL095069-01A2,,Cardiac Progenitor Patch for Treatment of Myocardial Infarction,"BURSAC, NENAD",DUKE UNIVERSITY,NC,"$195,000"
Heart Disease - Coronary Heart Disease,2010,NHLBI,5R01HL080008-06,,Calpains as Mediators of Cardiac Ischemic Injury,"DORN, GERALD",WASHINGTON UNIVERSITY,MO,"$368,980"
Heart Disease - Coronary Heart Disease,2010,NHLBI,5R01HL069938-09,,Hepatoma derived growth factor and vascular smooth muscle cell proliferation,"EVERETT, ALLEN",JOHNS HOPKINS UNIVERSITY,MD,"$369,000"
Heart Disease - Coronary Heart Disease,2010,NIDDK,5R01DK049302-14,,"Metabolic Syndrome, Lifestyle Modification and Resistance Training in HIV Disease","GRINSPOON, STEVEN",MASSACHUSETTS GENERAL HOSPITAL,MA,"$462,888"
Heart Disease - Coronary Heart Disease,2010,NHLBI,5R01HL088255-04,,The Mechanistic Basis of Cyclin A2-Mediated Cardiac Repair,"CHAUDHRY, HINA",MOUNT SINAI SCHOOL OF MEDICINE,NY,"$423,750"
Heart Disease - Coronary Heart Disease,2010,NHLBI,5R01HL083118-05,,ERK signaling and a hybrid surgical/molecular approach for chronic heart failure,"MANN, MICHAEL",NORTHERN CALIFORNIA INSTITUTE RES & EDUC,CA,"$400,538"
Heart Disease - Coronary Heart Disease,2010,NIBIB,5R01EB002185-10,,Biomechanics of Leukocytes and Molecular Imaging Agents,"LAWRENCE, MICHAEL",UNIVERSITY OF VIRGINIA CHARLOTTESVILLE,VA,"$1,042,268"
Heart Disease - Coronary Heart Disease,2010,NHLBI,5R01HL086576-04,,Role of complement in brain death induced injury to donor hearts,"TOMLINSON, STEPHEN",MEDICAL UNIVERSITY OF SOUTH CAROLINA,SC,"$374,334"
Heart Disease - Coronary Heart Disease,2010,NCCAM,5F32AT005048-02,,A mindfulness-based intervention for treatment of anxiety in ICD patients,"SALMOIRAGO BLOTCHER, ELENA",UNIV OF MASSACHUSETTS MED SCH WORCESTER,MA,"$65,418"
Heart Disease - Coronary Heart Disease,2010,NHLBI,5R01HL086709-03,,Engineered Atrium:  New Autologous Cells for Heart Repair,"ALLEN, MARGARET",BENAROYA RESEARCH INST AT VIRGINIA MASON,WA,"$634,366"
Heart Disease - Coronary Heart Disease,2010,NHLBI,5R21HL094883-02,,HDL-Associated S1P as an Indicator of Relative Risk for Cardiovascular Disease,"ARGRAVES, KELLEY",MEDICAL UNIVERSITY OF SOUTH CAROLINA,SC,"$184,375"
Heart Disease - Coronary Heart Disease,2010,NHLBI,5R01HL086988-04,,ApoE and SR-BI as Determinants of HDL and Macrophage Function in Atherogenesis,"LINTON, MACRAE",VANDERBILT UNIVERSITY,TN,"$383,750"
Heart Disease - Coronary Heart Disease,2010,NEI,5K08EY016357-02,,LIPOPROTEIN (A) IN VASCULAR DISEASES OF THE EYE,"MATHEWS, MICHAELA",UNIVERSITY OF MARYLAND BALTIMORE,MD,"$174,811"
Heart Disease - Coronary Heart Disease,2010,NHLBI,5U01HL084931-05,,Canada East and West Network,"ROULEAU, JEAN",MONTREAL HEART INSTITUTE,CANADA,"$262,170"
Heart Disease - Coronary Heart Disease,2010,NICHD,5R03HD055399-02,,Origins and Patterning of the Epicardium,"GLICKMAN HOLTZMAN, NATHALIA",QUEENS COLLEGE,NY,"$76,725"
Heart Disease - Coronary Heart Disease,2010,NIAID,1R13AI088774-01,,12th International Symposium on Human Chlamydial Infections,"SCHACHTER, JULIUS",UNIVERSITY OF CALIFORNIA SAN FRANCISCO,CA,"$8,000"
Heart Disease - Coronary Heart Disease,2010,NIAAA,5R21AA016567-02,,Drinking Patterns and Post MI Prognosis in Women,"MITTLEMAN, MURRAY",BETH ISRAEL DEACONESS MEDICAL CENTER,MA,"$215,222"
Heart Disease - Coronary Heart Disease,2010,NHLBI,5K23HL083981-05,,Embolic Protection During Renal Artery Stenting,"EDWARDS, MATTHEW",WAKE FOREST UNIVERSITY HEALTH SCIENCES,NC,"$109,420"
Heart Disease - Coronary Heart Disease,2010,NHLBI,5R01HL075092-07,,Integrins in the Endothelial Response to Fluid Shear Stress,"SCHWARTZ, MARTIN",UNIVERSITY OF VIRGINIA CHARLOTTESVILLE,VA,"$385,000"
Heart Disease - Coronary Heart Disease,2010,NHLBI,5R01HL088215-03,,GENOMIC SCAN FOR ATHEROSCLEROSIS PATHWAY GENES IN AFRICAN-AMERICANS FROM FHS-SCAN,"PROVINCE, MICHAEL",WASHINGTON UNIVERSITY,MO,"$759,343"
Heart Disease - Coronary Heart Disease,2010,NHLBI,2R01HL026441-29,,Risk factor-enhanced microvascular responses to ischemia-reperfusion.,"GRANGER, D.",LOUISIANA STATE UNIV HSC SHREVEPORT,LA,"$366,250"
Heart Disease - Coronary Heart Disease,2010,NHLBI,1R43HL102950-01,,Development of a Porcine Model of Atherosclerosis,"ROGERS, CHRISTOPHER","EXEMPLAR GENETICS, LLC",IA,"$129,935"
Heart Disease - Coronary Heart Disease,2010,NHLBI,5R01HL072684-07,,Preconditioning improves coronary patency,"PRZYKLENK, KARIN",WAYNE STATE UNIVERSITY,MI,"$342,000"
Heart Disease - Coronary Heart Disease,2010,NHLBI,7K08HL094703-02,,Effect of sarcolemmal KATP channels on ROS/RNS generation and calcium handling,"GUMINA, RICHARD",OHIO STATE UNIVERSITY,OH,"$120,241"
Heart Disease - Coronary Heart Disease,2010,NHLBI,5R21HL095002-02,,Inhibitors of the ENT4 Adenosine Transporter for Cardioprotection,"BUOLAMWINI, JOHN",UNIVERSITY OF TENNESSEE HEALTH SCI CTR,TN,"$185,000"
Heart Disease - Coronary Heart Disease,2010,NHLBI,1F32HL103103-01,,Role of Hepatic FoxO1 in Atherosclerosis,"HAEUSLER, REBECCA",COLUMBIA UNIVERSITY HEALTH SCIENCES,NY,"$52,154"
Heart Disease - Coronary Heart Disease,2010,NHLBI,5R37HL033921-26,,Ca2+ Regulation in Newly Formed Ventricular Myocytes,"HOUSER, STEVEN",TEMPLE UNIVERSITY,PA,"$443,191"
Heart Disease - Coronary Heart Disease,2010,NHLBI,5R44HL093860-03,,High Resolution Detectors for Single Photon Cardiac Imaging,"ENTINE, GERALD","RADIATION MONITORING DEVICES, INC.",MA,"$440,001"
Heart Disease - Coronary Heart Disease,2010,NHLBI,5K24HL084034-05,,Improving Med Adherence in Post-ACS Patients: Phase 1B Dose-Finding RCT,"DAVIDSON, KARINA",COLUMBIA UNIVERSITY HEALTH SCIENCES,NY,"$146,986"
Heart Disease - Coronary Heart Disease,2010,NHLBI,2R44HL084821-02A1,,Therapeutic to Reduce Acute Inflammation Following Cardiac Ischemia,"ALICOT-CARROLL, ELISABETH","DECIMMUNE THERAPEUTICS, INC",MA,"$1,119,082"
Heart Disease - Coronary Heart Disease,2010,NHLBI,1R41HL103002-01,,The effect of TLR4 inhibition on lung transplant ischemia-reperfusion injury,"GENOVA, PERRY",X-IN8 BIOLOGICALS CORPORATION,NC,"$321,746"
Heart Disease - Coronary Heart Disease,2010,NHLBI,1R43HL103035-01,,Prevention of ischemia reperfusion injury associated with acute myocardial infarc,"SHERMAN, CRAIG",HOPE PHARMACEUTICALS,AZ,"$236,917"
Heart Disease - Coronary Heart Disease,2010,NHLBI,1R43HL103026-01,,AntimiR-199a for cardiac ischemia and failure,"DELORENZO, MARIANA","VASADE BIOSCIENCES, INC.",NJ,"$132,191"
Heart Disease - Coronary Heart Disease,2010,NIDDK,5R01DK080111-03,,Are Cardioprotective Medications Effective in ESRD?,"SHIREMAN, THERESA",UNIVERSITY OF KANSAS MEDICAL CENTER,KS,"$267,861"
Heart Disease - Coronary Heart Disease,2010,NHLBI,5P01HL088117-03,,"Depression, Biobehavioral Mechanisms, & CHD/Mortality Outcomes","DAVIDSON, KARINA",COLUMBIA UNIVERSITY HEALTH SCIENCES,NY,"$2,565,463"
Heart Disease - Coronary Heart Disease,2010,NHLBI,5R01HL039297-24,,Noninvasive Coronary Artery Imaging Using MR,"NISHIMURA, DWIGHT",STANFORD UNIVERSITY,CA,"$391,076"
Heart Disease - Coronary Heart Disease,2010,NHLBI,2R44HL084769-02,,Magnetic Resonance Imaging Subsystem for Cardiac Ischemia Evaluation,"SANTOS, JUAN","HEARTVISTA, INC.",CA,"$509,354"
Heart Disease - Coronary Heart Disease,2010,NHLBI,5R01HL039902-19,,Coronary Vasculature Progenitor Cell in Human Ischemic Heart Failure,"ANVERSA, PIERO",BRIGHAM AND WOMEN'S HOSPITAL,MA,"$558,818"
Heart Disease - Coronary Heart Disease,2010,NIDDK,1R41DK083807-01A1,,"Novel Phosphate Binder: Effects on Hyperphosphatemia, Vascular Calcification & Bo","NELSON, DEANNA","BIOLINK LIFE SCIENCES, INC.",NC,"$194,509"
Heart Disease - Coronary Heart Disease,2010,NHLBI,7R01HL084405-04,,Cytoskeletal-Based Survival Pathways in Myocardium,"VANDER HEIDE, RICHARD",LOUISIANA STATE UNIV HSC NEW ORLEANS,LA,"$284,000"
Heart Disease - Coronary Heart Disease,2010,NHLBI,5R01HL089405-02,,Histone Deacetylase Inhibition: A Novel Approach to Cardioprotection,"ZHAO, TING",ROGER WILLIAMS HOSPITAL,RI,"$415,430"
Heart Disease - Coronary Heart Disease,2010,NHLBI,5SC1HL101431-02,,Defective isoforms of ApoE induce atherogenesis via unfolded protein responses,"YANG, HONG",MEHARRY MEDICAL COLLEGE,TN,"$293,000"
Heart Disease - Coronary Heart Disease,2010,NHLBI,1F30HL103013-01,,The role of miR-210 in cardiomyocyte metabolism following myocardial infarction,"QUIAT, DANIEL",UNIVERSITY OF TEXAS SW MED CTR/DALLAS,TX,"$27,780"
Heart Disease - Coronary Heart Disease,2010,NHLBI,5K23HL092792-03,,Atherosclerosis and Inflammation in HIV Disease,"LO, JANET",MASSACHUSETTS GENERAL HOSPITAL,MA,"$141,561"
Heart Disease - Coronary Heart Disease,2010,NHLBI,5K23HL091120-04,,Uncoupling Protein Polymorphisms and Cardiometabolic Responses to Beta-Blockers,"BEITELSHEES, AMBER",UNIVERSITY OF MARYLAND BALTIMORE,MD,"$132,842"
Heart Disease - Coronary Heart Disease,2010,NHLBI,5F31HL094102-03,,Nox1 and Nox4 Containing Oxidases are Required for PDGF-induced Migration of,"WILLIAMS, HOLLY",EMORY UNIVERSITY,GA,"$28,566"
Heart Disease - Coronary Heart Disease,2010,NHLBI,5R01HL090651-02,,Regulation Of Ischemic Preconditioning By Compartmentalized Signal Transduction,"O'BRYAN, JOHN",UNIVERSITY OF ILLINOIS AT CHICAGO,IL,"$274,750"
Heart Disease - Coronary Heart Disease,2010,NHLBI,5R01HL089655-03,,Genome Wide Association of Coronary Artery Disease and Related Risk Factors,"BROECKEL, ULRICH",MEDICAL COLLEGE OF WISCONSIN,WI,"$775,482"
Heart Disease - Coronary Heart Disease,2010,NIBIB,5R01EB009050-03,,Sonolysis in Acute Coronary Syndromes,"XIE, FENG",UNIVERSITY OF NEBRASKA MEDICAL CENTER,NE,"$560,082"
Heart Disease - Coronary Heart Disease,2010,NHLBI,5R01HL098082-02,,"Antiplatelet Therapy: Platelet Inhibition, Polymorphisms, and Protein Biomarkers","SABATINE, MARC",BRIGHAM AND WOMEN'S HOSPITAL,MA,"$445,000"
Heart Disease - Coronary Heart Disease,2010,NHLBI,5R01HL092946-02,,Fatty Acids and Heart Failure in the Physicians' Health Study,"DJOUSSE, LUC",BRIGHAM AND WOMEN'S HOSPITAL,MA,"$529,904"
Heart Disease - Coronary Heart Disease,2010,OD,5R01HL092946-02,,Fatty Acids and Heart Failure in the Physicians' Health Study,"DJOUSSE, LUC",BRIGHAM AND WOMEN'S HOSPITAL,MA,"$164,547"
Heart Disease - Coronary Heart Disease,2010,NHLBI,5F31HL095342-02,,Cardiac Progenitor Cell Chemotaxis,"AMADI, OVID",BRIGHAM AND WOMEN'S HOSPITAL,MA,"$41,380"
Heart Disease - Coronary Heart Disease,2010,NHLBI,5R21HL096059-02,,Mitigation of stent-mediated pathology by streamlined geometry,"DAVIES, PETER",UNIVERSITY OF PENNSYLVANIA,PA,"$200,000"
Heart Disease - Coronary Heart Disease,2010,NHLBI,5R01HL022512-33,,Ultrasonic Instrumentation for Cardiovascular Studies,"HARTLEY, CRAIG",BAYLOR COLLEGE OF MEDICINE,TX,"$383,750"
Heart Disease - Coronary Heart Disease,2010,NHLBI,5K23HL091106-03,,Metabolic Profiling of Acute Myocardial Injury in Humans,"LEWIS, GREGORY",MASSACHUSETTS GENERAL HOSPITAL,MA,"$142,358"
Heart Disease - Coronary Heart Disease,2010,NHLBI,5R01HL092071-04,,Cross-species analysis of myocardial susceptibility to perioperative stress,"PODGOREANU, MIHAI",DUKE UNIVERSITY,NC,"$483,276"
Heart Disease - Coronary Heart Disease,2010,NHLBI,5R01HL076801-06,,Inflammation and Infection in Atherosclerosis,"AMAR, SALOMON",BOSTON UNIVERSITY MEDICAL CAMPUS,MA,"$406,250"
Heart Disease - Coronary Heart Disease,2010,NHLBI,5K08HL097022-02,,Cardiac Magnetic Resonance to Detect Apoptosis in Vivo using Magnetic Labeling.,"DASH, RAJESH",STANFORD UNIVERSITY,CA,"$121,446"
Heart Disease - Coronary Heart Disease,2010,NHLBI,5F32HL096284-02,,The effect of ACC2 deletion on cardiac metabolism and function,"KOLWICZ, STEPHEN",UNIVERSITY OF WASHINGTON,WA,"$52,154"
Heart Disease - Coronary Heart Disease,2010,NHLBI,5R41HL088867-02,,Cardiac Regenerative Therapy with Cyclin A2,"CHAUDHRY, HINA","VENTRINOVA, INC.",NY,"$249,999"
Heart Disease - Coronary Heart Disease,2010,NHLBI,1P01HL095486-01A1,7913,Microvascular Dysfunction: Impact  Ischemia-Reperfusion Vascular Cell Interaction,"KORTHUIS, RONALD",UNIVERSITY OF MISSOURI-COLUMBIA,MO,"$362,155"
Heart Disease - Coronary Heart Disease,2010,NHLBI,2P01HL075443-06A1,7984,Mouse Physiology,"MAO, LAN",DUKE UNIVERSITY,NC,"$228,802"
Heart Disease - Coronary Heart Disease,2010,NHLBI,2R01HL064726-06,,Delayed-Enhancement Cardiac MRI: Prognostic Implications and Improved Imaging,"KIM, RAYMOND",DUKE UNIVERSITY,NC,"$488,572"
Heart Disease - Coronary Heart Disease,2010,NHLBI,5R21HL092513-02,,Creation of Stem Cells by Nuclear Reprogramming,"MCGARRY, THOMAS",NORTHWESTERN UNIVERSITY,IL,"$190,625"
Heart Disease - Coronary Heart Disease,2010,NHLBI,5K99HL094535-02,,"Genetic Variants Associated with HDL and LDL Cholesterol, and Triglyceride Levels","WILLER, CRISTEN",UNIVERSITY OF MICHIGAN AT ANN ARBOR,MI,"$90,000"
Heart Disease - Coronary Heart Disease,2010,NHLBI,5R33HL089027-04,,Nanostructuring and Molecular Imaging of Engineered Cardiovascular Tissues,"WU, JOSEPH",STANFORD UNIVERSITY,CA,"$773,367"
Heart Disease - Coronary Heart Disease,2010,NHLBI,5R44HL079726-05,,Catheter Guidance System for RF Ablation of Arrhythmias,"GALEA, ANNA",INFOSCITEX CORPORATION,MA,"$985,602"
Heart Disease - Coronary Heart Disease,2010,NHLBI,5R01HL093305-03,,Molecular mechanisms of medial calcification: regulation by transglutaminase 2,"NURMINSKAYA, MARIA",UNIVERSITY OF MARYLAND BALTIMORE,MD,"$337,500"
Heart Disease - Coronary Heart Disease,2010,NHLBI,5R01HL089945-03,,Imaging of Aortic Atherosclerosis and Inflammation in the Metabolic Syndrome,"MANNING, WARREN",BETH ISRAEL DEACONESS MEDICAL CENTER,MA,"$823,001"
Heart Disease - Coronary Heart Disease,2010,NHLBI,5R01HL088726-03,,Mechanisms of Depression in CVD,"BREMNER, JAMES",EMORY UNIVERSITY,GA,"$637,892"
Heart Disease - Coronary Heart Disease,2010,NHLBI,2P01HL036587-20A1,8153,Genetic and Environmental Effects on Clinical Cardiovascular Events in a Large Co,"WILLIAMS, REDFORD",DUKE UNIVERSITY,NC,"$592,293"
Heart Disease - Coronary Heart Disease,2010,NHLBI,2R37HL028143-26,,RhoA mediated survival signals in cardiomyocytes,"BROWN, JOAN",UNIVERSITY OF CALIFORNIA SAN DIEGO,CA,"$386,250"
Heart Disease - Coronary Heart Disease,2010,NHLBI,5R01HL067459-07,,Depression & CHD: Cellular-Molecular Mechanisms,"SUAREZ, EDWARD",DUKE UNIVERSITY,NC,"$749,381"
Heart Disease - Coronary Heart Disease,2010,NHLBI,5R01HL092245-02,,Mechanisms of coronary microvascular dysfunction in metabolic syndrome,"TUNE, JOHNATHAN",INDIANA UNIV-PURDUE UNIV AT INDIANAPOLIS,IN,"$381,826"
Heart Disease - Coronary Heart Disease,2010,NHLBI,5R01HL080644-06,,Estimating Effects of Interventions in Longitudinal Data,"HERNAN, MIGUEL",HARVARD UNIVERSITY (SCH OF PUBLIC HLTH),MA,"$426,349"
Heart Disease - Coronary Heart Disease,2010,NHLBI,1K01HL103184-01,,Molecular Mechanisms of Stem Cell Engraftment,"RODRIGUES, CLAUDIA",UNIVERSITY OF MIAMI SCHOOL OF MEDICINE,FL,"$132,163"
Heart Disease - Coronary Heart Disease,2010,NHLBI,1K01HL103176-01,,Protein Phosphatase Inhibitor-1 and vascular smooth muscle cell function,"HADRI, LAHOUARIA",MOUNT SINAI SCHOOL OF MEDICINE,NY,"$134,865"
Heart Disease - Coronary Heart Disease,2010,NHLBI,5K08HL097069-02,,Characterization of Cell-Based Therapy for Congenital Heart Patients,"KAUSHAL, SUNJAY",CHILDREN'S MEMORIAL HOSPITAL (CHICAGO),IL,"$129,060"
Heart Disease - Coronary Heart Disease,2010,NHLBI,5K23HL094834-02,,HDL Function as a Biomarker for Atherosclerotic Risk in Rheumatoid Arthritis,"CHARLES-SCHOEMAN, CHRISTINA",UNIVERSITY OF CALIFORNIA LOS ANGELES,CA,"$137,766"
Heart Disease - Coronary Heart Disease,2010,NHLBI,5R01HL093374-02,,Stress Management and Biomarkers of Risk in Cardiac Rehabilitation,"BLUMENTHAL, JAMES",DUKE UNIVERSITY,NC,"$750,496"
Heart Disease - Coronary Heart Disease,2010,NHLBI,5K23HL096893-02,,Improving cardiovascular risk assessment using ultrasound imaging,"NAMBI, VIJAY",BAYLOR COLLEGE OF MEDICINE,TX,"$137,510"
Heart Disease - Coronary Heart Disease,2010,NHLBI,5K23HL097151-02,,Human translational studies of CXCL12:  a novel GWAS atherosclerosis locus,"MEHTA, NEHAL",UNIVERSITY OF PENNSYLVANIA,PA,"$137,052"
Heart Disease - Coronary Heart Disease,2010,NHLBI,5R01HL094423-02,,"Exercise and Inflammation: Autonomic, Affective & Cellular Mechanisms","SLOAN, RICHARD",COLUMBIA UNIVERSITY HEALTH SCIENCES,NY,"$749,079"
Heart Disease - Coronary Heart Disease,2010,NHLBI,5K23HL092299-02,,Prognostic Utility of Absolute Coronary Microvascular Function by PET/CT,"DORBALA, SHARMILA",BRIGHAM AND WOMEN'S HOSPITAL,MA,"$140,992"
Heart Disease - Coronary Heart Disease,2010,NHLBI,5F32HL097587-02,,The Role of Sulfonylurea Receptor 2 Splice Variants in Myocardial Function,"FAHRENBACH, JOHN",UNIVERSITY OF CHICAGO,IL,"$50,474"
Heart Disease - Coronary Heart Disease,2010,NHLBI,5K01HL096413-02,,Genetics of In-Stent Restenosis: The Mouse to Human Strategy,"VAZQUEZ PADRON, ROBERTO",UNIVERSITY OF MIAMI SCHOOL OF MEDICINE,FL,"$106,844"
Heart Disease - Coronary Heart Disease,2010,NHLBI,5R01HL089944-03,,Advanced Glycation End-Products in Human Myocardium,"LEWINTER, MARTIN",UNIVERSITY OF VERMONT & ST AGRIC COLLEGE,VT,"$653,558"
Heart Disease - Coronary Heart Disease,2010,NHLBI,5K99HL091116-02,,Stress Hormones and Chondrogenic Vascular Calcification,"EVANS, JODI",WINTHROP-UNIVERSITY HOSPITAL,NY,"$93,009"
Heart Disease - Coronary Heart Disease,2010,NIEHS,5R00ES016586-03,,MMP-9 Activity Mediates Vascular Effects of Inhaled Environmental Air Pollutants,"LUND, AMIE",LOVELACE BIOMEDICAL & ENVIRONMENTAL RES,NM,"$249,000"
Heart Disease - Coronary Heart Disease,2010,NIA,5R01AG033761-02,,Effects of amino acids on regional lipid metabolism,"BORSHEIM, ELISABET",UNIVERSITY OF TEXAS MEDICAL BR GALVESTON,TX,"$300,420"
Heart Disease - Coronary Heart Disease,2010,NHLBI,5U01HL088939-04,,"Mitral Regurgitation, Heart Failure and Coronary Disease: Benefits to MV Repair?","MICHLER, ROBERT",ALBERT EINSTEIN COL OF MED YESHIVA UNIV,NY,"$415,000"
Heart Disease - Coronary Heart Disease,2010,NHLBI,5R01HL058669-10,,Brain metabolism and neuroprotection in cardiopulmonary bypass,"PASTUSZKO, ANNA",UNIVERSITY OF PENNSYLVANIA,PA,"$459,095"
Heart Disease - Coronary Heart Disease,2010,NHLBI,5K23HL094747-02,,Genetic Determinants of Coronary Artery Calcification in High-Risk Families,"KRAL, BRIAN",JOHNS HOPKINS UNIVERSITY,MD,"$139,725"
Heart Disease - Coronary Heart Disease,2010,NHLBI,5R01HL098037-02,,"Physical Activity, Depression, and Post-ACS Survival","SCHWARTZ, JOSEPH",COLUMBIA UNIVERSITY HEALTH SCIENCES,NY,"$402,500"
Heart Disease - Coronary Heart Disease,2010,NHLBI,5K23HL093118-02,,Early Noninvasive Detection of Myocardial Microbascular Dysfunction in Diabetes,"TAYLOR, ANGELA",UNIVERSITY OF VIRGINIA CHARLOTTESVILLE,VA,"$126,895"
Heart Disease - Coronary Heart Disease,2010,NHLBI,5K23HL097074-02,,Chemokines and Neovascularization in Coronary Artery Disease,"KEELEY, ELLEN",UNIVERSITY OF VIRGINIA CHARLOTTESVILLE,VA,"$135,189"
Heart Disease - Coronary Heart Disease,2010,NHLBI,5K99HL097021-02,,Efferocytosis in CVD & Inflammation,"THORP, EDWARD",COLUMBIA UNIVERSITY HEALTH SCIENCES,NY,"$90,000"
Heart Disease - Coronary Heart Disease,2010,NHLBI,5R01HL064395-09,,Bioengineering Design of Artificial Blood,"INTAGLIETTA, MARCOS",UNIVERSITY OF CALIFORNIA SAN DIEGO,CA,"$708,566"
Heart Disease - Coronary Heart Disease,2010,NHLBI,5R01HL097768-02,,Calcineurin's role in circadian regulation of cardiac function and remodeling,"ROTHERMEL, BEVERLY",UNIVERSITY OF TEXAS SW MED CTR/DALLAS,TX,"$392,500"
Heart Disease - Coronary Heart Disease,2010,NIDDK,5U01DK056990-12,,Health Outcomes of Weight loss: Look AHEAD -Action for Health in Diabetes,"BRAY, GEORGE",LSU PENNINGTON BIOMEDICAL RESEARCH CTR,LA,"$936,777"
Heart Disease - Coronary Heart Disease,2010,NIDDK,5U01DK057177-12,,Look AHEAD: Action for Health in Diabetes,"FOREYT, JOHN",BAYLOR COLLEGE OF MEDICINE,TX,"$977,020"
Heart Disease - Coronary Heart Disease,2010,NHLBI,5U01DK057151-12,,Look AHEAD: Action for Health in Diabetes,"HILL, JAMES",UNIVERSITY OF COLORADO DENVER,CO,"$1,000,000"
Heart Disease - Coronary Heart Disease,2010,NIDDK,5U01DK057151-12,,Look AHEAD: Action for Health in Diabetes,"HILL, JAMES",UNIVERSITY OF COLORADO DENVER,CO,"$22,375"
Heart Disease - Coronary Heart Disease,2010,NIDDK,5U01DK057182-12,,Health Outcomes of Weight loss: Look AHEAD -Action for Health in Diabetes,"JEFFERY, ROBERT",UNIVERSITY OF MINNESOTA TWIN CITIES,MN,"$938,757"
Heart Disease - Coronary Heart Disease,2010,NIDDK,5U01DK057002-12,,Look AHEAD: Action for Health in Diabetes,"JAKICIC, JOHN",UNIVERSITY OF PITTSBURGH AT PITTSBURGH,PA,"$999,397"
Heart Disease - Coronary Heart Disease,2010,NIDDK,5U01DK057219-13,,Clinical Center for Look AHEAD: Action for Health in Diabetes,"PETERS, ANNE",UNIVERSITY OF SOUTHERN CALIFORNIA,CA,"$732,631"
Heart Disease - Coronary Heart Disease,2010,NHLBI,5U01DK057008-12,,Clinical Center for LookAHEAD: Action for Health in Diabetes,"LEWIS, CORA",UNIVERSITY OF ALABAMA AT BIRMINGHAM,AL,"$1,000,000"
Heart Disease - Coronary Heart Disease,2010,NIDDK,5U01DK057008-12,,Clinical Center for LookAHEAD: Action for Health in Diabetes,"LEWIS, CORA",UNIVERSITY OF ALABAMA AT BIRMINGHAM,AL,"$56,821"
Heart Disease - Coronary Heart Disease,2010,NHLBI,5U01DK057135-12,,Look AHEAD: Action for Health in Diabetes,"WADDEN, THOMAS",UNIVERSITY OF PENNSYLVANIA,PA,"$1,000,000"
Heart Disease - Coronary Heart Disease,2010,NIDDK,5U01DK057135-12,,Look AHEAD: Action for Health in Diabetes,"WADDEN, THOMAS",UNIVERSITY OF PENNSYLVANIA,PA,"$48,354"
Heart Disease - Coronary Heart Disease,2010,NIDDK,5U01DK057149-12,,Look AHEAD: Action for Health in Diabetes,"BRANCATI, FREDERICK",JOHNS HOPKINS UNIVERSITY,MD,"$1,052,585"
Heart Disease - Coronary Heart Disease,2010,NIDDK,5U01DK057171-12,,The Look AHEAD Continuation: Action for Health in Diabetes,"HAZUDA, HELEN",UNIVERSITY OF TEXAS HLTH SCI CTR SAN ANT,TX,"$722,846"
Heart Disease - Coronary Heart Disease,2010,NIDDK,5U01DK057131-12,,Study of Health Outcomes of Weight loss: Look AHEAD-Action for Health in Diabetes,"KAHN, STEVEN",SEATTLE INST FOR BIOMEDICAL/CLINICAL RES,WA,"$904,270"
Heart Disease - Coronary Heart Disease,2010,NHLBI,5U01DK057078-12,,The Look AHEAD Continuation: Action for Health in Diabetes,"JOHNSON, KAREN",UNIVERSITY OF TENNESSEE HEALTH SCI CTR,TN,"$1,000,000"
Heart Disease - Coronary Heart Disease,2010,NIDDK,5U01DK057078-12,,The Look AHEAD Continuation: Action for Health in Diabetes,"JOHNSON, KAREN",UNIVERSITY OF TENNESSEE HEALTH SCI CTR,TN,"$219,026"
Heart Disease - Coronary Heart Disease,2010,NIDDK,5U01DK057154-12,,Action for Health in Diabetes (Look AHEAD),"NATHAN, DAVID",MASSACHUSETTS GENERAL HOSPITAL,MA,"$1,546,953"
Heart Disease - Coronary Heart Disease,2010,NIDDK,5U01DK057178-12,,Look AHEAD: Action for Health Diabetes,"PI-SUNYER, F.",ST. LUKE'S-ROOSEVELT INST FOR HLTH SCIS,NY,"$1,094,228"
Heart Disease - Coronary Heart Disease,2010,NIDDK,5U01DK056992-12,,The Look AHEAD Continuation: Action for Health in Diabetes,"WING, RENA",MIRIAM HOSPITAL,RI,"$603,114"
