Category,FY,Funding IC,Project Number,Sub Project #,Project Title,PI Name,Org Name,State / Country,Amount
Heart Disease - Coronary Heart Disease,2010,NINR,5U01DK056992-12,,The Look AHEAD Continuation: Action for Health in Diabetes,"WING, RENA",MIRIAM HOSPITAL,RI,"$200,000"
Heart Disease - Coronary Heart Disease,2010,OD,5U01DK056992-12,,The Look AHEAD Continuation: Action for Health in Diabetes,"WING, RENA",MIRIAM HOSPITAL,RI,"$100,000"
Heart Disease - Coronary Heart Disease,2010,NIDDK,5U01DK057136-12,,Look AHEAD: Action for Health in Diabetes,"ESPELAND, MARK",WAKE FOREST UNIVERSITY HEALTH SCIENCES,NC,"$2,059,201"
Heart Disease - Coronary Heart Disease,2010,NHLBI,5R00HL093115-03,,Mechanism of SSH1L Phosphatase Activation in VSMC: Role in Vascular Pathology,"SAN MARTIN, MARIA",EMORY UNIVERSITY,GA,"$249,000"
Heart Disease - Coronary Heart Disease,2010,NHLBI,5R37HL047073-20,,Cell-Cell Interactions in Thrombosis -Request for Extension of Merit Award,"MARCUS, AARON",WEILL MEDICAL COLLEGE OF CORNELL UNIV,NY,"$492,062"
Heart Disease - Coronary Heart Disease,2010,NIA,5R01AG013196-15,,Socio-economic status and heterogeneity in aging,"MARMOT, MICHAEL",UNIVERSITY COLLEGE LONDON,UK,"$645,028"
Heart Disease - Coronary Heart Disease,2010,NINDS,5U01NS039143-09,,Warfarin vs Aspirin in Reduced Ejection Fraction - STAT,"THOMPSON, JOHN",COLUMBIA UNIVERSITY HEALTH SCIENCES,NY,"$1,000,000"
Heart Disease - Coronary Heart Disease,2010,NHLBI,5R01HL068345-09,,Protein Stability in Polymer Delivery Systems,"SCHWENDEMAN, STEVEN",UNIVERSITY OF MICHIGAN AT ANN ARBOR,MI,"$275,145"
Heart Disease - Coronary Heart Disease,2010,NHLBI,5R01HL096796-02,,Plaque detection with the hydrocyanines,"MURTHY, NIREN",GEORGIA INSTITUTE OF TECHNOLOGY,GA,"$370,286"
Heart Disease - Coronary Heart Disease,2010,NIDCR,5R01DE018184-04,,Periodontal Disease and Coronary Artery Remodeling in CHD and Metabolic Syndrome,"WELTY, FRANCINE",BETH ISRAEL DEACONESS MEDICAL CENTER,MA,"$427,345"
Heart Disease - Coronary Heart Disease,2010,NIA,5K01AG034259-02,,Biological Aging Mitrochondrial Variants and Coronary Artery Disease,"ZHAO, JINYING",UNIVERSITY OF OKLAHOMA HLTH SCIENCES CTR,OK,"$131,247"
Heart Disease - Coronary Heart Disease,2010,NHLBI,5U01HL092022-02,,"Rule-Out Myocardial Infarction Using Computed Assisted Tomography-ROMICATII,DCC","SCHOENFELD, DAVID",MASSACHUSETTS GENERAL HOSPITAL,MA,"$393,791"
Heart Disease - Coronary Heart Disease,2010,NHLBI,1P01HL101398-01,8662,Mental Stress Ischemia: Prognosis and Genetic Influences,"SHEPS, DAVID",EMORY UNIVERSITY,GA,"$752,552"
Heart Disease - Coronary Heart Disease,2010,NHLBI,1P01HL101398-01,8663,Vascular Responses During Mental Stress,"QUYYUMI, ARSHED",EMORY UNIVERSITY,GA,"$211,790"
Heart Disease - Coronary Heart Disease,2010,NHLBI,1P01HL101398-01,8664,Depressions and Mental Stress Ischemia: Brain Mechanisms,"VACCARINO, VIOLA",EMORY UNIVERSITY,GA,"$295,983"
Heart Disease - Coronary Heart Disease,2010,NHLBI,5R21HL097353-02,,Identification of Novel Endothelial Progenitor Cells,"YOON, YOUNG-SUP",EMORY UNIVERSITY,GA,"$193,750"
Heart Disease - Coronary Heart Disease,2010,NIA,5U01AG029824-02,,ASPirin in Reducing Events in the Elderly,"GRIMM, RICHARD","MINNEAPOLIS MEDICAL RESEARCH FDN, INC.",MN,"$9,375,981"
Heart Disease - Coronary Heart Disease,2010,NHLBI,5R01HL065477-11,,FUNCTIONAL AND TARGETING POLYMERIC GENE CARRIERS,"KIM, SUNG WAN",UNIVERSITY OF UTAH,UT,"$338,625"
Heart Disease - Coronary Heart Disease,2010,NHLBI,5U01HL088955-04,,Cleveland Clinic Cardiothoracic Collaborative Clinical Center - C6,"BLACKSTONE, EUGENE",CLEVELAND CLINIC LERNER COL/MED-CWRU,OH,"$498,288"
Heart Disease - Coronary Heart Disease,2010,NHLBI,5U01HL088957-04,,Cardiac surgery techniques to treat ventricular and aortic remodeling,"ACKER, MICHAEL",UNIVERSITY OF PENNSYLVANIA,PA,"$387,206"
Heart Disease - Coronary Heart Disease,2010,NIDDK,5R01DK080662-02,,A Longitudinal Study of Endothelial Function and Erectile Dysfunction,"KUPELIAN, VARANT","NEW ENGLAND RESEARCH INSTITUTES, INC.",MA,"$383,165"
Heart Disease - Coronary Heart Disease,2010,NHLBI,5R01HL092798-02,,DIRECT EFFECTS OF ANTIRETROVIRAL THERAPY ON CARDIAC ENERGY HOMEOSTASIS,"HRUZ, PAUL",WASHINGTON UNIVERSITY,MO,"$387,500"
Heart Disease - Coronary Heart Disease,2010,NHLBI,5U01HL092040-02,,ROMICAT II - CCC - Lead Application,"HOFFMANN, UDO",MASSACHUSETTS GENERAL HOSPITAL,MA,"$1,913,403"
Heart Disease - Coronary Heart Disease,2010,NHLBI,1R01HL103635-01,,Identification and study of the vascular disease gene at 9p21.3,"QUERTERMOUS, THOMAS",STANFORD UNIVERSITY,CA,"$618,944"
Heart Disease - Coronary Heart Disease,2010,NIBIB,5R21EB010098-02,,Vulnerable Plaque Detection with Carotid Strain Imaging,"VARGHESE, TOMY",UNIVERSITY OF WISCONSIN MADISON,WI,"$183,769"
Heart Disease - Coronary Heart Disease,2010,NHLBI,7R00HL091056-04,,Post-translational Modification in Cardiac Muscle,"BIESIADECKI, BRANDON",OHIO STATE UNIVERSITY,OH,"$248,999"
Heart Disease - Coronary Heart Disease,2010,NHLBI,5U01HL099776-02,,Induced pluripotent stem cells in the understanding and treatment of heart diseas,"ROBBINS, ROBERT",STANFORD UNIVERSITY,CA,"$1,176,000"
Heart Disease - Coronary Heart Disease,2010,NIA,5K23AG032870-02,,"Sexuality, Aging and Heart Disease: Translating from Population to Patient","LINDAU, STACY",UNIVERSITY OF CHICAGO,IL,"$173,699"
Heart Disease - Coronary Heart Disease,2010,NIDDK,5R01DK077954-02,,Hormones and Sexual Function Predict Outcomes in Revascularized Men with Diabetes,"MCLAUGHLIN, MARY",MOUNT SINAI SCHOOL OF MEDICINE,NY,"$503,415"
Heart Disease - Coronary Heart Disease,2010,OD,5R21HL093626-02,,Mechanisms underlie inverse gender discrepancy in ischemic protection,"SHI, NIAN-QING",UNIVERSITY OF WISCONSIN MADISON,WI,"$185,625"
Heart Disease - Coronary Heart Disease,2010,NHLBI,5R01HL036310-21,,Socioeconomic gradient in CHD in early old age,"MARMOT, MICHAEL",UNIVERSITY COLLEGE LONDON,UK,"$292,970"
Heart Disease - Coronary Heart Disease,2010,NHLBI,1SC2HL107235-01,,Bio-printing stem cell based and oxygen releasing tissue grafts for myocardial in,"XU, TAO",UNIVERSITY OF TEXAS EL PASO,TX,"$138,115"
Heart Disease - Coronary Heart Disease,2010,NHLBI,1R18HL096563-01A1,,A Nurse-Led Physician-Directed System for Providing Optimal Cardiac Care,"KOTTKE, THOMAS",HEALTHPARTNERS RESEARCH FOUNDATION,MN,"$417,323"
Heart Disease - Coronary Heart Disease,2010,NINR,5K99NR011054-02,,Survival and Age Biases in Gene Associations with Coronary Disease,"DUNGAN, JENNIFER",DUKE UNIVERSITY,NC,"$86,457"
Heart Disease - Coronary Heart Disease,2010,NCCAM,5R21AT005136-02,,Ginsenoside Rb1 Decreases Injury-Induced Vascular Restenosis,"ZHOU, WEI","PALO ALTO INSTITUTE FOR RES & EDU, INC.",CA,"$141,768"
Heart Disease - Coronary Heart Disease,2010,NHLBI,1R01HL103866-01,,Gut flora metabolism of dietary phosphatidylcholine and cardiovascular disease,"HAZEN, STANLEY",CLEVELAND CLINIC LERNER COL/MED-CWRU,OH,"$514,324"
Heart Disease - Coronary Heart Disease,2010,OD,1R01HL103866-01,,Gut flora metabolism of dietary phosphatidylcholine and cardiovascular disease,"HAZEN, STANLEY",CLEVELAND CLINIC LERNER COL/MED-CWRU,OH,"$220,425"
Heart Disease - Coronary Heart Disease,2010,NHLBI,1R01HL103642-01,,Autogeneic Mitochondria: Surgical Cardioprotection,"MCCULLY, JAMES",BETH ISRAEL DEACONESS MEDICAL CENTER,MA,"$434,688"
Heart Disease - Coronary Heart Disease,2010,NHLBI,1R01HL103931-01,,Nitrative stress in heart failure,"TANG, WAI HONG",CLEVELAND CLINIC LERNER COL/MED-CWRU,OH,"$779,624"
Heart Disease - Coronary Heart Disease,2010,NHLBI,1R01HL104040-01,,Cardiac Induction by Small Molecule BMP Inhibitors,"HONG, CHARLES",VANDERBILT UNIVERSITY,TN,"$387,708"
Heart Disease - Coronary Heart Disease,2010,NHLBI,1R01HL104115-01,,The role of microRNA in cardiac cell death,"ABDELLATIF, MAHA",UNIV OF MED/DENT OF NJ-NJ MEDICAL SCHOOL,NJ,"$390,000"
Heart Disease - Coronary Heart Disease,2010,NHLBI,1R01HL104126-01,,Flow-induced coronary vasospasm in diabetic patients,"BAGI, ZSOLT",NEW YORK MEDICAL COLLEGE,NY,"$373,900"
Heart Disease - Coronary Heart Disease,2010,NHLBI,1R01HL104284-01,,Global Cardiovascular Disease Policy Model for Screening Prevention and Treatment,"GAZIANO, THOMAS",HARVARD UNIVERSITY (SCH OF PUBLIC HLTH),MA,"$633,425"
Heart Disease - Coronary Heart Disease,2010,NHLBI,1R01HL104173-01,,Protection of Developing White Matter during Cardiac Surgery,"JONAS, RICHARD",CHILDREN'S RESEARCH INSTITUTE,DC,"$410,176"
Heart Disease - Coronary Heart Disease,2010,NHLBI,1K23HL103720-01,,Improving Cardiovascular Outcomes in Individuals with a History of Incarceration,"WANG, EMILY",YALE UNIVERSITY,CT,"$136,733"
Heart Disease - Coronary Heart Disease,2010,NHLBI,2R37HL065619-10,,Myocyte Signaling and the Response to Stress,"PATTERSON, WINSTON",UNIVERSITY OF NORTH CAROLINA CHAPEL HILL,NC,"$370,000"
Heart Disease - Coronary Heart Disease,2010,NHLBI,1K99HL103846-01,,Redox Regulation of Endothelial Nitric Oxide Synthase and Cardiovascular Diseases,"CHEN, CHUN-AN",OHIO STATE UNIVERSITY,OH,"$110,268"
Heart Disease - Coronary Heart Disease,2010,NHLBI,1R21HL104315-01,,MG53 mediated myocardial repair for ischemic heart disease,"CAI, CHUANXI",UNIVERSITY OF LOUISVILLE,KY,"$223,500"
Heart Disease - Coronary Heart Disease,2010,NIDDK,1R21DK089368-01,,CABG and PCI for the Treatment of CAD in Individuals with CKD,"CHARYTAN, DAVID",BRIGHAM AND WOMEN'S HOSPITAL,MA,"$219,449"
Heart Disease - Coronary Heart Disease,2010,NHLBI,1R21HL104377-01,,Shared Mechanisms of Valvular and Vascular Calcification,"GRANDE-ALLEN, KATHRYN",RICE UNIVERSITY,TX,"$199,408"
Heart Disease - Coronary Heart Disease,2010,NHLBI,1R21HL104272-01,,Hypothermic Adaptation and Endothelial Protection from Severe Cold Stress,"ZIEGER, MICHAEL","CLARIAN HEALTH PARTNERS, INC.",IN,"$168,750"
Heart Disease - Coronary Heart Disease,2010,NHLBI,1R21HL104493-01,,Enhanced cardiomyocyte differentiation and maturation using myocardial matrix,"CHRISTMAN, KAREN",UNIVERSITY OF CALIFORNIA SAN DIEGO,CA,"$185,295"
Heart Disease - Coronary Heart Disease,2010,NHLBI,1R01HL104535-01,,Roles for ER Stress Inducible Cardiomyokines in the heart,"GLEMBOTSKI, CHRISTOPHER",SAN DIEGO STATE UNIVERSITY,CA,"$394,402"
Heart Disease - Coronary Heart Disease,2010,NHLBI,1R21HL104544-01,,Inducible Notch improves progenitor cell repair of damaged heart,"SUSSMAN, MARK",SAN DIEGO STATE UNIVERSITY,CA,"$186,875"
Heart Disease - Coronary Heart Disease,2010,NHLBI,1R01HL104326-01,,Function and Integration of Stem Cell-derived Cardiac Tissue Patch,"BURSAC, NENAD",DUKE UNIVERSITY,NC,"$348,484"
Heart Disease - Coronary Heart Disease,2010,NHLBI,1R15HL104587-01,,Regulation of cardiac myocyte proliferation and myocardial regeneration in Ciona,"EVANS-ANDERSON, HEATHER",WINTHROP UNIVERSITY,SC,"$417,319"
Heart Disease - Coronary Heart Disease,2010,RMAP,1DP2OD007464-01,,Directed Cardiac Cellular Programming: A New Paradigm for Cardiac Regeneration,"CHI, NEIL",UNIVERSITY OF CALIFORNIA SAN DIEGO,CA,"$2,322,250"
Heart Disease - Coronary Heart Disease,2010,NHLBI,1R01HL098077-01A1,,Multi-Scale Biology of Atherosclerosis in the Cellular Adhesion Pathway,"BIELINSKI, SUZETTE",MAYO CLINIC,MN,"$673,030"
Heart Disease - Coronary Heart Disease,2010,NHLBI,1R01HL098193-01A1,,Characterization of Atherosclerosis Modifier Genes,"SMITH, JONATHAN",CLEVELAND CLINIC LERNER COL/MED-CWRU,OH,"$465,718"
Heart Disease - Coronary Heart Disease,2010,NHLBI,1R01HL098490-01A1,,Mechanisms of photobiomodulation in myocardial reperfusion injury,"BIENENGRAEBER, MARTIN",MEDICAL COLLEGE OF WISCONSIN,WI,"$380,000"
Heart Disease - Coronary Heart Disease,2010,NHLBI,2R01HL075646-05A2,,The Role of Scavenger Receptor Class B Type 1 in Humans,"RODRIGUEZ, ANNABELLE",JOHNS HOPKINS UNIVERSITY,MD,"$807,900"
Heart Disease - Coronary Heart Disease,2010,NIEHS,1R01ES017794-01A1,,Modification of PM-Mediated Arrhythmogenesis in Populations,"WHITSEL, ERIC",UNIVERSITY OF NORTH CAROLINA CHAPEL HILL,NC,"$760,316"
Heart Disease - Coronary Heart Disease,2010,NHLBI,2R01HL081138-06,,MSX2-WNT SIGNALING IN CARDIOVASCULAR CALCIFICATION,"TOWLER, DWIGHT",WASHINGTON UNIVERSITY,MO,"$380,000"
Heart Disease - Coronary Heart Disease,2010,NHLBI,2R01HL059301-13,,Troponin and Heart Function in Health and Disease,"METZGER, JOSEPH",UNIVERSITY OF MINNESOTA TWIN CITIES,MN,"$387,674"
Heart Disease - Coronary Heart Disease,2010,NHLBI,2R01HL027339-23,,Mechanisms of Coronary Flow Regulation by Adenosine,"MUSTAFA, S.",WEST VIRGINIA UNIVERSITY,WV,"$500,303"
Heart Disease - Coronary Heart Disease,2010,NHLBI,1R01HL098468-01A1,,Role of Presenilin in Idiopathic Dilated Cardiomyopathy,"DEL MONTE, FEDERICA",BETH ISRAEL DEACONESS MEDICAL CENTER,MA,"$434,688"
Heart Disease - Coronary Heart Disease,2010,NHLBI,1R01HL098423-01A1,,Role of mTOR in the diabetic heart,"MATSUI, TAKASHI",UNIVERSITY OF HAWAII AT MANOA,HI,"$375,000"
Heart Disease - Coronary Heart Disease,2010,NHLBI,2R01HL062826-09A2,,Genetics of Vascular Remodeling,"BERK, BRADFORD",UNIVERSITY OF ROCHESTER,NY,"$382,500"
Heart Disease - Coronary Heart Disease,2010,NHLBI,1R01HL095951-01A2,,Roles of Plasminogen Activator Inhibitor-1 and Vitronectin in Failure of Coronary,"FAY, WILLIAM",UNIVERSITY OF MISSOURI-COLUMBIA,MO,"$384,746"
Heart Disease - Coronary Heart Disease,2010,NIDDK,1R01DK084997-01A1,,Adult Life Predictors of Genitourinary Disorders,"VAN DEN EEDEN, STEPHEN",KAISER FOUNDATION RESEARCH INSTITUTE,CA,"$585,932"
Heart Disease - Coronary Heart Disease,2010,NHLBI,1R01HL095868-01A2,,Ultrasound-Targeted Therapy for Acute Myocardial Infarction,"KAUL, SANJIV",OREGON HEALTH AND SCIENCE UNIVERSITY,OR,"$841,314"
Heart Disease - Coronary Heart Disease,2010,NHLBI,1R21HL098495-01A1,,Genetic Modification of Triggers of Acute Myocardial Infarction,"BAYLIN, ANA",UNIVERSITY OF MICHIGAN AT ANN ARBOR,MI,"$285,424"
Heart Disease - Coronary Heart Disease,2010,OD,1R21AG033876-01A2,,Moral Hazard in Less Invasive Surgical Technology for Coronary Artery Disease,"GROSSMAN, MICHAEL",NATIONAL BUREAU OF ECONOMIC RESEARCH,MA,"$150,000"
Heart Disease - Coronary Heart Disease,2010,NIA,1K01AG033652-01A2,,Cardiac Imaging of Thoracic Fat and Aortic Stiffness in Older High Risk Patients,"BRINKLEY, TINA",WAKE FOREST UNIVERSITY HEALTH SCIENCES,NC,"$108,669"
Heart Disease - Coronary Heart Disease,2010,NHLBI,1K99HL098459-01A1,,Novel Adipokines and Coronary Heart Disease in U.S. Men and Women with Diabetes,"SUN, QI",HARVARD UNIVERSITY (SCH OF PUBLIC HLTH),MA,"$93,307"
Heart Disease - Coronary Heart Disease,2010,NHLBI,1R21HL097129-01A2,,Bone marrow cell therapy for cardiac disease: Impact of donor age and infarction,"SPRINGER, MATTHEW",UNIVERSITY OF CALIFORNIA SAN FRANCISCO,CA,"$193,125"
Heart Disease - Coronary Heart Disease,2010,NHLBI,1K99HL097068-01A2,,Role of fatty acid metabolism for the prevention of sudden cardiac death,"CHIUVE, STEPHANIE",BRIGHAM AND WOMEN'S HOSPITAL,MA,"$126,813"
Heart Disease - Coronary Heart Disease,2010,NIDDK,1R21DK085363-01A1,,Development of a childhood metabolic syndrome risk score for predicting adult dis,"GURKA, MATTHEW",WEST VIRGINIA UNIVERSITY,WV,"$135,895"
Heart Disease - Coronary Heart Disease,2010,NHLBI,1R01HL108229-01A1,,Intravascular Fluorescence Molecular Imaging of Inflammation in Atherosclerosis,"JAFFER, FAROUC",MASSACHUSETTS GENERAL HOSPITAL,MA,"$393,458"
Heart Disease - Coronary Heart Disease,2010,NHLBI,2R01HL075316-05,,Ceramide Signaling in Coronary Endothelial Dysfunction,"LI, PIN-LAN",VIRGINIA COMMONWEALTH UNIVERSITY,VA,"$419,277"
Heart Disease - Coronary Heart Disease,2010,NHLBI,1R01HL102090-01A1,,Comprehensive autopsy characterization of sudden cardiac death,"TSENG, ZIAN",UNIVERSITY OF CALIFORNIA SAN FRANCISCO,CA,"$506,236"
Heart Disease - Coronary Heart Disease,2010,NHLBI,1R01HL102190-01A1,,Role of Wnts in Cardiac Repair,"DEB, ARJUN",UNIVERSITY OF NORTH CAROLINA CHAPEL HILL,NC,"$370,000"
Heart Disease - Coronary Heart Disease,2010,NHLBI,1R01HL102487-01A1,,Individualized Risk Stratification Using the Genomic Contribution,"BEECHAM, GARY",UNIVERSITY OF MIAMI SCHOOL OF MEDICINE,FL,"$757,801"
Heart Disease - Coronary Heart Disease,2010,NHLBI,1R01HL102442-01A1,,Effect of Extended-Release Niacin on Saphenous Vein Graft Atherosclerosis,"BRILAKIS, EMMANOUIL",UNIVERSITY OF TEXAS SW MED CTR/DALLAS,TX,"$312,400"
Heart Disease - Coronary Heart Disease,2010,NHLBI,3R01HL038324-20S1,,Measurement of free radical generation in the heart,"ZWEIER, JAY",OHIO STATE UNIVERSITY,OH,"$144,875"
Heart Disease - Coronary Heart Disease,2010,NHLBI,3R01HL044578-18S1,,Mechanisms of action and activation of the death-inducing protein Bnip3,"WEBSTER, KEITH",UNIVERSITY OF MIAMI SCHOOL OF MEDICINE,FL,"$12,531"
Heart Disease - Coronary Heart Disease,2010,NHLBI,3R01HL089744-01A2S1,,The Risk of Myocardial Infarction in Patients with Psoriasis,"GELFAND, JOEL",UNIVERSITY OF PENNSYLVANIA,PA,"$9,686"
Heart Disease - Coronary Heart Disease,2010,NHLBI,1F32HL099043-01A1,,The role of lectin-complexes in complement-mediated coagulopathy,"LA BONTE, LAURA",BRIGHAM AND WOMEN'S HOSPITAL,MA,"$50,474"
Heart Disease - Coronary Heart Disease,2010,NINR,5R01NR004908-08,,Predicting CHD Events in Black and White Women,"MCSWEENEY, JEAN",UNIVERSITY OF ARKANSAS MED SCIS LTL ROCK,AR,"$416,759"
Heart Disease - Coronary Heart Disease,2010,NHLBI,1F32HL096143-01A2,,Novel Approaches in Treatment of Vascular Injury Following Balloon Angioplasty,"KOSHMAN, YEVGENIYA",LOYOLA UNIVERSITY CHICAGO,IL,"$50,474"
Heart Disease - Coronary Heart Disease,2010,NHLBI,1R41HL104893-01,,Poloxamer 188 mechanism of action in ischemic heart failure.,"MARKHAM, BRUCE","PHRIXUS PHARMACEUTICALS, INC.",MI,"$306,708"
Heart Disease - Coronary Heart Disease,2010,NHLBI,2R42HL084844-02A1,,Acute-infarct selective cardiac MRI contrast agent,"VARGA-SZEMES, AKOS","ELGAVISH PARAMAGNETICS, INC.",AL,"$590,498"
Heart Disease - Coronary Heart Disease,2010,NHLBI,2R44HL092656-02A2,,Treatment of Acute Coronary Syndromes with Recombinant LCAT Infusion,"KRAUSE, BRIAN","ALPHACORE PHARMA, LLC",MI,"$1,022,830"
Heart Disease - Coronary Heart Disease,2010,NHLBI,1R43HL104954-01,,Tissue Repair During Acute Phase of Myocardial Infarction,"HUANG, MANLEY","PANORAMA RESEARCH, INC.",CA,"$230,586"
Heart Disease - Coronary Heart Disease,2010,NHLBI,2R44HL083578-03A2,,HDL Proteomics for Heart Disease Detection,"PRAZEN, BRYAN",INSILICOS,WA,"$400,000"
Heart Disease - Coronary Heart Disease,2010,NHLBI,1F32HL104997-01,,Role of Nox4 in VSMC Migration,"KHALIL, MAZEN",EMORY UNIVERSITY,GA,"$59,918"
Heart Disease - Coronary Heart Disease,2010,NHLBI,1F32HL104924-01,,Novel Biometric Tissue Architecture as a Cell Delivery Vehicle for Cardiac Regene,"TURNER, WILLIAM","UNIVERSITY OF CALIFORNIA, MERCED",CA,"$52,154"
Heart Disease - Coronary Heart Disease,2010,NHLBI,1R01HL096503-01A2,,Regulatory Mechanisms of Oxidative Stress in Cardiac Angiogenesis Postinfarction,"SUN, YAO",UNIVERSITY OF TENNESSEE HEALTH SCI CTR,TN,"$370,000"
Heart Disease - Coronary Heart Disease,2010,NHLBI,1R44HL102890-01A1,,Inhibition of Cardiac Device Induced Cellular Dysfunction in Pigs,"BANSAL, REKHA","NOVELMED THERAPEUTICS, INC.",OH,"$516,118"
Heart Disease - Coronary Heart Disease,2010,NHLBI,1F32HL105066-01,,Store Operated Calcium Channels Function in Vascular Smooth Muscle,"MANCARELLA, SALVATORE",TEMPLE UNIVERSITY,PA,"$50,474"
Heart Disease - Coronary Heart Disease,2010,NHLBI,1F31HL105109-01,,Identification of a Ventricular Progenitor using Irx4 as a genetic marker,"NELSON, DARYL",UNIVERSITY OF WISCONSIN MADISON,WI,"$29,216"
Heart Disease - Coronary Heart Disease,2010,NHLBI,2R01HL046005-18A1,,Heart and Muscle K+ Channels: Assembly and Regulation,"KOREN, GIDEON",RHODE ISLAND HOSPITAL,RI,"$537,484"
Heart Disease - Coronary Heart Disease,2010,NIDDK,3U01DK057177-11S2,,Look AHEAD: Action for Health in Diabetes,"FOREYT, JOHN",BAYLOR COLLEGE OF MEDICINE,TX,"$120,766"
Heart Disease - Coronary Heart Disease,2010,NHLBI,1R43HL105167-01,,Targeted Delivery of Cardioprotective Drugs,"BACKER, MARINA","SIBTECH, INC.",CT,"$385,462"
Heart Disease - Coronary Heart Disease,2010,NIGMS,4R44GM087784-02,,"Engineered tissue-based, high-throughput compound profiling","RUFANOVA, VICTORIYA","INVIVO SCIENCES, LLC.",WI,"$887,123"
Heart Disease - Coronary Heart Disease,2010,NHLBI,1R01HL105170-01,,Prolonged Ventricular Depolarization and Sudden Death in the Community,"CHUGH, SUMEET",CEDARS-SINAI MEDICAL CENTER,CA,"$419,340"
Heart Disease - Coronary Heart Disease,2010,NHLBI,3R01HL093052-02S1,,Regulation of Coronary Collateral Growth in the Metabolic Syndrome,"ROCIC, PETRA",UNIVERSITY OF SOUTH ALABAMA,AL,"$25,520"
Heart Disease - Coronary Heart Disease,2010,NHLBI,3R01HL092397-02S1,,Immune/Inflammation Genomics and the Risk of SLE and CHD,"KAMBOH, M.",UNIVERSITY OF PITTSBURGH AT PITTSBURGH,PA,"$51,653"
Heart Disease - Coronary Heart Disease,2010,NHLBI,1R01HL105176-01,,Wnt11 signaling in stem cell survival and cardiac regeneration,"XU, MEIFENG",UNIVERSITY OF CINCINNATI,OH,"$381,100"
Heart Disease - Coronary Heart Disease,2010,NHLBI,1P01HL098055-01A1,7172,"ABCA1, ApoAI and Reverse Cholesterol Transport","SMITH, JONATHAN",CLEVELAND CLINIC LERNER COL/MED-CWRU,OH,"$512,595"
Heart Disease - Coronary Heart Disease,2010,NHLBI,1R01HL098945-01A1,,Proteolytic Regulation of Troponin T & Cardiac Function,"JIN, JIAN-PING",WAYNE STATE UNIVERSITY,MI,"$380,000"
Heart Disease - Coronary Heart Disease,2010,NHLBI,5P01HL058000-12,5166,Immune Mechanisms in Atherosclerosis,"WEYAND, CORNELIA",EMORY UNIVERSITY,GA,"$372,814"
Heart Disease - Coronary Heart Disease,2010,NHLBI,1U01HL105268-01,,TRACE-CORE,"KIEFE, CATARINA",UNIV OF MASSACHUSETTS MED SCH WORCESTER,MA,"$1,536,126"
Heart Disease - Coronary Heart Disease,2010,NHLBI,1U01HL105270-01,,Center for Cardiovascular Outcomes Research at Yale University,"KRUMHOLZ, HARLAN",YALE UNIVERSITY,CT,"$1,505,615"
Heart Disease - Coronary Heart Disease,2010,NHLBI,1R01HL105375-01,,Macrophage Akt and IKKalpha signaling in apoptosis and atherosclerosis,"LINTON, MACRAE",VANDERBILT UNIVERSITY,TN,"$469,500"
Heart Disease - Coronary Heart Disease,2010,NHLBI,3R01HL080387-05S1,,Invasive Bacteria Accelerate Atherosclerosis through TLRs,"GENCO, CAROLINE",BOSTON UNIVERSITY MEDICAL CAMPUS,MA,"$61,805"
Heart Disease - Coronary Heart Disease,2010,NHLBI,4R44HL095238-02,,Development of novel tissue directed ultra sound therapeutic gene delivery system,"COLES, ERIC","SONOGENE, LLC",IL,"$356,959"
Heart Disease - Coronary Heart Disease,2010,NHLBI,N01HC48047-57-0-1,,CARDIA,"LEWIS, CORA E",UNIVERSITY OF ALABAMA AT BIRMINGHAM,AL,"$101,959"
Heart Disease - Coronary Heart Disease,2010,NHLBI,1K99HL105793-01,,Elucidating the mechanisms of venous reprogramming during coronary development,"RED-HORSE, MARY",STANFORD UNIVERSITY,CA,"$99,230"
Heart Disease - Coronary Heart Disease,2010,NHLBI,1K23HL105897-01,,Pharmacogenomics of Anti-platelet Response,"QAYYUM, REHAN",JOHNS HOPKINS UNIVERSITY,MD,"$139,721"
Heart Disease - Coronary Heart Disease,2010,NHLBI,3P01HL088117-02S1,,"Depression, Biobehavioral Mechanisms, & CHD/Mortality Outcomes","DAVIDSON, KARINA",COLUMBIA UNIVERSITY HEALTH SCIENCES,NY,"$36,335"
Heart Disease - Coronary Heart Disease,2010,NHLBI,N01HC55018-39-0-1,,Atherosclerosis Risk in Communities Study (ARIC),"HEISS, GERARDO",UNIVERSITY OF NORTH CAROLINA CHAPEL HILL,NC,"$1,343,482"
Heart Disease - Coronary Heart Disease,2010,NHLBI,N01HC55021-48-0-1,,Atherosclerosis Risk in Communities Study (ARIC),"MOSLEY, THOMAS",UNIVERSITY OF MISSISSIPPI MEDICAL CENTER,MS,"$1,033,604"
Heart Disease - Coronary Heart Disease,2010,NHLBI,N01HC55020-41-0-1,,Atherosclerosis Risk in Communities Study (ARIC),"CORESH, JOSEF",JOHNS HOPKINS UNIVERSITY,MD,"$1,222,739"
Heart Disease - Coronary Heart Disease,2010,NHLBI,N01HC55019-36-0-1,,Atherosclerosis Risk in Communities Study (ARIC),"FOLSOM, AARON",UNIVERSITY OF MINNESOTA TWIN CITIES,MN,"$1,302,441"
Heart Disease - Coronary Heart Disease,2010,NHLBI,N01HC55016-40-0-1,,Atherosclerosis Risk in Communities Study (ARIC),"BALLANTYNE, CHRISTIE M",BAYLOR COLLEGE OF MEDICINE,TX,"$737,739"
Heart Disease - Coronary Heart Disease,2010,NHLBI,N01HC55015-48-0-1,,Atherosclerosis Risk in Communities Study (ARIC),"CHAMBLESS, LLOYD",UNIVERSITY OF NORTH CAROLINA CHAPEL HILL,NC,"$1,816,554"
Heart Disease - Coronary Heart Disease,2010,NHLBI,4R00HL093358-02,,Restoring LV Function Post-MI Using Fibrin-Gel Based Engineered Myocardium,"BLACK, LAUREN",TUFTS UNIVERSITY MEDFORD,MA,"$249,000"
Heart Disease - Coronary Heart Disease,2010,NHLBI,5P50HL081011-05,9002,CLINICAL RESEARCH INFRASTRUCTURE,"FRANCIS, GARY",CLEVELAND CLINIC LERNER COL/MED-CWRU,OH,"$259,814"
Heart Disease - Coronary Heart Disease,2010,NHLBI,5P01HL062984-10,0002,"Modulation of Enothelial Vasomotor and Antithrombotic Functions by Antioxidants,","HEISTAD, DONALD",UNIVERSITY OF IOWA,IA,"$597,999"
Heart Disease - Coronary Heart Disease,2010,NIA,5P01AG026467-03,0001,POLYOL PATHWAY & MECHANISMS OF ISCHEMIC INJURY IN AGING,"RAMASAMY, RAVICHANDRAN",COLUMBIA UNIVERSITY HEALTH SCIENCES,NY,"$221,466"
Heart Disease - Coronary Heart Disease,2010,NIA,5P01AG026467-03,0003,AR & AGE-RAGE IN AGING: IMPACT ON ENDOTHELIAL AND VASCULAR STRESS,"YAN, SHI-FANG",COLUMBIA UNIVERSITY HEALTH SCIENCES,NY,"$213,106"
Heart Disease - Coronary Heart Disease,2010,NIA,5P01AG026467-03,9002,ANIMAL EXPERIMENTATION CORE,"RAMASAMY, RAVICHANDRAN",COLUMBIA UNIVERSITY HEALTH SCIENCES,NY,"$302,238"
Heart Disease - Coronary Heart Disease,2010,NIA,1K01AG036740-01A1,,Physician Level Analysis of Medical Technology Diffusion: A Study of Coronary Ste,"KARACA-MANDIC, PINAR",UNIVERSITY OF MINNESOTA TWIN CITIES,MN,"$121,014"
Heart Disease - Coronary Heart Disease,2010,NHLBI,2K24HL076346-06,,Gender Race and Ethnic Disparities Research in Cardiovascular Disease Prevention,"MOSCA, LORI",COLUMBIA UNIVERSITY HEALTH SCIENCES,NY,"$190,649"
