Category,FY,Funding IC,Project Number,Sub Project #,Project Title,PI Name,Org Name,State / Country,Amount
Heart Disease - Coronary Heart Disease,2014,NHLBI,5R01HL116530-02,,Novel imaging to identify lung mitochondrial injury and predict recovery,"JACOBS, ELIZABETH",MEDICAL COLLEGE OF WISCONSIN,WI,"$257,667"
Heart Disease - Coronary Heart Disease,2014,NHLBI,5K08HL116485-02,,Biomarkers of Heart Regeneration,"KARRA, RAVI",DUKE UNIVERSITY,NC,"$124,075"
Heart Disease - Coronary Heart Disease,2014,NHLBI,5R44HL110496-03,,Selectin targeted ultrasound contrast agents for detection of acute coronary synd,"RYCHAK, JOSHUA","TARGESON, INC.",CA,"$776,859"
Heart Disease - Coronary Heart Disease,2014,NHLBI,5R01HL115114-02,,Mechanisms of Coronary Vasomotor Control,"CHILIAN, WILLIAM",NORTHEAST OHIO MEDICAL UNIVERSITY,OH,"$359,406"
Heart Disease - Coronary Heart Disease,2014,NHLBI,5R01HL115275-03,,Role of Meis1 in Regulation of Cardiomyocyte Proliferation,"SADEK, HESHAM",UT SOUTHWESTERN MEDICAL CENTER,TX,"$501,998"
Heart Disease - Coronary Heart Disease,2014,NHLBI,5R01HL115282-02,,Biological sutures to enhance progenitor cell delivery and retention in the heart,"GAUDETTE, GLENN",WORCESTER POLYTECHNIC INSTITUTE,MA,"$380,808"
Heart Disease - Coronary Heart Disease,2014,RMAP,5UH2TR000901-02,,Plasma miRNA predictors of adverse mechanical and electrical remodeling after MI,"DAS, SAUMYA",BETH ISRAEL DEACONESS MEDICAL CENTER,MA,"$500,000"
Heart Disease - Coronary Heart Disease,2014,NIGMS,5P20GM103492-07,5010,Project 5 - Metabolomic Analysis of Atherothrombosis,"DEFILIPPIS, ANDREW",UNIVERSITY OF LOUISVILLE,KY,"$274,016"
Heart Disease - Coronary Heart Disease,2014,NHLBI,1R43HL123069-01,,Myocardial blood flow quantitation with the novel F-18 Flurpiridaz PET imaging tr,"VAN TRAIN, KENNETH","SYNTERMED, INC,",GA,"$164,919"
Heart Disease - Coronary Heart Disease,2014,RMAP,5UH2TR000921-02,,Extracellular RNAs: Biomarkers for Cardiovascular Risk and Disease,"FREEDMAN, JANE",UNIV OF MASSACHUSETTS MED SCH WORCESTER,MA,"$500,000"
Heart Disease - Coronary Heart Disease,2014,NHLBI,2R01HL095077-05A1,,Myocardial repair using human iPSC derived cardiac muscle patch,"ZHANG, JIANYI",UNIVERSITY OF MINNESOTA,MN,"$486,735"
Heart Disease - Coronary Heart Disease,2014,OD,1R56HL119886-01A1,,Sex differences in myocardial ischemia/reperfusion injury,"ARNOLD, ARTHUR",UNIVERSITY OF CALIFORNIA LOS ANGELES,CA,"$350,000"
Heart Disease - Coronary Heart Disease,2014,NHLBI,1R43HL120375-01A1,,Mild Hypothermia Catheter for Reperfusion Injury,"BERWICK, ZACHARY","3DT HOLDINGS, LLC",IN,"$230,895"
Heart Disease - Coronary Heart Disease,2014,NHLBI,4R42HL112518-03,,Targeted Nanoparticles of Bismuth Organo Complexes for Spectral CT Imaging of Cor,"WANG, Y","OCEAN NANOTECH, LLC",AR,"$500,010"
Heart Disease - Coronary Heart Disease,2014,NIA,5F30AG041567-04,,Endogenous Circular RNAs and the Control of Expression of Aging-related Genes,"JECK, WILLIAM",UNIV OF NORTH CAROLINA CHAPEL HILL,NC,"$37,645"
Heart Disease - Coronary Heart Disease,2014,NHLBI,5U24HL094373-05,,Preclinical Consortium to Facilitate Translation of Cardioprotective Therapies,"BOLLI, ROBERTO",UNIVERSITY OF LOUISVILLE,KY,"$2,197,000"
Heart Disease - Coronary Heart Disease,2014,NHLBI,5SC2HL119062-03,,High resolution ultrasound imaging sensor array for biomedical imaging applicatio,"SEO, SANG-WOO",CITY COLLEGE OF NEW YORK,NY,"$153,000"
Heart Disease - Coronary Heart Disease,2014,NHLBI,5K08HL119355-02,,Regulation of cellular metabolism by EglN dioxygenases,"OLENCHOCK, BENJAMIN",BRIGHAM AND WOMEN'S HOSPITAL,MA,"$133,716"
Heart Disease - Coronary Heart Disease,2014,NHLBI,1R43HL123221-01,,Improved Accuracy with Reduced Radiation Dose for SPECT MPI,"CULLOM, SHELBY","ADAPTIVEPHARMA, LLC",KS,"$115,430"
Heart Disease - Coronary Heart Disease,2014,NHLBI,5K12HL109009-04,,Enabling Medical Research Growth in Emergency Medicine,"BECKER, LANCE",UNIVERSITY OF PENNSYLVANIA,PA,"$987,749"
Heart Disease - Coronary Heart Disease,2014,NHLBI,1R41HL123334-01,,Novel coatings releasing synergistic polyphenols promote vascular healing,"DUGAS, TAMMY","REQUISITE BIOMEDICAL, LLC",LA,"$223,701"
Heart Disease - Coronary Heart Disease,2014,NHLBI,2R01HL070865-09A1,,Contribution of Notch signaling to vascular remodeling,"LIAW, LUCY",MAINE MEDICAL CENTER,ME,"$383,750"
Heart Disease - Coronary Heart Disease,2014,NHLBI,5R01HL111883-03,,Preclinical cardiac imaging package for clinical SPECT systems,"METZLER, SCOTT",UNIVERSITY OF PENNSYLVANIA,PA,"$697,516"
Heart Disease - Coronary Heart Disease,2014,NIAAA,5U01AA021989-03,,Zinc for HIV Disease among Alcohol Users -An RCT in the Russia ARCH Cohort,"SAMET, JEFFREY",BOSTON MEDICAL CENTER,MA,"$559,815"
Heart Disease - Coronary Heart Disease,2014,NHLBI,5R01HL117832-02,,Impact of Social-Interpersonal Factors in the ER on PTSD/Cardiac Outcomes,"EDMONDSON, DONALD",COLUMBIA UNIVERSITY HEALTH SCIENCES,NY,"$693,688"
Heart Disease - Coronary Heart Disease,2014,NIGMS,1F31GM109496-01A1,,Hypoxia and the Mitochondrial Unfolded Protein Response,"PENA, SALVADOR",UNIVERSITY OF ROCHESTER,NY,"$39,276"
Heart Disease - Coronary Heart Disease,2014,NCI,1R01CA186720-01,,Breast Cancer Survivors Cardiovascular Risks: Treatment and Behavioral Influences,"KIECOLT-GLASER, JANICE",OHIO STATE UNIVERSITY,OH,"$829,667"
Heart Disease - Coronary Heart Disease,2014,NHLBI,2P01HL091799-06A1,7157,Role of Ca2+ Flux ttirougti TRP Channels in Cardiac Stress Remodeling,"HOUSER, STEVEN",TEMPLE UNLVERSITY,,"$447,004"
Heart Disease - Coronary Heart Disease,2014,NHLBI,2P01HL091799-06A1,7159,Mouse Physiology/ Surgery Core,"GAO, ERHE",TEMPLE UNLVERSITY,,"$342,061"
Heart Disease - Coronary Heart Disease,2014,NHLBI,5R01HL064793-14,,Phosphorylation and Endothelial Nitric Oxide Production,"SESSA, WILLIAM",YALE UNIVERSITY,CT,"$407,925"
Heart Disease - Coronary Heart Disease,2014,NHLBI,5R01HL071158-12,,"SIRT1, Nitro-Lipids and Cardioprotection","BROOKES, PAUL",UNIVERSITY OF ROCHESTER,NY,"$376,075"
Heart Disease - Coronary Heart Disease,2014,NHLBI,5R01HL117730-02,,Infarct Repair with Mesenchymal Stem Cell Subpopulation,"DAWN, BUDDHADEB",UNIVERSITY OF KANSAS MEDICAL CENTER,KS,"$369,950"
Heart Disease - Coronary Heart Disease,2014,NHLBI,1F32HL117472-01A1,,Genome-wide scan for context-dependent associations with ischemic heart disease a,"RAJ, SRILAKSHMI",CORNELL UNIVERSITY,NY,"$53,282"
Heart Disease - Coronary Heart Disease,2014,NHLBI,1F32HL123323-01,,The role of DNA methylation in cardiac regeneration,"PAPIZAN, JAMES",UT SOUTHWESTERN MEDICAL CENTER,TX,"$51,530"
Heart Disease - Coronary Heart Disease,2014,NIA,5R01AG032443-05,,PROGERIN  ENDOTHELIAL DYSFUNCTION  AND VASCULAR DISEASE,"GIMBRONE, MICHAEL",BRIGHAM AND WOMEN'S HOSPITAL,MA,"$317,256"
Heart Disease - Coronary Heart Disease,2014,NIA,5R01AG039545-04,,Inflammatory response of aging heart to surgical myocardial ischemia,"MENG, XIANZHONG",UNIVERSITY OF COLORADO DENVER,CO,"$309,304"
Heart Disease - Coronary Heart Disease,2014,NHLBI,5R01HL112914-02,,TSP-1 and ROS: CD47 and SIRP-alpha as Mediators of Vascular Dysfunction,"PAGANO, PATRICK",UNIVERSITY OF PITTSBURGH AT PITTSBURGH,PA,"$376,993"
Heart Disease - Coronary Heart Disease,2014,NHLBI,5R01HL117385-02,,Hexokinases and Cardioprotection,"WEISS, JAMES",UNIVERSITY OF CALIFORNIA LOS ANGELES,CA,"$480,120"
Heart Disease - Coronary Heart Disease,2014,NIAMS,5R01AR063437-03,,Remote Inflammation and Atherothrombosis,"WARD, NICOLE",CASE WESTERN RESERVE UNIVERSITY,OH,"$346,185"
Heart Disease - Coronary Heart Disease,2014,NHLBI,5R01HL117986-02,,Biasing Myocardial Neuregulin Signaling with Engineered Ligands,"LEE, RICHARD",BRIGHAM AND WOMEN'S HOSPITAL,MA,"$410,653"
Heart Disease - Coronary Heart Disease,2014,NHLBI,1F31HL120580-01A1,,Use of Real Time MRI for Evaluation of Regional Myocardial Function,"CONTIJOCH, FRANCISCO",UNIVERSITY OF PENNSYLVANIA,PA,"$45,156"
Heart Disease - Coronary Heart Disease,2014,NIA,5R01AG026290-07,,Universal Health Insurance and the Adequacy and Efficiency of Health Care,"CARD, DAVID",NATIONAL BUREAU OF ECONOMIC RESEARCH,MA,"$371,843"
Heart Disease - Coronary Heart Disease,2014,NIA,5K01AG036740-05,,Physician Level Analysis of Medical Technology Diffusion: Coronary Stents Study,"KARACA-MANDIC, PINAR",UNIVERSITY OF MINNESOTA,MN,"$123,924"
Heart Disease - Coronary Heart Disease,2014,NHLBI,5R01HL077921-08,,VIRTUAL TOOLS FOR CARDIAC VENTRICULAR REMODELING SURGERY,"GUCCIONE, JULIUS","UNIVERSITY OF CALIFORNIA, SAN FRANCISCO",CA,"$366,489"
Heart Disease - Coronary Heart Disease,2014,NHLBI,5K08HL116790-02,,Cell-type Specificity of Heritable Channelopathies: Role of the Purkinje Fiber,"IYER, VIVEK",COLUMBIA UNIVERSITY HEALTH SCIENCES,NY,"$133,110"
Heart Disease - Coronary Heart Disease,2014,NHLBI,5R01HL118627-02,,Minimally Invasive Ventricular Polymeric Injection for Treatment of Heart Failure,"GUCCIONE, JULIUS",NORTHERN CALIFORNIA INSTITUTE/RES/EDU,CA,"$749,658"
Heart Disease - Coronary Heart Disease,2014,NHLBI,5R01HL119828-02,,Oxidation-specific nanoparticles for imaging atherosclerosis,"TSIMIKAS, SOTIRIOS",UNIVERSITY OF CALIFORNIA SAN DIEGO,CA,"$394,905"
Heart Disease - Coronary Heart Disease,2014,NIA,5R01AG020628-10,,Leukocyte-endothelial cell interaction in aging,"YUNG, RAYMOND",UNIVERSITY OF MICHIGAN,MI,"$297,011"
Heart Disease - Coronary Heart Disease,2014,NIA,5K01AG041787-04,,Psychobiology of Racial Minority Stress and Cellular Aging,"CHAE, HUI WOONG","UNIV OF MARYLAND, COLLEGE PARK",MD,"$116,123"
Heart Disease - Coronary Heart Disease,2014,NHLBI,5K23HL111339-02,,Role of alternatively spliced Tissue Factor in atherosclerosis,"GIANNARELLI, CHIARA",ICAHN SCHOOL OF MEDICINE AT MOUNT SINAI,NY,"$142,340"
Heart Disease - Coronary Heart Disease,2014,NHLBI,5R01HL116591-02,,Paracrine Regulation of Heart Failure,"WALSH, KENNETH",BOSTON UNIVERSITY MEDICAL CAMPUS,MA,"$401,065"
Heart Disease - Coronary Heart Disease,2014,NIDDK,5U01DK096189-02,,"Aldosterone, nitric oxide, myocardial fibrosis, and capillary loss in ESRD","CHARYTAN, DAVID",BRIGHAM AND WOMEN'S HOSPITAL,MA,"$521,271"
Heart Disease - Coronary Heart Disease,2014,RMAP,5R01DK097768-03,,Isogenic Human Pluripotent Stem Cell-Based Models of Human Disease Mutations,"ALTSHULER, DAVID","BROAD INSTITUTE, INC.",MA,"$2,224,488"
Heart Disease - Coronary Heart Disease,2014,NIEHS,5R01ES019217-04,,Endothelial Progenitor Cells and Particulate Air Pollution,"O'TOOLE, TIMOTHY",UNIVERSITY OF LOUISVILLE,KY,"$532,522"
Heart Disease - Coronary Heart Disease,2014,NIGMS,5K23GM102678-03,,Aspirin Pharmacogenomics: Role of PEAR1 in Personalized Anti-Platelet Therapy,"LEWIS, JOSHUA",UNIVERSITY OF MARYLAND BALTIMORE,MD,"$161,218"
Heart Disease - Coronary Heart Disease,2014,NHGRI,5U01HG006379-04,,EMR Phenotype and Community Engaged Genomic Associations,"KULLO, IFTIKHAR",MAYO CLINIC ROCHESTER,MN,"$982,592"
Heart Disease - Coronary Heart Disease,2014,OD,5U01HG006379-04,,EMR Phenotype and Community Engaged Genomic Associations,"KULLO, IFTIKHAR",MAYO CLINIC ROCHESTER,MN,"$164,026"
Heart Disease - Coronary Heart Disease,2014,NHLBI,5R44HL095203-05,,Safety of Allogeneic Cardiosphere-Derived Cells for Dilated Cardiomyopathy,"SMITH, RACHEL","CAPRICOR, INC.",CA,"$998,765"
Heart Disease - Coronary Heart Disease,2014,NHLBI,5K23HL114884-02,,Molecular Basis of Autosomal Dominant Hypercholesterolemia in a Multiethnic Cohor,"AHMAD, ZAHID",UT SOUTHWESTERN MEDICAL CENTER,TX,"$155,250"
Heart Disease - Coronary Heart Disease,2014,NHLBI,5K23HL118138-02,,Balancing the Risks of Ischemia and Bleeding in Percutaneous Coronary Interventio,"YEH, ROBERT",MASSACHUSETTS GENERAL HOSPITAL,MA,"$137,160"
Heart Disease - Coronary Heart Disease,2014,NHLBI,3R01HL102022-04S1,,"RAGE, Diabetes and Myocardial Infarction","RAMASAMY, RAVICHANDRAN",NEW YORK UNIVERSITY SCHOOL OF MEDICINE,NY,"$399,376"
Heart Disease - Coronary Heart Disease,2014,NIAMS,5R01AR053102-09,,Mechanisms of initiation of skeletal mineralization,"MILLAN, JOSE",SANFORD-BURNHAM MEDICAL RESEARCH INSTIT,CA,"$429,975"
Heart Disease - Coronary Heart Disease,2014,NHLBI,5R01HL091989-06,,Reliable Evaluation of Coronary Artery Disease using Myocardial BOLD MRI with CO2,"DHARMAKUMAR, ROHAN",CEDARS-SINAI MEDICAL CENTER,CA,"$408,225"
Heart Disease - Coronary Heart Disease,2014,NHLBI,5K99HL114648-02,,A Novel Role of Macrophage TSP1-CD47 Signaling in Atherosclerosis,"CSANYI, GABOR",UNIVERSITY OF PITTSBURGH AT PITTSBURGH,PA,"$88,012"
Heart Disease - Coronary Heart Disease,2014,NHLBI,5K99HL114721-02,,S-Nitrosylation and Cardioprotection,"KOHR, MARK",JOHNS HOPKINS UNIVERSITY,MD,"$107,487"
Heart Disease - Coronary Heart Disease,2014,NHLBI,5R00HL112852-04,,Functional relevance of cardiac regeneration by c-kit positive stem cells,"VAN BERLO, JOHANNES",UNIVERSITY OF MINNESOTA,MN,"$238,097"
Heart Disease - Coronary Heart Disease,2014,NHLBI,5K23HL119620-02,,Assessment of Perfusion Reserve and Effects of Exercise in Microvascular Angina,"BOURQUE, JAMIESON",UNIVERSITY OF VIRGINIA,VA,"$134,703"
Heart Disease - Coronary Heart Disease,2014,NIBIB,5K25EB014914-03,,4D MRI Development for Cardiovascular Imaging,"LIU, JING","UNIVERSITY OF CALIFORNIA, SAN FRANCISCO",CA,"$168,386"
Heart Disease - Coronary Heart Disease,2014,NIA,5R01AG045933-02,,Lead Optimization of Novel Inhibitors of Tissue Non-specific Alkaline Phosphatase,"COSFORD, NICHOLAS",SANFORD-BURNHAM MEDICAL RESEARCH INSTIT,CA,"$752,413"
Heart Disease - Coronary Heart Disease,2014,NHLBI,5R01HL083237-07,,Myocardial Injury Associated with Mitochondria-Derived Oxygen Free Radical(s),"CHEN, YEONG-RENN",NORTHEAST OHIO MEDICAL UNIVERSITY,OH,"$372,008"
Heart Disease - Coronary Heart Disease,2014,NHLBI,5R01HL117062-02,,The role of Stearate in the regulation of vascular calcification in chronic kidne,"MIYAZAKI, MAKOTO",UNIVERSITY OF COLORADO DENVER,CO,"$379,750"
Heart Disease - Coronary Heart Disease,2014,NHLBI,5R01HL118019-02,,Anatomic and Physiologic Determinants of Vessel-Specific Ischemia by Coronary CT,"MIN, JAMES",WEILL MEDICAL COLL OF CORNELL UNIV,NY,"$654,832"
Heart Disease - Coronary Heart Disease,2014,NHLBI,5R01HL119464-02,,"SFRP2, cell survival, and coronary vascular angiogenesis","VATNER, DOROTHY",RBHS-NEW JERSEY MEDICAL SCHOOL,NJ,"$450,425"
Heart Disease - Coronary Heart Disease,2014,NIDA,1R01DA037012-01A1,,"Effects of polydrug use, adulterants and HIV on cardiac injury in homeless women","RILEY, ELISE","UNIVERSITY OF CALIFORNIA, SAN FRANCISCO",CA,"$725,434"
Heart Disease - Coronary Heart Disease,2014,NHLBI,5P01HL069779-12,7683,Physiology Core,"JAMES, JEANNE",CINCINNATI CHILDRENS HOSP MED CTR,OH,"$269,053"
Heart Disease - Coronary Heart Disease,2014,NHLBI,2R01HL071546-10,,Analysis of a Novel Homeobox gene in CV Development,"EPSTEIN, JONATHAN",UNIVERSITY OF PENNSYLVANIA,PA,"$394,588"
Heart Disease - Coronary Heart Disease,2014,NCCAM,5R00AT006704-05,,DHA Mechanisms in Obesity-mediated Cardiac Remodeling Post-Myocardial Infarction,"HALADE, GANESH",UNIVERSITY OF ALABAMA AT BIRMINGHAM,AL,"$215,776"
Heart Disease - Coronary Heart Disease,2014,OD,5R00AT006704-05,,DHA Mechanisms in Obesity-mediated Cardiac Remodeling Post-Myocardial Infarction,"HALADE, GANESH",UNIVERSITY OF ALABAMA AT BIRMINGHAM,AL,"$24,250"
Heart Disease - Coronary Heart Disease,2014,NHLBI,5R01HL116577-02,,Novel Vehicles for Targeted Cardiovascular Repair,"KIBBE, MELINA",NORTHWESTERN UNIVERSITY AT CHICAGO,IL,"$1,070,603"
Heart Disease - Coronary Heart Disease,2014,NIDDK,5R01DK084997-05,,Adult Life Predictors of Genitourinary Disorders,"VAN DEN EEDEN, STEPHEN",KAISER FOUNDATION RESEARCH INSTITUTE,CA,"$464,322"
Heart Disease - Coronary Heart Disease,2014,NHLBI,1K23HL123341-01,,"Pericardial fat, inflammation, and structural heart disease in HIV","LONGENECKER, CHRIS",CASE WESTERN RESERVE UNIVERSITY,OH,"$155,909"
Heart Disease - Coronary Heart Disease,2014,NHLBI,1U01HL123336-01,,REPRIEVE - CCC - Lead Application,"GRINSPOON, STEVEN",MASSACHUSETTS GENERAL HOSPITAL,MA,"$6,060,885"
Heart Disease - Coronary Heart Disease,2014,NHLBI,1U01HL123339-01,,REPRIEVE - DCC,"HOFFMANN, UDO",MASSACHUSETTS GENERAL HOSPITAL,MA,"$1,359,105"
Heart Disease - Coronary Heart Disease,2014,NIAID,1K24AI112393-01,,HIV Viral Reservoirs and Monocyte Activation in HIV-Associated Atherosclerosis,"HSUE, PRISCILLA","UNIVERSITY OF CALIFORNIA, SAN FRANCISCO",CA,"$181,528"
Heart Disease - Coronary Heart Disease,2014,NHLBI,1R01HL123351-01,,Targeting GI Epithelial Integrity to Improve Arterial Inflammation in HIV,"LO, JANET",MASSACHUSETTS GENERAL HOSPITAL,MA,"$827,188"
Heart Disease - Coronary Heart Disease,2014,NHLBI,2R01HL069229-14,,Osteogenic Regulation of Vascular Calcification,"TOWLER, DWIGHT",SANFORD-BURNHAM MEDICAL RESEARCH INSTIT,CA,"$487,500"
Heart Disease - Coronary Heart Disease,2014,NIA,5R01AG038492-04,,Cumulative Stress and CVD Risk in Middle-Aged and Older Women,"ALBERT, MICHELLE",HOWARD UNIVERSITY,DC,"$547,025"
Heart Disease - Coronary Heart Disease,2014,NCI,5U01CA138962-06,,VITamin D and omegA-3 triaL (VITAL),"MANSON, JOANN",BRIGHAM AND WOMEN'S HOSPITAL,MA,"$1,849,394"
Heart Disease - Coronary Heart Disease,2014,NIGMS,5P20GM103527-07,5042,Role of bioactive lipids in the protective pathways of obesity in ischemic cardi,"ABDEL-LATIF, AHMED",UNIVERSITY OF KENTUCKY,KY,"$255,066"
Heart Disease - Coronary Heart Disease,2014,NIGMS,5P20GM103644-02,8050,Incentives to Improve Cardiac Rehabilitation Participation in Low-income Pati..,"GAALEMA, DIANN",UNIV OF VERMONT & STATE AGRIC COLL,,"$211,757"
Heart Disease - Coronary Heart Disease,2014,NHLBI,5P01HL085577-07,7488,Restoration of Myocardial Healing by Extracellular Matrix Remodeling,"SUSSMAN, MARK",SAN DIEGO STATE UNIVERSITY,CA,"$170,677"
Heart Disease - Coronary Heart Disease,2014,NHLBI,5P01HL085577-07,7489,Restoration of Myocardial Healing through G-coupled Protein Receptor Signaling,"BROWN, JOAN",SAN DIEGO STATE UNIVERSITY,CA,"$325,260"
Heart Disease - Coronary Heart Disease,2014,NHLBI,5P01HL085577-07,7490,Restoration of Myocardial Healing Through Cardiokine Secretion,"GLEMBOTSKI, CHRISTOPHER",SAN DIEGO STATE UNIVERSITY,CA,"$313,719"
Heart Disease - Coronary Heart Disease,2014,NHLBI,5P01HL085577-07,7493,Cell Biology and Histology,"BROWN, JOAN",SAN DIEGO STATE UNIVERSITY,CA,"$260,209"
Heart Disease - Coronary Heart Disease,2014,NHLBI,5P01HL085577-07,7494,Physiology and Surgery,"SUSSMAN, MARK",SAN DIEGO STATE UNIVERSITY,CA,"$220,401"
Heart Disease - Coronary Heart Disease,2014,NHLBI,1R01HL119065-01A1,,Intracoronary imaging of plaque collagen in patients,"NADKARNI, SEEMANTINI",MASSACHUSETTS GENERAL HOSPITAL,MA,"$777,572"
Heart Disease - Coronary Heart Disease,2014,NHLBI,5R21HL121495-02,,Treatment and Risk Factor Determinants of Cardiovascular Outcomes in BARI 2D,"BROOKS, MARIA",UNIVERSITY OF PITTSBURGH AT PITTSBURGH,PA,"$113,190"
Heart Disease - Coronary Heart Disease,2014,NIGMS,5P20GM103652-02,8258,Improvement of Coronary Vascular Functions by Endothelium targeted increase in reactive oxygen species,"ABID, RUHUL","OCEAN STATE RESEARCH INSTITUTE, INC.",RI,"$266,544"
Heart Disease - Coronary Heart Disease,2014,NCCAM,5R34AT007569-03,,Development of a Tai Chi Program to Overcome Barriers to Cardiac Rehabilitation,"SALMOIRAGO-BLOTCHER, ELENA",MIRIAM HOSPITAL,RI,"$302,155"
Heart Disease - Coronary Heart Disease,2014,NHLBI,1R01HL123368-01,,"PTSD, Medication Adherence, and Prognosis after Acute Coronary Syndromes","KRONISH, IAN",COLUMBIA UNIVERSITY HEALTH SCIENCES,NY,"$399,990"
Heart Disease - Coronary Heart Disease,2014,NCCAM,5R21AT007600-02,,Developing a Mindfulness Movement Intervention Program for Post-MI Patients,"REDWINE, LAURA",VETERANS MEDICAL RESEARCH FDN/SAN DIEGO,CA,"$71,780"
Heart Disease - Coronary Heart Disease,2014,OD,5R21AT007600-02,,Developing a Mindfulness Movement Intervention Program for Post-MI Patients,"REDWINE, LAURA",VETERANS MEDICAL RESEARCH FDN/SAN DIEGO,CA,"$97,000"
Heart Disease - Coronary Heart Disease,2014,NHLBI,5U01HL117904-02,,ISCHEMIA-CKD SDCC,"O'BRIEN, SEAN",DUKE UNIVERSITY,NC,"$188,050"
Heart Disease - Coronary Heart Disease,2014,NHLBI,5U01HL117905-02,,The ISCHEMIA-CKD Trial-CCC-Lead Application,"BANGALORE, SRIPAL",NEW YORK UNIVERSITY SCHOOL OF MEDICINE,NY,"$2,162,294"
Heart Disease - Coronary Heart Disease,2014,NHLBI,1R01HL122158-01A1,,Anti-inflammatory Therapy with Low Dose Methotrexate for Reduction of PAD,"PRADHAN, ARUNA",BRIGHAM AND WOMEN'S HOSPITAL,MA,"$442,291"
Heart Disease - Coronary Heart Disease,2014,NIMHD,1R43MD009554-01,,Rapid STEMI Fibrinolysis for Underserved Populations,"CREIGHTON, FRANCIS","PULSE THERAPEUTICS, INC.",MO,"$198,449"
Heart Disease - Coronary Heart Disease,2014,NHLBI,1R01HL119153-01A1,,CIAO-ISCHEMIA - Resubmission - 1,"REYNOLDS, HARMONY",NEW YORK UNIVERSITY SCHOOL OF MEDICINE,NY,"$490,220"
Heart Disease - Coronary Heart Disease,2014,NHLBI,5DP1HL123271-02,,Virtual Electrophysiology Laboratory,"TRAYANOVA, NATALIA",JOHNS HOPKINS UNIVERSITY,MD,"$793,800"
Heart Disease - Coronary Heart Disease,2014,NIMH,5R01MH100332-02,,INTEGRATING DEPRESSION CARE FOR ACS PATIENTS IN LOW-RESOURCE HOSPITALS IN CHINA,"WU, YANGFENG",GEORGE INSTITUTE CHINA,CHINA,"$366,232"
Heart Disease - Coronary Heart Disease,2014,NHLBI,1R01HL123574-01,,Circadian Regulation of Myocardial Insulin Signaling,"YOUNG, MARTIN",UNIVERSITY OF ALABAMA AT BIRMINGHAM,AL,"$382,250"
Heart Disease - Coronary Heart Disease,2014,NHLBI,1K99HL123485-01,,Systems Genetic Analysis of Atherogenic Transcriptional Regulation in Human Cells,"ROMANOSKI, CASEY",UNIVERSITY OF CALIFORNIA SAN DIEGO,CA,"$140,249"
Heart Disease - Coronary Heart Disease,2014,NIBIB,2R01EB007829-10,,Advanced MRI Technology in Safety & Intervention,"BOTTOMLEY, PAUL",JOHNS HOPKINS UNIVERSITY,MD,"$586,471"
Heart Disease - Coronary Heart Disease,2014,RMAP,1DP2HL127727-01,,Toward Regeneration of Whole Bioartificial Human Heart,"YANG, LEI",UNIVERSITY OF PITTSBURGH AT PITTSBURGH,PA,"$2,310,000"
Heart Disease - Coronary Heart Disease,2014,NHLBI,1K08HL123519-01,,EMBRYONIC-DERIVED MACROPHAGES IN CORONARY DEVELOPMENT AND ADULT CORONARY GROWTH,"LAVINE, KORY",WASHINGTON UNIVERSITY,MO,"$125,542"
Heart Disease - Coronary Heart Disease,2014,NHLBI,1K23HL123634-01,,Alkaline Phosphatase in Infant Cardiopulmonary Bypass: Kinetics and Relationship,"DAVIDSON, JESSE",UNIVERSITY OF COLORADO DENVER,CO,"$154,421"
Heart Disease - Coronary Heart Disease,2014,NHLBI,1R01HL123689-01,,Multiscale modeling for vein graft failure risk stratification in CABG patients,"MARSDEN, ALISON",UNIVERSITY OF CALIFORNIA SAN DIEGO,CA,"$373,017"
Heart Disease - Coronary Heart Disease,2014,NHLBI,1R01HL123917-01,,HDL Proteins and Coronary Heart Disease,"SACKS, FRANK",HARVARD SCHOOL OF PUBLIC HEALTH,MA,"$818,941"
Heart Disease - Coronary Heart Disease,2014,NHLBI,1R21HL121726-01A1,,Estimating Work Productivity from Self-Reported Health in Cardiovascular Disease,"ANATCHKOVA, MILENA",UNIV OF MASSACHUSETTS MED SCH WORCESTER,MA,"$125,625"
Heart Disease - Coronary Heart Disease,2014,NHLBI,1R01HL123949-01,,Low-dose SPECT/CT for imaging chemotherapy-induced microvascular cardiotoxicity,"LIU, CHI",YALE UNIVERSITY,CT,"$392,355"
Heart Disease - Coronary Heart Disease,2014,NHLBI,1R01HL120854-01A1,,T-cell subsets as CVD risk factors in CHS and MESA,"PSATY, BRUCE",UNIVERSITY OF WASHINGTON,WA,"$726,570"
Heart Disease - Coronary Heart Disease,2014,NHLBI,1R01HL116381-01A1,,Neighborhoods and Coronary Disease: Exploring Mechanisms and Improving Methods,"SUNDQUIST, KRISTINA",LUND UNIVERSITY,SWEDEN,"$493,931"
Heart Disease - Coronary Heart Disease,2014,NIAMS,2R01AR043727-15A1,,Hopkins Lupus Cohort,"PETRI, MICHELLE",JOHNS HOPKINS UNIVERSITY,MD,"$682,380"
Heart Disease - Coronary Heart Disease,2014,NIAAA,1U34AA023258-01,,Planning Grant for a Multi Center RCT of Moderate Alcohol Use on Chronic Disease,"MUKAMAL, KENNETH",BETH ISRAEL DEACONESS MEDICAL CENTER,MA,"$469,626"
Heart Disease - Coronary Heart Disease,2014,NHLBI,1R21HL120781-01A1,,Systematic cell-based functional screening for LDL and triglyceride genes,"KATHIRESAN, SEKAR",MASSACHUSETTS GENERAL HOSPITAL,MA,"$252,448"
Heart Disease - Coronary Heart Disease,2014,NCATS,1R44HL123909-01,,Semiconductor Electronic Label-Free Assay (SELFA) for Diagnosing Heart Disease,"SHIN, KYEONG-SIK","SELFA, INC.",CA,"$212,718"
Heart Disease - Coronary Heart Disease,2014,NHLBI,1R01HL124074-01,,Exosome-mediated cardioprotection and regeneration,"MARBAN, EDUARDO",CEDARS-SINAI MEDICAL CENTER,CA,"$425,000"
Heart Disease - Coronary Heart Disease,2014,NIA,1R01AG046267-01A1,,National Health Literacy Mapping to Inform Healthcare Policy,"FANG, GANG",UNIV OF NORTH CAROLINA CHAPEL HILL,NC,"$519,523"
Heart Disease - Coronary Heart Disease,2014,NHLBI,2R01HL033921-31,,Calcium and Cardiac Regeneration after Myocardial Infarction,"HOUSER, STEVEN",TEMPLE UNIV OF THE COMMONWEALTH,PA,"$503,329"
Heart Disease - Coronary Heart Disease,2014,NHLBI,1R01HL119229-01A1,,TRPC Channel Regulation of Cardiac Hypertrophy and Contractility,"HOUSER, STEVEN",TEMPLE UNIV OF THE COMMONWEALTH,PA,"$292,254"
Heart Disease - Coronary Heart Disease,2014,NHLBI,1R21HL124100-01,,A biomimetic reverse thermal gel for the treatment of myocardial infarction,"PARK, DAE WON",UNIVERSITY OF COLORADO DENVER,CO,"$214,900"
Heart Disease - Coronary Heart Disease,2014,NHLBI,1R01HL121358-01A1,,NGS in Large CAD Families: In-Depth Identification of Rare Risk Genomic Variants,"WANG, QING",CLEVELAND CLINIC LERNER COM-CWRU,OH,"$707,607"
Heart Disease - Coronary Heart Disease,2014,NHLBI,2R01HL089765-06A1,,High Performance Automated System for Analysis of Fast Cardiac SPECT,"SLOMKA, PIOTR",CEDARS-SINAI MEDICAL CENTER,CA,"$653,934"
Heart Disease - Coronary Heart Disease,2014,NHLBI,3R01HL097979-04S1,,Antiarrhythmic Mechanisms in the Hearts of Hibernating Mammals,"XIE, LAI-HUA",RBHS-NEW JERSEY MEDICAL SCHOOL,NJ,"$374,636"
Heart Disease - Coronary Heart Disease,2014,NHLBI,1R01HL124187-01,,Therapeutic Mechanisms of Human CD34 Exosomes,"SAHOO, SUSMITA",NORTHWESTERN UNIVERSITY AT CHICAGO,IL,"$386,250"
